Sheet: new weed out(460)
A1: Acc No. | B1: Author | C1: Title | D1: Quantity | E1: Cost per Unit | F1: Total Cost | G1: Yr. of Purchase | H1: Stock Register Pg. No. | I1: Life Span (yrs) | J1: Depreciated Value | K1: Justification by Stock Holder | L1: Yr. of Publishing | M1: Source | N1: Publisher
A2: 2 | B2: jk"Vªh; f'k{kd | C2: f'k{kd vkSj lekt | D2: 1 | E2: 53 | F2: of:=[.E2]*[.D2] -> 53 | G2: 1994 | I2: of:=YEAR(TODAY())-[.G2] -> 31 | L2: 1985 | M2: NCERT Delhi | N2: {ks=h; dk;kZy; y[kuÅ
A3: 5 | B3: Mk0 ghjkyky nhf{kr | C3: vkpk;Z ds'ko nkl | D3: 1 | E3: 27.5 | F3: of:=[.E3]*[.D3] -> 27.5 | G3: 1994 | I3: of:=YEAR(TODAY())-[.G3] -> 31 | L3: 1985 | M3: NCERT Delhi | N3: {ks=h; dk;kZy; y[kuÅ
A4: 6 | B4: ,e0ih iafMr | C4: xzh vjfoUn | D4: 1 | E4: 30 | F4: of:=[.E4]*[.D4] -> 30 | G4: 1994 | I4: of:=YEAR(TODAY())-[.G4] -> 31 | L4: 2007 | M4: NCERT Delhi | N4: {ks=h; dk;kZy; y[kuÅ
A5: 7 | B5: Mk0 lE;w izlkn | C5: AKBARI DARBAR KE HINDI KAVI | D5: 1 | E5: 40 | F5: of:=[.E5]*[.D5] -> 40 | G5: 1994 | I5: of:=YEAR(TODAY())-[.G5] -> 31 | L5: 1990 | M5: NCERT Delhi | N5: {ks=h; dk;kZy; y[kuÅ
A6: 12 | B6: Hkxorh 'kj.k flag | C6: vkpk;Z ujsUnz nso | D6: 1 | E6: 11 | F6: of:=[.E6]*[.D6] -> 11 | G6: 1994 | I6: of:=YEAR(TODAY())-[.G6] -> 31 | L6: 1980 | M6: NCERT Delhi | N6: {ks=h; dk;kZy; y[kuÅ
A7: 18 | B7: Jh cky'kkSfj | C7: rsyxq lkfgR;k dk bfrgkl | D7: 1 | E7: 4 | F7: of:=[.E7]*[.D7] -> 4 | G7: 1994 | I7: of:=YEAR(TODAY())-[.G7] -> 31 | L7: 1972 | M7: NCERT Delhi | N7: {ks=h; dk;kZy; y[kuÅ
A8: 19 | B8: Mk0 ds Hkkldj | C8: ey;kye lkfgR; dk bfrgkl | D8: 1 | E8: 9 | F8: of:=[.E8]*[.D8] -> 9 | G8: 1994 | I8: of:=YEAR(TODAY())-[.G8] -> 31 | L8: 1979 | M8: NCERT Delhi | N8: {ks=h; dk;kZy; y[kuÅ
A9: 20 | B9: ,l0ds cksl | C9: ofdaepUnz pVthZ | D9: 1 | E9: 17 | F9: of:=[.E9]*[.D9] -> 17 | G9: 1994 | I9: of:=YEAR(TODAY())-[.G9] -> 31 | L9: 1984 | M9: NCERT Delhi | N9: {ks=h; dk;kZy; y[kuÅ
A10: 21 | B10: vkj0ikFkZ lkjFkh | C10: ,l lR;ewfrZ | D10: 1 | E10: 4.5 | F10: of:=[.E10]*[.D10] -> 4.5 | G10: 1994 | I10: of:=YEAR(TODAY())-[.G10] -> 31 | L10: 1974 | M10: NCERT Delhi | N10: {ks=h; dk;kZy; y[kuÅ
A11: 28 | B11: t0d``n d".knso | C11: xqtjkrh lkfgR; dk bfrgkl | D11: 1 | E11: 90 | F11: of:=[.E11]*[.D11] -> 90 | G11: 1994 | I11: of:=YEAR(TODAY())-[.G11] -> 31 | L11: 1993 | M11: NCERT Delhi | N11: {ks=h; dk;kZy; y[kuÅ
A12: 29 | B12: e/kqdj fn?ks | C12: iwokZpay dh vksj | D12: 1 | E12: 17.5 | F12: of:=[.E12]*[.D12] -> 17.5 | G12: 1994 | I12: of:=YEAR(TODAY())-[.G12] -> 31 | L12: 1985 | M12: NCERT Delhi | N12: {ks=h; dk;kZy; y[kuÅ
A13: 33 | B13: ,e0,l0,u0psfV;kj | C13: rfeyukMq yksd laLd`fr | D13: 1 | E13: 11 | F13: of:=[.E13]*[.D13] -> 11 | G13: 1994 | I13: of:=YEAR(TODAY())-[.G13] -> 31 | L13: 1982 | M13: NCERT Delhi | N13: {ks=h; dk;kZy; y[kuÅ
A14: 34 | B14: dsih,l esuu | C14: lh 'kdju uk;j | D14: 1 | E14: 19 | F14: of:=[.E14]*[.D14] -> 19 | G14: 1994 | I14: of:=YEAR(TODAY())-[.G14] -> 31 | L14: 1977 | M14: NCERT Delhi | N14: {ks=h; dk;kZy; y[kuÅ
A15: 42 | B15: Jh lqnkjkuh | C15: xksLokeh rqylhnkl | D15: 1 | E15: 8 | F15: of:=[.E15]*[.D15] -> 8 | G15: 1994 | I15: of:=YEAR(TODAY())-[.G15] -> 31 | L15: 1972 | M15: NCERT Delhi | N15: {ks=h; dk;kZy; y[kuÅ
A16: 47 | B16: u0fd'kksj uojRu | C16: egkohj izlkn f}osnh | D16: 1 | E16: 15 | F16: of:=[.E16]*[.D16] -> 15 | G16: 1994 | I16: of:=YEAR(TODAY())-[.G16] -> 31 | L16: 1985 | M16: NCERT Delhi | N16: {ks=h; dk;kZy; y[kuÅ
A17: 52 | B17: dRrfj flag | C17: Kkuh xq:eq[k | D17: 1 | E17: 12 | F17: of:=[.E17]*[.D17] -> 12 | G17: 1994 | I17: of:=YEAR(TODAY())-[.G17] -> 31 | L17: 1988 | M17: NCERT Delhi | N17: {ks=h; dk;kZy; y[kuÅ
A18: 54 | B18: Mk0 n'kjFk | C18: vkfn 'kadjkp;Z | D18: 1 | E18: 11 | F18: of:=[.E18]*[.D18] -> 11 | G18: 1994 | I18: of:=YEAR(TODAY())-[.G18] -> 31 | L18: 1992 | M18: NCERT Delhi | N18: {ks=h; dk;kZy; y[kuÅ
A19: 60 | B19: lqjsUnz pkSnjh] lqjs'k jke | C19: Q.kh'oj ukFk] Jhfuokl | D19: 1 | E19: 9 | F19: of:=[.E19]*[.D19] -> 9 | G19: 1994 | I19: of:=YEAR(TODAY())-[.G19] -> 31 | L19: 1972 | M19: NCERT Delhi | N19: {ks=h; dk;kZy; y[kuÅ
A20: 61 | B20: Vh0,e0 ih0 egknsou | C20: Shankaracharya | D20: 1 | E20: 9 | F20: of:=[.E20]*[.D20] -> 9 | G20: 1994 | I20: of:=YEAR(TODAY())-[.G20] -> 31 | L20: 1968 | M20: NCERT Delhi | N20: {ks=h; dk;kZy; y[kuÅ
A21: 62 | B21: izHkkdj ekpos | C21: rahul sankrityanand | D21: 1 | E21: 15 | F21: of:=[.E21]*[.D21] -> 15 | G21: 1994 | I21: of:=YEAR(TODAY())-[.G21] -> 31 | L21: 1990 | M21: NCERT Delhi | N21: {ks=h; dk;kZy; y[kuÅ
A22: 65 | B22: jke o{k | C22: daadu dayal | D22: 1 | E22: 15 | F22: of:=[.E22]*[.D22] -> 15 | G22: 1994 | I22: of:=YEAR(TODAY())-[.G22] -> 31 | L22: 1991 | M22: NCERT Delhi | N22: {ks=h; dk;kZy; y[kuÅ
A23: 67 | B23: e/kqjs'k | C23: rangey raghav | D23: 1 | E23: 6 | F23: of:=[.E23]*[.D23] -> 6 | G23: 1994 | I23: of:=YEAR(TODAY())-[.G23] -> 31 | L23: 1973 | M23: NCERT Delhi | N23: {ks=h; dk;kZy; y[kuÅ
A24: 69 | B24: ekHkkfMiqqMh | C24: dr pattabhi sitaraman | D24: 1 | E24: 15 | F24: of:=[.E24]*[.D24] -> 15 | G24: 1994 | I24: of:=YEAR(TODAY())-[.G24] -> 31 | L24: 1990 | M24: NCERT Delhi | N24: {ks=h; dk;kZy; y[kuÅ
A25: 73 | B25: izse 'kadj | C25: nanhe dulare bajpeyi | D25: 1 | E25: 15 | F25: of:=[.E25]*[.D25] -> 15 | G25: 1994 | I25: of:=YEAR(TODAY())-[.G25] -> 31 | L25: 1981 | M25: NCERT Delhi | N25: {ks=h; dk;kZy; y[kuÅ
A26: 75 | B26: fo".kqny 'kekZ | C26: surya mal mishran | D26: 1 | E26: 15 | F26: of:=[.E26]*[.D26] -> 15 | G26: 1994 | I26: of:=YEAR(TODAY())-[.G26] -> 31 | L26: 1990 | M26: NCERT Delhi | N26: {ks=h; dk;kZy; y[kuÅ
A27: 76 | B27: d`".k ny | C27: sumitra nandan pant | D27: 1 | E27: 15 | F27: of:=[.E27]*[.D27] -> 15 | G27: 1994 | I27: of:=YEAR(TODAY())-[.G27] -> 31 | L27: 1982 | M27: NCERT Delhi | N27: {ks=h; dk;kZy; y[kuÅ
A28: 79 | B28: jes'k pUnz | C28: jay shanker prasad | D28: 1 | E28: 15 | F28: of:=[.E28]*[.D28] -> 15 | G28: 1994 | I28: of:=YEAR(TODAY())-[.G28] -> 31 | L28: 1990 | M28: NCERT Delhi | N28: {ks=h; dk;kZy; y[kuÅ
A29: 80 | B29: enu xks;y | C29: baalmukund | D29: 1 | E29: 15 | F29: of:=[.E29]*[.D29] -> 15 | G29: 1994 | I29: of:=YEAR(TODAY())-[.G29] -> 31 | L29: 1991 | M29: NCERT Delhi | N29: {ks=h; dk;kZy; y[kuÅ
A30: 88 | C30: ljkstuh uk;Mw | D30: 1 | E30: 10 | F30: of:=[.E30]*[.D30] -> 10 | G30: 1994 | I30: of:=YEAR(TODAY())-[.G30] -> 31 | L30: 1991 | M30: NCERT Delhi | N30: {ks=h; dk;kZy; y[kuÅ
A31: 90 | B31: kSy xqIrk] vy;k ikBd | C31: ehjk ogu] dLrqjck xka/kh | D31: 1 | E31: 9 | F31: of:=[.E31]*[.D31] -> 9 | G31: 1994 | I31: of:=YEAR(TODAY())-[.G31] -> 31 | L31: 1990 | M31: NCERT Delhi | N31: {ks=h; dk;kZy; y[kuÅ
A32: 91 | B32: izks0 Mh0 ih PkVVksik?;k; | C32: f'k{kd vkSj lekt | D32: 1 | E32: 53 | F32: of:=[.E32]*[.D32] -> 53 | G32: 1994 | I32: of:=YEAR(TODAY())-[.G32] -> 31 | L32: 1983-85 | M32: NCERT Delhi | N32: {ks=h; dk;kZy; y[kuÅ
A33: 92 | B33: fn0lh0 eqys | C33: LokLF; ,oa tula[;k | D33: 1 | F33: of:=[.E33]*[.D33] -> 0 | G33: 1994 | I33: of:=YEAR(TODAY())-[.G33] -> 31 | L33: 1992 | M33: NCERT Delhi | N33: {ks=h; dk;kZy; y[kuÅ
A34: 97 | B34: xksfoUnnkl | C34: v'kskd | D34: 1 | E34: 20 | F34: of:=[.E34]*[.D34] -> 20 | G34: 1994 | I34: of:=YEAR(TODAY())-[.G34] -> 31 | L34: 1990 | M34: NCERT Delhi | N34: {ks=h; dk;kZy; y[kuÅ
A35: 99 | B35: Mk0 xksfoUnnkl | C35: lqa[k fdlesa | D35: 1 | E35: 30 | F35: of:=[.E35]*[.D35] -> 30 | G35: 1994 | I35: of:=YEAR(TODAY())-[.G35] -> 31 | L35: 1990 | M35: NCERT Delhi | N35: {ks=h; dk;kZy; y[kuÅ
A36: 105 | B36: Mk0 xksfoUnnkl | C36: fodkl | D36: 1 | E36: 30 | F36: of:=[.E36]*[.D36] -> 30 | G36: 1994 | I36: of:=YEAR(TODAY())-[.G36] -> 31 | L36: 1990 | M36: NCERT Delhi | N36: {ks=h; dk;kZy; y[kuÅ
A37: 107 | B37: Mk0 xksfoUnnkl | C37: flagy ]}hi | D37: 1 | E37: 30 | F37: of:=[.E37]*[.D37] -> 30 | G37: 1994 | I37: of:=YEAR(TODAY())-[.G37] -> 31 | L37: 1990 | M37: NCERT Delhi | N37: {ks=h; dk;kZy; y[kuÅ
A38: 109 | B38: Mk0 xksfoUnnkl | C38: Hkfo";ok.kh | D38: 1 | E38: 40 | F38: of:=[.E38]*[.D38] -> 40 | G38: 1994 | I38: of:=YEAR(TODAY())-[.G38] -> 31 | L38: 1990 | M38: NCERT Delhi | N38: {ks=h; dk;kZy; y[kuÅ
A39: 110 | B39: e/kqdj fn?ks | C39: iwokZpay dh vksj | D39: 1 | E39: 90 | F39: of:=[.E39]*[.D39] -> 90 | G39: 1994 | I39: of:=YEAR(TODAY())-[.G39] -> 31 | L39: 1993 | M39: NCERT Delhi | N39: {ks=h; dk;kZy; y[kuÅ
A40: 118 | B40: Lokeh eqeq{kkuUn | C40: foosdkuUn lkfgR; 6 | D40: 1 | E40: 175 | F40: of:=[.E40]*[.D40] -> 175 | G40: 1994 | I40: of:=YEAR(TODAY())-[.G40] -> 31 | L40: 1993 | M40: NCERT Delhi | N40: {ks=h; dk;kZy; y[kuÅ
A41: 120 | B41: Lokeh eqeq{kkuUn | C41: foosdkuUn lkfgR; 8 | D41: 1 | E41: 175 | F41: of:=[.E41]*[.D41] -> 175 | G41: 1994 | I41: of:=YEAR(TODAY())-[.G41] -> 31 | L41: 1993 | M41: NCERT Delhi | N41: {ks=h; dk;kZy; y[kuÅ
A42: 133 | B42: C.D. Gupta | C42: The C.of satyajit Ray | D42: 1 | E42: 44 | F42: of:=[.E42]*[.D42] -> 44 | G42: 1995 | I42: of:=YEAR(TODAY())-[.G42] -> 30 | L42: 1994 | M42: N.B.T. | N42: Deepak Book agency
A43: 143 | B43: K.A. Abbas | C43: HOW FILMS ARE MADE | D43: 1 | E43: 7 | F43: of:=[.E43]*[.D43] -> 7 | G43: 1995 | I43: of:=YEAR(TODAY())-[.G43] -> 30 | L43: 1977 | M43: N.B.T. | N43: Deepak Book agency
A44: 144 | B44: l. Majumdar | C44: The S. of our Rivers. (P-1) | D44: 1 | E44: 8 | F44: of:=[.E44]*[.D44] -> 8 | G44: 1995 | I44: of:=YEAR(TODAY())-[.G44] -> 30 | L44: 1970 | M44: N.B.T. | N44: Deepak Book agency
A45: 145 | B45: A.hayashi | C45: Hello Moon | D45: 1 | E45: 6 | F45: of:=[.E45]*[.D45] -> 6 | G45: 1995 | I45: of:=YEAR(TODAY())-[.G45] -> 30 | L45: 1986 | M45: N.B.T. | N45: Deepak Book agency
A46: 146 | B46: AL. Valliappa | C46: The S. of our Rivers. (P-2) | D46: 1 | E46: 7 | F46: of:=[.E46]*[.D46] -> 7 | G46: 1995 | I46: of:=YEAR(TODAY())-[.G46] -> 30 | L46: 1973 | M46: N.B.T. | N46: Deepak Book agency
A47: 147 | B47: R.Bond | C47: The W. of trees | D47: 1 | E47: 5 | F47: of:=[.E47]*[.D47] -> 5 | G47: 1995 | I47: of:=YEAR(TODAY())-[.G47] -> 30 | L47: 1975 | M47: N.B.T. | N47: Deepak Book agency
A48: 150 | B48: R. Bond | C48: W.W.at the zoo | D48: 1 | E48: 6 | F48: of:=[.E48]*[.D48] -> 6 | G48: 1995 | I48: of:=YEAR(TODAY())-[.G48] -> 30 | L48: 1974 | M48: N.B.T. | N48: Deepak Book agency
A49: 154 | B49: K. Satyanand | C49: The S. of the red cross | D49: 1 | E49: 6.5 | F49: of:=[.E49]*[.D49] -> 6.5 | G49: 1995 | I49: of:=YEAR(TODAY())-[.G49] -> 30 | L49: 1975 | M49: N.B.T. | N49: Deepak Book agency
A50: 157 | B50: N.Manuishakam | C50: Environmenttal Pollution | D50: 1 | E50: 30 | F50: of:=[.E50]*[.D50] -> 30 | G50: 1995 | I50: of:=YEAR(TODAY())-[.G50] -> 30 | L50: 1984 | M50: N.B.T. | N50: Deepak Book agency
A51: 164 | B51: K. Chaitanya | C51: H.I.W.H. Freedom | D51: 1 | E51: 10 | F51: of:=[.E51]*[.D51] -> 10 | G51: 1995 | I51: of:=YEAR(TODAY())-[.G51] -> 30 | L51: 1973 | M51: N.B.T. | N51: Deepak Book agency
A52: 166 | B52: K.B. | C52: Waiting for the rain | D52: 1 | E52: 7.5 | F52: of:=[.E52]*[.D52] -> 7.5 | G52: 1995 | I52: of:=YEAR(TODAY())-[.G52] -> 30 | L52: 1990 | M52: N.B.T. | N52: Deepak Book agency
A53: 167 | B53: Marti | C53: What is a tree | D53: 1 | E53: 7.5 | F53: of:=[.E53]*[.D53] -> 7.5 | G53: 1995 | I53: of:=YEAR(TODAY())-[.G53] -> 30 | L53: 1994 | M53: N.B.T. | N53: Deepak Book agency
A54: 168 | B54: P. Chakravati | C54: Our tree | D54: 1 | E54: 6.5 | F54: of:=[.E54]*[.D54] -> 6.5 | G54: 1995 | I54: of:=YEAR(TODAY())-[.G54] -> 30 | L54: 1985 | M54: N.B.T. | N54: Deepak Book agency
A55: 169 | B55: Rama | C55: Water | D55: 1 | E55: 8.5 | F55: of:=[.E55]*[.D55] -> 8.5 | G55: 1995 | I55: of:=YEAR(TODAY())-[.G55] -> 30 | L55: 1987 | M55: N.B.T. | N55: Deepak Book agency
A56: 170 | B56: K.S.Shekharam | C56: Our useful Plants | D56: 1 | E56: 8 | F56: of:=[.E56]*[.D56] -> 8 | G56: 1995 | I56: of:=YEAR(TODAY())-[.G56] -> 30 | L56: 1982 | M56: N.B.T. | N56: Deepak Book agency
A57: 172 | B57: J.Manokaran | C57: Sun flower & butterflies | D57: 1 | E57: 8.5 | F57: of:=[.E57]*[.D57] -> 8.5 | G57: 1995 | I57: of:=YEAR(TODAY())-[.G57] -> 30 | L57: 1993 | M57: N.B.T. | N57: Deepak Book agency
A58: 173 | B58: N.S, Gupta | C58: The beautiful peacock | D58: 1 | E58: 5 | F58: of:=[.E58]*[.D58] -> 5 | G58: 1995 | I58: of:=YEAR(TODAY())-[.G58] -> 30 | L58: 1988 | M58: N.B.T. | N58: Deepak Book agency
A59: 174 | B59: D.Dev | C59: The story of mango | D59: 1 | E59: 6 | F59: of:=[.E59]*[.D59] -> 6 | G59: 1995 | I59: of:=YEAR(TODAY())-[.G59] -> 30 | L59: 1993 | M59: N.B.T. | N59: Deepak Book agency
A60: 176 | B60: M.Mujeeb | C60: Dr. zakir Hussain | D60: 1 | E60: 10 | F60: of:=[.E60]*[.D60] -> 10 | G60: 1995 | I60: of:=YEAR(TODAY())-[.G60] -> 30 | M60: N.B.T. | N60: Deepak Book agency
A61: 177 | B61: S.Prakash | C61: Story of swargiya | D61: 1 | E61: 28 | F61: of:=[.E61]*[.D61] -> 28 | G61: 1995 | I61: of:=YEAR(TODAY())-[.G61] -> 30 | L61: 1973 | M61: N.B.T. | N61: Deepak Book agency
A62: 181 | B62: Amrit Rai | C62: Prem chanda | D62: 1 | E62: 5 | F62: of:=[.E62]*[.D62] -> 5 | G62: 1995 | I62: of:=YEAR(TODAY())-[.G62] -> 30 | L62: 1978 | M62: N.B.T. | N62: Deepak Book agency
A63: 185 | B63: Amrit Rai | C63: Festival of Eid | D63: 1 | E63: 5 | F63: of:=[.E63]*[.D63] -> 5 | G63: 1995 | I63: of:=YEAR(TODAY())-[.G63] -> 30 | L63: 1980 | M63: N.B.T. | N63: Deepak Book agency
A64: 187 | B64: R. Paranjapa | C64: A story about water | D64: 1 | E64: 6 | F64: of:=[.E64]*[.D64] -> 6 | G64: 1995 | I64: of:=YEAR(TODAY())-[.G64] -> 30 | L64: 1992 | M64: N.B.T. | N64: Deepak Book agency
A65: 205 | B65: izhre flag | C65: egkjktk j.kthr flag | D65: 1 | E65: 5.5 | F65: of:=[.E65]*[.D65] -> 5.5 | G65: 1995 | I65: of:=YEAR(TODAY())-[.G65] -> 30 | L65: 1989 | M65: N.B.T. India | N65: Deepak Book agency
A66: 217 | B66: lnkf'ko okSfM;kj | C66: jkuh psUuEek | D66: 1 | E66: 10 | F66: of:=[.E66]*[.D66] -> 10 | G66: 1995 | I66: of:=YEAR(TODAY())-[.G66] -> 30 | L66: 1980 | M66: N.B.T. India | N66: Deepak Book agency
A67: 225 | B67: ,l-,- v;;j | C67: vktkn fgan QkSt dh dgkuh | D67: 1 | E67: 22 | F67: of:=[.E67]*[.D67] -> 22 | G67: 1995 | I67: of:=YEAR(TODAY())-[.G67] -> 30 | L67: 1972 | M67: N.B.T. India | N67: Deepak Book agency
A68: 227 | B68: T;ksfr"k nRr xqIr | C68: Hkjrh; U;kSgkj | D68: 1 | E68: 26 | F68: of:=[.E68]*[.D68] -> 26 | G68: 1995 | I68: of:=YEAR(TODAY())-[.G68] -> 30 | L68: 1983 | M68: N.B.T. India | N68: Deepak Book agency
A69: 243 | B69: deyk 'kekZ | C69: vijkftrk | D69: 1 | E69: 11 | F69: of:=[.E69]*[.D69] -> 11 | G69: 1995 | I69: of:=YEAR(TODAY())-[.G69] -> 30 | L69: 1990 | M69: C.B.T.India | N69: Deepak Book agency
A70: 244 | B70: czts'oj cekZ | C70: lwjnkl | D70: 1 | E70: 8 | F70: of:=[.E70]*[.D70] -> 8 | G70: 1995 | I70: of:=YEAR(TODAY())-[.G70] -> 30 | L70: 1969 | M70: C.B.T.India | N70: Deepak Book agency
A71: 253 | B71: jktsUnz'kadj HkVV | C71: egkjk.kk izrki | D71: 1 | E71: 12 | F71: of:=[.E71]*[.D71] -> 12 | G71: 1995 | I71: of:=YEAR(TODAY())-[.G71] -> 30 | L71: 1967 | M71: N.B.T. India | N71: Deepak Book agency
A72: 255 | B72: vkj-ds izHkq | C72: egkRek xka/kh ds fopkj | D72: 1 | E72: 76 | F72: of:=[.E72]*[.D72] -> 76 | G72: 1995 | I72: of:=YEAR(TODAY())-[.G72] -> 30 | L72: 1994 | M72: N.B.T. India | N72: Deepak Book agency
A73: 270 | B73: okyehfd pkS/kjh | C73: Hkjr ds izFke jk"Vifr Mk0 jktsUnz izlkn | D73: 1 | E73: 8.5 | F73: of:=[.E73]*[.D73] -> 8.5 | G73: 1995 | I73: of:=YEAR(TODAY())-[.G73] -> 30 | L73: 1984 | M73: N.B.T. India | N73: Deepak Book agency
A74: 276 | B74: Vh-,e-ih- egknsou | C74: kadjk pk;Z | D74: 1 | E74: 9 | F74: of:=[.E74]*[.D74] -> 9 | G74: 1995 | I74: of:=YEAR(TODAY())-[.G74] -> 30 | L74: 1968 | M74: N.B.T. India | N74: Deepak Book agency
A75: 277 | B75: Mk- jktdqekj | C75: ,uh cslsaV | D75: 1 | E75: 11 | F75: of:=[.E75]*[.D75] -> 11 | G75: 1995 | I75: of:=YEAR(TODAY())-[.G75] -> 30 | L75: 1912 | M75: N.B.T. India | N75: Deepak Book agency
A76: 279 | B76: vydk 'kadj | C76: bfUnjk fiz;nf'kZuh | D76: 1 | E76: 28 | F76: of:=[.E76]*[.D76] -> 28 | G76: 1995 | I76: of:=YEAR(TODAY())-[.G76] -> 30 | L76: 1992 | M76: N.B.T. India | N76: Deepak Book agency
A77: 284 | B77: egk'ork nsoh | C77: brok eqaMk us yM+kbZ thrh | D77: 1 | E77: 7 | F77: of:=[.E77]*[.D77] -> 7 | G77: 1995 | I77: of:=YEAR(TODAY())-[.G77] -> 30 | L77: 1993 | N77: Deepak Book agency
A78: 286 | B78: ,e- eqthc | C78: Mk0 tkfdj gqlSu | D78: 1 | E78: 35 | F78: of:=[.E78]*[.D78] -> 35 | G78: 1995 | I78: of:=YEAR(TODAY())-[.G78] -> 30 | L78: 1972 | N78: Deepak Book agency
A79: 303 | B79: foeyk jLrkSxh | C79: flLvj fuosfnrk | D79: 1 | E79: 12 | F79: of:=[.E79]*[.D79] -> 12 | G79: 1995 | I79: of:=YEAR(TODAY())-[.G79] -> 30 | L79: 1993 | M79: Ikzdk'ku foHkkx | N79: Deepak Book agency
A80: 305 | B80: fouksn feJ | C80: 'kghnks ds [kr | D80: 1 | E80: 5 | F80: of:=[.E80]*[.D80] -> 5 | G80: 1995 | I80: of:=YEAR(TODAY())-[.G80] -> 30 | L80: 1990 | M80: Ikzdk'ku foHkkx | N80: Deepak Book agency
A81: 313 | B81: fQjkst pUn | C81: yktir jk; | D81: 1 | E81: 50 | F81: of:=[.E81]*[.D81] -> 50 | G81: 1995 | I81: of:=YEAR(TODAY())-[.G81] -> 30 | L81: 1987 | M81: Ikzdk'ku foHkkx | N81: Deepak Book agency
A82: 315 | C82: HkkjrsUnq gfj'pUnz | D82: 1 | E82: 8 | F82: of:=[.E82]*[.D82] -> 8 | G82: 1995 | I82: of:=YEAR(TODAY())-[.G82] -> 30 | L82: 1983 | M82: Ikzdk'ku foHkkx | N82: Deepak Book agency
A83: 316 | B83: ch-vkj- oekZ | D83: 1 | E83: 13 | F83: of:=[.E83]*[.D83] -> 13 | G83: 1995 | I83: of:=YEAR(TODAY())-[.G83] -> 30 | L83: 1980 | M83: Ikzdk'ku foHkkx | N83: Deepak Book agency
A84: 325 | B84: {kse pUnz lqeu | C84: fgUnh ds ;'kLoh i=dkj | D84: 1 | E84: 5 | F84: of:=[.E84]*[.D84] -> 5 | G84: 1995 | I84: of:=YEAR(TODAY())-[.G84] -> 30 | L84: 1986 | M84: Ikzdk'ku foHkkx | N84: Deepak Book agency
A85: 329 | B85: foiu panz | C85: LorU=rk laxzke | D85: 1 | E85: 28 | F85: of:=[.E85]*[.D85] -> 28 | G85: 1995 | I85: of:=YEAR(TODAY())-[.G85] -> 30 | L85: 1972 | M85: N.B.T. India | N85: Deepak Book agency
A86: 334 | B86: Mk0 chjokyk Hkkolkj | C86: vkfnoklh dyk | D86: 1 | E86: 20 | F86: of:=[.E86]*[.D86] -> 20 | G86: 1995 | I86: of:=YEAR(TODAY())-[.G86] -> 30 | L86: 1993 | M86: Ikzdk'ku foHkkx | N86: Deepak Book agency
A87: 337 | B87: Mk0 n'kjFk vks>k | C87: vkfn 'kadjkpk;Z thou vkSj lans'k | D87: 1 | E87: 15 | F87: of:=[.E87]*[.D87] -> 15 | G87: 1995 | I87: of:=YEAR(TODAY())-[.G87] -> 30 | L87: 1991 | M87: Ikzdk'ku foHkkx | N87: Deepak Book agency
A88: 358 | B88: Anita Patel | C88: C.B Raman | D88: 1 | E88: 20 | F88: of:=[.E88]*[.D88] -> 20 | G88: 1995 | I88: of:=YEAR(TODAY())-[.G88] -> 30 | L88: 1993 | M88: Learning Press | N88: Deepak Book agency
A89: 359 | B89: Many Joseph | C89: Louis Pastuer | D89: 1 | E89: 15 | F89: of:=[.E89]*[.D89] -> 15 | G89: 1995 | I89: of:=YEAR(TODAY())-[.G89] -> 30 | L89: 1993 | M89: Learning Press | N89: Deepak Book agency
A90: 366 | B90: Anita Patel | C90: Homi Bhabba | D90: 1 | E90: 15 | F90: of:=[.E90]*[.D90] -> 15 | G90: 1995 | I90: of:=YEAR(TODAY())-[.G90] -> 30 | L90: 1993 | M90: Learning Press | N90: Deepak Book agency
A91: 370 | B91: Vandana Malhotra | C91: Michael faraday | D91: 1 | E91: 15 | F91: of:=[.E91]*[.D91] -> 15 | G91: 1995 | I91: of:=YEAR(TODAY())-[.G91] -> 30 | L91: 1994 | M91: Learning Press | N91: Deepak Book agency
A92: 371 | B92: Madhuri | C92: Alexander Flaming | D92: 1 | E92: 15 | F92: of:=[.E92]*[.D92] -> 15 | G92: 1995 | I92: of:=YEAR(TODAY())-[.G92] -> 30 | L92: 1994 | M92: Learning Press | N92: Deepak Book agency
A93: 378 | B93: Mary Joseph | C93: Alfred Nobel | D93: 1 | E93: 15 | F93: of:=[.E93]*[.D93] -> 15 | G93: 1995 | I93: of:=YEAR(TODAY())-[.G93] -> 30 | L93: 1994 | M93: Learning Press | N93: Deepak Book agency
A94: 382 | B94: C.Mathur | C94: Pronoun | D94: 1 | E94: 25 | F94: of:=[.E94]*[.D94] -> 25 | G94: 1995 | I94: of:=YEAR(TODAY())-[.G94] -> 30 | L94: 1994 | M94: Learning Press | N94: Deepak Book agency
A95: 427 | B95: vy oyhvIik | C95: gekjh ufn;ksa dh dgkuh &2 | D95: 1 | E95: 6.5 | F95: of:=[.E95]*[.D95] -> 6.5 | G95: 1995 | I95: of:=YEAR(TODAY())-[.G95] -> 30 | L95: 1993 | M95: N.B.T. | N95: Deepak Book agency
A96: 434 | B96: d`".k d``iykuh | C96: }kfjdkukFk VSxksj | D96: 1 | E96: 37 | F96: of:=[.E96]*[.D96] -> 37 | G96: 1995 | I96: of:=YEAR(TODAY())-[.G96] -> 30 | L96: 1989 | M96: N.B.T. | N96: Deepak Book agency
A97: 437 | B97: lq/khjiar | C97: vklQ vyh | D97: 1 | E97: 12 | F97: of:=[.E97]*[.D97] -> 12 | G97: 1995 | I97: of:=YEAR(TODAY())-[.G97] -> 30 | L97: 1989 | M97: N.B.T. | N97: Deepak Book agency
A98: 438 | B98: [kyhQ vgen futkeh | C98: ks[k futkeqnhu vkSfy;k | D98: 1 | E98: 10.5 | F98: of:=[.E98]*[.D98] -> 10.5 | G98: 1995 | I98: of:=YEAR(TODAY())-[.G98] -> 30 | L98: 1990 | M98: N.B.T. | N98: Deepak Book agency
A99: 441 | B99: ghjk yky 'kekZ | C99: vfgY;k ckbZ | D99: 1 | E99: 15 | F99: of:=[.E99]*[.D99] -> 15 | G99: 1995 | I99: of:=YEAR(TODAY())-[.G99] -> 30 | L99: 1994 | M99: N.B.T. | N99: Deepak Book agency
A100: 444 | B100: uotkr | C100: Jh vjfoUn | D100: 1 | E100: 12.5 | F100: of:=[.E100]*[.D100] -> 12.5 | G100: 1995 | I100: of:=YEAR(TODAY())-[.G100] -> 30 | L100: 1990 | M100: N.B.T. | N100: Deepak Book agency
A101: 462 | B101: olq/kk pdzorhZ | C101: flLvj fuosfnrk | D101: 1 | E101: 8 | F101: of:=[.E101]*[.D101] -> 8 | G101: 1995 | I101: of:=YEAR(TODAY())-[.G101] -> 30 | L101: 1990 | M101: N.B.T. | N101: Deepak Book agency
A102: 476 | B102: ckcwjke vktkn | C102: Jh R;kxjkt | D102: 1 | E102: 12 | F102: of:=[.E102]*[.D102] -> 12 | G102: 1995 | I102: of:=YEAR(TODAY())-[.G102] -> 30 | L102: 1986 | M102: izdk'ku foHkkx | N102: Deepak Book agency
A103: 480 | B103: lhrkjke [ksMkoky | C103: iszepUn us dgk Fkk | D103: 1 | E103: 34.6 | F103: of:=[.E103]*[.D103] -> 34.6 | G103: 1995 | I103: of:=YEAR(TODAY())-[.G103] -> 30 | L103: 1990 | M103: izdk'ku foHkkx | N103: Deepak Book agency
A104: 488 | B104: Mk0 ghjkyky cnksfr;k | C104: ugha :drh gS unh | D104: 1 | E104: 6 | F104: of:=[.E104]*[.D104] -> 6 | G104: 1995 | I104: of:=YEAR(TODAY())-[.G104] -> 30 | L104: 1988 | M104: izdk'ku foHkkx | N104: Deepak Book agency
A105: 490 | B105: lq'khy dqekj | C105: rFkkxr Hkxoku | D105: 1 | E105: 10 | F105: of:=[.E105]*[.D105] -> 10 | G105: 1995 | I105: of:=YEAR(TODAY())-[.G105] -> 30 | L105: 1994 | M105: vk;Z cqd fMiks | N105: {ks=h; dk;kZy; y[kuÅ
A106: 508 | B106: Bkdqj izlkn flag | C106: ckcw fo"k.kq ijkM+dj | D106: 1 | E106: 15 | F106: of:=[.E106]*[.D106] -> 15 | G106: 1995 | I106: of:=YEAR(TODAY())-[.G106] -> 30 | L106: 1994 | M106: lkfgR; vdkneh | N106: {ks=h; dk;kZy; y[kuÅ
A107: 509 | B107: lkfyy 'kqDy | C107: Hkxorh pj.k xqIr | D107: 1 | E107: 15 | F107: of:=[.E107]*[.D107] -> 15 | G107: 1995 | I107: of:=YEAR(TODAY())-[.G107] -> 30 | L107: 1989 | M107: vk;Z cqd fMiks | N107: {ks=h; dk;kZy; y[kuÅ
A108: 512 | B108: fo".kq izHkkdj | C108: Lokeh n;kUkUn ljLorh | D108: 1 | E108: 15 | F108: of:=[.E108]*[.D108] -> 15 | G108: 1995 | I108: of:=YEAR(TODAY())-[.G108] -> 30 | L108: 1991 | M108: lkfgR; vdkneh | N108: {ks=h; dk;kZy; y[kuÅ
A109: 514 | B109: cyoUr flag vkuUn | C109: ckck Qjhn | D109: 1 | E109: 15 | F109: of:=[.E109]*[.D109] -> 15 | G109: 1995 | I109: of:=YEAR(TODAY())-[.G109] -> 30 | L109: 1991 | M109: lkfgR; vdkneh | N109: {ks=h; dk;kZy; y[kuÅ
A110: 520 | B110: vkse fodkl | C110: dEi;wVj ls ckrphr | D110: 1 | E110: 10 | F110: of:=[.E110]*[.D110] -> 10 | G110: 1995 | I110: of:=YEAR(TODAY())-[.G110] -> 30 | L110: 1989 | M110: ,u0lhbZ0vkj0Vh2 | N110: {ks=h; dk;kZy; y[kuÅ
A111: 560 | B111: vouhUnz dqekj | C111: egkuek enu eksgu ekyoh; | D111: 1 | E111: 12 | F111: of:=[.E111]*[.D111] -> 12 | G111: 1995 | I111: of:=YEAR(TODAY())-[.G111] -> 30 | L111: 1989 | M111: vk;Z cqd fMiks | N111: {ks=h; dk;kZy; y[kuÅ
A112: 567 | B112: fo'o fiz; eq[kthZ | C112: txnh'k pUnz cksl | D112: 1 | E112: 30 | F112: of:=[.E112]*[.D112] -> 30 | G112: 1995 | I112: of:=YEAR(TODAY())-[.G112] -> 30 | L112: 1993 | M112: lwpu ,oa izlkj.k ea=ky; | N112: {ks=h; dk;kZy; y[kuÅ
A113: 568 | B113: vkj- ikFkZ lkjFkh | C113: ds- dkejkt | D113: 1 | E113: 7 | F113: of:=[.E113]*[.D113] -> 7 | G113: 1995 | I113: of:=YEAR(TODAY())-[.G113] -> 30 | L113: 1986 | M113: lwpu ,oa izlkj.k ea=ky; | N113: {ks=h; dk;kZy; y[kuÅ
A114: 569 | B114: Mk0 jkts'k izlkn | C114: Hkkjr ds egku f'k{kk 'kkL=h | D114: 1 | E114: 12 | F114: of:=[.E114]*[.D114] -> 12 | G114: 1995 | I114: of:=YEAR(TODAY())-[.G114] -> 30 | L114: 1992 | M114: lwpu ,oa izlkj.k ea=ky; | N114: {ks=h; dk;kZy; y[kuÅ
A115: 571 | B115: ds0 d`".k ewfrZ | C115: ck.k HkVV | D115: 1 | E115: 15 | F115: of:=[.E115]*[.D115] -> 15 | G115: 1995 | I115: of:=YEAR(TODAY())-[.G115] -> 30 | L115: 1992 | M115: lkfgR; vdkneh | N115: {ks=h; dk;kZy; y[kuÅ
A116: 574 | B116: euksgj yky oekZ | C116: Mk0 izQqYy PkUnz jk; | D116: 1 | E116: 1 | F116: of:=[.E116]*[.D116] -> 1 | G116: 1995 | I116: of:=YEAR(TODAY())-[.G116] -> 30 | L116: 1993 | M116: vEoj izdk'ku | N116: {ks=h; dk;kZy; y[kuÅ
A117: 587 | B117: ekSykuk vktkn | C117: izsjd egku ekuo | D117: 1 | E117: 1 | F117: of:=[.E117]*[.D117] -> 1 | G117: 1995 | I117: of:=YEAR(TODAY())-[.G117] -> 30 | L117: 1989 | M117: ihrkEcj | N117: {ks=h; dk;kZy; y[kuÅ
A118: 592 | B118: vkse izdk'k | C118: vk/kqfud fgUnh lkfgR; | D118: 1 | E118: 1 | F118: of:=[.E118]*[.D118] -> 1 | G118: 1995 | I118: of:=YEAR(TODAY())-[.G118] -> 30 | L118: 1990 | M118: ihrkEcj | N118: {ks=h; dk;kZy; y[kuÅ
A119: 609 | B119: t-oa?ksik/;k; | C119: Hkkjrh; lkaLd`frd fuf/k Ik;kZoj.k Ja[kyk | D119: 1 | E119: 10 | F119: of:=[.E119]*[.D119] -> 10 | G119: 1995 | I119: of:=YEAR(TODAY())-[.G119] -> 30 | L119: 1984 | M119: Hkkjrh; lakLd`fr | N119: {ks=h; dk;kZy; y[kuÅ
A120: 610 | B120: ,e-y{e.k psfVokj | C120: rfeyukMq yksdlaLd`fr | D120: 1 | E120: 1 | F120: of:=[.E120]*[.D120] -> 1 | G120: 1995 | I120: of:=YEAR(TODAY())-[.G120] -> 30 | L120: 1973 | M120: us0 cqd VªªLV | N120: {ks=h; dk;kZy; y[kuÅ
A121: 620 | B121: c`t fd'kksj feJ | C121: vo/k ds izeq[k dfo | D121: 1 | E121: 1 | F121: of:=[.E121]*[.D121] -> 1 | G121: 1995 | I121: of:=YEAR(TODAY())-[.G121] -> 30 | L121: 1960 | M121: fgUnh foHkkx y[kuÅ | N121: {ks=h; dk;kZy; y[kuÅ
A122: 621 | B122: Mk0 nhun;ky xqIr | C122: cztHkk"kk lwj dks'k Hkkx-1 | D122: 1 | E122: 1 | F122: of:=[.E122]*[.D122] -> 1 | G122: 1995 | I122: of:=YEAR(TODAY())-[.G122] -> 30 | M122: fgUnh foHkkx y[kuÅ | N122: {ks=h; dk;kZy; y[kuÅ
A123: 623 | B123: Mk0 nhun;ky xqIr | C123: cztHkk"kk lwj dks'k Hkkx-3 | D123: 1 | E123: 1 | F123: of:=[.E123]*[.D123] -> 1 | G123: 1995 | I123: of:=YEAR(TODAY())-[.G123] -> 30 | M123: fgUnh foHkkx y[kuÅ | N123: {ks=h; dk;kZy; y[kuÅ
A124: 624 | B124: Mk0 nhun;ky xqIr | C124: cztHkk"kk lwj dks'k Hkkx-4 | D124: 1 | E124: 1 | F124: of:=[.E124]*[.D124] -> 1 | G124: 1995 | I124: of:=YEAR(TODAY())-[.G124] -> 30 | M124: fgUnh foHkkx y[kuÅ | N124: {ks=h; dk;kZy; y[kuÅ
A125: 626 | B125: Mk0 nhun;ky xqIr | C125: cztHkk"kk lwj dks'k Hkkx-6 | D125: 1 | E125: 1 | F125: of:=[.E125]*[.D125] -> 1 | G125: 1995 | I125: of:=YEAR(TODAY())-[.G125] -> 30 | M125: fgUnh foHkkx y[kuÅ | N125: {ks=h; dk;kZy; y[kuÅ
A126: 627 | B126: Mk0 nhun;ky xqIr | C126: cztHkk"kk lwj dks'k Hkkx-7 | D126: 1 | E126: 1 | F126: of:=[.E126]*[.D126] -> 1 | G126: 1995 | I126: of:=YEAR(TODAY())-[.G126] -> 30 | M126: fgUnh foHkkx y[kuÅ | N126: {ks=h; dk;kZy; y[kuÅ
A127: 628 | B127: Mk0 nhun;ky xqIr | C127: cztHkk"kk lwj dks'k Hkkx-8 | D127: 1 | E127: 1 | F127: of:=[.E127]*[.D127] -> 1 | G127: 1995 | I127: of:=YEAR(TODAY())-[.G127] -> 30 | M127: fgUnh foHkkx y[kuÅ | N127: {ks=h; dk;kZy; y[kuÅ
A128: 629 | B128: Mk0 nhun;ky xqIr | C128: cztHkk"kk lwj dks'k Hkkx-9 | D128: 1 | E128: 1 | F128: of:=[.E128]*[.D128] -> 1 | G128: 1995 | I128: of:=YEAR(TODAY())-[.G128] -> 30 | M128: fgUnh foHkkx y[kuÅ | N128: {ks=h; dk;kZy; y[kuÅ
A129: 630 | B129: Mk0 nhun;ky xqIr | C129: cztHkk"kk lwj dks'k Hkkx-10 | D129: 1 | E129: 1 | F129: of:=[.E129]*[.D129] -> 1 | G129: 1995 | I129: of:=YEAR(TODAY())-[.G129] -> 30 | M129: fgUnh foHkkx y[kuÅ | N129: {ks=h; dk;kZy; y[kuÅ
A130: 631 | B130: Mk0 ljyk 'kqDy | C130: fgUnh lwQh dfo vkSj dkO; | D130: 1 | E130: 1 | F130: of:=[.E130]*[.D130] -> 1 | G130: 1995 | I130: of:=YEAR(TODAY())-[.G130] -> 30 | M130: fgUnh foHkkx y[kuÅ | N130: {ks=h; dk;kZy; y[kuÅ
A131: 639 | B131: ftusUnz Hkkjrh | C131: fn0 lkB esa _rq o.kZu | D131: 1 | E131: 20 | F131: of:=[.E131]*[.D131] -> 20 | G131: 1995 | I131: of:=YEAR(TODAY())-[.G131] -> 30 | M131: m0iz0 fgUnh la2 | N131: {ks=h; dk;kZy; y[kuÅ
A132: 642 | B132: eqgEen xqDrQk [ka | C132: mnwZ fgUnh 'kCndks'k | D132: 1 | E132: 140 | F132: of:=[.E132]*[.D132] -> 140 | G132: 1995 | I132: of:=YEAR(TODAY())-[.G132] -> 30 | L132: 1992 | M132: m0iz0 fgUnh la5 | N132: {ks=h; dk;kZy; y[kuÅ
A133: 644 | B133: lqjs'k flag | C133: Hkjrh; i{kh | D133: 1 | E133: 230 | F133: of:=[.E133]*[.D133] -> 230 | G133: 1995 | I133: of:=YEAR(TODAY())-[.G133] -> 30 | L133: 1992 | M133: m0iz fgUnh laLFkku | N133: {ks=h; dk;kZy; y[kuÅ
A134: 651 | B134: P.N Dev | C134: OPERATION BLACK BOARD | D134: 1 | E134: 11 | F134: of:=[.E134]*[.D134] -> 11 | G134: 1995 | I134: of:=YEAR(TODAY())-[.G134] -> 30 | L134: 1988 | M134: N.C.E.R.T | N134: {ks=h; dk;kZy; y[kuÅ
A135: 652 | B135: yhyk/kj 'kekZ | C135: Hkkjr ds izeq[k rhFkZ Lfky | D135: 1 | E135: 6 | F135: of:=[.E135]*[.D135] -> 6 | G135: 1995 | I135: of:=YEAR(TODAY())-[.G135] -> 30 | L135: 1990 | M135: N.C.E.R.T | N135: {ks=h; dk;kZy; y[kuÅ
A136: 658 | B136: nhun;ky f=osnh | C136: gekjk v:ukpy izns'k | D136: 1 | E136: 8 | F136: of:=[.E136]*[.D136] -> 8 | G136: 1995 | I136: of:=YEAR(TODAY())-[.G136] -> 30 | L136: 1990 | M136: N.C.E.R.T | N136: {ks=h; dk;kZy; y[kuÅ
A137: 667 | B137: K. sudha Rao | C137: INFLUENCE OF CONT. EVALUATION ON LEARNING | D137: 1 | E137: 33.35 | F137: of:=[.E137]*[.D137] -> 33.35 | G137: 1995 | I137: of:=YEAR(TODAY())-[.G137] -> 30 | L137: 1986 | M137: N.C.E.R.T | N137: {ks=h; dk;kZy; y[kuÅ
A138: 668 | B138: Seizp Tashima | C138: Fly grasshopper | D138: 1 | E138: 16 | F138: of:=[.E138]*[.D138] -> 16 | G138: 1995 | I138: of:=YEAR(TODAY())-[.G138] -> 30 | L138: 1992 | M138: N.B.P. | N138: {ks=h; dk;kZy; y[kuÅ
A139: 671 | B139: Madhu Powle | C139: Festival of colours | D139: 1 | E139: 6.5 | F139: of:=[.E139]*[.D139] -> 6.5 | G139: 1995 | I139: of:=YEAR(TODAY())-[.G139] -> 30 | L139: 1990 | M139: N.B.P. | N139: {ks=h; dk;kZy; y[kuÅ
A140: 672 | B140: Ashish sen gupta | C140: Set me free | D140: 1 | E140: 6.5 | F140: of:=[.E140]*[.D140] -> 6.5 | G140: 1995 | I140: of:=YEAR(TODAY())-[.G140] -> 30 | L140: 1995 | M140: N.B.P. | N140: {ks=h; dk;kZy; y[kuÅ
A141: 673 | B141: Mickey Patel | C141: The best thirteen | D141: 1 | E141: 22 | F141: of:=[.E141]*[.D141] -> 22 | G141: 1995 | I141: of:=YEAR(TODAY())-[.G141] -> 30 | L141: 1994 | M141: N.B.P. | N141: {ks=h; dk;kZy; y[kuÅ
A142: 675 | B142: Lila Majumdat | C142: Barapani | D142: 1 | E142: 8 | F142: of:=[.E142]*[.D142] -> 8 | G142: 1995 | I142: of:=YEAR(TODAY())-[.G142] -> 30 | L142: 1992 | M142: N.B.P. | N142: {ks=h; dk;kZy; y[kuÅ
A143: 676 | B143: Prem chand | C143: Festival of Eid | D143: 1 | E143: 5 | F143: of:=[.E143]*[.D143] -> 5 | G143: 1995 | I143: of:=YEAR(TODAY())-[.G143] -> 30 | L143: 1991 | M143: N.B.P. | N143: {ks=h; dk;kZy; y[kuÅ
A144: 677 | B144: Mahasveta devi | C144: Ek-Kori's dream | D144: 1 | E144: 7 | F144: of:=[.E144]*[.D144] -> 7 | G144: 1995 | I144: of:=YEAR(TODAY())-[.G144] -> 30 | L144: 1992 | M144: N.B.P. | N144: {ks=h; dk;kZy; y[kuÅ
A145: 681 | B145: Uma anand | C145: Be prepared | D145: 1 | E145: 8 | F145: of:=[.E145]*[.D145] -> 8 | G145: 1995 | I145: of:=YEAR(TODAY())-[.G145] -> 30 | L145: 1993 | M145: N.B.P. | N145: {ks=h; dk;kZy; y[kuÅ
A146: 698 | B146: ashish sen gupta | C146: L.s the red kite | D146: 1 | E146: 6.5 | F146: of:=[.E146]*[.D146] -> 6.5 | G146: 1995 | I146: of:=YEAR(TODAY())-[.G146] -> 30 | L146: 1995 | M146: N.B.T.I. | N146: {ks=h; dk;kZy; y[kuÅ
A147: 699 | B147: Qudria Z. | C147: Begam fulabo mousie | D147: 1 | E147: 7.5 | F147: of:=[.E147]*[.D147] -> 7.5 | G147: 1995 | I147: of:=YEAR(TODAY())-[.G147] -> 30 | L147: 1993 | M147: N.B.T.I. | N147: {ks=h; dk;kZy; y[kuÅ
A148: 700 | B148: Sant surti | C148: A visit to the zoo | D148: 1 | E148: 6 | F148: of:=[.E148]*[.D148] -> 6 | G148: 1995 | I148: of:=YEAR(TODAY())-[.G148] -> 30 | L148: 1994 | M148: N.B.T.I. | N148: {ks=h; dk;kZy; y[kuÅ
A149: 702 | B149: M.C. gabbriel | C149: A tale of trouble | D149: 1 | E149: 7.5 | F149: of:=[.E149]*[.D149] -> 7.5 | G149: 1995 | I149: of:=YEAR(TODAY())-[.G149] -> 30 | L149: 1992 | M149: N.B.T.I. | N149: {ks=h; dk;kZy; y[kuÅ
A150: 729 | B150: Dr. V.N. Bave | C150: You and your health | D150: 1 | E150: 67 | F150: of:=[.E150]*[.D150] -> 67 | G150: 1995 | I150: of:=YEAR(TODAY())-[.G150] -> 30 | L150: 1993 | M150: N.B.T.I. | N150: {ks=h; dk;kZy; y[kuÅ
A151: 755 | B151: Pratibha Nath | C151: The visitor | D151: 1 | E151: 10 | F151: of:=[.E151]*[.D151] -> 10 | G151: 1995 | I151: of:=YEAR(TODAY())-[.G151] -> 30 | L151: 1993 | M151: C.B.T.N.D | N151: {ks=h; dk;kZy; y[kuÅ
A152: 757 | B152: sharaddhaavan | C152: The rivers | D152: 1 | E152: 10 | F152: of:=[.E152]*[.D152] -> 10 | G152: 1995 | I152: of:=YEAR(TODAY())-[.G152] -> 30 | L152: 1993 | M152: C.B.T.N.D | N152: {ks=h; dk;kZy; y[kuÅ
A153: 758 | B153: shankar | C153: The tortoise and the swans | D153: 1 | E153: 10 | F153: of:=[.E153]*[.D153] -> 10 | G153: 1995 | I153: of:=YEAR(TODAY())-[.G153] -> 30 | L153: 1992 | M153: C.B.T.N.D | N153: {ks=h; dk;kZy; y[kuÅ
A154: 760 | B154: Shankar | C154: Four deafmen | D154: 1 | E154: 10 | F154: of:=[.E154]*[.D154] -> 10 | G154: 1995 | I154: of:=YEAR(TODAY())-[.G154] -> 30 | L154: 1984 | M154: C.B.T.N.D | N154: {ks=h; dk;kZy; y[kuÅ
A155: 762 | B155: A.K.Shri Kumar | C155: The Sami Tree | D155: 1 | E155: 12 | F155: of:=[.E155]*[.D155] -> 12 | G155: 1995 | I155: of:=YEAR(TODAY())-[.G155] -> 30 | L155: 1990 | M155: C.B.T.N.D | N155: {ks=h; dk;kZy; y[kuÅ
A156: 763 | B156: Deepak Krishchan | C156: Kala pani | D156: 1 | E156: 11 | F156: of:=[.E156]*[.D156] -> 11 | G156: 1995 | I156: of:=YEAR(TODAY())-[.G156] -> 30 | L156: 1993 | M156: C.B.T.N.D | N156: {ks=h; dk;kZy; y[kuÅ
A157: 766 | B157: B.G.Verma | C157: ONAM | D157: 1 | E157: 8 | F157: of:=[.E157]*[.D157] -> 8 | G157: 1995 | I157: of:=YEAR(TODAY())-[.G157] -> 30 | L157: 1990 | M157: C.B.T.N.D | N157: {ks=h; dk;kZy; y[kuÅ
A158: 770 | B158: xksiky d`".k | C158: The forest Nymph | D158: 1 | E158: 25 | F158: of:=[.E158]*[.D158] -> 25 | G158: 1995 | I158: of:=YEAR(TODAY())-[.G158] -> 30 | L158: 1993 | M158: lkfgR; vdkneh | N158: {ks=h; dk;kZy; y[kuÅ
A159: 814 | B159: Prem Nanda Kumar | C159: the mother | D159: 1 | E159: 5 | F159: of:=[.E159]*[.D159] -> 5 | G159: 1996 | I159: of:=YEAR(TODAY())-[.G159] -> 29 | L159: 1977 | M159: N.B.T. India | N159: Deepak book depot
A160: 815 | B160: Shakti M Gupta | C160: Birbal sahni | D160: 1 | E160: 4 | F160: of:=[.E160]*[.D160] -> 4 | G160: 1996 | I160: of:=YEAR(TODAY())-[.G160] -> 29 | L160: 1978 | M160: N.B.T. India | N160: Deepak book depot
A161: 816 | B161: Leela George | C161: Gautama buddha | D161: 1 | E161: 8 | F161: of:=[.E161]*[.D161] -> 8 | G161: 1996 | I161: of:=YEAR(TODAY())-[.G161] -> 29 | L161: 1982 | M161: N.B.T. India | N161: Deepak book depot
A162: 822 | B162: Sigrunshri Vastava | C162: India's young heroes | D162: 1 | E162: 7 | F162: of:=[.E162]*[.D162] -> 7 | G162: 1996 | I162: of:=YEAR(TODAY())-[.G162] -> 29 | L162: 1983 | M162: N.B.T. India | N162: Deepak book depot
A163: 825 | B163: sumangal Prakash | C163: story of swarajya part 2 | D163: 1 | E163: 10 | F163: of:=[.E163]*[.D163] -> 10 | G163: 1996 | I163: of:=YEAR(TODAY())-[.G163] -> 29 | L163: 1973 | M163: N.B.T. India | N163: Deepak book depot
A164: 835 | B164: Amrit Rai | C164: Prem chand | D164: 1 | E164: 5 | F164: of:=[.E164]*[.D164] -> 5 | G164: 1996 | I164: of:=YEAR(TODAY())-[.G164] -> 29 | L164: 1978 | M164: N.B.T. India | N164: Deepak book depot
A165: 837 | B165: Mehrooj wadia | C165: we Indians | D165: 1 | E165: 7.5 | F165: of:=[.E165]*[.D165] -> 7.5 | G165: 1996 | I165: of:=YEAR(TODAY())-[.G165] -> 29 | L165: 1984 | M165: N.B.T. India | N165: Deepak book depot
A166: 840 | B166: Valli Kannan | C166: Madam Rides the bus | D166: 1 | E166: 10.5 | F166: of:=[.E166]*[.D166] -> 10.5 | G166: 1996 | I166: of:=YEAR(TODAY())-[.G166] -> 29 | L166: 1982 | M166: N.B.T. India | N166: Deepak book depot
A167: 844 | B167: Jagdish Joshi | C167: search | D167: 1 | E167: 5.5 | F167: of:=[.E167]*[.D167] -> 5.5 | G167: 1996 | I167: of:=YEAR(TODAY())-[.G167] -> 29 | L167: 1991 | M167: N.B.T. India | N167: Deepak book depot
A168: 848 | B168: Shinta cho. | C168: little cabbage | D168: 1 | E168: 10 | F168: of:=[.E168]*[.D168] -> 10 | G168: 1996 | I168: of:=YEAR(TODAY())-[.G168] -> 29 | L168: 1992 | M168: N.B.T. India | N168: Deepak book depot
A169: 849 | B169: P. Division | C169: Temples of India | D169: 1 | E169: 30 | F169: of:=[.E169]*[.D169] -> 30 | G169: 1996 | I169: of:=YEAR(TODAY())-[.G169] -> 29 | L169: 1990 | M169: N.B.T. India | N169: Deepak book depot
A170: 870 | B170: Hkky;nz | C170: dkslyk | D170: 1 | E170: 48 | F170: of:=[.E170]*[.D170] -> 48 | G170: 1996 | I170: of:=YEAR(TODAY())-[.G170] -> 29 | L170: 1993 | M170: N.B.T. India | N170: Deepak book depot
A171: 875 | B171: kadj ekadk'kh | C171: xaxrok xaxkekbZ | D171: 1 | E171: 28 | F171: of:=[.E171]*[.D171] -> 28 | G171: 1996 | I171: of:=YEAR(TODAY())-[.G171] -> 29 | L171: 176 | M171: N.B.T. India | N171: Deepak book depot
A172: 877 | B172: e/q eaxs'k | C172: ekfge dh [kkMh | D172: 1 | E172: 26 | F172: of:=[.E172]*[.D172] -> 26 | G172: 1996 | I172: of:=YEAR(TODAY())-[.G172] -> 29 | L172: 1993 | M172: N.B.T. India | N172: Deepak book depot
A173: 880 | B173: ds-ih- ds'ko | C173: vrhr ds fnu | D173: 1 | E173: 38 | F173: of:=[.E173]*[.D173] -> 38 | G173: 1996 | I173: of:=YEAR(TODAY())-[.G173] -> 29 | L173: 1987 | M173: N.B.T. India | N173: Deepak book depot
A174: 887 | B174: cztsój | C174: lwjnkl | D174: 1 | E174: 8 | F174: of:=[.E174]*[.D174] -> 8 | G174: 1996 | I174: of:=YEAR(TODAY())-[.G174] -> 29 | L174: 1969 | M174: N.B.T. India | N174: Deepak book depot
A175: 890 | B175: okfljsMMh | C175: feVVh dk vkneh | D175: 1 | E175: 64 | F175: of:=[.E175]*[.D175] -> 64 | G175: 1996 | I175: of:=YEAR(TODAY())-[.G175] -> 29 | L175: 1995 | M175: N.B.T. India | N175: Deepak book depot
A176: 897 | B176: egkdfo Hkkl | C176: LoIuckl cnyk | D176: 1 | E176: 12 | F176: of:=[.E176]*[.D176] -> 12 | G176: 1996 | I176: of:=YEAR(TODAY())-[.G176] -> 29 | L176: 1992 | M176: N.B.T. India | N176: Deepak book depot
A177: 900 | B177: fo;ksxh gfj | C177: ckiw dh ,frgkfld ;k=k | D177: 1 | E177: 12 | F177: of:=[.E177]*[.D177] -> 12 | G177: 1996 | I177: of:=YEAR(TODAY())-[.G177] -> 29 | L177: 1989 | M177: lwpuk vkSj izlkj.k | N177: Deepak book depot
A178: 901 | B178: lq/kkdj ikaMs; | C178: xksfoUn cYyHk iar | D178: 1 | E178: 26 | F178: of:=[.E178]*[.D178] -> 26 | G178: 1996 | I178: of:=YEAR(TODAY())-[.G178] -> 29 | L178: 1987 | M178: lwpuk vkSj izlkj.k | N178: Deepak book depot
A179: 903 | B179: foalsV 'kfu | C179: xka/kh th | D179: 1 | E179: 50 | F179: of:=[.E179]*[.D179] -> 50 | G179: 1996 | I179: of:=YEAR(TODAY())-[.G179] -> 29 | L179: 1994 | M179: lwpuk vkSj izlkj.k | N179: Deepak book depot
A180: 905 | B180: Jh e/kqdj | C180: vkdk'kok.kh fofo/kk | D180: 1 | E180: 20 | F180: of:=[.E180]*[.D180] -> 20 | G180: 1996 | I180: of:=YEAR(TODAY())-[.G180] -> 29 | L180: 1993 | M180: vkdk'kok.kh egk0 | N180: Deepak book depot
A181: 919 | B181: dqosEiq | C181: dkuw: gsXxfMfr | D181: 1 | E181: 40 | F181: of:=[.E181]*[.D181] -> 40 | G181: 1996 | I181: of:=YEAR(TODAY())-[.G181] -> 29 | L181: 1981 | M181: lkfgR; vdkneh | N181: Deepak book depot
A182: 921 | B182: xtsUnz dqekj | C182: dydRrs ds ikl gh | D182: 1 | E182: 100 | F182: of:=[.E182]*[.D182] -> 100 | G182: 1996 | I182: of:=YEAR(TODAY())-[.G182] -> 29 | L182: 1992 | M182: lkfgR; vdkneh | N182: Deepak book depot
A183: 934 | B183: jtuh dkar | C183: esjh fcfV;k | D183: 1 | E183: 30 | F183: of:=[.E183]*[.D183] -> 30 | G183: 1996 | I183: of:=YEAR(TODAY())-[.G183] -> 29 | L183: 1994 | M183: lkfgR; vdkneh | N183: Deepak book depot
A184: 940 | B184: bClu | C184: eqxkZch | D184: 1 | E184: 15 | F184: of:=[.E184]*[.D184] -> 15 | G184: 1996 | I184: of:=YEAR(TODAY())-[.G184] -> 29 | L184: 1983 | M184: lkfgR; vdkneh | N184: Deepak book depot
A185: 941 | B185: fo".kq izHkkdj | C185: izlkn jpuk lap;u | D185: 1 | E185: 130 | F185: of:=[.E185]*[.D185] -> 130 | G185: 1996 | I185: of:=YEAR(TODAY())-[.G185] -> 29 | L185: 1991 | M185: lkfgR; vdkneh | N185: Deepak book depot
A186: 944 | B186: xaxk?kj xkMxhy | C186: cPpksa us nckspk pksj | D186: 1 | E186: 25 | F186: of:=[.E186]*[.D186] -> 25 | G186: 1996 | I186: of:=YEAR(TODAY())-[.G186] -> 29 | L186: 1993 | M186: lkfgR; vdkneh | N186: Deepak book depot
A187: 946 | B187: Ukk0ikFkZ lkjFkh | C187: ;g xyh fcdkm ugha | D187: 1 | E187: 40 | F187: of:=[.E187]*[.D187] -> 40 | G187: 1996 | I187: of:=YEAR(TODAY())-[.G187] -> 29 | L187: 1985 | M187: lkfgR; vdkneh | N187: Deepak book depot
A188: 947 | B188: l/kkukFk jk; | C188: fpfydk | D188: 1 | E188: 10 | F188: of:=[.E188]*[.D188] -> 10 | G188: 1996 | I188: of:=YEAR(TODAY())-[.G188] -> 29 | L188: 1970 | M188: lkfgR; vdkneh | N188: Deepak book depot
A189: 949 | B189: izHkkdj ekpos | C189: jkgqy lkad`R;k;u | D189: 1 | E189: 15 | F189: of:=[.E189]*[.D189] -> 15 | G189: 1996 | I189: of:=YEAR(TODAY())-[.G189] -> 29 | L189: 1990 | M189: lkfgR; vdkneh | N189: Deepak book depot
A190: 953 | B190: df.kdj rksej | C190: johUnz ukFk dh dgkfu;ka Hkkx 2 | D190: 1 | E190: 65 | F190: of:=[.E190]*[.D190] -> 65 | G190: 1996 | I190: of:=YEAR(TODAY())-[.G190] -> 29 | L190: 1990 | M190: lkfgR; vdkneh | N190: Deepak book depot
A191: 957 | B191: y{ke.k xk;dokM | C191: mBkbz xhjh | D191: 1 | E191: 100 | F191: of:=[.E191]*[.D191] -> 100 | G191: 1996 | I191: of:=YEAR(TODAY())-[.G191] -> 29 | L191: 1992 | M191: lkfgR; vdkneh | N191: Deepak book depot
A192: 958 | B192: ;qxthr uoyiqjh | C192: ckcjukek | D192: 1 | E192: 100 | F192: of:=[.E192]*[.D192] -> 100 | G192: 1996 | I192: of:=YEAR(TODAY())-[.G192] -> 29 | L192: 1994 | M192: lkfgR; vdkneh | N192: Deepak book depot
A193: 961 | B193: Mk0 ijekuan | C193: fons'kh ;kf=;ksa dh utj esa Hkkjr | D193: 1 | E193: 15 | F193: of:=[.E193]*[.D193] -> 15 | G193: 1996 | I193: of:=YEAR(TODAY())-[.G193] -> 29 | L193: 1992 | M193: lkfgR; vdkneh | N193: Deepak book depot
A194: 962 | B194: Mk0 n'kjFk | C194: vkfn 'kadjkpk;Z | D194: 1 | E194: 15 | F194: of:=[.E194]*[.D194] -> 15 | G194: 1996 | I194: of:=YEAR(TODAY())-[.G194] -> 29 | L194: 1991 | M194: lkfgR; vdkneh | N194: Deepak book depot
A195: 970 | B195: egsUnz flag | C195: dkaxMk | D195: 1 | E195: 50 | F195: of:=[.E195]*[.D195] -> 50 | G195: 1996 | I195: of:=YEAR(TODAY())-[.G195] -> 29 | L195: 1984 | M195: lkfgR; vdkneh | N195: Deepak book depot
A196: 971 | B196: Nk0 ljyk 'kqDy | C196: ik'pkR; thou dyk | D196: 1 | E196: 5 | F196: of:=[.E196]*[.D196] -> 5 | G196: 1996 | I196: of:=YEAR(TODAY())-[.G196] -> 29 | L196: 1973 | M196: mRrj izns'k 'kklu | N196: y[kuÅ {ks=h; dk;kZy;
A197: 972 | B197: izHkkdj lnk f'ko if.Mr | C197: egkjk"V ds lUrksa dh dFkk | D197: 1 | E197: 32 | F197: of:=[.E197]*[.D197] -> 32 | G197: 1996 | I197: of:=YEAR(TODAY())-[.G197] -> 29 | L197: 1991 | M197: mRrj izns'k 'kklu | N197: y[kuÅ {ks=h; dk;kZy;
A198: 975 | B198: Mk0 fo|kfuokl | C198: ckcw ';ke lqUnj nkl | D198: 1 | E198: 43 | F198: of:=[.E198]*[.D198] -> 43 | G198: 1996 | I198: of:=YEAR(TODAY())-[.G198] -> 29 | L198: 1983 | M198: mRrj izns'k 'kklu | N198: y[kuÅ {ks=h; dk;kZy;
A199: 983 | B199: okpLifr xSjksy | C199: Hkkjrh; laLd`fr vkSj dyk | D199: 1 | E199: 50 | F199: of:=[.E199]*[.D199] -> 50 | G199: 1996 | I199: of:=YEAR(TODAY())-[.G199] -> 29 | L199: 1973 | M199: mRrj izns'k 'kklu | N199: y[kuÅ {ks=h; dk;kZy;
A200: 985 | B200: ds vkj ,u xqykVh | C200: gekjh ukS lsuk | D200: 1 | E200: 5.5 | F200: of:=[.E200]*[.D200] -> 5.5 | G200: 1996 | I200: of:=YEAR(TODAY())-[.G200] -> 29 | L200: 1976 | N200: y[kuÅ {ks=h; dk;kZy;
A201: 998 | B201: v:.k dqekj nRr | C201: pk; dh dgkuh | D201: 1 | E201: 5.5 | F201: of:=[.E201]*[.D201] -> 5.5 | G201: 1996 | I201: of:=YEAR(TODAY())-[.G201] -> 29 | L201: 1986 | N201: y[kuÅ {ks=h; dk;kZy;
A202: 1001 | B202: [kyhQ vgen futkeh | C202: 'ks[k futkeqnnhu vkSfy;k | D202: 1 | E202: 10.5 | F202: of:=[.E202]*[.D202] -> 10.5 | G202: 1996 | I202: of:=YEAR(TODAY())-[.G202] -> 29 | L202: 1988 | N202: y[kuÅ {ks=h; dk;kZy;
A203: 1002 | B203: jkcVs th- Hks;l | C203: cPpks ds fy, lgh 'kq:vkr | D203: 1 | E203: 26 | F203: of:=[.E203]*[.D203] -> 26 | G203: 1996 | I203: of:=YEAR(TODAY())-[.G203] -> 29 | L203: 1984 | N203: y[kuÅ {ks=h; dk;kZy;
A204: 1003 | B204: fo|k HkkLdj | C204: 'ksj'kkg lwjh | D204: 1 | E204: 15 | F204: of:=[.E204]*[.D204] -> 15 | G204: 1996 | I204: of:=YEAR(TODAY())-[.G204] -> 29 | L204: 1972 | N204: y[kuÅ {ks=h; dk;kZy;
A205: 1006 | B205: nh- ,e- ih egknou | C205: 'kadjkpk;Z | D205: 1 | E205: 9 | F205: of:=[.E205]*[.D205] -> 9 | G205: 1996 | I205: of:=YEAR(TODAY())-[.G205] -> 29 | L205: 1968 | N205: y[kuÅ {ks=h; dk;kZy;
A206: 1015 | B206: usfepUnz tsu | C206: u;s fgUnh y/kq ukVd | D206: 1 | E206: 28.5 | F206: of:=[.E206]*[.D206] -> 28.5 | G206: 1996 | I206: of:=YEAR(TODAY())-[.G206] -> 29 | L206: 1986 | N206: y[kuÅ {ks=h; dk;kZy;
A207: 1019 | B207: , ih nklxqIr | C207: vk'kqrks"k eqdthZ | D207: 1 | E207: 9.5 | F207: of:=[.E207]*[.D207] -> 9.5 | G207: 1996 | I207: of:=YEAR(TODAY())-[.G207] -> 29 | L207: 1986 | N207: y[kuÅ {ks=h; dk;kZy;
A208: 1021 | B208: olar ewu | C208: Mk0 ckck lkgc vkacsMdj | D208: 1 | E208: 43 | F208: of:=[.E208]*[.D208] -> 43 | G208: 1996 | I208: of:=YEAR(TODAY())-[.G208] -> 29 | L208: 1991 | N208: y[kuÅ {ks=h; dk;kZy;
A209: 1032 | B209: fo".kq izHkkdj | C209: gekjk ukVd | D209: 1 | E209: 10.5 | F209: of:=[.E209]*[.D209] -> 10.5 | G209: 1996 | I209: of:=YEAR(TODAY())-[.G209] -> 29 | L209: 1984 | N209: y[kuÅ {ks=h; dk;kZy;
A210: 1035 | B210: js[kk vxzoky | C210: jDr dh dgkuh | D210: 1 | E210: 7 | F210: of:=[.E210]*[.D210] -> 7 | G210: 1996 | I210: of:=YEAR(TODAY())-[.G210] -> 29 | L210: 1986 | N210: y[kuÅ {ks=h; dk;kZy;
A211: 1044 | B211: nsl jkt xks;y | C211: ;kn tokgjyky dh | D211: 1 | E211: 6.5 | F211: of:=[.E211]*[.D211] -> 6.5 | G211: 1996 | I211: of:=YEAR(TODAY())-[.G211] -> 29 | L211: 1989 | N211: y[kuÅ {ks=h; dk;kZy;
A212: 1082 | B212: egkdfo HkkEl | C212: LoIu okl onRrk | D212: 1 | E212: 12 | F212: of:=[.E212]*[.D212] -> 12 | G212: 1996 | I212: of:=YEAR(TODAY())-[.G212] -> 29 | L212: 1992 | N212: y[kuÅ {ks=h; dk;kZy;
A213: 1085 | B213: y{eh dkar oekZ | C213: iq:"kksRre nkl VaMu | D213: 1 | E213: 14.1 | F213: of:=[.E213]*[.D213] -> 14.1 | G213: 1996 | I213: of:=YEAR(TODAY())-[.G213] -> 29 | L213: 1989 | M213: N.C.E.R.T | N213: y[kuÅ {ks=h; dk;kZy;
A214: 1095 | B214: jkepj.k esgjks=k | C214: rRo u;s iqjkus | D214: 1 | E214: 8 | F214: of:=[.E214]*[.D214] -> 8 | G214: 1996 | I214: of:=YEAR(TODAY())-[.G214] -> 29 | L214: 1989 | M214: N.C.E.R.T | N214: y[kuÅ {ks=h; dk;kZy;
A215: 1123 | C215: science for 9th class part 3 | D215: 1 | E215: 0 | F215: of:=[.E215]*[.D215] -> 0 | G215: 1996 | I215: of:=YEAR(TODAY())-[.G215] -> 29 | L215: 1980 | M215: tect book | N215: R. lal book depot
A216: 1124 | B216: R.S. Mittal | C216: laboretory manual in science | D216: 1 | E216: 36.8 | F216: of:=[.E216]*[.D216] -> 36.8 | G216: 1996 | I216: of:=YEAR(TODAY())-[.G216] -> 29 | L216: 1989 | M216: tect book | N216: R. lal book depot
A217: 1130 | B217: ohjssUnz roj | C217: vfgY;kckbZ | D217: 1 | E217: 6 | F217: of:=[.E217]*[.D217] -> 6 | G217: 1996 | I217: of:=YEAR(TODAY())-[.G217] -> 29 | L217: 1991 | M217: N.C.E.R.T | N217: {ks=h; dk;kZy; y[kuÅ
A218: 1132 | B218: izks0 deyk [ksrjiky | C218: 'kjhj fdz;k vkSj [ksydwn | D218: 1 | E218: 21 | F218: of:=[.E218]*[.D218] -> 21 | G218: 1996 | I218: of:=YEAR(TODAY())-[.G218] -> 29 | L218: 1994 | M218: N.C.E.R.T | N218: {ks=h; dk;kZy; y[kuÅ
A219: 1134 | B219: Mk0 izHkkdj ekpos | C219: xka/kh th ds vkJe esa | D219: 1 | E219: 6.5 | F219: of:=[.E219]*[.D219] -> 6.5 | G219: 1996 | I219: of:=YEAR(TODAY())-[.G219] -> 29 | L219: 1991 | M219: N.C.E.R.T | N219: {ks=h; dk;kZy; y[kuÅ
A220: 1140 | B220: fgeka'kq tks'kh | C220: lwjt peds vk/kh jkr | D220: 1 | E220: 13 | F220: of:=[.E220]*[.D220] -> 13 | G220: 1996 | I220: of:=YEAR(TODAY())-[.G220] -> 29 | M220: N.C.E.R.T | N220: {ks=h; dk;kZy; y[kuÅ
A221: 1144 | B221: lS;n tgwj dkfle | C221: iasafXou ds ns'k esa | D221: 1 | E221: 11.2 | F221: of:=[.E221]*[.D221] -> 11.2 | G221: 1996 | I221: of:=YEAR(TODAY())-[.G221] -> 29 | L221: 1987 | M221: N.C.E.R.T | N221: {ks=h; dk;kZy; y[kuÅ
A222: 1149 | B222: Mk0 foófe= mik/;k; | C222: jke izlkn fcfLey dh vkRedFkk | D222: 1 | E222: 13 | F222: of:=[.E222]*[.D222] -> 13 | G222: 1996 | I222: of:=YEAR(TODAY())-[.G222] -> 29 | L222: 1994 | M222: N.C.E.R.T | N222: {ks=h; dk;kZy; y[kuÅ
A223: 1153 | B223: Mk0 pdorkS | C223: pdzorhZ jktxksikykpkjh | D223: 1 | E223: 6 | F223: of:=[.E223]*[.D223] -> 6 | G223: 1996 | I223: of:=YEAR(TODAY())-[.G223] -> 29 | L223: 1991 | M223: N.C.E.R.T | N223: {ks=h; dk;kZy; y[kuÅ
A224: 1175 | B224: HkosUnzukFk | C224: vkdk'k | D224: 1 | E224: 50 | F224: of:=[.E224]*[.D224] -> 50 | G224: 1996 | I224: of:=YEAR(TODAY())-[.G224] -> 29 | L224: 1996 | M224: N.C.E.R.T | N224: {ks=h; dk;kZy; y[kuÅ
A225: 1176 | B225: Mk0 t;dkaru | C225: cnyrs psgjs | D225: 1 | E225: 50 | F225: of:=[.E225]*[.D225] -> 50 | G225: 1996 | I225: of:=YEAR(TODAY())-[.G225] -> 29 | L225: 1995 | M225: N.C.E.R.T | N225: {ks=h; dk;kZy; y[kuÅ
A226: 1198 | B226: Dr P Magaraja Rao | C226: Dr. Radhakrishnan | D226: 1 | E226: 45 | F226: of:=[.E226]*[.D226] -> 45 | G226: 1996 | I226: of:=YEAR(TODAY())-[.G226] -> 29 | L226: 1994 | M226: N.C.E.R.T | N226: {ks=h; dk;kZy; y[kuÅ
A227: 1215 | B227: Mrs Geeta lal | C227: civilization | D227: 1 | E227: 30 | F227: of:=[.E227]*[.D227] -> 30 | G227: 1996 | I227: of:=YEAR(TODAY())-[.G227] -> 29 | L227: 1994 | M227: N.C.E.R.T | N227: {ks=h; dk;kZy; y[kuÅ
A228: 1233 | B228: Feisal Alkazi | C228: Chipko | D228: 1 | E228: 20 | F228: of:=[.E228]*[.D228] -> 20 | G228: 1996 | I228: of:=YEAR(TODAY())-[.G228] -> 29 | M228: N.C.E.R.T | N228: {ks=h; dk;kZy; y[kuÅ
A229: 1234 | B229: Feisal Alkazi | C229: Chipko | D229: 1 | E229: 20 | F229: of:=[.E229]*[.D229] -> 20 | G229: 1996 | I229: of:=YEAR(TODAY())-[.G229] -> 29 | M229: N.C.E.R.T | N229: {ks=h; dk;kZy; y[kuÅ
A230: 1241 | B230: Feisal Alkazi | C230: Chipko | D230: 1 | E230: 20 | F230: of:=[.E230]*[.D230] -> 20 | G230: 1996 | I230: of:=YEAR(TODAY())-[.G230] -> 29 | M230: N.C.E.R.T | N230: {ks=h; dk;kZy; y[kuÅ
A231: 1247 | B231: Priti Jain | C231: The rain drop | D231: 1 | E231: 20 | F231: of:=[.E231]*[.D231] -> 20 | G231: 1996 | I231: of:=YEAR(TODAY())-[.G231] -> 29 | M231: N.C.E.R.T | N231: {ks=h; dk;kZy; y[kuÅ
A232: 1248 | B232: Priti Jain | C232: The rain drop | D232: 1 | E232: 20 | F232: of:=[.E232]*[.D232] -> 20 | G232: 1996 | I232: of:=YEAR(TODAY())-[.G232] -> 29 | M232: N.C.E.R.T | N232: {ks=h; dk;kZy; y[kuÅ
A233: 1249 | B233: Priti Jain | C233: The rain drop | D233: 1 | E233: 20 | F233: of:=[.E233]*[.D233] -> 20 | G233: 1996 | I233: of:=YEAR(TODAY())-[.G233] -> 29 | M233: N.C.E.R.T | N233: {ks=h; dk;kZy; y[kuÅ
A234: 1253 | B234: Feisal Alkazi | C234: Naina's Village | D234: 1 | E234: 20 | F234: of:=[.E234]*[.D234] -> 20 | G234: 1996 | I234: of:=YEAR(TODAY())-[.G234] -> 29 | M234: N.C.E.R.T | N234: {ks=h; dk;kZy; y[kuÅ
A235: 1256 | B235: Feisal Aliazi | C235: Nainas village | D235: 1 | E235: 20 | F235: of:=[.E235]*[.D235] -> 20 | G235: 1996 | I235: of:=YEAR(TODAY())-[.G235] -> 29 | M235: N.C.E.R.T | N235: {ks=h; dk;kzy; y[kuÅ
A236: 1258 | B236: Feisal Aliazi | C236: Nainas village | D236: 1 | E236: 20 | F236: of:=[.E236]*[.D236] -> 20 | G236: 1996 | I236: of:=YEAR(TODAY())-[.G236] -> 29 | M236: N.C.E.R.T | N236: {ks=h; dk;kzy; y[kuÅ
A237: 1262 | B237: Feisal Aliazi | C237: Nainas village | D237: 1 | E237: 20 | F237: of:=[.E237]*[.D237] -> 20 | G237: 1996 | I237: of:=YEAR(TODAY())-[.G237] -> 29 | M237: N.C.E.R.T | N237: {ks=h; dk;kzy; y[kuÅ
A238: 1263 | B238: Feisal Aliazi | C238: with in the well | D238: 1 | E238: 20 | F238: of:=[.E238]*[.D238] -> 20 | G238: 1996 | I238: of:=YEAR(TODAY())-[.G238] -> 29 | M238: N.C.E.R.T | N238: {ks=h; dk;kzy; y[kuÅ
A239: 1264 | B239: Feisal Aliazi | C239: with in the well | D239: 1 | E239: 20 | F239: of:=[.E239]*[.D239] -> 20 | G239: 1996 | I239: of:=YEAR(TODAY())-[.G239] -> 29 | M239: N.C.E.R.T | N239: {ks=h; dk;kzy; y[kuÅ
A240: 1265 | B240: Feisal Aliazi | C240: with in the well | D240: 1 | E240: 20 | F240: of:=[.E240]*[.D240] -> 20 | G240: 1996 | I240: of:=YEAR(TODAY())-[.G240] -> 29 | M240: N.C.E.R.T | N240: {ks=h; dk;kzy; y[kuÅ
A241: 1266 | B241: Feisal Aliazi | C241: with in the well | D241: 1 | E241: 20 | F241: of:=[.E241]*[.D241] -> 20 | G241: 1996 | I241: of:=YEAR(TODAY())-[.G241] -> 29 | M241: N.C.E.R.T | N241: {ks=h; dk;kzy; y[kuÅ
A242: 1268 | B242: Feisal Aliazi | C242: with in the well | D242: 1 | E242: 20 | F242: of:=[.E242]*[.D242] -> 20 | G242: 1996 | I242: of:=YEAR(TODAY())-[.G242] -> 29 | M242: N.C.E.R.T | N242: {ks=h; dk;kzy; y[kuÅ
A243: 1269 | B243: Feisal Aliazi | C243: with in the well | D243: 1 | E243: 20 | F243: of:=[.E243]*[.D243] -> 20 | G243: 1996 | I243: of:=YEAR(TODAY())-[.G243] -> 29 | M243: N.C.E.R.T | N243: {ks=h; dk;kzy; y[kuÅ
A244: 1271 | B244: Feisal Aliazi | C244: with in the well | D244: 1 | E244: 20 | F244: of:=[.E244]*[.D244] -> 20 | G244: 1996 | I244: of:=YEAR(TODAY())-[.G244] -> 29 | M244: N.C.E.R.T | N244: {ks=h; dk;kzy; y[kuÅ
A245: 1273 | B245: Feisal Aliazi | C245: The wrath of nature | D245: 1 | E245: 20 | F245: of:=[.E245]*[.D245] -> 20 | G245: 1996 | I245: of:=YEAR(TODAY())-[.G245] -> 29 | M245: N.C.E.R.T | N245: {ks=h; dk;kzy; y[kuÅ
A246: 1276 | B246: Feisal Aliazi | C246: The wrath of nature | D246: 1 | E246: 28 | F246: of:=[.E246]*[.D246] -> 28 | G246: 1996 | I246: of:=YEAR(TODAY())-[.G246] -> 29 | M246: N.C.E.R.T | N246: {ks=h; dk;kzy; y[kuÅ
A247: 1277 | B247: Feisal Aliazi | C247: The wrath of nature | D247: 1 | E247: 28 | F247: of:=[.E247]*[.D247] -> 28 | G247: 1996 | I247: of:=YEAR(TODAY())-[.G247] -> 29 | M247: N.C.E.R.T | N247: {ks=h; dk;kzy; y[kuÅ
A248: 1278 | B248: Feisal Aliazi | C248: The wrath of nature | D248: 1 | E248: 28 | F248: of:=[.E248]*[.D248] -> 28 | G248: 1996 | I248: of:=YEAR(TODAY())-[.G248] -> 29 | M248: N.C.E.R.T | N248: {ks=h; dk;kzy; y[kuÅ
A249: 1279 | B249: Feisal Aliazi | C249: The wrath of nature | D249: 1 | E249: 28 | F249: of:=[.E249]*[.D249] -> 28 | G249: 1996 | I249: of:=YEAR(TODAY())-[.G249] -> 29 | M249: N.C.E.R.T | N249: {ks=h; dk;kzy; y[kuÅ
A250: 1281 | B250: Feisal Aliazi | C250: The wrath of nature | D250: 1 | E250: 28 | F250: of:=[.E250]*[.D250] -> 28 | G250: 1996 | I250: of:=YEAR(TODAY())-[.G250] -> 29 | M250: N.C.E.R.T | N250: {ks=h; dk;kzy; y[kuÅ
A251: 1282 | B251: Feisal Aliazi | C251: The wrath of nature | D251: 1 | E251: 28 | F251: of:=[.E251]*[.D251] -> 28 | G251: 1996 | I251: of:=YEAR(TODAY())-[.G251] -> 29 | M251: N.C.E.R.T | N251: {ks=h; dk;kzy; y[kuÅ
A252: 1288 | B252: Anil Agarwal | C252: To wards green village | D252: 1 | E252: 20 | F252: of:=[.E252]*[.D252] -> 20 | G252: 1996 | I252: of:=YEAR(TODAY())-[.G252] -> 29 | L252: 1996 | M252: N.C.E.R.T | N252: {ks=h; dk;kzy; y[kuÅ
A253: 1289 | B253: Anil Agarwal | C253: To wards green village | D253: 1 | E253: 20 | F253: of:=[.E253]*[.D253] -> 20 | G253: 1996 | I253: of:=YEAR(TODAY())-[.G253] -> 29 | L253: 1996 | M253: N.C.E.R.T | N253: {ks=h; dk;kzy; y[kuÅ
A254: 1290 | B254: Anil Agarwal | C254: To wards green village | D254: 1 | E254: 20 | F254: of:=[.E254]*[.D254] -> 20 | G254: 1996 | I254: of:=YEAR(TODAY())-[.G254] -> 29 | L254: 1996 | M254: N.C.E.R.T | N254: {ks=h; dk;kzy; y[kuÅ
A255: 1295 | B255: Anil Agarwal | C255: Global warming | D255: 1 | E255: 30 | F255: of:=[.E255]*[.D255] -> 30 | G255: 1996 | I255: of:=YEAR(TODAY())-[.G255] -> 29 | L255: 1996 | M255: N.C.E.R.T | N255: {ks=h; dk;kzy; y[kuÅ
A256: 1300 | B256: Anil Agarwal | C256: Global warming | D256: 1 | E256: 30 | F256: of:=[.E256]*[.D256] -> 30 | G256: 1996 | I256: of:=YEAR(TODAY())-[.G256] -> 29 | L256: 1996 | M256: N.C.E.R.T | N256: {ks=h; dk;kzy; y[kuÅ
A257: 1303 | B257: Usha Rai | C257: Call of the commons | D257: 1 | E257: 10 | F257: of:=[.E257]*[.D257] -> 10 | G257: 1996 | I257: of:=YEAR(TODAY())-[.G257] -> 29 | L257: 1996 | M257: N.C.E.R.T | N257: {ks=h; dk;kzy; y[kuÅ
A258: 1304 | B258: Usha Rai | C258: Call of the commons | D258: 1 | E258: 10 | F258: of:=[.E258]*[.D258] -> 10 | G258: 1996 | I258: of:=YEAR(TODAY())-[.G258] -> 29 | L258: 1996 | M258: N.C.E.R.T | N258: {ks=h; dk;kzy; y[kuÅ
A259: 1305 | B259: Usha Rai | C259: Call of the commons | D259: 1 | E259: 10 | F259: of:=[.E259]*[.D259] -> 10 | G259: 1996 | I259: of:=YEAR(TODAY())-[.G259] -> 29 | L259: 1996 | M259: N.C.E.R.T | N259: {ks=h; dk;kzy; y[kuÅ
A260: 1306 | B260: Usha Rai | C260: Call of the commons | D260: 1 | E260: 10 | F260: of:=[.E260]*[.D260] -> 10 | G260: 1996 | I260: of:=YEAR(TODAY())-[.G260] -> 29 | L260: 1996 | M260: N.C.E.R.T | N260: {ks=h; dk;kzy; y[kuÅ
A261: 1310 | B261: P.R Mishra | C261: Chakriy vikas Pranali | D261: 1 | E261: 10 | F261: of:=[.E261]*[.D261] -> 10 | G261: 1996 | I261: of:=YEAR(TODAY())-[.G261] -> 29 | L261: 1996 | M261: N.C.E.R.T | N261: {ks=h; dk;kzy; y[kuÅ
A262: 1311 | B262: P.R Mishra | C262: Chakriy vikas Pranali | D262: 1 | E262: 10 | F262: of:=[.E262]*[.D262] -> 10 | G262: 1996 | I262: of:=YEAR(TODAY())-[.G262] -> 29 | L262: 1996 | M262: N.C.E.R.T | N262: {ks=h; dk;kzy; y[kuÅ
A263: 1312 | B263: P.R Mishra | C263: Chakriy vikas Pranali | D263: 1 | E263: 10 | F263: of:=[.E263]*[.D263] -> 10 | G263: 1996 | I263: of:=YEAR(TODAY())-[.G263] -> 29 | L263: 1996 | M263: N.C.E.R.T | N263: {ks=h; dk;kzy; y[kuÅ
A264: 1313 | B264: P.R Mishra | C264: Chakriy vikas Pranali | D264: 1 | E264: 10 | F264: of:=[.E264]*[.D264] -> 10 | G264: 1996 | I264: of:=YEAR(TODAY())-[.G264] -> 29 | L264: 1996 | M264: N.C.E.R.T | N264: {ks=h; dk;kzy; y[kuÅ
A265: 1314 | B265: P.R Mishra | C265: Chakriy vikas Pranali | D265: 1 | E265: 10 | F265: of:=[.E265]*[.D265] -> 10 | G265: 1996 | I265: of:=YEAR(TODAY())-[.G265] -> 29 | M265: N.C.E.R.T | N265: {ks=h; dk;kzy; y[kuÅ
A266: 1315 | B266: P.R Mishra | C266: Chakriy vikas Pranali | D266: 1 | E266: 10 | F266: of:=[.E266]*[.D266] -> 10 | G266: 1996 | I266: of:=YEAR(TODAY())-[.G266] -> 29 | M266: N.C.E.R.T | N266: {ks=h; dk;kzy; y[kuÅ
A267: 1316 | B267: P.R Mishra | C267: Chakriy vikas Pranali | D267: 1 | E267: 10 | F267: of:=[.E267]*[.D267] -> 10 | G267: 1996 | I267: of:=YEAR(TODAY())-[.G267] -> 29 | M267: N.C.E.R.T | N267: {ks=h; dk;kzy; y[kuÅ
A268: 1317 | B268: P.R Mishra | C268: Chakriy vikas Pranali | D268: 1 | E268: 10 | F268: of:=[.E268]*[.D268] -> 10 | G268: 1996 | I268: of:=YEAR(TODAY())-[.G268] -> 29 | M268: N.C.E.R.T | N268: {ks=h; dk;kzy; y[kuÅ
A269: 1318 | B269: P.R Mishra | C269: Northern lifestyle | D269: 1 | E269: 10 | F269: of:=[.E269]*[.D269] -> 10 | G269: 1996 | I269: of:=YEAR(TODAY())-[.G269] -> 29 | M269: N.C.E.R.T | N269: {ks=h; dk;kzy; y[kuÅ
A270: 1319 | B270: P.R Mishra | C270: Northern lifestyle | D270: 1 | E270: 10 | F270: of:=[.E270]*[.D270] -> 10 | G270: 1996 | I270: of:=YEAR(TODAY())-[.G270] -> 29 | M270: N.C.E.R.T | N270: {ks=h; dk;kzy; y[kuÅ
A271: 1320 | B271: P.R Mishra | C271: Northern lifestyle | D271: 1 | E271: 10 | F271: of:=[.E271]*[.D271] -> 10 | G271: 1996 | I271: of:=YEAR(TODAY())-[.G271] -> 29 | M271: N.C.E.R.T | N271: {ks=h; dk;kzy; y[kuÅ
A272: 1321 | B272: P.R Mishra | C272: Northern lifestyle | D272: 1 | E272: 10 | F272: of:=[.E272]*[.D272] -> 10 | G272: 1996 | I272: of:=YEAR(TODAY())-[.G272] -> 29 | M272: N.C.E.R.T | N272: {ks=h; dk;kzy; y[kuÅ
A273: 1322 | B273: P.R Mishra | C273: Northern lifestyle | D273: 1 | E273: 10 | F273: of:=[.E273]*[.D273] -> 10 | G273: 1996 | I273: of:=YEAR(TODAY())-[.G273] -> 29 | M273: N.C.E.R.T | N273: {ks=h; dk;kzy; y[kuÅ
A274: 1324 | B274: P.R Mishra | C274: Northern lifestyle | D274: 1 | E274: 10 | F274: of:=[.E274]*[.D274] -> 10 | G274: 1996 | I274: of:=YEAR(TODAY())-[.G274] -> 29 | M274: N.C.E.R.T | N274: {ks=h; dk;kzy; y[kuÅ
A275: 1325 | B275: P.R Mishra | C275: Northern lifestyle | D275: 1 | E275: 10 | F275: of:=[.E275]*[.D275] -> 10 | G275: 1996 | I275: of:=YEAR(TODAY())-[.G275] -> 29 | M275: N.C.E.R.T | N275: {ks=h; dk;kzy; y[kuÅ
A276: 1328 | B276: Mostafa Tolba | C276: A duty to hope | D276: 1 | E276: 10 | F276: of:=[.E276]*[.D276] -> 10 | G276: 1996 | I276: of:=YEAR(TODAY())-[.G276] -> 29 | M276: N.C.E.R.T | N276: {ks=h; dk;kzy; y[kuÅ
A277: 1329 | B277: Mostafa Tolba | C277: A duty to hope | D277: 1 | E277: 10 | F277: of:=[.E277]*[.D277] -> 10 | G277: 1996 | I277: of:=YEAR(TODAY())-[.G277] -> 29 | M277: N.C.E.R.T | N277: {ks=h; dk;kzy; y[kuÅ
A278: 1330 | B278: Mostafa Tolba | C278: A duty to hope | D278: 1 | E278: 10 | F278: of:=[.E278]*[.D278] -> 10 | G278: 1996 | I278: of:=YEAR(TODAY())-[.G278] -> 29 | M278: N.C.E.R.T | N278: {ks=h; dk;kzy; y[kuÅ
A279: 1334 | B279: Mostafa Tolba | C279: A duty to hope | D279: 1 | E279: 10 | F279: of:=[.E279]*[.D279] -> 10 | G279: 1996 | I279: of:=YEAR(TODAY())-[.G279] -> 29 | M279: N.C.E.R.T | N279: {ks=h; dk;kzy; y[kuÅ
A280: 1335 | B280: Mostafa Tolba | C280: A duty to hope | D280: 1 | E280: 10 | F280: of:=[.E280]*[.D280] -> 10 | G280: 1996 | I280: of:=YEAR(TODAY())-[.G280] -> 29 | M280: N.C.E.R.T | N280: {ks=h; dk;kzy; y[kuÅ
A281: 1338 | B281: Mostafa Tolba | C281: A duty to hope | D281: 1 | E281: 10 | F281: of:=[.E281]*[.D281] -> 10 | G281: 1996 | I281: of:=YEAR(TODAY())-[.G281] -> 29 | M281: N.C.E.R.T | N281: {ks=h; dk;kzy; y[kuÅ
A282: 1339 | B282: Mostafa Tolba | C282: A duty to hope | D282: 1 | E282: 10 | F282: of:=[.E282]*[.D282] -> 10 | G282: 1996 | I282: of:=YEAR(TODAY())-[.G282] -> 29 | M282: N.C.E.R.T | N282: {ks=h; dk;kzy; y[kuÅ
A283: 1340 | B283: Mostafa Tolba | C283: A duty to hope | D283: 1 | E283: 10 | F283: of:=[.E283]*[.D283] -> 10 | G283: 1996 | I283: of:=YEAR(TODAY())-[.G283] -> 29 | M283: N.C.E.R.T | N283: {ks=h; dk;kzy; y[kuÅ
A284: 1342 | B284: Mostafa Tolba | C284: A duty to hope | D284: 1 | E284: 10 | F284: of:=[.E284]*[.D284] -> 10 | G284: 1996 | I284: of:=YEAR(TODAY())-[.G284] -> 29 | M284: N.C.E.R.T | N284: {ks=h; dk;kzy; y[kuÅ
A285: 1343 | B285: S.K. Ram | C285: Grammar through stories 3 | D285: 1 | E285: 37.5 | F285: of:=[.E285]*[.D285] -> 37.5 | G285: 1996 | I285: of:=YEAR(TODAY())-[.G285] -> 29 | L285: 1995 | M285: N.C.E.R.T | N285: {ks=h; dk;kzy; y[kuÅ
A286: 1344 | B286: S.K. Ram | C286: Grammar through stories 3 | D286: 1 | E286: 37.5 | F286: of:=[.E286]*[.D286] -> 37.5 | G286: 1996 | I286: of:=YEAR(TODAY())-[.G286] -> 29 | L286: 1995 | M286: N.C.E.R.T | N286: {ks=h; dk;kzy; y[kuÅ
A287: 1348 | B287: S.K. Ram | C287: Grammar through stories 3 | D287: 1 | E287: 37.5 | F287: of:=[.E287]*[.D287] -> 37.5 | G287: 1996 | I287: of:=YEAR(TODAY())-[.G287] -> 29 | L287: 1995 | M287: N.C.E.R.T | N287: {ks=h; dk;kzy; y[kuÅ
A288: 1350 | B288: S.K. Ram | C288: Grammar through stories 3 | D288: 1 | E288: 37.5 | F288: of:=[.E288]*[.D288] -> 37.5 | G288: 1996 | I288: of:=YEAR(TODAY())-[.G288] -> 29 | L288: 1995 | M288: N.C.E.R.T | N288: {ks=h; dk;kzy; y[kuÅ
A289: 1361 | B289: S.K. Ram | C289: Grammar through stories 1 | D289: 1 | E289: 34.5 | F289: of:=[.E289]*[.D289] -> 34.5 | G289: 1996 | I289: of:=YEAR(TODAY())-[.G289] -> 29 | L289: 1995 | M289: N.C.E.R.T | N289: {ks=h; dk;kzy; y[kuÅ
A290: 1363 | B290: S.K. Ram | C290: Grammar through stories 1 | D290: 1 | E290: 34.5 | F290: of:=[.E290]*[.D290] -> 34.5 | G290: 1996 | I290: of:=YEAR(TODAY())-[.G290] -> 29 | L290: 1995 | M290: N.C.E.R.T | N290: {ks=h; dk;kzy; y[kuÅ
A291: 1370 | B291: S.K. Ram | C291: Grammar through stories 4 | D291: 1 | E291: 40 | F291: of:=[.E291]*[.D291] -> 40 | G291: 1996 | I291: of:=YEAR(TODAY())-[.G291] -> 29 | L291: 1995 | M291: N.C.E.R.T | N291: {ks=h; dk;kzy; y[kuÅ
A292: 1371 | B292: S.K. Ram | C292: Grammar through stories 4 | D292: 1 | E292: 40 | F292: of:=[.E292]*[.D292] -> 40 | G292: 1996 | I292: of:=YEAR(TODAY())-[.G292] -> 29 | L292: 1995 | M292: N.C.E.R.T | N292: {ks=h; dk;kzy; y[kuÅ
A293: 1372 | B293: S.K. Ram | C293: Grammar through stories 4 | D293: 1 | E293: 40 | F293: of:=[.E293]*[.D293] -> 40 | G293: 1996 | I293: of:=YEAR(TODAY())-[.G293] -> 29 | L293: 1995 | M293: N.C.E.R.T | N293: {ks=h; dk;kzy; y[kuÅ
A294: 1373 | B294: S.K. Ram | C294: Grammar through stories 4 | D294: 1 | E294: 40 | F294: of:=[.E294]*[.D294] -> 40 | G294: 1996 | I294: of:=YEAR(TODAY())-[.G294] -> 29 | L294: 1995 | M294: N.C.E.R.T | N294: {ks=h; dk;kzy; y[kuÅ
A295: 1378 | B295: T.L.H. Smith | C295: The english errors of indian students | D295: 1 | E295: 13 | F295: of:=[.E295]*[.D295] -> 13 | G295: 1996 | I295: of:=YEAR(TODAY())-[.G295] -> 29 | L295: 1996 | M295: N.C.E.R.T | N295: {ks=h; dk;kzy; y[kuÅ
A296: 1411 | B296: txrjke vk;Z | C296: lPps cPps fdrus vPNs | D296: 1 | E296: 12 | F296: of:=[.E296]*[.D296] -> 12 | G296: 1996 | I296: of:=YEAR(TODAY())-[.G296] -> 29 | L296: 1996 | M296: fo0 isij cqDl fnYyh | N296: txrjke ,.M lUl fnYyh
A297: 1427 | B297: j/kquUnu fnys | C297: dnerky | D297: 1 | E297: 32 | F297: of:=[.E297]*[.D297] -> 32 | G297: 1996 | I297: of:=YEAR(TODAY())-[.G297] -> 29 | L297: 1991 | M297: txrjke fnYyh | N297: txrjke ,.M lUl fnYyh
A298: 1432 | B298: d``".knRr ikyhoky | C298: vEcsMdj lekt O;oLFkk | D298: 1 | E298: 80 | F298: of:=[.E298]*[.D298] -> 80 | G298: 1996 | I298: of:=YEAR(TODAY())-[.G298] -> 29 | L298: 1996 | M298: fd0 xkW/khuxj fnYyh | N298: txrjke ,.M lUl fnYyh
A299: 1437 | B299: lj.k | C299: gekjs izjs.kk lskz= | D299: 1 | E299: 32 | F299: of:=[.E299]*[.D299] -> 32 | G299: 1996 | I299: of:=YEAR(TODAY())-[.G299] -> 29 | L299: 1996 | M299: vk0iz0fnYyh | N299: txrjke ,.M lUl fnYyh
A300: 1445 | B300: jkefujatu | C300: lPph dlkbZ | D300: 1 | E300: 16 | F300: of:=[.E300]*[.D300] -> 16 | G300: 1996 | I300: of:=YEAR(TODAY())-[.G300] -> 29 | L300: 1995 | M300: fd0 xkW/khuxj fnYyh | N300: txrjke ,.M lUl fnYyh
A301: 1446 | B301: lw;Znso izlkn | C301: dzkfUrdkjh | D301: 1 | E301: 24 | F301: of:=[.E301]*[.D301] -> 24 | G301: 1996 | I301: of:=YEAR(TODAY())-[.G301] -> 29 | L301: 1992 | M301: fg0 iq0 Hk.Mkj fnYyh | N301: txrjke ,.M lUl fnYyh
A302: 1468 | B302: JhpUnz tSu | C302: Hkkjr ds o``{k | D302: 1 | E302: 9.6 | F302: of:=[.E302]*[.D302] -> 9.6 | G302: 1996 | I302: of:=YEAR(TODAY())-[.G302] -> 29 | L302: 1996 | M302: fo0 isij cqDl fnYyh | N302: txrjke ,.M lUl fnYyh
A303: 1486 | B303: fo".kq nRr 'kekZ | C303: iznw"k.k i``Foh dk xzg.k | D303: 1 | E303: 48 | F303: of:=[.E303]*[.D303] -> 48 | G303: 1996 | I303: of:=YEAR(TODAY())-[.G303] -> 29 | L303: 1995 | M303: fg0 iq0 Hk.Mkj fnYyh | N303: txrjke ,.M lUl fnYyh
A304: 1487 | B304: fo".kq nRr 'kekZ | C304: I;kZoj.k iznw"k.k | D304: 1 | E304: 80 | F304: of:=[.E304]*[.D304] -> 80 | G304: 1996 | I304: of:=YEAR(TODAY())-[.G304] -> 29 | L304: 1994 | M304: vk0iz0fnYyh | N304: txrjke ,.M lUl fnYyh
A305: 1494 | B305: lq/khj lsu | C305: vkvks cPpksa [ksy okLdsV cky | D305: 1 | E305: 8 | F305: of:=[.E305]*[.D305] -> 8 | G305: 1996 | I305: of:=YEAR(TODAY())-[.G305] -> 29 | L305: 1995 | M305: fg0 iq0 Hk.Mkj fnYyh | N305: txrjke ,.M lUl fnYyh
A306: 1496 | B306: lq/khj lsu | C306: vkvks cPpksa [ksy [kks [kks | D306: 1 | E306: 8 | F306: of:=[.E306]*[.D306] -> 8 | G306: 1996 | I306: of:=YEAR(TODAY())-[.G306] -> 29 | L306: 1995 | M306: fg0 iq0 Hk.Mkj fnYyh | N306: txrjke ,.M lUl fnYyh
A307: 1504 | B307: Lokeh lfPpnkuUn | C307: xhrk vkSj gekjs izlu | D307: 1 | E307: 60 | F307: of:=[.E307]*[.D307] -> 60 | G307: 1996 | I307: of:=YEAR(TODAY())-[.G307] -> 29 | L307: 1995 | M307: fdrkc?kj xkW/khuxj fnYyh | N307: txrjke ,.M lUl fnYyh
A308: 1517 | B308: fouksn R;kxh | C308: Hkkjr esa 'kklu o 'kkld dSls gks | D308: 1 | E308: 16 | F308: of:=[.E308]*[.D308] -> 16 | G308: 1996 | I308: of:=YEAR(TODAY())-[.G308] -> 29 | L308: 1996 | M308: fdrkc?kj xkW/khuxj fnYyh | N308: txrjke ,.M lUl fnYyh
A309: 1519 | B309: vjfoan tSu | C309: vLi``'rk vkSj ekuork | D309: 1 | E309: 40 | F309: of:=[.E309]*[.D309] -> 40 | G309: 1996 | I309: of:=YEAR(TODAY())-[.G309] -> 29 | L309: 1996 | M309: fo0 isij cqDl fnYyh | N309: txrjke ,.M lUl fnYyh
A310: 1524 | B310: jktsUnz voLFkh | C310: nqfu;k ds vtuoh nksLr | D310: 1 | E310: 64 | F310: of:=[.E310]*[.D310] -> 64 | G310: 1996 | I310: of:=YEAR(TODAY())-[.G310] -> 29 | L310: 1996 | M310: fg0 iq0 Hk.Mkj fnYyh | N310: txrjke ,.M lUl fnYyh
A311: 1533 | B311: d`0f'k0egsrk | C311: vn``'; gkFkksa dk tkwn | D311: 1 | E311: 40 | F311: of:=[.E311]*[.D311] -> 40 | G311: 1996 | I311: of:=YEAR(TODAY())-[.G311] -> 29 | L311: 1996 | M311: vk0iz0fnYyh | N311: txrjke ,.M lUl fnYyh
A312: 1537 | B312: Karuna Kumar | C312: Learn English for science | D312: 1 | E312: 20 | F312: of:=[.E312]*[.D312] -> 20 | G312: 1997 | I312: of:=YEAR(TODAY())-[.G312] -> 28 | L312: 1991 | M312: NVS New Delhi | N312: NVS LR
A313: 1553 | B313: Karuna Kumar | C313: Learn English for science | D313: 1 | E313: 20 | F313: of:=[.E313]*[.D313] -> 20 | G313: 1997 | I313: of:=YEAR(TODAY())-[.G313] -> 28 | L313: 1991 | M313: NVS New Delhi | N313: NVS LR
A314: 1563 | B314: Karl Eric | C314: Children & the environment | D314: 1 | E314: Free | F314: of:=[.E314]*[.D314] ->  | G314: 1997 | I314: of:=YEAR(TODAY())-[.G314] -> 28 | L314: 1996 | M314: Centre new Delhi | N314: NVS LR
A315: 1579 | B315: Qdhj pUnz | C315: dqEc o vU; esys | D315: 1 | E315: 3 | F315: of:=[.E315]*[.D315] -> 3 | G315: 1997 | I315: of:=YEAR(TODAY())-[.G315] -> 28 | M315: izdk'ku foHkkx | N315: ;'kiky ,aM cznlZ :Mdh
A316: 1580 | B316: ih vkj vktkn | C316: gtkjh izzlkn f}osnh | D316: 1 | E316: 11.5 | F316: of:=[.E316]*[.D316] -> 11.5 | G316: 1997 | I316: of:=YEAR(TODAY())-[.G316] -> 28 | L316: 1985 | M316: izdk'ku foHkkx | N316: ;'kiky ,aM cznlZ :Mdh
A317: 1583 | C317: ENGLISH MATTERS | D317: 1 | F317: of:=[.E317]*[.D317] -> 0 | G317: 1997 | I317: of:=YEAR(TODAY())-[.G317] -> 28 | L317: Mar | M317: CBSE Delhi | N317: NVS LR
A318: 1634 | B318: jkepju eksg | C318: ukHkdh; fooj.k | D318: 1 | E318: 8 | F318: of:=[.E318]*[.D318] -> 8 | G318: 1997 | I318: of:=YEAR(TODAY())-[.G318] -> 28 | L318: 1991 | M318: NCERT | N318: NVS LR
A319: 1640 | B319: Jh ch0jke jktw | C319: vkU/kz izns'k laLd`fr | D319: 1 | E319: 15 | F319: of:=[.E319]*[.D319] -> 15 | G319: 1997 | I319: of:=YEAR(TODAY())-[.G319] -> 28 | L319: 1991 | M319: NBT New Delhi | N319: NVS LR
A320: 1642 | B320: nqxkzizlkn | C320: rsfUtx uksjxs | D320: 1 | E320: 4.9 | F320: of:=[.E320]*[.D320] -> 4.9 | G320: 1997 | I320: of:=YEAR(TODAY())-[.G320] -> 28 | L320: 1970 | M320: NCERT | N320: NVS LR
A321: 1649 | B321: izdk'ku ch | C321: nf{k.k Hkkjr ds efUnj | D321: 1 | E321: 50 | F321: of:=[.E321]*[.D321] -> 50 | G321: 1997 | I321: of:=YEAR(TODAY())-[.G321] -> 28 | L321: 1995 | M321: lwpuk izlkj.k ea=ky; | N321: NVS LR
A322: 1665 | B322: Ministing & labour | C322: CAREER THROUGH COMPETITIVE EXAMINATIONS | D322: 1 | E322: Free | F322: of:=[.E322]*[.D322] ->  | G322: 1997 | I322: of:=YEAR(TODAY())-[.G322] -> 28 | L322: 1998 | M322: Ministary of labour | N322: NVS LR
A323: 1669 | B323: Ministing & labour | C323: CAREER IN PARAMEDICAL OCCUPATION | D323: 1 | E323: Free | F323: of:=[.E323]*[.D323] ->  | G323: 1997 | I323: of:=YEAR(TODAY())-[.G323] -> 28 | L323: 1988 | M323: Ministary of labour | N323: NVS LR
A324: 1671 | B324: Ministing & labour | C324: work series 35 | D324: 1 | E324: Free | F324: of:=[.E324]*[.D324] ->  | G324: 1997 | I324: of:=YEAR(TODAY())-[.G324] -> 28 | L324: 1990 | M324: Ministary of labour | N324: NVS LR
A325: 1673 | B325: Ministing & labour | C325: work sries 39 | D325: 1 | E325: Free | F325: of:=[.E325]*[.D325] ->  | G325: 1997 | I325: of:=YEAR(TODAY())-[.G325] -> 28 | L325: 1991 | M325: Ministary of labour | N325: NVS LR
A326: 1677 | B326: Labour Mind | C326: careers in HOTELIERING | D326: 1 | E326: Free | F326: of:=[.E326]*[.D326] ->  | G326: 1997 | I326: of:=YEAR(TODAY())-[.G326] -> 28 | L326: 1981 | M326: Ministary of labour | N326: NVS LR
A327: 1693 | B327: 'kqdnso izlkn | C327: oSKkfud dk cpiu | D327: 1 | E327: 50 | F327: of:=[.E327]*[.D327] -> 50 | G327: 1997 | I327: of:=YEAR(TODAY())-[.G327] -> 28 | L327: 1997 | M327: xz-Fk vdkneh ubZ fnYyh | N327: NVS LR
A328: 1709 | B328: lat; 'kqDy | C328: okiw ds O;ax fouksn | D328: 1 | E328: 15 | F328: of:=[.E328]*[.D328] -> 15 | G328: 1997 | I328: of:=YEAR(TODAY())-[.G328] -> 28 | L328: 1996 | M328: loksZn; dzk fnYyh | N328: NVS LR
A329: 1716 | B329: Prabhakar muchwe | C329: Rahul sanskrityan | D329: 1 | E329: 15 | F329: of:=[.E329]*[.D329] -> 15 | G329: 1997 | I329: of:=YEAR(TODAY())-[.G329] -> 28 | L329: 1995 | M329: Sahitya Academy | N329: NVS LR
A330: 1718 | B330: prema nannd kumar | C330: S. Radhakrishanan | D330: 1 | E330: 25 | F330: of:=[.E330]*[.D330] -> 25 | G330: 1997 | I330: of:=YEAR(TODAY())-[.G330] -> 28 | L330: 1997 | M330: sahitya Academy | N330: NVS LR
A331: 1749 | B331: Gopal K, puri | C331: Gen. Int Test of reasoning | D331: 1 | E331: 150 | F331: of:=[.E331]*[.D331] -> 150 | G331: 1997 | I331: of:=YEAR(TODAY())-[.G331] -> 28 | L331: 1998 | M331: Pioneer Medical Pub Delhi | N331: Arya B. Dep. N Delhi
A332: 1753 | B332: Neelam soni | C332: Tech. trg inst. & courses | D332: 1 | E332: 100 | F332: of:=[.E332]*[.D332] -> 100 | G332: 1997 | I332: of:=YEAR(TODAY())-[.G332] -> 28 | L332: 1997 | M332: Student aid pub Delhi | N332: Arya B. Dep. N Delhi
A333: 1780 | B333: Gauri shankar | C333: New light eng grammar | D333: 1 | E333: 64.8 | F333: of:=[.E333]*[.D333] -> 64.8 | G333: 1997 | I333: of:=YEAR(TODAY())-[.G333] -> 28 | L333: 1997 | M333: Arya book depot Delhi | N333: Arya B. Dep. N Delhi
A334: 1782 | B334: K.Bhatt urmila | C334: getting head at +2 XII | D334: 1 | E334: 59.8 | F334: of:=[.E334]*[.D334] -> 59.8 | G334: 1997 | I334: of:=YEAR(TODAY())-[.G334] -> 28 | L334: 1996 | M334: Arya book depot Delhi | N334: Arya B. Dep. N Delhi
A335: 1802 | B335: naxy tkYVs | C335: O;kdj.k fgUnh i=kpkj | D335: 1 | E335: 100 | F335: of:=[.E335]*[.D335] -> 100 | G335: 1997 | I335: of:=YEAR(TODAY())-[.G335] -> 28 | L335: 1996 | M335: fo|k fogkj fnYyh | N335: Prabhat Pra. Delhi
A336: 1805 | B336: jktsUnz voLFkh | C336: ekjh'kl dh dgkfu;kWa | D336: 1 | E336: 40 | F336: of:=[.E336]*[.D336] -> 40 | G336: 1997 | I336: of:=YEAR(TODAY())-[.G336] -> 28 | L336: 1986 | M336: izHkkr izdk'ku fnYyh | N336: Prabhat Pra. Delhi
A337: 1836 | B337: ehjk tSu | C337: lkekftd ln~Hkko dh dgkfu;kWa | D337: 1 | E337: 100 | F337: of:=[.E337]*[.D337] -> 100 | G337: 1997 | I337: of:=YEAR(TODAY())-[.G337] -> 28 | L337: 1996 | M337: izHkkr izdk'ku fnYyh | N337: Prabhat Pra. Delhi
A338: 1840 | B338: fxfjjkt 'kekZ | C338: jkt ifjoa'k dh ,adkdh | D338: 1 | E338: 100 | F338: of:=[.E338]*[.D338] -> 100 | G338: 1997 | I338: of:=YEAR(TODAY())-[.G338] -> 28 | L338: 1996 | M338: izHkkr izdk'ku fnYyh | N338: Prabhat Pra. Delhi
A339: 1847 | B339: 'kadj n;ky flag | C339: ;s dgkuh ugh gS | D339: 1 | E339: 200 | F339: of:=[.E339]*[.D339] -> 200 | G339: 1997 | I339: of:=YEAR(TODAY())-[.G339] -> 28 | L339: 1995 | M339: izHkkr izdk'ku fnYyh | N339: Prabhat Pra. Delhi
A340: 1852 | B340: ,0ih0JhokLro | C340: ?kkrd jksxksa lss dSls cps | D340: 1 | E340: 0 | F340: of:=[.E340]*[.D340] -> 0 | G340: 1997 | I340: of:=YEAR(TODAY())-[.G340] -> 28 | L340: 1995 | M340: izHkkr izdk'ku fnYyh | N340: Prabhat Pra. Delhi
A341: 1950 | C341: THE SOUND SYTEM OF INDIAN ENGLISH | D341: 1 | F341: of:=[.E341]*[.D341] -> 0 | G341: 1998 | I341: of:=YEAR(TODAY())-[.G341] -> 27
A342: 1951 | C342: THE SOUND SYTEM OF INDIAN ENGLISH | D342: 1 | F342: of:=[.E342]*[.D342] -> 0 | G342: 1998 | I342: of:=YEAR(TODAY())-[.G342] -> 27
A343: 1960 | B343: CIEEL | C343: Exercise in spoken english | D343: 1 | E343: 176 | F343: of:=[.E343]*[.D343] -> 176 | G343: 1998 | I343: of:=YEAR(TODAY())-[.G343] -> 27 | L343: 1997 | M343: CIEFL hydrabad | N343: CIEFL
A344: 1961 | B344: CIEEL | C344: Exercise in spoken english | D344: 1 | E344: 176 | F344: of:=[.E344]*[.D344] -> 176 | G344: 1998 | I344: of:=YEAR(TODAY())-[.G344] -> 27 | L344: 1997 | M344: CIEFL hydrabad | N344: CIEFL
A345: 1965 | B345: CIEEL | C345: MAKERS AND FINDERS | D345: 1 | E345: 185 | F345: of:=[.E345]*[.D345] -> 185 | G345: 1998 | I345: of:=YEAR(TODAY())-[.G345] -> 27 | L345: 1997 | M345: CIEFL hydrabad | N345: CIEFL
A346: 1967 | B346: Shatya Akadami | C346: 23 short stories | D346: 1 | E346: 100 | F346: of:=[.E346]*[.D346] -> 100 | G346: 1998 | I346: of:=YEAR(TODAY())-[.G346] -> 27 | L346: 1997 | M346: lkfgR; izdk'ku fnYyh | N346: NVS LR
A347: 1969 | B347: Prem Seth | C347: Applied for jobs | D347: 1 | E347: 200 | F347: of:=[.E347]*[.D347] -> 200 | G347: 1998 | I347: of:=YEAR(TODAY())-[.G347] -> 27 | L347: 1997 | M347: Sterling pub Delhi | N347: NVS LR
A348: 2032 | B348: R. k murti | C348: KNOW THE NOVEL LAUREATES III | D348: 1 | E348: 25 | F348: of:=[.E348]*[.D348] -> 25 | G348: 1998 | I348: of:=YEAR(TODAY())-[.G348] -> 27 | L348: 1998 | M348: Pitamber Prakshan | N348: NVS LR
A349: 2043 | B349: R.L Bhatia | C349: A NEW PATTERN ENGLISH GRAMMAR AND TRANSLATION | D349: 1 | E349: 26 | F349: of:=[.E349]*[.D349] -> 26 | G349: 1998 | I349: of:=YEAR(TODAY())-[.G349] -> 27 | L349: 1993 | M349: Arya book depot Delhi | N349: NVS LR
A350: 2048 | B350: C.Raman Murti | C350: Indian Painting | D350: 1 | E350: 55 | F350: of:=[.E350]*[.D350] -> 55 | G350: 1998 | I350: of:=YEAR(TODAY())-[.G350] -> 27 | L350: 1990 | M350: NBT Publisher | N350: NVS LR
A351: 2052 | B351: Vdyh f'ko'kadj fiYys | C351: nks 'ksj nku | D351: 1 | E351: 40 | F351: of:=[.E351]*[.D351] -> 40 | G351: 1998 | I351: of:=YEAR(TODAY())-[.G351] -> 27 | L351: 1998 | M351: lkfgR; ,dkneh ] fnYyh | N351: NVS LR
A352: 2062 | B352: izse pUn | C352: lsoklnu | D352: 1 | E352: 150 | F352: of:=[.E352]*[.D352] -> 150 | G352: 1998 | I352: of:=YEAR(TODAY())-[.G352] -> 27 | L352: 1997 | M352: jk"V~zHkk"kk izdk"ku | N352: NVS LR
A353: 2072 | B353: fo".kq izHkkdj | C353: u, ,dkadh | D353: 1 | E353: 60 | F353: of:=[.E353]*[.D353] -> 60 | G353: 1998 | I353: of:=YEAR(TODAY())-[.G353] -> 27 | L353: 1997 | M353: vk;Z cqd fMiksa | N353: NVS LR
A354: 2085 | B354: lqHkk"k d";i | C354: gekjh laln | D354: 1 | E354: 47 | F354: of:=[.E354]*[.D354] -> 47 | G354: 1998 | I354: of:=YEAR(TODAY())-[.G354] -> 27 | L354: 1991 | M354: N.B.T. Delhi | N354: NVS LR
A355: 2089 | B355: lqHkk"k d";i | C355: Hkkjr dk lafo/kku | D355: 1 | E355: 7.5 | F355: of:=[.E355]*[.D355] -> 7.5 | G355: 1998 | I355: of:=YEAR(TODAY())-[.G355] -> 27 | L355: 1997 | M355: N.B.T. Delhi | N355: NVS LR
A356: 2127 | B356: Mk fo|k fuokl | C356: ckcw';kelqUnjnkl ds fucU/k | D356: 1 | E356: 83 | F356: of:=[.E356]*[.D356] -> 83 | G356: 1998 | I356: of:=YEAR(TODAY())-[.G356] -> 27 | L356: 1983 | M356: Uttar pradesh sansthan | N356: NVS LR
A357: 2130 | B357: Mk0 jes'k pUnz | C357: ijek.kq fo[k.Mu | D357: 1 | E357: 9 | F357: of:=[.E357]*[.D357] -> 9 | G357: 1998 | I357: of:=YEAR(TODAY())-[.G357] -> 27 | L357: 1990 | M357: Uttar pradesh sansthan | N357: NVS LR
A358: 2146 | B358: ve``rjk; | C358: nl izfrfuf/k dgkfu;ka | D358: 1 | E358: 60 | F358: of:=[.E358]*[.D358] -> 60 | G358: 1998 | I358: of:=YEAR(TODAY())-[.G358] -> 27 | L358: 1997 | M358: Kitab Ghar | N358: NVS LR
A359: 2147 | B359: eqdqUn csnh | C359: gtkjh izlkn f}osnh ds pqus fucU/k | D359: 1 | E359: 80 | F359: of:=[.E359]*[.D359] -> 80 | G359: 1998 | I359: of:=YEAR(TODAY())-[.G359] -> 27 | L359: 1996 | M359: Kitab Ghar | N359: NVS LR
A360: 2148 | B360: dey fd'kksj | C360: ftKklk,a esjh | D360: 1 | E360: 75 | F360: of:=[.E360]*[.D360] -> 75 | G360: 1998 | I360: of:=YEAR(TODAY())-[.G360] -> 27 | L360: 1996 | M360: Kitab Ghar | N360: NVS LR
A361: 2178 | B361: xaxk izlkn | C361: bruk dqN | D361: 1 | E361: 50 | F361: of:=[.E361]*[.D361] -> 50 | G361: 1998 | I361: of:=YEAR(TODAY())-[.G361] -> 27 | L361: 1991 | M361: xqtZj xzUFk]vgenkckn | N361: fdrkc?kj xkW/khuxj fnYyh
A362: 2179 | B362: ch0ts0gjthr | C362: fizfliy ij'kq jke | D362: 1 | E362: 35 | F362: of:=[.E362]*[.D362] -> 35 | G362: 1998 | I362: of:=YEAR(TODAY())-[.G362] -> 27 | L362: 1994 | M362: fgekpy iqLrd Hk.Mkj | N362: fdrkc?kj xkW/khuxj fnYyh
A363: 2182 | B363: jfoUnz R;kxh | C363: ns'k fons'k dh dFkk | D363: 1 | E363: 60 | F363: of:=[.E363]*[.D363] -> 60 | G363: 1998 | I363: of:=YEAR(TODAY())-[.G363] -> 27 | L363: 1994 | M363: fdrkc?kj xkW/khuxj fnYyh | N363: fdrkc?kj xkW/khuxj fnYyh
A364: 2186 | B364: izHkkdj mik/;k; | C364: fgUnh fn'kk ,oa n'kk | D364: 1 | E364: 75 | F364: of:=[.E364]*[.D364] -> 75 | G364: 1998 | I364: of:=YEAR(TODAY())-[.G364] -> 27 | L364: 1995 | M364: fgekpy iqLrd Hk.Mkj | N364: fdrkc?kj xkW/khuxj fnYyh
A365: 2189 | B365: lwjt nso izlkn | C365: jke egy | D365: 1 | E365: 30 | F365: of:=[.E365]*[.D365] -> 30 | G365: 1998 | I365: of:=YEAR(TODAY())-[.G365] -> 27 | L365: 1919 | M365: txrjke ,.M lUl | N365: fdrkc?kj xkW/khuxj fnYyh
A366: 2192 | B366: kadj 'ks"k | C366: jRu xHkkZ | D366: 1 | E366: 20 | F366: of:=[.E366]*[.D366] -> 20 | G366: 1998 | I366: of:=YEAR(TODAY())-[.G366] -> 27 | L366: 1998 | M366: txrjke vk;kZ] fnYyh | N366: fdrkc?kj xkW/khuxj fnYyh
A367: 2193 | B367: iznhi iUFk | C367: ykSVus ls igys | D367: 1 | E367: 40 | F367: of:=[.E367]*[.D367] -> 40 | G367: 1998 | I367: of:=YEAR(TODAY())-[.G367] -> 27 | L367: 1997 | M367: fdrkc?kj xkW/khuxj fnYyh | N367: fdrkc?kj xkW/khuxj fnYyh
A368: 2200 | B368: egs'k Mse , | C368: xzg okfVdk o Qy okyh lfct;k | D368: 1 | E368: 15 | F368: of:=[.E368]*[.D368] -> 15 | G368: 1998 | I368: of:=YEAR(TODAY())-[.G368] -> 27 | L368: 1997 | M368: izHkkr izdk'ku fnYyh | N368: fdrkc?kj xkW/khuxj fnYyh
A369: 2227 | B369: Hkhë lkguh | C369: jax ns calrh pksyk | D369: 1 | E369: 50 | F369: of:=[.E369]*[.D369] -> 50 | G369: 1998 | I369: of:=YEAR(TODAY())-[.G369] -> 27 | L369: 1998 | M369: fdrkc?kj xkW/khuxj fnYyh | N369: fdrkc?kj xkW/khuxj fnYyh
A370: 2253 | B370: th Mh fo"V | C370: flEiy LihM xkbM | D370: 1 | E370: 32 | F370: of:=[.E370]*[.D370] -> 32 | G370: 1999 | I370: of:=YEAR(TODAY())-[.G370] -> 26 | L370: 1996 | M370: vk;kZ izdk'ku fnYyh | N370: vk;Z cqd fMiks
A371: 2257 | B371: Luies karicole | C371: x``g izcU/ku | D371: 1 | E371: 15 | F371: of:=[.E371]*[.D371] -> 15 | G371: 1999 | I371: of:=YEAR(TODAY())-[.G371] -> 26 | L371: 1998 | M371: vk;kZ izdk'ku fnYyh | N371: vk;Z cqd fMiks
A372: 2263 | B372: Sarna & others | C372: uksV cqd dk eSFl | D372: 1 | E372: 250 | F372: of:=[.E372]*[.D372] -> 250 | G372: 1999 | I372: of:=YEAR(TODAY())-[.G372] -> 26 | L372: 1997 | M372: vk;kZ izdk'ku fnYyh | N372: vk;Z cqd fMiks
A373: 2264 | B373: Mahesh chaner & others | C373: lkLd`frd jk"V~z dk v[k.M Hkkjr | D373: 1 | E373: 100 | F373: of:=[.E373]*[.D373] -> 100 | G373: 1999 | I373: of:=YEAR(TODAY())-[.G373] -> 26 | L373: 1992 | M373: vk;kZ izdk'ku fnYyh | N373: vk;Z cqd fMiks
A374: 2269 | B374: Yadunath chobe | C374: ewjyh | D374: 1 | E374: 45 | F374: of:=[.E374]*[.D374] -> 45 | G374: 1999 | I374: of:=YEAR(TODAY())-[.G374] -> 26 | L374: 1994 | M374: vk;kZ izdk'ku fnYyh | N374: vk;Z cqd fMiks
A375: 2270 | B375: I.P. Agarwal | C375: cky fodkl ,oa 'kSf{kd fdz;k,a | D375: 1 | E375: 90 | F375: of:=[.E375]*[.D375] -> 90 | G375: 1999 | I375: of:=YEAR(TODAY())-[.G375] -> 26 | L375: 1997 | M375: vk;kZ izdk'ku fnYyh | N375: vk;Z cqd fMiks
A376: 2313 | B376: lqns'k lj.k | C376: dkSeh ,drk | D376: 1 | E376: 8 | F376: of:=[.E376]*[.D376] -> 8 | G376: 1999 | I376: of:=YEAR(TODAY())-[.G376] -> 26 | L376: 1997 | M376: vk;kZ izdk'ku fnYyh | N376: Arya B. Dep. N Delhi
A377: 2317 | B377: gfjd`".k izseh | C377: izfr'kks/k | D377: 1 | E377: 40 | F377: of:=[.E377]*[.D377] -> 40 | G377: 1999 | I377: of:=YEAR(TODAY())-[.G377] -> 26 | L377: 1993 | M377: vk;kZ izdk'ku fnYyh | N377: Arya B. Dep. N Delhi
A378: 2320 | B378: b0ih0th0 | C378: ifjos'ku v/;;u | D378: 1 | E378: 20 | F378: of:=[.E378]*[.D378] -> 20 | G378: 1999 | I378: of:=YEAR(TODAY())-[.G378] -> 26 | L378: 1988 | M378: vk;kZ izdk'ku fnYyh | N378: Arya B. Dep. N Delhi
A379: 2338 | B379: vkj0,y0 LVheSUlu | C379: dSMuSi | D379: 1 | E379: 25 | F379: of:=[.E379]*[.D379] -> 25 | G379: 1999 | I379: of:=YEAR(TODAY())-[.G379] -> 26 | L379: 1998 | M379: vk;kZ izdk'ku fnYyh | N379: Arya B. Dep. N Delhi
A380: 2384 | B380: ,e0 lkjLor | C380: speaking english frequently | D380: 1 | E380: 48 | F380: of:=[.E380]*[.D380] -> 48 | G380: 1999 | I380: of:=YEAR(TODAY())-[.G380] -> 26 | L380: 1999 | M380: Diamond Stationer,JWP | N380: NVS LR Lucknow
A381: 2407 | B381: xksfoUn ik.Mas; | C381: oks} /keZ dk fodkl | D381: 1 | E381: 40 | F381: of:=[.E381]*[.D381] -> 40 | G381: 1999 | I381: of:=YEAR(TODAY())-[.G381] -> 26 | L381: 1998 | M381: ,u0oh0,l0 y[kuÅ | N381: NVS LR Lucknow
A382: 2463 | B382: , fo'okl | C382: dkslZ bu tujy LVMh | D382: 1 | E382: 16 | F382: of:=[.E382]*[.D382] -> 16 | G382: 1999 | I382: of:=YEAR(TODAY())-[.G382] -> 26 | L382: 1998 | M382: ,u0oh0,l0 y[kuÅ | N382: NVS LR Lucknow
A383: 2465 | B383: R.S.Dhillon | C383: D.P. kit of Idoms & phrase | D383: 1 | E383: 90 | F383: of:=[.E383]*[.D383] -> 90 | G383: 1999 | I383: of:=YEAR(TODAY())-[.G383] -> 26 | L383: 1997 | M383: ,u0oh0,l0 y[kuÅ | N383: NVS LR Lucknow
A384: 2466 | B384: B.M Hrcd | C384: Art of public speaking | D384: 1 | E384: 50 | F384: of:=[.E384]*[.D384] -> 50 | G384: 1999 | I384: of:=YEAR(TODAY())-[.G384] -> 26 | L384: 1998 | M384: ,u0oh0,l0 y[kuÅ | N384: NVS LR Lucknow
A385: 2483 | B385: vfurk flag | C385: fgUnh 'kOnks adk iz;ksx | D385: 1 | E385: 75 | F385: of:=[.E385]*[.D385] -> 75 | G385: 1999 | I385: of:=YEAR(TODAY())-[.G385] -> 26 | L385: 1999 | M385: ,u0oh0,l0 y[kuÅ | N385: NVS LR Lucknow
A386: 2485 | B386: ih0czges'k | C386: Fansting stories | D386: 1 | E386: 65 | F386: of:=[.E386]*[.D386] -> 65 | G386: 1999 | I386: of:=YEAR(TODAY())-[.G386] -> 26 | L386: 1998 | M386: ,u0oh0,l0 y[kuÅ | N386: NVS LR Lucknow
A387: 2492 | B387: izdk'k pUnz | C387: Kabir | D387: 1 | E387: 42 | F387: of:=[.E387]*[.D387] -> 42 | G387: 1999 | I387: of:=YEAR(TODAY())-[.G387] -> 26 | L387: 1997 | M387: ,u0oh0,l0 y[kuÅ | N387: NVS LR Lucknow
A388: 2495 | B388: ds0lh0flag | C388: What life the way have me | D388: 1 | E388: 50 | F388: of:=[.E388]*[.D388] -> 50 | G388: 1999 | I388: of:=YEAR(TODAY())-[.G388] -> 26 | L388: 1994 | M388: ,u0oh0,l0 y[kuÅ | N388: NVS LR Lucknow
A389: 2506 | B389: nh{kk fc"V | C389: m"ek vkSj m"ek xfrdh | D389: 1 | E389: 20 | F389: of:=[.E389]*[.D389] -> 20 | G389: 1999 | I389: of:=YEAR(TODAY())-[.G389] -> 26 | L389: 1976 | M389: ,u0oh0,l0 y[kuÅ | N389: NVS LR Lucknow
A390: 2518 | B390: /kUut; fd'kksj | C390: COSMIC KIRANE | D390: 1 | E390: 9 | F390: of:=[.E390]*[.D390] -> 9 | G390: 1999 | I390: of:=YEAR(TODAY())-[.G390] -> 26 | L390: 1998 | M390: ,u0oh0,l0 y[kuÅ | N390: NVS LR Lucknow
A391: 2568 | B391: ,l0lh0ekgsójh | C391: Lab Manual | D391: 1 | E391: 54 | F391: of:=[.E391]*[.D391] -> 54 | G391: 1999 | I391: of:=YEAR(TODAY())-[.G391] -> 26 | L391: 1999 | M391: Diamond Stationer,JWP | N391: Diomond station Jaipur
A392: 2654 | B392: 'krjpUnz | C392: cMh nhnh | D392: 1 | E392: 40 | F392: of:=[.E392]*[.D392] -> 40 | G392: 1999 | I392: of:=YEAR(TODAY())-[.G392] -> 26 | L392: 1998 | M392: Sahatiya prakashan | N392: NVS lucknow
A393: 2655 | B393: 'krjpUnz | C393: pUnz ukFk | D393: 1 | E393: 40 | F393: of:=[.E393]*[.D393] -> 40 | G393: 1999 | I393: of:=YEAR(TODAY())-[.G393] -> 26 | L393: 1998 | M393: Sahatiya prakashan | N393: NVS lucknow
A394: 2685 | B394: cktisbZ | C394: compline ref course of Phy | D394: 1 | E394: 90 | F394: of:=[.E394]*[.D394] -> 90 | G394: 2000 | I394: of:=YEAR(TODAY())-[.G394] -> 25 | L394: 2000 | M394: Diamond Stationary | N394: NVS lucknow
A395: 2791 | B395: jktsUnz izdk'k prqosZnh | C395: Hkk"k.k dyk | D395: 1 | E395: 35 | F395: of:=[.E395]*[.D395] -> 35 | G395: 2000 | I395: of:=YEAR(TODAY())-[.G395] -> 25 | L395: 1999 | M395: Upkar prakashan | N395: NVS lucknow
A396: 2827 | B396: P Sen gupta | C396: JOURNEY TO THE MAGNETIC NORTH POLE | D396: 1 | E396: 8 | F396: of:=[.E396]*[.D396] -> 8 | G396: 2000 | I396: of:=YEAR(TODAY())-[.G396] -> 25 | L396: 1999 | M396: NBT Delhi | N396: NVS lucknow
A397: 2916 | B397: y{ehdkar ik.Ms; | C397: lapkj ek/e esa fgUnh dk iz;ksx | D397: 1 | E397: 150 | F397: of:=[.E397]*[.D397] -> 150 | G397: 2000 | I397: of:=YEAR(TODAY())-[.G397] -> 25 | L397: 2000 | M397: Jaheerpur Malya Kanpur | N397: NVS lucknow
A398: 2928 | B398: egs'koj flag | C398: Hkjrh; yksdra= leL;k,a ,oa leknku | D398: 1 | E398: 200 | F398: of:=[.E398]*[.D398] -> 200 | G398: 2000 | I398: of:=YEAR(TODAY())-[.G398] -> 25 | L398: 2000 | M398: Jaheerpur Malya Kanpur | N398: NVS lucknow
A399: 2937 | B399: ds lh [kUuk | C399: Hkkjr esa fons'kh ;k=kh | D399: 1 | E399: 6 | F399: of:=[.E399]*[.D399] -> 6 | G399: 2000 | I399: of:=YEAR(TODAY())-[.G399] -> 25 | L399: 1990 | M399: Sheetal book centre Delhi | N399: NVS lucknow
A400: 3012 | B400: ch0,y0xksLokeh | C400: HkkSfrd jlk;u | D400: 1 | E400: 130 | F400: of:=[.E400]*[.D400] -> 130 | G400: 2001 | I400: of:=YEAR(TODAY())-[.G400] -> 24 | L400: 2000 | M400: Malik sons company | N400: NVS lucknow
A401: 3019 | B401: ys[kdx.k | C401: lkxk vkQ bf.M;k | D401: 1 | E401: 30 | F401: of:=[.E401]*[.D401] -> 30 | G401: 2001 | I401: of:=YEAR(TODAY())-[.G401] -> 24 | L401: 2000 | M401: Ocean book Delhi | N401: NVS lucknow
A402: 3054 | B402: izeksn ,Ufkuh | C402: iksiqyj QSUp LVksfjt | D402: 1 | E402: 60 | F402: of:=[.E402]*[.D402] -> 60 | G402: 2001 | I402: of:=YEAR(TODAY())-[.G402] -> 24 | L402: 2001 | M402: ljLorh izdk'ku fnYyh | N402: NVS lucknow
A403: 3107 | B403: Rita singh | C403: Vishav ka Ithyas | D403: 1 | E403: 60 | F403: of:=[.E403]*[.D403] -> 60 | G403: 2001 | I403: of:=YEAR(TODAY())-[.G403] -> 24 | L403: 1995 | M403: S. Chand & company | N403: NVS lucknow
A404: 3146 | B404: M.L Khanna | C404: English in use Grammar &Vocational | D404: 1 | E404: 120 | F404: of:=[.E404]*[.D404] -> 120 | G404: 2001 | I404: of:=YEAR(TODAY())-[.G404] -> 24 | L404: 2000 | M404: Kehner Pub | N404: JN Stationary Mart JWP
A405: 3147 | B405: M.L Khanna | C405: English in use Grammar &Vocational | D405: 1 | E405: 120 | F405: of:=[.E405]*[.D405] -> 120 | G405: 2001 | I405: of:=YEAR(TODAY())-[.G405] -> 24 | L405: 2000 | M405: Kehner Pub | N405: JN Stationary Mart JWP
A406: 3150 | B406: M.L Khanna | C406: English in use Grammar &Vocational | D406: 1 | E406: 120 | F406: of:=[.E406]*[.D406] -> 120 | G406: 2001 | I406: of:=YEAR(TODAY())-[.G406] -> 24 | L406: 2000 | M406: Kehner Pub | N406: JN Stationary Mart JWP
A407: 3303 | B407: Jayant Kumar bhatia | C407: Bharat ki Jansankhya ankre | D407: 1 | E407: 74 | F407: of:=[.E407]*[.D407] -> 74 | G407: 2002 | I407: of:=YEAR(TODAY())-[.G407] -> 23 | L407: 2002 | M407: Prakashan Vivhag | N407: JN stationary Mart JWP
A408: 3330 | B408: S. dass Gupta | C408: PI AN UNENDING STORY IN MATHS | D408: 1 | E408: 29 | F408: of:=[.E408]*[.D408] -> 29 | G408: 2002 | I408: of:=YEAR(TODAY())-[.G408] -> 23 | L408: 2002 | M408: NCERT Delhi | N408: JN stationary Mart JWP
A409: 3389 | B409: RL Singhal | C409: Solid state physics | D409: 1 | E409: 150 | F409: of:=[.E409]*[.D409] -> 150 | G409: 2002 | I409: of:=YEAR(TODAY())-[.G409] -> 23 | L409: 2002 | M409: Kedar Nath Ram nath Meerut | N409: Prabhat Prakashan Delhi
A410: 3397 | B410: Hullar Muradabadi | C410: Jai andar ki baat hai | D410: 1 | E410: 125 | F410: of:=[.E410]*[.D410] -> 125 | G410: 2002 | I410: of:=YEAR(TODAY())-[.G410] -> 23 | L410: 2002 | M410: Vani Prakashan | N410: Vani Prakashan
A411: 3515 | B411: fo".kq izzHkkdj | C411: fo"kqqizHkkdj ds lEiw.kZ ukVd | D411: 1 | E411: 150 | F411: of:=[.E411]*[.D411] -> 150 | G411: 2003 | I411: of:=YEAR(TODAY())-[.G411] -> 22 | L411: 2003 | M411: Prabhat prakashan | N411: Prabhat Prakashan Delhi
A412: 3516 | B412: fo".kq izzHkkdj | C412: fo"kqqizHkkdj ds lEiw.kZ ukVd | D412: 1 | E412: 150 | F412: of:=[.E412]*[.D412] -> 150 | G412: 2003 | I412: of:=YEAR(TODAY())-[.G412] -> 22 | L412: 2003 | M412: Prabhat prakashan | N412: Prabhat Prakashan Delhi
A413: 3522 | B413: fo".kq izzHkkdj | C413: ,d vkSj dqerh | D413: 1 | E413: 300 | F413: of:=[.E413]*[.D413] -> 300 | G413: 2003 | I413: of:=YEAR(TODAY())-[.G413] -> 22 | L413: 2002 | M413: Prabhat prakashan | N413: Prabhat Prakashan Delhi
A414: 3534 | B414: Hkxorh pj.k oekZ | C414: Hkwys fcljs fp= | D414: 1 | E414: 395 | F414: of:=[.E414]*[.D414] -> 395 | G414: 2003 | I414: of:=YEAR(TODAY())-[.G414] -> 22 | L414: 2003 | M414: Pratibha Prakashan | N414: Prabhat Prakashan Delhi
A415: 3578 | B415: lhrk jke vk;kZ | C415: HkkX;orh | D415: 1 | E415: 80 | F415: of:=[.E415]*[.D415] -> 80 | G415: 2003 | I415: of:=YEAR(TODAY())-[.G415] -> 22 | L415: 2003 | M415: Shardha Prakashn | N415: Shardha Prakashan
A416: 3584 | B416: pj.knkl flag | C416: bhagat singh shadid teen naatak | D416: 1 | E416: 500 | F416: of:=[.E416]*[.D416] -> 500 | G416: 2003 | I416: of:=YEAR(TODAY())-[.G416] -> 22 | L416: 2003 | M416: Vani Prakashan | N416: Vani Prakashan
A417: 3587 | B417: 'kjn tks'kh | C417: iqjkus isM dh ckrs | D417: 1 | E417: 160 | F417: of:=[.E417]*[.D417] -> 160 | G417: 2003 | I417: of:=YEAR(TODAY())-[.G417] -> 22 | L417: 2001 | M417: Matrey Prakashan | N417: Vani Prakashan
A418: 3605 | B418: eskguyky HkVukxj | C418: vk/kqfud dfork | D418: 1 | E418: 15 | F418: of:=[.E418]*[.D418] -> 15 | G418: 2003 | I418: of:=YEAR(TODAY())-[.G418] -> 22 | L418: 1999 | M418: Meharban Prakashan | N418: Agar book Delhi
A419: 3616 | B419: d`".k nso 'kekZ | C419: e/kqekyrh | D419: 1 | E419: 30 | F419: of:=[.E419]*[.D419] -> 30 | G419: 2003 | I419: of:=YEAR(TODAY())-[.G419] -> 22 | L419: 2003 | M419: Kala Mindir | N419: Agar book Delhi
A420: 3619 | B420: ,l0ds0egsójh | C420: gad dhara | D420: 1 | E420: 18 | F420: of:=[.E420]*[.D420] -> 18 | G420: 2003 | I420: of:=YEAR(TODAY())-[.G420] -> 22 | L420: 2003 | M420: Kitabh ghar Delhi | N420: Agar book Delhi
A421: 3662 | B421: jkts'k 'kekZ | C421: fnudj vkSj mudh jféjfr | D421: 1 | E421: 35 | F421: of:=[.E421]*[.D421] -> 35 | G421: 2003 | I421: of:=YEAR(TODAY())-[.G421] -> 22 | L421: 1998 | M421: Ashok Prakashan | N421: Agar book Delhi
A422: 3664 | B422: vfHkeU;q | C422: 'kCn Hkax | D422: 1 | E422: 20 | F422: of:=[.E422]*[.D422] -> 20 | G422: 2003 | I422: of:=YEAR(TODAY())-[.G422] -> 22 | L422: 1999 | M422: Ashok Prakashan | N422: Agar book Delhi
A423: 3669 | B423: d`".k nso 'kekZ | C423: jkx njckjh | D423: 1 | E423: 40 | F423: of:=[.E423]*[.D423] -> 40 | G423: 2003 | I423: of:=YEAR(TODAY())-[.G423] -> 22 | L423: 1999 | M423: Frank & sons Dehi | N423: Agar book Delhi
A424: 3718 | B424: lh0,Q0,l0 | C424: Green School | D424: 1 | E424: 75 | F424: of:=[.E424]*[.D424] -> 75 | G424: 2005 | I424: of:=YEAR(TODAY())-[.G424] -> 20 | L424: 2005 | M424: CSF Delhi | N424: NVS lucknow
A425: 3720 | B425: lh0,Q0,l1 | C425: Green School | D425: 1 | E425: 75 | F425: of:=[.E425]*[.D425] -> 75 | G425: 2005 | I425: of:=YEAR(TODAY())-[.G425] -> 20 | L425: 2005 | M425: CSF Delhi | N425: NVS lucknow
A426: 3727 | B426: Gopal chutarvedi | C426: Bharat AUR BHAIS | D426: 1 | E426: 150 | F426: of:=[.E426]*[.D426] -> 150 | G426: 2005 | I426: of:=YEAR(TODAY())-[.G426] -> 20 | L426: 2002 | M426: Sahity Prakashan | N426: Prabhat Prakashan Delhi
A427: 3738 | B427: CBT | C427: six Plays | D427: 1 | E427: 36 | F427: of:=[.E427]*[.D427] -> 36 | G427: 2005 | I427: of:=YEAR(TODAY())-[.G427] -> 20 | L427: 2002 | M427: Icon Prakashan | N427: Prabhat Prakashan Delhi
A428: 3740 | B428: Mohan rakesh | C428: Andhere band kamre | D428: 1 | E428: 250 | F428: of:=[.E428]*[.D428] -> 250 | G428: 2005 | I428: of:=YEAR(TODAY())-[.G428] -> 20 | L428: 2003 | M428: Prabhat prakashan | N428: Prabhat Prakashan Delhi
A429: 3741 | B429: Ak Dutta | C429: Pakistan Jinha se Jahid tak | D429: 1 | E429: 300 | F429: of:=[.E429]*[.D429] -> 300 | G429: 2005 | I429: of:=YEAR(TODAY())-[.G429] -> 20 | L429: 2003 | M429: Pratibha Prakashan | N429: Prabhat Prakashan Delhi
A430: 3770 | B430: tSd fyUlu | C430: white fangs | D430: 1 | E430: 150 | F430: of:=[.E430]*[.D430] -> 150 | G430: 2005 | I430: of:=YEAR(TODAY())-[.G430] -> 20 | L430: 2000 | M430: S Kumar Publication Delhi | N430: Prabhat Prakashan Delhi
A431: 3790 | B431: prqjlsu | C431: Ohanery ki rochak kahaniya | D431: 1 | E431: 150 | F431: of:=[.E431]*[.D431] -> 150 | G431: 2005 | I431: of:=YEAR(TODAY())-[.G431] -> 20 | L431: 2003 | M431: Suyogaya Prakashan | N431: JN stationary Mart JWP
A432: 3817 | B432: ykycgknqj | C432: four tales of bangal | D432: 1 | E432: 195 | F432: of:=[.E432]*[.D432] -> 195 | G432: 2006 | I432: of:=YEAR(TODAY())-[.G432] -> 19 | L432: 2003 | M432: Roopa & company | N432: Cambrage book depot
A433: 3848 | B433: fp=ke/kqxy | C433: Abha | D433: 1 | E433: 500 | F433: of:=[.E433]*[.D433] -> 500 | G433: 2006 | I433: of:=YEAR(TODAY())-[.G433] -> 19 | L433: 2005 | M433: Samajik Prakashan Delhi | N433: Cambrage book depot
A434: 3856 | B434: fojsUnz flag xkSM | C434: vishav me aatankwaad | D434: 1 | E434: 50 | F434: of:=[.E434]*[.D434] -> 50 | G434: 2006 | I434: of:=YEAR(TODAY())-[.G434] -> 19 | L434: 2004 | M434: Samajik Prakashan Delhi | N434: Cambrage book depot
A435: 3876 | B435: foóokfe= 'kekZ | C435: Grabhi or aakal | D435: 1 | E435: 200 | F435: of:=[.E435]*[.D435] -> 200 | G435: 2006 | I435: of:=YEAR(TODAY())-[.G435] -> 19 | L435: 2004 | M435: Rajpal & sons | N435: Cambrage book depot
A436: 3926 | B436: Y sundar raj &Abdul K. | C436: Mahashakti bhart | D436: 1 | E436: 250 | F436: of:=[.E436]*[.D436] -> 250 | G436: 2006 | I436: of:=YEAR(TODAY())-[.G436] -> 19 | L436: 2006 | M436: Prabhat Parkashan | N436: NVS LR lucknow
A437: 3970 | B437: Vijay Agarwal | C437: Same aapki muthi me | D437: 1 | E437: 150 | F437: of:=[.E437]*[.D437] -> 150 | G437: 2006 | I437: of:=YEAR(TODAY())-[.G437] -> 19 | L437: 2006 | M437: Jai Co. House Delhi | N437: NVS LR lucknow
A438: 3986 | B438: Papual Nangle | C438: New teacher complete source book | D438: 1 | E438: 225 | F438: of:=[.E438]*[.D438] -> 225 | G438: 2006 | I438: of:=YEAR(TODAY())-[.G438] -> 19 | L438: 2006 | M438: C.B.S.E Pub. New Delhi | N438: NVS LR lucknow
A439: 4240 | B439: Charls Digens | C439: David Copper field | D439: 1 | E439: 60 | F439: of:=[.E439]*[.D439] -> 60 | G439: 2007 | I439: of:=YEAR(TODAY())-[.G439] -> 18 | L439: 2006 | M439: S.chand & comapany N Delhi | N439: S. Chand Ramnagar Delhi
A440: 4258 | B440: Prativanath | C440: Leaving with value | D440: 1 | E440: 65 | F440: of:=[.E440]*[.D440] -> 65 | G440: 2008 | I440: of:=YEAR(TODAY())-[.G440] -> 17 | L440: 2007 | M440: S.chand & company Delhi | N440: S.Chand DDN
A441: 4301 | B441: W Turner | C441: As you like it | D441: 1 | E441: 90 | F441: of:=[.E441]*[.D441] -> 90 | G441: 2008 | I441: of:=YEAR(TODAY())-[.G441] -> 17 | L441: 2008 | M441: S.chand & company Delhi | N441: S.Chand DDN
A442: 4309 | B442: JC Pices | C442: Postive today | D442: 1 | E442: 30 | F442: of:=[.E442]*[.D442] -> 30 | G442: 2008 | I442: of:=YEAR(TODAY())-[.G442] -> 17 | L442: 2008 | M442: Kabir Prakashan | N442: NVS LR lucknow
A443: 4945 | B443: Prem Chand | C443: Gaban | D443: 1 | E443: 360 | F443: of:=[.E443]*[.D443] -> 360 | G443: 2011 | I443: of:=YEAR(TODAY())-[.G443] -> 14 | L443: 2011 | M443: izse ifCyds'ku bykgkckn | N443: NVS LR lucknow
A444: 4951 | B444: Arun Gour | C444: Bacho ke liye yog | D444: 1 | E444: 175 | F444: of:=[.E444]*[.D444] -> 175 | G444: 2011 | I444: of:=YEAR(TODAY())-[.G444] -> 14 | L444: 2011 | M444: Kku xaxk izdk'ku fnYyh | N444: NVS LR lucknow
A445: 5130 | B445: Sursh Ritupan | C445: Japan ki lok kathayan | D445: 1 | E445: 90 | F445: of:=[.E445]*[.D445] -> 90 | G445: 2011 | I445: of:=YEAR(TODAY())-[.G445] -> 14 | L445: 2011 | M445: NBT Delhi | N445: NBT Delhi
A446: 5345 | B446: Vishnu dutt sharma | C446: Prudashan rodhi braksh | D446: 1 | E446: 150 | F446: of:=[.E446]*[.D446] -> 150 | G446: 2012 | I446: of:=YEAR(TODAY())-[.G446] -> 13 | L446: 2012 | M446: Viskas paper bag prakashan delhi | N446: RO Lucknow
A447: 5403 | B447: Babu Deviki Nandan | C447: Chadrakanta Sutati | D447: 1 | E447: 400 | F447: of:=[.E447]*[.D447] -> 400 | G447: 2012 | I447: of:=YEAR(TODAY())-[.G447] -> 13 | L447: 2012 | M447: Nav Nidhi prakashan Gagiabad | N447: RO Lucknow
A448: 5500 | B448: Flowrangi Teneja | C448: Antriksh ka romanch | D448: 1 | E448: 200 | F448: of:=[.E448]*[.D448] -> 200 | G448: 2012 | I448: of:=YEAR(TODAY())-[.G448] -> 13 | L448: 2012 | M448: Doon Publication | N448: RO Lucknow
A449: 5559 | B449: Ravindra Nath Tagore | C449: Ravinder Nath ke siksha prad kah | D449: 1 | E449: 150 | F449: of:=[.E449]*[.D449] -> 150 | G449: 2012 | I449: of:=YEAR(TODAY())-[.G449] -> 13 | L449: 2012 | M449: Granth Bharti publisher | N449: RO Lucknow
A450: 5625 | B450: Amar chitra katha | C450: Pictorial stories for children | D450: 1 | E450: 35 | F450: of:=[.E450]*[.D450] -> 35 | G450: 2012 | I450: of:=YEAR(TODAY())-[.G450] -> 13 | L450: 2012 | M450: Amar chitr katha Prakashan | N450: Creating India foundation
A451: 5783 | B451: Connon dile | C451: Mot ki saya | D451: 1 | E451: 60 | F451: of:=[.E451]*[.D451] -> 60 | G451: 2012 | I451: of:=YEAR(TODAY())-[.G451] -> 13 | L451: 2012 | M451: Hind Pocket books | N451: Diamod Stationer JWP
A452: 5974 | B452: Shri Ram sharma | C452: Jeevan jeene ki kala | D452: 1 | E452: 36 | F452: of:=[.E452]*[.D452] -> 36 | G452: 2013 | I452: of:=YEAR(TODAY())-[.G452] -> 12 | L452: 2011 | M452: Jan jagran Mathura | N452: Shanti Kunj Haridwar
A453: 6434 | B453: Cambrize | C453: Robot and Robotic | D453: 1 | E453: 24 | F453: of:=[.E453]*[.D453] -> 24 | G453: 2014 | I453: of:=YEAR(TODAY())-[.G453] -> 11 | L453: 1994 | M453: NBT Publication | N453: NVS Lucknow
A454: 6435 | B454: Cambrize | C454: Robot and Robotic | D454: 1 | E454: 24 | F454: of:=[.E454]*[.D454] -> 24 | G454: 2014 | I454: of:=YEAR(TODAY())-[.G454] -> 11 | L454: 1994 | M454: NBT Publication | N454: NVS Lucknow
A455: 6436 | B455: Cambrize | C455: Robot and Robotic | D455: 1 | E455: 24 | F455: of:=[.E455]*[.D455] -> 24 | G455: 2014 | I455: of:=YEAR(TODAY())-[.G455] -> 11 | L455: 1994 | M455: NBT Publication | N455: NVS Lucknow
A456: 6440 | B456: Cambrize | C456: Robot and Robotic | D456: 1 | E456: 24 | F456: of:=[.E456]*[.D456] -> 24 | G456: 2014 | I456: of:=YEAR(TODAY())-[.G456] -> 11 | L456: 1994 | M456: NBT Publication | N456: NVS Lucknow
A457: 6445 | B457: Subash brothers | C457: Africa and India | D457: 1 | E457: 43 | F457: of:=[.E457]*[.D457] -> 43 | G457: 2014 | I457: of:=YEAR(TODAY())-[.G457] -> 11 | L457: 1996 | M457: NBT Publication | N457: NVS Lucknow
A458: 6452 | B458: Varrier Eluein | C458: When the world was young | D458: 1 | E458: 30 | F458: of:=[.E458]*[.D458] -> 30 | G458: 2014 | I458: of:=YEAR(TODAY())-[.G458] -> 11 | L458: 1996 | M458: NBT Publication | N458: NVS Lucknow
A459: 6461 | B459: BC sharma | C459: Material Marvels | D459: 1 | E459: 40 | F459: of:=[.E459]*[.D459] -> 40 | G459: 2014 | I459: of:=YEAR(TODAY())-[.G459] -> 11 | L459: 1999 | M459: Amity Publisher | N459: NVS Lucknow
A460: 7398 | B460: Sekshpeare | C460: SHAKESPEARE KI ROCHAK KAHANIYA | D460: 1 | E460: 250 | F460: of:=[.E460]*[.D460] -> 250 | G460: 2015 | I460: of:=YEAR(TODAY())-[.G460] -> 10 | L460: 2015 | M460: PRATISTHAN | N460: ASHIRVAD BOOK DEPOT
A461: 8245 | B461: v nayadu | C461: more ki puch par aak | D461: 1 | E461: 35 | F461: of:=[.E461]*[.D461] -> 35 | G461: 2016 | I461: of:=YEAR(TODAY())-[.G461] -> 9 | L461: 2014 | M461: NATIONAL BOOKS TRUST | N461: NATIONAL BOOKS TRUST

Sheet: missing(478)
A1: Acc No. | B1: Author | C1: Title | D1: Quantity | E1: Cost per Unit | F1: Total Cost | G1: Yr. of Purchase | H1: Stock Register Pg. No. | I1: Life Span (yrs) | J1: Depreciated Value | K1: Justification by Stock Holder | L1: Yr. of Publishing | M1: Source | N1: Publisher
A2: 3 | B2: vk;ksxu dh fjiksZV | D2: 1 | E2: 50 | F2: of:=[.E2]*[.D2] -> 50 | G2: 1994 | I2: of:=YEAR(TODAY())-[.G2] -> 31 | L2: 1987 | M2: NCERT Delhi | N2: {ks=h; dk;kZy; y[kuÅ
A3: 10 | B3: ?kuifr ik.Ms; | C3: Lokeh n;kuUn ljLorh | D3: 1 | E3: 70 | F3: of:=[.E3]*[.D3] -> 70 | G3: 1994 | I3: of:=YEAR(TODAY())-[.G3] -> 31 | L3: 1993 | M3: NCERT Delhi | N3: {ks=h; dk;kZy; y[kuÅ
A4: 13 | B4: ch0 ,l0 ldyk okyk | C4: telsnuh rkjk | D4: 1 | E4: 27 | F4: of:=[.E4]*[.D4] -> 27 | G4: 1994 | I4: of:=YEAR(TODAY())-[.G4] -> 31 | L4: 1987 | M4: NCERT Delhi | N4: {ks=h; dk;kZy; y[kuÅ
A5: 14 | B5: oh0,l0 ukjk;.k jk; | C5: Mk0 ,u0,l0gkfMdj | D5: 1 | E5: 15.25 | F5: of:=[.E5]*[.D5] -> 15.25 | G5: 1994 | I5: of:=YEAR(TODAY())-[.G5] -> 31 | L5: 1985 | M5: NCERT Delhi | N5: {ks=h; dk;kZy; y[kuÅ
A6: 22 | B6: Vh0,u0 txnh'ku | C6: Jhfuokl 'kkL=h | D6: 1 | E6: 20 | F6: of:=[.E6]*[.D6] -> 20 | G6: 1994 | I6: of:=YEAR(TODAY())-[.G6] -> 31 | L6: 1992 | M6: NCERT Delhi | N6: {ks=h; dk;kZy; y[kuÅ
A7: 26 | B7: fu0 lk/ku cksl | C7: jkekuUn pVksi/;k; | D7: 1 | E7: 11 | F7: of:=[.E7]*[.D7] -> 11 | G7: 1994 | I7: of:=YEAR(TODAY())-[.G7] -> 31 | L7: 1882 | M7: NCERT Delhi | N7: {ks=h; dk;kZy; y[kuÅ
A8: 36 | B8: Mk0 gfjny | C8: x<+okyh Hkk"kk | D8: 1 | E8: 15 | F8: of:=[.E8]*[.D8] -> 15 | G8: 1994 | I8: of:=YEAR(TODAY())-[.G8] -> 31 | L8: 1980 | M8: NCERT Delhi | N8: {ks=h; dk;kZy; y[kuÅ
A9: 51 | B9: izfrHkk vxzoky | C9: eksgu jkds'k | D9: 1 | E9: 16 | F9: of:=[.E9]*[.D9] -> 16 | G9: 1994 | I9: of:=YEAR(TODAY())-[.G9] -> 31 | L9: 1985 | M9: NCERT Delhi | N9: {ks=h; dk;kZy; y[kuÅ
A10: 53 | B10: ek0 papjhd | C10: egkRek T;ksfrok | D10: 1 | E10: 15 | F10: of:=[.E10]*[.D10] -> 15 | G10: 1994 | I10: of:=YEAR(TODAY())-[.G10] -> 31 | L10: 1991 | M10: NCERT Delhi | N10: {ks=h; dk;kZy; y[kuÅ
A11: 58 | B11: ve`r jk; | C11: izse pUn | D11: 1 | E11: 15 | F11: of:=[.E11]*[.D11] -> 15 | G11: 1994 | I11: of:=YEAR(TODAY())-[.G11] -> 31 | L11: 1984 | M11: NCERT Delhi | N11: {ks=h; dk;kZy; y[kuÅ
A12: 66 | D12: 1 | E12: 15 | F12: of:=[.E12]*[.D12] -> 15 | G12: 1994 | I12: of:=YEAR(TODAY())-[.G12] -> 31 | L12: 1990 | M12: NCERT Delhi | N12: {ks=h; dk;kZy; y[kuÅ
A13: 71 | B13: fot;sUnzz | C13: shri vallabha charya | D13: 1 | E13: 6 | F13: of:=[.E13]*[.D13] -> 6 | G13: 1994 | I13: of:=YEAR(TODAY())-[.G13] -> 31 | L13: 1973 | M13: NCERT Delhi | N13: {ks=h; dk;kZy; y[kuÅ
A14: 106 | B14: Mk0 xksfoUnnkl | C14: drZO; | D14: 1 | E14: 30 | F14: of:=[.E14]*[.D14] -> 30 | G14: 1994 | I14: of:=YEAR(TODAY())-[.G14] -> 31 | L14: 1990 | M14: NCERT Delhi | N14: {ks=h; dk;kZy; y[kuÅ
A15: 116 | B15: Lokeh eqeq{kkuUn | C15: foosdkuUn lkfgR; 4 | D15: 1 | E15: 175 | F15: of:=[.E15]*[.D15] -> 175 | G15: 1994 | I15: of:=YEAR(TODAY())-[.G15] -> 31 | L15: 1993 | M15: NCERT Delhi | N15: {ks=h; dk;kZy; y[kuÅ
A16: 117 | B16: Lokeh eqeq{kkuUn | C16: foosdkuUn lkfgR; 5 | D16: 1 | E16: 175 | F16: of:=[.E16]*[.D16] -> 175 | G16: 1994 | I16: of:=YEAR(TODAY())-[.G16] -> 31 | L16: 1993 | M16: NCERT Delhi | N16: {ks=h; dk;kZy; y[kuÅ
A17: 119 | B17: Lokeh eqeq{kkuUn | C17: foosdkuUn lkfgR; 7 | D17: 1 | E17: 175 | F17: of:=[.E17]*[.D17] -> 175 | G17: 1994 | I17: of:=YEAR(TODAY())-[.G17] -> 31 | L17: 1993 | M17: NCERT Delhi | N17: {ks=h; dk;kZy; y[kuÅ
A18: 121 | B18: Lokeh eqeq{kkuUn | C18: foosdkuUn lkfgR; 9 | D18: 1 | E18: 175 | F18: of:=[.E18]*[.D18] -> 175 | G18: 1994 | I18: of:=YEAR(TODAY())-[.G18] -> 31 | L18: 1993 | M18: NCERT Delhi | N18: {ks=h; dk;kZy; y[kuÅ
A19: 122 | B19: Lokeh eqeq{kkuUn | C19: foosdkuUn lkfgR; 10 | D19: 1 | E19: 175 | F19: of:=[.E19]*[.D19] -> 175 | G19: 1994 | I19: of:=YEAR(TODAY())-[.G19] -> 31 | L19: 1993 | M19: NCERT Delhi | N19: {ks=h; dk;kZy; y[kuÅ
A20: 129 | B20: K.R. Srinivasan | C20: Temples of south India | D20: 1 | E20: 37 | F20: of:=[.E20]*[.D20] -> 37 | G20: 1995 | I20: of:=YEAR(TODAY())-[.G20] -> 30 | L20: 1972 | M20: N.B.T. | N20: Deepak Book agency
A21: 186 | B21: S. Surti | C21: A visit to the zoo | D21: 1 | E21: 6.5 | F21: of:=[.E21]*[.D21] -> 6.5 | G21: 1995 | I21: of:=YEAR(TODAY())-[.G21] -> 30 | L21: 1991 | M21: N.B.T. | N21: Deepak Book agency
A22: 188 | B22: S. sharma | C22: a journey to Gomukha | D22: 1 | E22: 6 | F22: of:=[.E22]*[.D22] -> 6 | G22: 1995 | I22: of:=YEAR(TODAY())-[.G22] -> 30 | L22: 1987 | M22: N.B.T. | N22: Deepak Book agency
A23: 229 | B23: v:Ik dqekj nRr | C23: pk; dh dgkuh | D23: 1 | E23: 5.5 | F23: of:=[.E23]*[.D23] -> 5.5 | G23: 1995 | I23: of:=YEAR(TODAY())-[.G23] -> 30 | L23: 1985 | M23: N.B.T. India | N23: Deepak Book agency
A24: 271 | B24: yhyk etqe nkj | C24: gekjh ufn;ksa dh dgkuh | D24: 1 | E24: 8 | F24: of:=[.E24]*[.D24] -> 8 | G24: 1995 | I24: of:=YEAR(TODAY())-[.G24] -> 30 | L24: 1970 | M24: N.B.T. India | N24: Deepak Book agency
A25: 272 | B25: ve`rjk; | C25: izsepUn | D25: 1 | E25: 6 | F25: of:=[.E25]*[.D25] -> 6 | G25: 1995 | I25: of:=YEAR(TODAY())-[.G25] -> 30 | L25: 1978 | M25: N.B.T. India | N25: Deepak Book agency
A26: 459 | B26: ih-,e-tks'kh | C26: cgqr fnu gq,&1 | D26: 1 | E26: 8 | F26: of:=[.E26]*[.D26] -> 8 | G26: 1995 | I26: of:=YEAR(TODAY())-[.G26] -> 30 | L26: 1994 | M26: N.B.T. | N26: Deepak Book agency
A27: 491 | B27: lqjthr | C27: f'kdkj dh jksekapdkjh iqtko dsljh dgkfu;ka | D27: 1 | E27: 15 | F27: of:=[.E27]*[.D27] -> 15 | G27: 1995 | I27: of:=YEAR(TODAY())-[.G27] -> 30 | M27: vk;Z cqd fMiks | N27: {ks=h; dk;kZy; y[kuÅ
A28: 492 | B28: lq'khy dqekj | C28: ykyk yktir jk; | D28: 1 | E28: 8 | F28: of:=[.E28]*[.D28] -> 8 | G28: 1995 | I28: of:=YEAR(TODAY())-[.G28] -> 30 | L28: 1992 | M28: vk;Z cqd fMiks | N28: {ks=h; dk;kZy; y[kuÅ
A29: 493 | B29: jkts'k 'kekZ | C29: ckIik jkoy | D29: 1 | E29: 16 | F29: of:=[.E29]*[.D29] -> 16 | G29: 1995 | I29: of:=YEAR(TODAY())-[.G29] -> 30 | L29: 1992 | M29: vk;Z cqd fMiks | N29: {ks=h; dk;kZy; y[kuÅ
A30: 495 | B30: O;fFkr g~j; | C30: lalkj dh Js"B yksd dFkk,a | D30: 1 | E30: 12 | F30: of:=[.E30]*[.D30] -> 12 | G30: 1995 | I30: of:=YEAR(TODAY())-[.G30] -> 30 | L30: 1991 | M30: vk;Z cqd fMiks | N30: {ks=h; dk;kZy; y[kuÅ
A31: 500 | B31: lq'khy dqekj | C31: egkeuk enu eksgu ekyoh; | D31: 1 | E31: 12 | F31: of:=[.E31]*[.D31] -> 12 | G31: 1995 | I31: of:=YEAR(TODAY())-[.G31] -> 30 | L31: 1992 | M31: vk;Z cqd fMiks | N31: {ks=h; dk;kZy; y[kuÅ
A32: 501 | B32: Jh O;fFkr gn; | C32: ehjk ckbZ | D32: 1 | E32: 16 | F32: of:=[.E32]*[.D32] -> 16 | G32: 1995 | I32: of:=YEAR(TODAY())-[.G32] -> 30 | L32: 1995 | M32: vk;Z cqd fMiks | N32: {ks=h; dk;kZy; y[kuÅ
A33: 622 | B33: Mk0 nhun;ky xqIr | C33: cztHkk"kk lwj dks'k Hkkx-2 | D33: 1 | E33: 1 | F33: of:=[.E33]*[.D33] -> 1 | G33: 1995 | I33: of:=YEAR(TODAY())-[.G33] -> 30 | M33: fgUnh foHkkx y[kuÅ | N33: {ks=h; dk;kZy; y[kuÅ
A34: 625 | B34: Mk0 nhun;ky xqIr | C34: cztHkk"kk lwj dks'k Hkkx-5 | D34: 1 | E34: 1 | F34: of:=[.E34]*[.D34] -> 1 | G34: 1995 | I34: of:=YEAR(TODAY())-[.G34] -> 30 | M34: fgUnh foHkkx y[kuÅ | N34: {ks=h; dk;kZy; y[kuÅ
A35: 636 | B35: ia- lhrkjke | C35: f'k{kk n'kZu | D35: 1 | E35: 12 | F35: of:=[.E35]*[.D35] -> 12 | G35: 1995 | I35: of:=YEAR(TODAY())-[.G35] -> 30 | L35: 1970 | M35: lwpuk foHkkx m0iz2 | N35: {ks=h; dk;kZy; y[kuÅ
A36: 643 | B36: vftrk JhokLro | C36: vPNs jkLrs tks LoLFk cuk,xs | D36: 1 | F36: of:=[.E36]*[.D36] -> 0 | G36: 1995 | I36: of:=YEAR(TODAY())-[.G36] -> 30 | L36: 1994 | M36: ihrkEcj | N36: {ks=h; dk;kZy; y[kuÅ
A37: 663 | B37: euh'k pUnz mRre | C37: jkdsV | D37: 1 | E37: 8.45 | F37: of:=[.E37]*[.D37] -> 8.45 | G37: 1995 | I37: of:=YEAR(TODAY())-[.G37] -> 30 | L37: 1988 | M37: N.C.E.R.T | N37: {ks=h; dk;kZy; y[kuÅ
A38: 664 | B38: Jh izlkn | C38: <e<ee<e cky dfork,a | D38: 1 | E38: 13 | F38: of:=[.E38]*[.D38] -> 13 | G38: 1995 | I38: of:=YEAR(TODAY())-[.G38] -> 30 | L38: 1989 | M38: N.C.E.R.T | N38: {ks=h; dk;kZy; y[kuÅ
A39: 746 | B39: Bal krishna | C39: Glimpse of India Technalogy | D39: 1 | E39: 110 | F39: of:=[.E39]*[.D39] -> 110 | G39: 1995 | I39: of:=YEAR(TODAY())-[.G39] -> 30 | L39: 1988 | M39: P.D.M.I.B.G.I. | N39: {ks=h; dk;kZy; y[kuÅ
A40: 856 | B40: ewYdjkt | C40: xyh eqgYys ds dqN [ksy | D40: 1 | E40: 8.5 | F40: of:=[.E40]*[.D40] -> 8.5 | G40: 1996 | I40: of:=YEAR(TODAY())-[.G40] -> 29 | L40: 1983 | M40: N.B.T. India | N40: Deepak book depot
A41: 952 | B41: jkeflag rksej | C41: johUnz ukFk dh dgkfu;ka Hkkx 1 | D41: 1 | E41: 80 | F41: of:=[.E41]*[.D41] -> 80 | G41: 1996 | I41: of:=YEAR(TODAY())-[.G41] -> 29 | L41: 1992 | M41: lkfgR; vdkneh | N41: Deepak book depot
A42: 967 | B42: ls;n vcnqy | C42: ;k;koj | D42: 1 | E42: 60 | F42: of:=[.E42]*[.D42] -> 60 | G42: 1996 | I42: of:=YEAR(TODAY())-[.G42] -> 29 | L42: 1992 | M42: lkfgR; vdkneh | N42: Deepak book depot
A43: 1020 | B43: fnyhi dqekj eqdthZ | C43: pSrU; | D43: 1 | E43: 8 | F43: of:=[.E43]*[.D43] -> 8 | G43: 1996 | I43: of:=YEAR(TODAY())-[.G43] -> 29 | L43: 1972 | N43: y[kuÅ {ks=h; dk;kZy;
A44: 1028 | B44: gtkjh izlkn | C44: eU= rU= | D44: 1 | E44: 8 | F44: of:=[.E44]*[.D44] -> 8 | G44: 1996 | I44: of:=YEAR(TODAY())-[.G44] -> 29 | L44: 1993 | N44: y[kuÅ {ks=h; dk;kZy;
A45: 1029 | B45: kjfnUnq lsu jk; | C45: jaxfojaxk jktLFkku | D45: 1 | E45: 6 | F45: of:=[.E45]*[.D45] -> 6 | G45: 1996 | I45: of:=YEAR(TODAY())-[.G45] -> 29 | L45: 1986 | N45: y[kuÅ {ks=h; dk;kZy;
A46: 1084 | B46: eukst nkl | C46: lkgl ds /kuh | D46: 1 | E46: 10 | F46: of:=[.E46]*[.D46] -> 10 | G46: 1996 | I46: of:=YEAR(TODAY())-[.G46] -> 29 | L46: 1988 | M46: N.C.E.R.T | N46: y[kuÅ {ks=h; dk;kZy;
A47: 1189 | B47: Rarala D Nandedkar | C47: Brave new generatioon | D47: 1 | E47: 20 | F47: of:=[.E47]*[.D47] -> 20 | G47: 1996 | I47: of:=YEAR(TODAY())-[.G47] -> 29 | L47: 1994 | M47: N.C.E.R.T | N47: {ks=h; dk;kZy; y[kuÅ
A48: 1191 | B48: V.G Kulkarni | C48: Doing science is fun | D48: 1 | E48: 30 | F48: of:=[.E48]*[.D48] -> 30 | G48: 1996 | I48: of:=YEAR(TODAY())-[.G48] -> 29 | L48: 1993 | M48: N.C.E.R.T | N48: {ks=h; dk;kZy; y[kuÅ
A49: 1219 | B49: Mk0 /keZiky xka/kh | C49: Jh ukjk;.k xq: | D49: 1 | E49: 10.5 | F49: of:=[.E49]*[.D49] -> 10.5 | G49: 1996 | I49: of:=YEAR(TODAY())-[.G49] -> 29 | L49: 1985 | M49: N.C.E.R.T | N49: {ks=h; dk;kZy; y[kuÅ
A50: 1229 | B50: J.T. Glover | C50: Vedic Mathematics | D50: 1 | E50: 65 | F50: of:=[.E50]*[.D50] -> 65 | G50: 1996 | I50: of:=YEAR(TODAY())-[.G50] -> 29 | M50: N.C.E.R.T | N50: {ks=h; dk;kZy; y[kuÅ
A51: 1230 | B51: J.T. Glover | C51: Vedic Mathematics | D51: 1 | E51: 65 | F51: of:=[.E51]*[.D51] -> 65 | G51: 1996 | I51: of:=YEAR(TODAY())-[.G51] -> 29 | M51: N.C.E.R.T | N51: {ks=h; dk;kZy; y[kuÅ
A52: 1239 | B52: Feisal Alkazi | C52: Chipko | D52: 1 | E52: 20 | F52: of:=[.E52]*[.D52] -> 20 | G52: 1996 | I52: of:=YEAR(TODAY())-[.G52] -> 29 | M52: N.C.E.R.T | N52: {ks=h; dk;kZy; y[kuÅ
A53: 1240 | B53: Feisal Alkazi | C53: Chipko | D53: 1 | E53: 20 | F53: of:=[.E53]*[.D53] -> 20 | G53: 1996 | I53: of:=YEAR(TODAY())-[.G53] -> 29 | M53: N.C.E.R.T | N53: {ks=h; dk;kZy; y[kuÅ
A54: 1242 | B54: Feisal Alkazi | C54: Chipko | D54: 1 | E54: 20 | F54: of:=[.E54]*[.D54] -> 20 | G54: 1996 | I54: of:=YEAR(TODAY())-[.G54] -> 29 | M54: N.C.E.R.T | N54: {ks=h; dk;kZy; y[kuÅ
A55: 1261 | B55: Feisal Aliazi | C55: Nainas village | D55: 1 | E55: 20 | F55: of:=[.E55]*[.D55] -> 20 | G55: 1996 | I55: of:=YEAR(TODAY())-[.G55] -> 29 | M55: N.C.E.R.T | N55: {ks=h; dk;kzy; y[kuÅ
A56: 1274 | B56: Feisal Aliazi | C56: The wrath of nature | D56: 1 | E56: 28 | F56: of:=[.E56]*[.D56] -> 28 | G56: 1996 | I56: of:=YEAR(TODAY())-[.G56] -> 29 | M56: N.C.E.R.T | N56: {ks=h; dk;kzy; y[kuÅ
A57: 1280 | B57: Feisal Aliazi | C57: The wrath of nature | D57: 1 | E57: 28 | F57: of:=[.E57]*[.D57] -> 28 | G57: 1996 | I57: of:=YEAR(TODAY())-[.G57] -> 29 | M57: N.C.E.R.T | N57: {ks=h; dk;kzy; y[kuÅ
A58: 1308 | B58: P.R Mishra | C58: Chakriy vikas Pranali | D58: 1 | E58: 10 | F58: of:=[.E58]*[.D58] -> 10 | G58: 1996 | I58: of:=YEAR(TODAY())-[.G58] -> 29 | L58: 1996 | M58: N.C.E.R.T | N58: {ks=h; dk;kzy; y[kuÅ
A59: 1326 | B59: P.R Mishra | C59: Northern lifestyle | D59: 1 | E59: 10 | F59: of:=[.E59]*[.D59] -> 10 | G59: 1996 | I59: of:=YEAR(TODAY())-[.G59] -> 29 | M59: N.C.E.R.T | N59: {ks=h; dk;kzy; y[kuÅ
A60: 1327 | B60: P.R Mishra | C60: Northern lifestyle | D60: 1 | E60: 10 | F60: of:=[.E60]*[.D60] -> 10 | G60: 1996 | I60: of:=YEAR(TODAY())-[.G60] -> 29 | M60: N.C.E.R.T | N60: {ks=h; dk;kzy; y[kuÅ
A61: 1352 | B61: S.K. Ram | C61: Grammar through stories 2 | D61: 1 | E61: 34.5 | F61: of:=[.E61]*[.D61] -> 34.5 | G61: 1996 | I61: of:=YEAR(TODAY())-[.G61] -> 29 | L61: 1995 | M61: N.C.E.R.T | N61: {ks=h; dk;kzy; y[kuÅ
A62: 1433 | B62: bUnziky flag | C62: xq:n'kZu | D62: 1 | E62: 9.6 | F62: of:=[.E62]*[.D62] -> 9.6 | G62: 1996 | I62: of:=YEAR(TODAY())-[.G62] -> 29 | L62: 1996 | M62: fg0 iq0 Hk.Mkj fnYyh | N62: txrjke ,.M lUl fnYyh
A63: 1444 | B63: ukjk;.k ijekj | C63: gkfj;s uk fgEer | D63: 1 | E63: 8 | F63: of:=[.E63]*[.D63] -> 8 | G63: 1996 | I63: of:=YEAR(TODAY())-[.G63] -> 29 | L63: 1996 | M63: txrjke fnYyh | N63: txrjke ,.M lUl fnYyh
A64: 1510 | B64: eSfDle xksdhZ | C64: ubZ vk'kk | D64: 1 | E64: 100 | F64: of:=[.E64]*[.D64] -> 100 | G64: 1996 | I64: of:=YEAR(TODAY())-[.G64] -> 29 | L64: 1996 | M64: fdrkc?kj xkW/khuxj fnYyh | N64: txrjke ,.M lUl fnYyh
A65: 1538 | B65: Karuna Kumar | C65: Learn English for science | D65: 1 | E65: 20 | F65: of:=[.E65]*[.D65] -> 20 | G65: 1997 | I65: of:=YEAR(TODAY())-[.G65] -> 28 | L65: 1991 | M65: NVS New Delhi | N65: NVS LR
A66: 1544 | B66: Karuna Kumar | C66: Learn English for science | D66: 1 | E66: 20 | F66: of:=[.E66]*[.D66] -> 20 | G66: 1997 | I66: of:=YEAR(TODAY())-[.G66] -> 28 | L66: 1991 | M66: NVS New Delhi | N66: NVS LR
A67: 1552 | B67: Karuna Kumar | C67: Learn English for science | D67: 1 | E67: 20 | F67: of:=[.E67]*[.D67] -> 20 | G67: 1997 | I67: of:=YEAR(TODAY())-[.G67] -> 28 | L67: 1991 | M67: NVS New Delhi | N67: NVS LR
A68: 1638 | B68: Mk0 ljdk'kqDy | C68: ik"pkR; thou | D68: 1 | E68: 5 | F68: of:=[.E68]*[.D68] -> 5 | G68: 1997 | I68: of:=YEAR(TODAY())-[.G68] -> 28 | L68: 1967 | M68: m0 iz fg0 laLFkku y[kuÅ | N68: NVS LR
A69: 1654 | B69: T. Jucoks M.R Astin | C69: 100 Atheletics | D69: 1 | E69: 60 | F69: of:=[.E69]*[.D69] -> 60 | G69: 1997 | I69: of:=YEAR(TODAY())-[.G69] -> 28 | L69: 1997 | M69: Gemini books Delhi | N69: NVS LR
A70: 1655 | B70: T.R. Bhawat | C70: Inventions 1 | D70: 1 | E70: 60 | F70: of:=[.E70]*[.D70] -> 60 | G70: 1997 | I70: of:=YEAR(TODAY())-[.G70] -> 28 | L70: 1995 | M70: Dream land pub. Delhi | N70: NVS LR
A71: 1664 | B71: Ministing & labour | D71: 1 | E71: Free | F71: of:=[.E71]*[.D71] ->  | G71: 1997 | I71: of:=YEAR(TODAY())-[.G71] -> 28 | L71: 1988 | M71: Ministary of labour | N71: NVS LR
A72: 1670 | B72: Ministing & labour | C72: career in environment Sci. | D72: 1 | E72: Free | F72: of:=[.E72]*[.D72] ->  | G72: 1997 | I72: of:=YEAR(TODAY())-[.G72] -> 28 | L72: 1994 | M72: Ministary of labour | N72: NVS LR
A73: 1672 | B73: Ministing & labour | C73: careers in lib. Sci | D73: 1 | E73: Free | F73: of:=[.E73]*[.D73] ->  | G73: 1997 | I73: of:=YEAR(TODAY())-[.G73] -> 28 | L73: 1994 | M73: Ministary of labour | N73: NVS LR
A74: 1674 | B74: Labour Mind | C74: lSjUMj djus okyks ds fy, jkstxkj | D74: 1 | E74: Free | F74: of:=[.E74]*[.D74] ->  | G74: 1997 | I74: of:=YEAR(TODAY())-[.G74] -> 28 | L74: 1995 | M74: Carrier study centre | N74: NVS LR
A75: 1676 | B75: Labour Mind | C75: self employ in small scale Ind | D75: 1 | E75: Free | F75: of:=[.E75]*[.D75] ->  | G75: 1997 | I75: of:=YEAR(TODAY())-[.G75] -> 28 | L75: 1982 | M75: Ministary of labour | N75: NVS LR
A76: 1704 | B76: R.S.Dhillon | C76: NDA Kit | D76: 1 | E76: 275 | F76: of:=[.E76]*[.D76] -> 275 | G76: 1997 | I76: of:=YEAR(TODAY())-[.G76] -> 28 | L76: 1997 | M76: Dhellon Gr of Delhi | N76: NVS LR
A77: 1705 | B77: R.S.Dhillon | C77: function with plants | D77: 1 | E77: 16 | F77: of:=[.E77]*[.D77] -> 16 | G77: 1997 | I77: of:=YEAR(TODAY())-[.G77] -> 28 | L77: 1997 | M77: Viks publisher Delhi | N77: NVS LR
A78: 1740 | B78: Maheshwari Asurathi | C78: A complete guide for biology 2 | D78: 1 | E78: 109.8 | F78: of:=[.E78]*[.D78] -> 109.8 | G78: 1997 | I78: of:=YEAR(TODAY())-[.G78] -> 28 | L78: 1996 | M78: Arya book depot Delhi | N78: Arya B. Dep. N Delhi
A79: 1742 | B79: Maheshwar & Bhalla | C79: sci book for sec. sch. Biology | D79: 1 | E79: 29 | F79: of:=[.E79]*[.D79] -> 29 | G79: 1997 | I79: of:=YEAR(TODAY())-[.G79] -> 28 | L79: 1996 | M79: Arya book depot Delhi | N79: Arya B. Dep. N Delhi
A80: 1781 | B80: K Bhatt urmila | C80: getting head at +2 XI | D80: 1 | E80: 44.8 | F80: of:=[.E80]*[.D80] -> 44.8 | G80: 1997 | I80: of:=YEAR(TODAY())-[.G80] -> 28 | L80: 1996 | M80: Arya book depot Delhi | N80: Arya B. Dep. N Delhi
A81: 1801 | B81: jkeewfrZ flag | C81: yksdfDr dks'k | D81: 1 | E81: 100 | F81: of:=[.E81]*[.D81] -> 100 | G81: 1997 | I81: of:=YEAR(TODAY())-[.G81] -> 28 | L81: 1996 | M81: izHkkr izdk'ku fnYyh | N81: Prabhat Pra. Delhi
A82: 1821 | B82: jks'kuyky | C82: vktknh dh dgkuh | D82: 1 | E82: 0 | F82: of:=[.E82]*[.D82] -> 0 | G82: 1997 | I82: of:=YEAR(TODAY())-[.G82] -> 28 | L82: 1996 | M82: lfgR; izdk'ku fnYyh | N82: Prabhat Pra. Delhi
A83: 1837 | B83: fxfjjkt 'kekZ | C83: lkxj foKku | D83: 1 | E83: 125 | F83: of:=[.E83]*[.D83] -> 125 | G83: 1997 | I83: of:=YEAR(TODAY())-[.G83] -> 28 | L83: 1996 | M83: lkfgR; izdk'ku fnYyh | N83: Prabhat Pra. Delhi
A84: 1940 | B84: enkfj;k | C84: gekjk LokLF; | D84: 1 | E84: 8 | F84: of:=[.E84]*[.D84] -> 8 | G84: 1998 | I84: of:=YEAR(TODAY())-[.G84] -> 27 | L84: 1994 | M84: ijesójh izdk'ku fnYyh
A85: 1952 | B85: CIEFL | C85: work book english reader | D85: 1 | F85: of:=[.E85]*[.D85] -> 0 | G85: 1998 | I85: of:=YEAR(TODAY())-[.G85] -> 27
A86: 1953 | B86: CIEFL | C86: work book english reader | D86: 1 | F86: of:=[.E86]*[.D86] -> 0 | G86: 1998 | I86: of:=YEAR(TODAY())-[.G86] -> 27
A87: 1954 | B87: CIEFL | C87: work book english reader | D87: 1 | F87: of:=[.E87]*[.D87] -> 0 | G87: 1998 | I87: of:=YEAR(TODAY())-[.G87] -> 27
A88: 1963 | B88: CIEEL | C88: MAKERS AND FINDERS | D88: 1 | E88: 185 | F88: of:=[.E88]*[.D88] -> 185 | G88: 1998 | I88: of:=YEAR(TODAY())-[.G88] -> 27 | L88: 1997 | M88: CIEFL hydrabad | N88: CIEFL
A89: 1982 | B89: T.P Kalinand | C89: Folk tales of Karnatka | D89: 1 | E89: 35 | F89: of:=[.E89]*[.D89] -> 35 | G89: 1998 | I89: of:=YEAR(TODAY())-[.G89] -> 27 | L89: 1998 | M89: Learner Press Delhi | N89: NVS LR
A90: 2007 | B90: G Vakantraman | C90: Question bank in office Practice | D90: 1 | E90: 60 | F90: of:=[.E90]*[.D90] -> 60 | G90: 1998 | I90: of:=YEAR(TODAY())-[.G90] -> 27 | L90: 1995 | M90: NCERT | N90: NVS LR
A91: 2027 | B91: Pratibha Natha | C91: Treasure of tales III | D91: 1 | E91: 30 | F91: of:=[.E91]*[.D91] -> 30 | G91: 1998 | I91: of:=YEAR(TODAY())-[.G91] -> 27 | L91: 1997 | M91: S.Chand | N91: NVS LR
A92: 2035 | B92: Arghna | C92: Living English for Juniors | D92: 1 | E92: 22 | F92: of:=[.E92]*[.D92] -> 22 | G92: 1998 | I92: of:=YEAR(TODAY())-[.G92] -> 27 | L92: 1998 | M92: Jayeet Publication | N92: NVS LR
A93: 2042 | B93: B.B sharma | C93: Guide to home gardening | D93: 1 | E93: 60 | F93: of:=[.E93]*[.D93] -> 60 | G93: 1998 | I93: of:=YEAR(TODAY())-[.G93] -> 27 | L93: 1998 | M93: Arya book depot Delhi | N93: NVS LR
A94: 2116 | B94: vt; dqqekj prqosnhZ | C94: Hkkjrh; oSKkfud | D94: 1 | E94: 20 | F94: of:=[.E94]*[.D94] -> 20 | G94: 1998 | I94: of:=YEAR(TODAY())-[.G94] -> 27 | L94: 1996 | M94: Rachna Prakashan | N94: NVS LR
A95: 2187 | B95: vuqie | C95: ty rajxksa dh vkRedFkk | D95: 1 | E95: 50 | F95: of:=[.E95]*[.D95] -> 50 | G95: 1998 | I95: of:=YEAR(TODAY())-[.G95] -> 27 | L95: 1992 | M95: izeSójh izdk'ku | N95: fdrkc?kj xkW/khuxj fnYyh
A96: 2188 | B96: vksedkj egjk | C96: ryk'k tkjh gSA | D96: 1 | E96: 30 | F96: of:=[.E96]*[.D96] -> 30 | G96: 1998 | I96: of:=YEAR(TODAY())-[.G96] -> 27 | L96: 1987 | M96: fdrkc?kj xkW/khuxj fnYyh | N96: fdrkc?kj xkW/khuxj fnYyh
A97: 2205 | B97: ck.kks ljrkt | C97: taxy esa exay | D97: 1 | E97: 25 | F97: of:=[.E97]*[.D97] -> 25 | G97: 1998 | I97: of:=YEAR(TODAY())-[.G97] -> 27 | L97: 1997 | M97: txrjke ,.M lUl | N97: fdrkc?kj xkW/khuxj fnYyh
A98: 2210 | B98: pUnziky flga e;ad | C98: ,drk dk egRo | D98: 1 | E98: 20 | F98: of:=[.E98]*[.D98] -> 20 | G98: 1998 | I98: of:=YEAR(TODAY())-[.G98] -> 27 | L98: 1998 | M98: fgekpy iqLrd Hk.Mkj | N98: fdrkc?kj xkW/khuxj fnYyh
A99: 2213 | B99: fpUe; ?kks"k | C99: Vhdk yxok;s | D99: 1 | E99: 10 | F99: of:=[.E99]*[.D99] -> 10 | G99: 1998 | I99: of:=YEAR(TODAY())-[.G99] -> 27 | L99: 1997 | M99: fdrkc?kj xkW/khuxj fnYyh | N99: fdrkc?kj xkW/khuxj fnYyh
A100: 2216 | B100: JhpUnz tSu | C100: Hkkjr ds o`{k | D100: 1 | E100: 12 | F100: of:=[.E100]*[.D100] -> 12 | G100: 1998 | I100: of:=YEAR(TODAY())-[.G100] -> 27 | L100: 1996 | M100: izeSójh izdk'ku | N100: fdrkc?kj xkW/khuxj fnYyh
A101: 2234 | B101: ';ke flag 'k'kh | C101: vfXu lkxj | D101: 1 | E101: 40 | F101: of:=[.E101]*[.D101] -> 40 | G101: 1999 | I101: of:=YEAR(TODAY())-[.G101] -> 26 | L101: 1997 | M101: fdrkc?kj xkW/khuxj fnYyh | N101: txrjke ,.M lUl fnYyh
A102: 2258 | B102: egsUnz oekZ | C102: izkphu Hkkjr dh okLrq dyk | D102: 1 | E102: 150 | F102: of:=[.E102]*[.D102] -> 150 | G102: 1999 | I102: of:=YEAR(TODAY())-[.G102] -> 26 | L102: 1996 | M102: vk;kZ izdk'ku fnYyh | N102: vk;Z cqd fMiks
A103: 2334 | B103: egsUnz flag ,gykor | C103: flyflyk | D103: 1 | E103: 45 | F103: of:=[.E103]*[.D103] -> 45 | G103: 1999 | I103: of:=YEAR(TODAY())-[.G103] -> 26 | L103: 1993 | M103: vk;kZ izdk'ku fnYyh | N103: Arya B. Dep. N Delhi
A104: 2387 | B104: ,u0oh0,l0fnYyh | C104: CBSE exam 1998 | D104: 1 | F104: of:=[.E104]*[.D104] -> 0 | G104: 1999 | I104: of:=YEAR(TODAY())-[.G104] -> 26 | L104: 1998 | M104: ,u0oh0,l0 y[kuÅ | N104: NVS LR Lucknow
A105: 2423 | B105: Prem barman | C105: Albert stechwetch | D105: 1 | E105: 45 | F105: of:=[.E105]*[.D105] -> 45 | G105: 1999 | I105: of:=YEAR(TODAY())-[.G105] -> 26 | L105: 1998 | M105: ,u0oh0,l0 y[kuÅ | N105: NVS LR Lucknow
A106: 2449 | B106: A.K Dutta | C106: xsEl ,.M LVwMSUVl Qkj fpYMu | D106: 1 | E106: 75 | F106: of:=[.E106]*[.D106] -> 75 | G106: 1999 | I106: of:=YEAR(TODAY())-[.G106] -> 26 | L106: 1990 | M106: ,u0oh0,l0 y[kuÅ | N106: NVS LR Lucknow
A107: 2456 | B107: , ,l diwj | C107: vkRe n'kZu 'kkgh 'kgj fnYyh | D107: 1 | E107: 25 | F107: of:=[.E107]*[.D107] -> 25 | G107: 1999 | I107: of:=YEAR(TODAY())-[.G107] -> 26 | L107: 1999 | M107: ,u0oh0,l0 y[kuÅ | N107: NVS LR Lucknow
A108: 2488 | B108: 'kkfUr flag | C108: yfyr ,dkadh | D108: 1 | E108: 50 | F108: of:=[.E108]*[.D108] -> 50 | G108: 1999 | I108: of:=YEAR(TODAY())-[.G108] -> 26 | L108: 1996 | M108: ,u0oh0,l0 y[kuÅ | N108: NVS LR Lucknow
A109: 2510 | B109: ';kepUnz diwj | C109: dFkk lfjrk lkxj dh dgkfu;ka | D109: 1 | E109: 100 | F109: of:=[.E109]*[.D109] -> 100 | G109: 1999 | I109: of:=YEAR(TODAY())-[.G109] -> 26 | L109: 1998 | M109: ,u0oh0,l0 y[kuÅ | N109: NVS LR Lucknow
A110: 2656 | B110: 'krjpUnz | C110: lfork | D110: 1 | E110: 40 | F110: of:=[.E110]*[.D110] -> 40 | G110: 1999 | I110: of:=YEAR(TODAY())-[.G110] -> 26 | L110: 1998 | M110: Sahatiya prakashan | N110: NVS lucknow
A111: 2738 | B111: Tyar Bhatt | C111: No about science innovations, coordinate Chemistry | D111: 1 | E111: of:=195+60 -> 255 | F111: of:=[.E111]*[.D111] -> 255 | G111: 2000 | I111: of:=YEAR(TODAY())-[.G111] -> 25 | L111: 1995 | M111: Dreamland prakashan delhi | N111: NVS lucknow
A112: 2771 | B112: fryd jkt 'kekZ | C112: Js"B vk/kqfud fuca/k | D112: 1 | E112: 190 | F112: of:=[.E112]*[.D112] -> 190 | G112: 2000 | I112: of:=YEAR(TODAY())-[.G112] -> 25 | L112: 1999 | M112: Arya book depot | N112: NVS lucknow
A113: 2802 | B113: vkj ds tSu | C113: lkekU; Kku | D113: 1 | E113: 195 | F113: of:=[.E113]*[.D113] -> 195 | G113: 2000 | I113: of:=YEAR(TODAY())-[.G113] -> 25 | M113: Upkar prakashan | N113: NVS lucknow
A114: 2803 | B114: Taresh D | C114: Reaching womenhood | D114: 1 | E114: 35 | F114: of:=[.E114]*[.D114] -> 35 | G114: 2000 | I114: of:=YEAR(TODAY())-[.G114] -> 25 | M114: NBT Delhi | N114: NVS lucknow
A115: 3000 | B115: Shelly batra | C115: Guide to women sexual harshment | D115: 1 | E115: 250 | F115: of:=[.E115]*[.D115] -> 250 | G115: 2001 | I115: of:=YEAR(TODAY())-[.G115] -> 24 | L115: 2000 | M115: Granth Akdhami | N115: NVS lucknow
A116: 3004 | B116: V.Arya | C116: The famous fables | D116: 1 | E116: 32 | F116: of:=[.E116]*[.D116] -> 32 | G116: 2001 | I116: of:=YEAR(TODAY())-[.G116] -> 24 | L116: 2000 | M116: Ratna Sagar | N116: NVS lucknow
A117: 3037 | B117: ,e0th0fiYyS | C117: fxQVM fpYMu ,.M MoyieSaV | D117: 1 | E117: 550 | F117: of:=[.E117]*[.D117] -> 550 | G117: 2001 | I117: of:=YEAR(TODAY())-[.G117] -> 24 | L117: 2001 | M117: Ocean book Delhi | N117: NVS lucknow
A118: 3038 | B118: ih0fl}kUr | C118: yks,LV okbYM , U;wt | D118: 1 | E118: 225 | F118: of:=[.E118]*[.D118] -> 225 | G118: 2001 | I118: of:=YEAR(TODAY())-[.G118] -> 24 | L118: 2001 | M118: R & Night Pub.Delhi | N118: NVS lucknow
A119: 3106 | B119: Rita singh | C119: Vishav ka Ithyas | D119: 1 | E119: 35 | F119: of:=[.E119]*[.D119] -> 35 | G119: 2001 | I119: of:=YEAR(TODAY())-[.G119] -> 24 | L119: 1989 | M119: S. Chand & company | N119: NVS lucknow
A120: 3116 | B120: P. Robinson | C120: Carrier in physics IIT | D120: 1 | E120: 275 | F120: of:=[.E120]*[.D120] -> 275 | G120: 2001 | I120: of:=YEAR(TODAY())-[.G120] -> 24 | L120: 2001 | M120: Tata Micro Hill | N120: JN Stationary Mart JWP
A121: 3157 | B121: Kumar & Rohit | C121: Planed Physiolgy | D121: 1 | E121: 120 | F121: of:=[.E121]*[.D121] -> 120 | G121: 2001 | I121: of:=YEAR(TODAY())-[.G121] -> 24 | L121: 2001 | M121: Orbis Jhonson | N121: JN Stationary Mart JWP
A122: 3167 | B122: P.K. Sinha | C122: Computer Fundamental | D122: 1 | E122: 99 | F122: of:=[.E122]*[.D122] -> 99 | G122: 2001 | I122: of:=YEAR(TODAY())-[.G122] -> 24 | L122: 1992 | M122: BPP | N122: Cambridge book Depot
A123: 3207 | B123: P.K Sinha | C123: Computer Fundamental | D123: 1 | E123: 99 | F123: of:=[.E123]*[.D123] -> 99 | G123: 2001 | I123: of:=YEAR(TODAY())-[.G123] -> 24 | L123: 1992 | M123: BPP | N123: BPB Publication
A124: 3225 | B124: E balaswami | C124: Object oriented programme inC++ | D124: 1 | E124: 65 | F124: of:=[.E124]*[.D124] -> 65 | G124: 2001 | I124: of:=YEAR(TODAY())-[.G124] -> 24 | L124: 2001 | M124: Tata Micro Hill | N124: Tata Micro Ltd Delhi
A125: 3227 | B125: E balaswami | C125: Object oriented programme inC++ | D125: 1 | E125: 65 | F125: of:=[.E125]*[.D125] -> 65 | G125: 2001 | I125: of:=YEAR(TODAY())-[.G125] -> 24 | L125: 2001 | M125: Tata Micro Hill | N125: Tata Micro Ltd Delhi
A126: 3237 | B126: Kal sehwareaz | C126: Microsoft exel | D126: 1 | E126: 60 | F126: of:=[.E126]*[.D126] -> 60 | G126: 2001 | I126: of:=YEAR(TODAY())-[.G126] -> 24 | L126: 1998 | M126: BPP | N126: BPB Publication
A127: 3241 | B127: Kal sehwareaz | C127: Microsoft exel | D127: 1 | E127: 60 | F127: of:=[.E127]*[.D127] -> 60 | G127: 2001 | I127: of:=YEAR(TODAY())-[.G127] -> 24 | L127: 1998 | M127: BPP | N127: BPB Publication
A128: 3242 | B128: Kal sehwareaz | C128: Microsoft exel | D128: 1 | E128: 60 | F128: of:=[.E128]*[.D128] -> 60 | G128: 2001 | I128: of:=YEAR(TODAY())-[.G128] -> 24 | L128: 1998 | M128: BPP | N128: BPB Publication
A129: 3251 | B129: Kal sehwareaz | C129: Microsoft exel | D129: 1 | E129: 60 | F129: of:=[.E129]*[.D129] -> 60 | G129: 2001 | I129: of:=YEAR(TODAY())-[.G129] -> 24 | L129: 1998 | M129: BPP | N129: BPB Publication
A130: 3331 | B130: Y & Hall | C130: Understanding Mathematics | D130: 1 | E130: 895 | F130: of:=[.E130]*[.D130] -> 895 | G130: 2002 | I130: of:=YEAR(TODAY())-[.G130] -> 23 | L130: 2002 | M130: NCERT Delhi | N130: JN stationary Mart JWP
A131: 3350 | B131: DADL | C131: robinson cruso | D131: 1 | E131: 85 | F131: of:=[.E131]*[.D131] -> 85 | G131: 2002 | I131: of:=YEAR(TODAY())-[.G131] -> 23 | L131: 2002 | M131: Oxford University | N131: JN stationary Mart JWP
A132: 3391 | B132: BS Pandit | C132: student concent dictionary | D132: 1 | E132: 250 | F132: of:=[.E132]*[.D132] -> 250 | G132: 2002 | I132: of:=YEAR(TODAY())-[.G132] -> 23 | L132: 2002 | M132: Student Book depot | N132: Prabhat Prakashan Delhi
A133: 3404 | B133: GT Glover | C133: vedic Mathematics | D133: 1 | E133: 125 | F133: of:=[.E133]*[.D133] -> 125 | G133: 2003 | I133: of:=YEAR(TODAY())-[.G133] -> 22 | L133: 2002 | M133: Moti lal Banarsi Dass Delhi | N133: NVS lucknow
A134: 3407 | B134: VS Agarwal | C134: vedic Mathematics | D134: 1 | E134: 95 | F134: of:=[.E134]*[.D134] -> 95 | G134: 2003 | I134: of:=YEAR(TODAY())-[.G134] -> 22 | L134: 2002 | M134: Moti lal Banarsi Dass Delhi | N134: NVS lucknow
A135: 3411 | B135: Misra & Misra | C135: Chemistry | D135: 1 | E135: 360 | F135: of:=[.E135]*[.D135] -> 360 | G135: 2003 | I135: of:=YEAR(TODAY())-[.G135] -> 22 | L135: 2003 | M135: Arya book Publication Delhi | N135: NVS lucknow
A136: 3434 | B136: Sarna Gupta | C136: New course sec. Mathematics | D136: 1 | E136: 110 | F136: of:=[.E136]*[.D136] -> 110 | G136: 2003 | I136: of:=YEAR(TODAY())-[.G136] -> 22 | L136: 2003 | M136: Arya book Publication Delhi | N136: NVS lucknow
A137: 3455 | B137: R Misra | C137: Chemistry | D137: 1 | E137: 68 | F137: of:=[.E137]*[.D137] -> 68 | G137: 2003 | I137: of:=YEAR(TODAY())-[.G137] -> 22 | L137: 2003 | M137: Arya book Publication Delhi | N137: NVS lucknow
A138: 3500 | B138: Honby | C138: Oxford Dictionary | D138: 1 | E138: 380 | F138: of:=[.E138]*[.D138] -> 380 | G138: 2003 | I138: of:=YEAR(TODAY())-[.G138] -> 22 | L138: 2003 | M138: Oxford University | N138: Sury enterprices Hw
A139: 3581 | B139: pj.knkl flag | C139: lEiw.kZ ukVd | D139: 1 | E139: 500 | F139: of:=[.E139]*[.D139] -> 500 | G139: 2003 | I139: of:=YEAR(TODAY())-[.G139] -> 22 | L139: 2003 | M139: Vani Prakashan | N139: Vani Prakashan
A140: 3609 | B140: jke pUnz oekZ | C140: fgUnh lkfgR; dk fodkl | D140: 1 | E140: 75 | F140: of:=[.E140]*[.D140] -> 75 | G140: 2003 | I140: of:=YEAR(TODAY())-[.G140] -> 22 | L140: 1999 | M140: Radhakrishnan | N140: Agar book Delhi
A141: 3611 | B141: dkUrk jkt | C141: }kij | D141: 1 | E141: 50 | F141: of:=[.E141]*[.D141] -> 50 | G141: 2003 | I141: of:=YEAR(TODAY())-[.G141] -> 22 | L141: 1999 | M141: Shardha Prakashn | N141: Agar book Delhi
A142: 3675 | B142: dsoykuUn | C142: ;ksxklu | D142: 1 | E142: 100 | F142: of:=[.E142]*[.D142] -> 100 | G142: 2004 | I142: of:=YEAR(TODAY())-[.G142] -> 21 | L142: 1997 | M142: kewelya Dham Lonawala | N142: Yoga Mission Lonawala
A143: 3679 | B143: gfj'pUnz 'kekZ | C143: e/;dkyhu Hkkjr | D143: 1 | E143: 80 | F143: of:=[.E143]*[.D143] -> 80 | G143: 2004 | I143: of:=YEAR(TODAY())-[.G143] -> 21 | L143: 2004 | M143: Hindi Madham | N143: Rai book depot Meerut
A144: 3683 | B144: ,l0lh0jkW; | C144: ekWMZu VkbEl | D144: 1 | E144: 95 | F144: of:=[.E144]*[.D144] -> 95 | G144: 2004 | I144: of:=YEAR(TODAY())-[.G144] -> 21 | L144: 2002 | M144: Sarswati Prakashan Delhi | N144: Rai book depot Meerut
A145: 3721 | B145: CSE | C145: Green School | D145: 1 | E145: 75 | F145: of:=[.E145]*[.D145] -> 75 | G145: 2005 | I145: of:=YEAR(TODAY())-[.G145] -> 20 | L145: 2005 | M145: CSF Delhi | N145: NVS lucknow
A146: 3759 | B146: YK Kntner | C146: let us c++ | D146: 1 | E146: 180 | F146: of:=[.E146]*[.D146] -> 180 | G146: 2005 | I146: of:=YEAR(TODAY())-[.G146] -> 20 | L146: 2004 | M146: BPB Publication | N146: Prabhat Prakashan Delhi
A147: 3789 | B147: vkj0ds0pUnz | C147: Indian artist | D147: 1 | E147: 400 | F147: of:=[.E147]*[.D147] -> 400 | G147: 2005 | I147: of:=YEAR(TODAY())-[.G147] -> 20 | L147: 2004 | M147: B M Prakashan Delhi | N147: JN stationary Mart JWP
A148: 3802 | B148: jke izlkn /;kuh | C148: Uttaratal ki khoj | D148: 1 | E148: 400 | F148: of:=[.E148]*[.D148] -> 400 | G148: 2005 | I148: of:=YEAR(TODAY())-[.G148] -> 20 | L148: 2004 | M148: Vidya Vihar Delhi | N148: M.Y Gyani Kotdwar
A149: 3807 | B149: t;loky | C149: Chemistry | D149: 1 | E149: 535 | F149: of:=[.E149]*[.D149] -> 535 | G149: 2005 | I149: of:=YEAR(TODAY())-[.G149] -> 20 | L149: 2005 | M149: Modern Publication | N149: Goyal Pustak Haridwar
A150: 3877 | B150: veZrlsu | C150: Shukantala | D150: 1 | E150: 75 | F150: of:=[.E150]*[.D150] -> 75 | G150: 2006 | I150: of:=YEAR(TODAY())-[.G150] -> 19 | L150: 2004 | M150: Paying wing delhi | N150: Cambrage book depot
A151: 3899 | B151: Oxford University | C151: Oxford Essential Eng.Hindi Dis | D151: 1 | E151: 110 | F151: of:=[.E151]*[.D151] -> 110 | G151: 2006 | I151: of:=YEAR(TODAY())-[.G151] -> 19 | L151: 2006 | M151: Oxford University Delhi | N151: NVS LR lucknow
A152: 3947 | B152: Asha Gupta | C152: Mopasa ki Unthi kahaniya | D152: 1 | E152: 200 | F152: of:=[.E152]*[.D152] -> 200 | G152: 2006 | I152: of:=YEAR(TODAY())-[.G152] -> 19 | L152: 2006 | M152: Sahitya ka Itihas Delhi | N152: NVS LR lucknow
A153: 4003 | B153: AS Honby | C153: New oxford learner dictionary | D153: 1 | E153: 599 | F153: of:=[.E153]*[.D153] -> 599 | G153: 2006 | I153: of:=YEAR(TODAY())-[.G153] -> 19 | L153: 2006 | M153: Oxford University Delhi | N153: NVS LR lucknow
A154: 4054 | B154: Micle Ashbhy | C154: oxford learner student dictionary | D154: 1 | E154: 165 | F154: of:=[.E154]*[.D154] -> 165 | G154: 2006 | I154: of:=YEAR(TODAY())-[.G154] -> 19 | L154: 2006 | M154: Oxford University Delhi | N154: NVS LR lucknow
A155: 4055 | B155: Micle Ashbhy | C155: oxford learner student dictionary | D155: 1 | E155: 165 | F155: of:=[.E155]*[.D155] -> 165 | G155: 2006 | I155: of:=YEAR(TODAY())-[.G155] -> 19 | L155: 2006 | M155: Oxford University Delhi | N155: NVS LR lucknow
A156: 4063 | B156: Micle Ashbhy | C156: oxford learner student dictionary | D156: 1 | E156: 165 | F156: of:=[.E156]*[.D156] -> 165 | G156: 2006 | I156: of:=YEAR(TODAY())-[.G156] -> 19 | L156: 2006 | M156: Oxford University Delhi | N156: NVS LR lucknow
A157: 4070 | B157: Oxford University | C157: Cambridge learner dictionary | D157: 1 | E157: 195 | F157: of:=[.E157]*[.D157] -> 195 | G157: 2006 | I157: of:=YEAR(TODAY())-[.G157] -> 19 | L157: 2006 | M157: Oxford University Delhi | N157: NVS LR lucknow
A158: 4072 | B158: Oxford University | C158: Cambridge learner dictionary | D158: 1 | E158: 195 | F158: of:=[.E158]*[.D158] -> 195 | G158: 2006 | I158: of:=YEAR(TODAY())-[.G158] -> 19 | L158: 2006 | M158: Oxford University Delhi | N158: NVS LR lucknow
A159: 4073 | B159: Oxford University | C159: Cambridge learner dictionary | D159: 1 | E159: 195 | F159: of:=[.E159]*[.D159] -> 195 | G159: 2006 | I159: of:=YEAR(TODAY())-[.G159] -> 19 | L159: 2006 | M159: Oxford University Delhi | N159: NVS LR lucknow
A160: 4087 | B160: Lal & Jain | C160: NVS entrance digest | D160: 1 | E160: 70 | F160: of:=[.E160]*[.D160] -> 70 | G160: 2006 | I160: of:=YEAR(TODAY())-[.G160] -> 19 | L160: 2006 | M160: Upkar Prakshan Agra | N160: NVS LR lucknow
A161: 4093 | B161: BS Behel | C161: Elements of Physical chemistry | D161: 1 | E161: 350 | F161: of:=[.E161]*[.D161] -> 350 | G161: 2006 | I161: of:=YEAR(TODAY())-[.G161] -> 19 | L161: 2007 | M161: S.Chan & Co. Ram Nagar Delhi | N161: S.Chand DDN
A162: 4148 | B162: Vibha Gupta | C162: carrer pathway | D162: 1 | E162: 480 | F162: of:=[.E162]*[.D162] -> 480 | G162: 2006 | I162: of:=YEAR(TODAY())-[.G162] -> 19 | L162: 2006 | M162: Tata Micro Hill Prakshan Delhi | N162: Hansa Stationer JWP
A163: 4160 | B163: Shiv Khera | C163: You can win | D163: 1 | E163: 225 | F163: of:=[.E163]*[.D163] -> 225 | G163: 2007 | I163: of:=YEAR(TODAY())-[.G163] -> 18 | L163: 2004 | M163: Mac Millon India Hydrabad | N163: Rawat Jawalapur Haridwaar
A164: 4276 | B164: M Thomas | C164: Effective teaching in school | D164: 1 | E164: 160 | F164: of:=[.E164]*[.D164] -> 160 | G164: 2008 | I164: of:=YEAR(TODAY())-[.G164] -> 17 | L164: 2008 | M164: S.chand & company Delhi | N164: S.Chand DDN
A165: 4311 | B165: Hill | C165: Speaking course | D165: 1 | E165: 125 | F165: of:=[.E165]*[.D165] -> 125 | G165: 2008 | I165: of:=YEAR(TODAY())-[.G165] -> 17 | L165: 2008 | M165: Oxford University Delhi | N165: NVS LR lucknow
A166: 4323 | B166: SAD | C166: Jeet aap ki | D166: 1 | E166: 200 | F166: of:=[.E166]*[.D166] -> 200 | G166: 2008 | I166: of:=YEAR(TODAY())-[.G166] -> 17 | L166: 2006 | M166: Meckmillon Delhi | N166: Oswal book agra
A167: 4453 | B167: PK Mehta | C167: Principle of Biology | D167: 1 | E167: 510 | F167: of:=[.E167]*[.D167] -> 510 | G167: 2009 | I167: of:=YEAR(TODAY())-[.G167] -> 16 | L167: 2008 | M167: S Chandra & company Delhi | N167: S.Chand DDN
A168: 4466 | B168: JC Agarwal | C168: Nano Technology | D168: 1 | E168: 150 | F168: of:=[.E168]*[.D168] -> 150 | G168: 2009 | I168: of:=YEAR(TODAY())-[.G168] -> 16 | L168: 2009 | M168: S Chandra & company Delhi | N168: S.Chand DDN
A169: 4481 | B169: NK Choudhary | C169: Socal science 9 | D169: 1 | E169: 115 | F169: of:=[.E169]*[.D169] -> 115 | G169: 2009 | I169: of:=YEAR(TODAY())-[.G169] -> 16 | L169: 2009 | M169: S Chandra & company Delhi | N169: S.Chand DDN
A170: 4494 | B170: Vipin chandra | C170: Hindi kendrik 12 | D170: 1 | E170: 240 | F170: of:=[.E170]*[.D170] -> 240 | G170: 2009 | I170: of:=YEAR(TODAY())-[.G170] -> 16 | L170: 2009 | M170: Rachana Sagar Delhi | N170: NVS LR lucknow
A171: 4501 | B171: ';kelqUnj 'kekZ | C171: 51 vigyan model | D171: 1 | E171: 150 | F171: of:=[.E171]*[.D171] -> 150 | G171: 2010 | I171: of:=YEAR(TODAY())-[.G171] -> 15 | L171: 2009 | M171: Vidya Vihar Delhi | N171: Diamond Stationary JWP
A172: 4556 | B172: lqjsUnz dqekj | C172: Vastu chitran | D172: 1 | E172: 38 | F172: of:=[.E172]*[.D172] -> 38 | G172: 2010 | I172: of:=YEAR(TODAY())-[.G172] -> 15 | L172: 2009 | M172: Anupam Prakashan India | N172: Diamond Stationary JWP
A173: 4565 | B173: Asha Purna | C173: Fabric paintings | D173: 1 | E173: 80 | F173: of:=[.E173]*[.D173] -> 80 | G173: 2010 | I173: of:=YEAR(TODAY())-[.G173] -> 15 | L173: 2009 | M173: Asha Pura Publication | N173: Diamond Stationary JWP
A174: 4629 | B174: RP rana | C174: Physics class 7 | D174: 1 | E174: 140 | F174: of:=[.E174]*[.D174] -> 140 | G174: 2010 | I174: of:=YEAR(TODAY())-[.G174] -> 15 | L174: 2009 | M174: S Chandra & company Delhi | N174: S.Chand DDN
A175: 4630 | B175: RP rana | C175: Physics class 8 | D175: 1 | E175: 150 | F175: of:=[.E175]*[.D175] -> 150 | G175: 2010 | I175: of:=YEAR(TODAY())-[.G175] -> 15 | L175: 2010 | M175: S Chandra & company Delhi | N175: S.Chand DDN
A176: 4633 | B176: RP rana | C176: Chemistry 8 | D176: 1 | E176: 150 | F176: of:=[.E176]*[.D176] -> 150 | G176: 2010 | I176: of:=YEAR(TODAY())-[.G176] -> 15 | L176: 2010 | M176: S Chandra & company Delhi | N176: S.Chand DDN
A177: 4656 | B177: D Mehra | C177: computer science 12 | D177: 1 | E177: 240 | F177: of:=[.E177]*[.D177] -> 240 | G177: 2010 | I177: of:=YEAR(TODAY())-[.G177] -> 15 | L177: 2010 | M177: S Chandra & company Delhi | N177: S.Chand DDN
A178: 4676 | B178: Jack Kaligan | C178: Atlas of the space | D178: 1 | E178: 149 | F178: of:=[.E178]*[.D178] -> 149 | G178: 2010 | I178: of:=YEAR(TODAY())-[.G178] -> 15 | L178: 2010 | M178: S Chandra & company Delhi | N178: S.Chand DDN
A179: 4750 | B179: B Serli | C179: Heat & energy | D179: 1 | E179: 119 | F179: of:=[.E179]*[.D179] -> 119 | G179: 2010 | I179: of:=YEAR(TODAY())-[.G179] -> 15 | L179: 2010 | M179: S Chandra & company Delhi | N179: S.Chand DDN
A180: 4752 | B180: Jim Green | C180: Green revolution | D180: 1 | E180: 119 | F180: of:=[.E180]*[.D180] -> 119 | G180: 2010 | I180: of:=YEAR(TODAY())-[.G180] -> 15 | L180: 2010 | M180: S Chandra & company Delhi | N180: S.Chand DDN
A181: 4769 | B181: Johan Richord | C181: Skin hair hygenie | D181: 1 | E181: 99 | F181: of:=[.E181]*[.D181] -> 99 | G181: 2010 | I181: of:=YEAR(TODAY())-[.G181] -> 15 | L181: 2010 | M181: S Chandra & company Delhi | N181: S.Chand DDN
A182: 4779 | B182: Jhon Green | C182: Cell | D182: 1 | E182: 99 | F182: of:=[.E182]*[.D182] -> 99 | G182: 2010 | I182: of:=YEAR(TODAY())-[.G182] -> 15 | L182: 2010 | M182: S Chandra & company Delhi | N182: S.Chand DDN
A183: 4789 | B183: K Viseman | C183: Practice of coperation | D183: 1 | E183: 60 | F183: of:=[.E183]*[.D183] -> 60 | G183: 2010 | I183: of:=YEAR(TODAY())-[.G183] -> 15 | L183: 2010 | M183: S Chandra & company Delhi | N183: S.Chand DDN
A184: 4896 | B184: Anil Kumar | C184: Success is non ending | D184: 1 | E184: 130 | F184: of:=[.E184]*[.D184] -> 130 | G184: 2011 | I184: of:=YEAR(TODAY())-[.G184] -> 14 | L184: 2011 | M184: Kku xaxk izdk'ku fnYyh | N184: NVS LR lucknow
A185: 4961 | B185: H walic | C185: The Time machine | D185: 1 | E185: 92 | F185: of:=[.E185]*[.D185] -> 92 | G185: 2011 | I185: of:=YEAR(TODAY())-[.G185] -> 14 | L185: 2010 | M185: lj.k cqd fMiks fnYyh | N185: NVS LR lucknow
A186: 4985 | B186: V karant | C186: I can I will | D186: 1 | E186: 92 | F186: of:=[.E186]*[.D186] -> 92 | G186: 2011 | I186: of:=YEAR(TODAY())-[.G186] -> 14 | L186: 2011 | M186: Mack Millon Publisher | N186: NVS LR lucknow
A187: 5022 | B187: Jain Mathur | C187: Adunik vishav ka ithyas | D187: 1 | E187: 920 | F187: of:=[.E187]*[.D187] -> 920 | G187: 2011 | I187: of:=YEAR(TODAY())-[.G187] -> 14 | L187: 2011 | M187: Jain Prakashan Mandir Jaipur | N187: Jain Prakashan Mandir
A188: 5023 | B188: Jain Mathur | C188: Adunik vishav ka ithyas | D188: 1 | F188: of:=[.E188]*[.D188] -> 0 | G188: 2011 | I188: of:=YEAR(TODAY())-[.G188] -> 14 | L188: 2011 | M188: Jain Prakashan Mandir Jaipur | N188: Jain Prakashan Mandir
A189: 5151 | B189: Manorma Dewan | C189: Divar b anya kahaniya | D189: 1 | E189: 40 | F189: of:=[.E189]*[.D189] -> 40 | G189: 2011 | I189: of:=YEAR(TODAY())-[.G189] -> 14 | L189: 2011 | M189: NBT Delhi | N189: NBT Delhi
A190: 5228 | B190: Ahasan Ali | C190: Sahid Abdul Hamid | D190: 1 | E190: 40 | F190: of:=[.E190]*[.D190] -> 40 | G190: 2011 | I190: of:=YEAR(TODAY())-[.G190] -> 14 | L190: 2011 | M190: NBT Delhi | N190: NBT Delhi
A191: 5307 | B191: Dream Tara | C191: Paper flowers | D191: 1 | E191: 150 | F191: of:=[.E191]*[.D191] -> 150 | G191: 2012 | I191: of:=YEAR(TODAY())-[.G191] -> 13 | L191: 2012 | M191: Sadna publishr Delhi | N191: Sadna publishr Delhi
A192: 5308 | B192: Dream Tara | C192: Stone in art | D192: 1 | E192: 150 | F192: of:=[.E192]*[.D192] -> 150 | G192: 2012 | I192: of:=YEAR(TODAY())-[.G192] -> 13 | L192: 2012 | M192: Sadna publishr Delhi | N192: Sadna publishr Delhi
A193: 5333 | B193: J Ramesh | C193: strenth of postive thinking | D193: 1 | E193: 300 | F193: of:=[.E193]*[.D193] -> 300 | G193: 2012 | I193: of:=YEAR(TODAY())-[.G193] -> 13 | L193: 2012 | M193: Knowledge Prakashan Delhi | N193: RO Lucknow
A194: 5343 | B194: Chartarjee | C194: Media studies | D194: 1 | E194: 425 | F194: of:=[.E194]*[.D194] -> 425 | G194: 2012 | I194: of:=YEAR(TODAY())-[.G194] -> 13 | L194: 2012 | M194: Meena prakashn | N194: RO Lucknow
A195: 5393 | B195: CK Pathak | C195: Media communication | D195: 1 | E195: 450 | F195: of:=[.E195]*[.D195] -> 450 | G195: 2012 | I195: of:=YEAR(TODAY())-[.G195] -> 13 | L195: 2011 | M195: Meena prakashn | N195: RO Lucknow
A196: 5399 | B196: Pavitra Kumar sharma | C196: Vivharik manovigyan | D196: 1 | E196: 200 | F196: of:=[.E196]*[.D196] -> 200 | G196: 2012 | I196: of:=YEAR(TODAY())-[.G196] -> 13 | L196: 2012 | M196: Ocien book private limited | N196: RO Lucknow
A197: 5506 | B197: Sham Sundar Sharma | C197: Bukamp | D197: 1 | E197: 200 | F197: of:=[.E197]*[.D197] -> 200 | G197: 2012 | I197: of:=YEAR(TODAY())-[.G197] -> 13 | L197: 2012 | M197: Gyan ganga delhi | N197: RO Lucknow
A198: 5595 | B198: VL Gupta | C198: 13 Micro ecomomics | D198: 1 | E198: 300 | F198: of:=[.E198]*[.D198] -> 300 | G198: 2012 | I198: of:=YEAR(TODAY())-[.G198] -> 13 | L198: 2012 | M198: Arya Publication | N198: RO Lucknow
A199: 5614 | B199: Amar chitra katha | C199: Praldah | D199: 1 | E199: 50 | F199: of:=[.E199]*[.D199] -> 50 | G199: 2012 | I199: of:=YEAR(TODAY())-[.G199] -> 13 | L199: 2012 | M199: Amar chitr katha Prakashan | N199: Creating India foundation
A200: 5615 | B200: Amar chitra katha | C200: Rani Durga vati | D200: 1 | E200: 50 | F200: of:=[.E200]*[.D200] -> 50 | G200: 2012 | I200: of:=YEAR(TODAY())-[.G200] -> 13 | L200: 2012 | M200: Amar chitr katha Prakashan | N200: Creating India foundation
A201: 5616 | B201: Amar chitra katha | C201: Krishan | D201: 1 | E201: 50 | F201: of:=[.E201]*[.D201] -> 50 | G201: 2012 | I201: of:=YEAR(TODAY())-[.G201] -> 13 | L201: 2012 | M201: Amar chitr katha Prakashan | N201: Creating India foundation
A202: 5617 | B202: Amar chitra katha | C202: Anirudha | D202: 1 | E202: 40 | F202: of:=[.E202]*[.D202] -> 40 | G202: 2012 | I202: of:=YEAR(TODAY())-[.G202] -> 13 | L202: 2012 | M202: Amar chitr katha Prakashan | N202: Creating India foundation
A203: 5618 | B203: Amar chitra katha | C203: Basan sena | D203: 1 | E203: 40 | F203: of:=[.E203]*[.D203] -> 40 | G203: 2012 | I203: of:=YEAR(TODAY())-[.G203] -> 13 | L203: 2012 | M203: Amar chitr katha Prakashan | N203: Creating India foundation
A204: 5619 | B204: Amar chitra katha | C204: Udhyan | D204: 1 | E204: 40 | F204: of:=[.E204]*[.D204] -> 40 | G204: 2012 | I204: of:=YEAR(TODAY())-[.G204] -> 13 | L204: 2012 | M204: Amar chitr katha Prakashan | N204: Creating India foundation
A205: 5620 | B205: Amar chitra katha | C205: Prithvi raj chauhan | D205: 1 | E205: 40 | F205: of:=[.E205]*[.D205] -> 40 | G205: 2012 | I205: of:=YEAR(TODAY())-[.G205] -> 13 | L205: 2012 | M205: Amar chitr katha Prakashan | N205: Creating India foundation
A206: 5621 | B206: Amar chitra katha | C206: Pictorial stories for children | D206: 1 | E206: 35 | F206: of:=[.E206]*[.D206] -> 35 | G206: 2012 | I206: of:=YEAR(TODAY())-[.G206] -> 13 | L206: 2012 | M206: Amar chitr katha Prakashan | N206: Creating India foundation
A207: 5626 | B207: Amar chitra katha | C207: Pictorial stories for children | D207: 1 | E207: 35 | F207: of:=[.E207]*[.D207] -> 35 | G207: 2012 | I207: of:=YEAR(TODAY())-[.G207] -> 13 | L207: 2012 | M207: Amar chitr katha Prakashan | N207: Creating India foundation
A208: 5628 | B208: Amar chitra katha | C208: Kartiken | D208: 1 | E208: 40 | F208: of:=[.E208]*[.D208] -> 40 | G208: 2012 | I208: of:=YEAR(TODAY())-[.G208] -> 13 | L208: 2012 | M208: Amar chitr katha Prakashan | N208: Creating India foundation
A209: 5629 | B209: Amar chitra katha | C209: Krishna | D209: 1 | E209: 40 | F209: of:=[.E209]*[.D209] -> 40 | G209: 2012 | I209: of:=YEAR(TODAY())-[.G209] -> 13 | L209: 2012 | M209: Amar chitr katha Prakashan | N209: Creating India foundation
A210: 5630 | B210: Amar chitra katha | C210: Chandra gupt morya | D210: 1 | E210: 40 | F210: of:=[.E210]*[.D210] -> 40 | G210: 2012 | I210: of:=YEAR(TODAY())-[.G210] -> 13 | L210: 2012 | M210: Amar chitr katha Prakashan | N210: Creating India foundation
A211: 5631 | B211: Amar chitra katha | C211: Krishan shishupal | D211: 1 | E211: 40 | F211: of:=[.E211]*[.D211] -> 40 | G211: 2012 | I211: of:=YEAR(TODAY())-[.G211] -> 13 | L211: 2012 | M211: Amar chitr katha Prakashan | N211: Creating India foundation
A212: 5632 | B212: Amar chitra katha | C212: Prithvi raj chauhan | D212: 1 | E212: 40 | F212: of:=[.E212]*[.D212] -> 40 | G212: 2012 | I212: of:=YEAR(TODAY())-[.G212] -> 13 | L212: 2012 | M212: Amar chitr katha Prakashan | N212: Creating India foundation
A213: 5633 | B213: Amar chitra katha | C213: Krishan dev ray | D213: 1 | E213: 40 | F213: of:=[.E213]*[.D213] -> 40 | G213: 2012 | I213: of:=YEAR(TODAY())-[.G213] -> 13 | L213: 2012 | M213: Amar chitr katha Prakashan | N213: Creating India foundation
A214: 5634 | B214: Amar chitra katha | C214: Ram Krishan | D214: 1 | E214: 40 | F214: of:=[.E214]*[.D214] -> 40 | G214: 2012 | I214: of:=YEAR(TODAY())-[.G214] -> 13 | L214: 2012 | M214: Amar chitr katha Prakashan | N214: Creating India foundation
A215: 5636 | B215: Amar chitra katha | C215: Hanuman | D215: 1 | E215: 40 | F215: of:=[.E215]*[.D215] -> 40 | G215: 2012 | I215: of:=YEAR(TODAY())-[.G215] -> 13 | L215: 2012 | M215: Amar chitr katha Prakashan | N215: Creating India foundation
A216: 5638 | B216: Amar chitra katha | C216: Krishana Narasukh | D216: 1 | E216: 40 | F216: of:=[.E216]*[.D216] -> 40 | G216: 2012 | I216: of:=YEAR(TODAY())-[.G216] -> 13 | L216: 2012 | M216: Amar chitr katha Prakashan | N216: Creating India foundation
A217: 5640 | B217: Amar chitra katha | C217: Raja Boj | D217: 1 | E217: 40 | F217: of:=[.E217]*[.D217] -> 40 | G217: 2012 | I217: of:=YEAR(TODAY())-[.G217] -> 13 | L217: 2012 | M217: Amar chitr katha Prakashan | N217: Creating India foundation
A218: 5643 | B218: Amar chitra katha | C218: crow & owl | D218: 1 | E218: 40 | F218: of:=[.E218]*[.D218] -> 40 | G218: 2012 | I218: of:=YEAR(TODAY())-[.G218] -> 13 | L218: 2012 | M218: Amar chitr katha Prakashan | N218: Creating India foundation
A219: 5644 | B219: Amar chitra katha | C219: Vasav dutta | D219: 1 | E219: 40 | F219: of:=[.E219]*[.D219] -> 40 | G219: 2012 | I219: of:=YEAR(TODAY())-[.G219] -> 13 | L219: 2012 | M219: Amar chitr katha Prakashan | N219: Creating India foundation
A220: 5645 | B220: Amar chitra katha | C220: Vidya sagar | D220: 1 | E220: 40 | F220: of:=[.E220]*[.D220] -> 40 | G220: 2012 | I220: of:=YEAR(TODAY())-[.G220] -> 13 | L220: 2012 | M220: Amar chitr katha Prakashan | N220: Creating India foundation
A221: 5646 | B221: Amar chitra katha | C221: Vikrma ditya | D221: 1 | E221: 40 | F221: of:=[.E221]*[.D221] -> 40 | G221: 2012 | I221: of:=YEAR(TODAY())-[.G221] -> 13 | L221: 2012 | M221: Amar chitr katha Prakashan | N221: Creating India foundation
A222: 5648 | B222: Amar chitra katha | C222: Tales of rama | D222: 1 | E222: 40 | F222: of:=[.E222]*[.D222] -> 40 | G222: 2012 | I222: of:=YEAR(TODAY())-[.G222] -> 13 | L222: 2012 | M222: Amar chitr katha Prakashan | N222: Creating India foundation
A223: 5649 | B223: Amar chitra katha | C223: tales of Upnishad | D223: 1 | E223: 40 | F223: of:=[.E223]*[.D223] -> 40 | G223: 2012 | I223: of:=YEAR(TODAY())-[.G223] -> 13 | L223: 2012 | M223: Amar chitr katha Prakashan | N223: Creating India foundation
A224: 5651 | B224: Amar chitra katha | C224: Jagdish chandra vasu | D224: 1 | E224: 40 | F224: of:=[.E224]*[.D224] -> 40 | G224: 2012 | I224: of:=YEAR(TODAY())-[.G224] -> 13 | L224: 2012 | M224: Amar chitr katha Prakashan | N224: Creating India foundation
A225: 5652 | B225: Amar chitra katha | C225: Panna Harirani | D225: 1 | E225: 40 | F225: of:=[.E225]*[.D225] -> 40 | G225: 2012 | I225: of:=YEAR(TODAY())-[.G225] -> 13 | L225: 2012 | M225: Amar chitr katha Prakashan | N225: Creating India foundation
A226: 5654 | B226: Amar chitra katha | C226: shiv parwati | D226: 1 | E226: 50 | F226: of:=[.E226]*[.D226] -> 50 | G226: 2012 | I226: of:=YEAR(TODAY())-[.G226] -> 13 | L226: 2012 | M226: Amar chitr katha Prakashan | N226: Creating India foundation
A227: 5655 | B227: Amar chitra katha | C227: Rama | D227: 1 | E227: 50 | F227: of:=[.E227]*[.D227] -> 50 | G227: 2012 | I227: of:=YEAR(TODAY())-[.G227] -> 13 | L227: 2012 | M227: Amar chitr katha Prakashan | N227: Creating India foundation
A228: 5660 | B228: Amar chitra katha | C228: Bajiraw | D228: 1 | E228: 50 | F228: of:=[.E228]*[.D228] -> 50 | G228: 2012 | I228: of:=YEAR(TODAY())-[.G228] -> 13 | L228: 2012 | M228: Amar chitr katha Prakashan | N228: Creating India foundation
A229: 5661 | B229: Amar chitra katha | C229: Nirsima | D229: 1 | E229: 50 | F229: of:=[.E229]*[.D229] -> 50 | G229: 2012 | I229: of:=YEAR(TODAY())-[.G229] -> 13 | L229: 2012 | M229: Amar chitr katha Prakashan | N229: Creating India foundation
A230: 5662 | B230: Amar chitra katha | C230: Dhronha | D230: 1 | E230: 50 | F230: of:=[.E230]*[.D230] -> 50 | G230: 2012 | I230: of:=YEAR(TODAY())-[.G230] -> 13 | L230: 2012 | M230: Amar chitr katha Prakashan | N230: Creating India foundation
A231: 5666 | B231: Amar chitra katha | C231: Rama nath Tenali | D231: 1 | E231: 50 | F231: of:=[.E231]*[.D231] -> 50 | G231: 2012 | I231: of:=YEAR(TODAY())-[.G231] -> 13 | L231: 2012 | M231: Amar chitr katha Prakashan | N231: Creating India foundation
A232: 5668 | B232: Amar chitra katha | C232: Kacha Divyani | D232: 1 | E232: 50 | F232: of:=[.E232]*[.D232] -> 50 | G232: 2012 | I232: of:=YEAR(TODAY())-[.G232] -> 13 | L232: 2012 | M232: Amar chitr katha Prakashan | N232: Creating India foundation
A233: 5670 | B233: Amar chitra katha | C233: Man ki stories | D233: 1 | E233: 50 | F233: of:=[.E233]*[.D233] -> 50 | G233: 2012 | I233: of:=YEAR(TODAY())-[.G233] -> 13 | L233: 2012 | M233: Amar chitr katha Prakashan | N233: Creating India foundation
A234: 5671 | B234: Amar chitra katha | C234: Pictorial story of children | D234: 1 | E234: 20 | F234: of:=[.E234]*[.D234] -> 20 | G234: 2012 | I234: of:=YEAR(TODAY())-[.G234] -> 13 | L234: 2012 | M234: Amar chitr katha Prakashan | N234: Creating India foundation
A235: 5672 | B235: Amar chitra katha | C235: Pictorial story of children | D235: 1 | E235: 20 | F235: of:=[.E235]*[.D235] -> 20 | G235: 2012 | I235: of:=YEAR(TODAY())-[.G235] -> 13 | L235: 2012 | M235: Amar chitr katha Prakashan | N235: Creating India foundation
A236: 5673 | B236: Amar chitra katha | C236: Pictorial story of children | D236: 1 | E236: 20 | F236: of:=[.E236]*[.D236] -> 20 | G236: 2012 | I236: of:=YEAR(TODAY())-[.G236] -> 13 | L236: 2012 | M236: Amar chitr katha Prakashan | N236: Creating India foundation
A237: 5674 | B237: Amar chitra katha | C237: Pictorial story of children | D237: 1 | E237: 20 | F237: of:=[.E237]*[.D237] -> 20 | G237: 2012 | I237: of:=YEAR(TODAY())-[.G237] -> 13 | L237: 2012 | M237: Amar chitr katha Prakashan | N237: Creating India foundation
A238: 5675 | B238: Amar chitra katha | C238: Pictorial story of children | D238: 1 | E238: 20 | F238: of:=[.E238]*[.D238] -> 20 | G238: 2012 | I238: of:=YEAR(TODAY())-[.G238] -> 13 | L238: 2012 | M238: Amar chitr katha Prakashan | N238: Creating India foundation
A239: 5676 | B239: Amar chitra katha | C239: Pictorial story of children | D239: 1 | E239: 20 | F239: of:=[.E239]*[.D239] -> 20 | G239: 2012 | I239: of:=YEAR(TODAY())-[.G239] -> 13 | L239: 2012 | M239: Amar chitr katha Prakashan | N239: Creating India foundation
A240: 5693 | B240: Amar chitra katha | C240: Viveka nand | D240: 1 | E240: 5 | F240: of:=[.E240]*[.D240] -> 5 | G240: 2012 | I240: of:=YEAR(TODAY())-[.G240] -> 13 | L240: 2012 | M240: Amar chitr katha Prakashan | N240: Creating India foundation
A241: 5695 | B241: Amar chitra katha | C241: Prophit Mohmad | D241: 1 | E241: 5 | F241: of:=[.E241]*[.D241] -> 5 | G241: 2012 | I241: of:=YEAR(TODAY())-[.G241] -> 13 | L241: 2012 | M241: Amar chitr katha Prakashan | N241: Creating India foundation
A242: 5696 | B242: Amar chitra katha | C242: Holy mother | D242: 1 | E242: 5 | F242: of:=[.E242]*[.D242] -> 5 | G242: 2012 | I242: of:=YEAR(TODAY())-[.G242] -> 13 | L242: 2012 | M242: Amar chitr katha Prakashan | N242: Creating India foundation
A243: 5697 | B243: Amar chitra katha | C243: Sh rama | D243: 1 | E243: 5 | F243: of:=[.E243]*[.D243] -> 5 | G243: 2012 | I243: of:=YEAR(TODAY())-[.G243] -> 13 | L243: 2012 | M243: Amar chitr katha Prakashan | N243: Creating India foundation
A244: 5698 | B244: Amar chitra katha | C244: Shri Ram Krishan | D244: 1 | E244: 5 | F244: of:=[.E244]*[.D244] -> 5 | G244: 2012 | I244: of:=YEAR(TODAY())-[.G244] -> 13 | L244: 2012 | M244: Amar chitr katha Prakashan | N244: Creating India foundation
A245: 5699 | B245: Amar chitra katha | C245: Guru nanak | D245: 1 | E245: 5 | F245: of:=[.E245]*[.D245] -> 5 | G245: 2012 | I245: of:=YEAR(TODAY())-[.G245] -> 13 | L245: 2012 | M245: Amar chitr katha Prakashan | N245: Creating India foundation
A246: 5700 | B246: Amar chitra katha | C246: Jathustra | D246: 1 | E246: 5 | F246: of:=[.E246]*[.D246] -> 5 | G246: 2012 | I246: of:=YEAR(TODAY())-[.G246] -> 13 | L246: 2012 | M246: Amar chitr katha Prakashan | N246: Creating India foundation
A247: 5701 | B247: Amar chitra katha | C247: Budda | D247: 1 | E247: 5 | F247: of:=[.E247]*[.D247] -> 5 | G247: 2012 | I247: of:=YEAR(TODAY())-[.G247] -> 13 | L247: 2012 | M247: Amar chitr katha Prakashan | N247: Creating India foundation
A248: 5716 | B248: Amar chitra katha | C248: Ganesha | D248: 1 | E248: 50 | F248: of:=[.E248]*[.D248] -> 50 | G248: 2012 | I248: of:=YEAR(TODAY())-[.G248] -> 13 | L248: 2012 | M248: Amar chitr katha Prakashan | N248: Creating India foundation
A249: 5717 | B249: Amar chitra katha | C249: Birbal | D249: 1 | E249: 50 | F249: of:=[.E249]*[.D249] -> 50 | G249: 2012 | I249: of:=YEAR(TODAY())-[.G249] -> 13 | L249: 2012 | M249: Amar chitr katha Prakashan | N249: Creating India foundation
A250: 5719 | B250: Amar chitra katha | C250: Krishna Rukmani | D250: 1 | E250: 50 | F250: of:=[.E250]*[.D250] -> 50 | G250: 2012 | I250: of:=YEAR(TODAY())-[.G250] -> 13 | L250: 2012 | M250: Amar chitr katha Prakashan | N250: Creating India foundation
A251: 5720 | B251: Amar chitra katha | C251: surya | D251: 1 | E251: 50 | F251: of:=[.E251]*[.D251] -> 50 | G251: 2012 | I251: of:=YEAR(TODAY())-[.G251] -> 13 | L251: 2012 | M251: Amar chitr katha Prakashan | N251: Creating India foundation
A252: 5721 | B252: Amar chitra katha | C252: shiva Jee | D252: 1 | E252: 50 | F252: of:=[.E252]*[.D252] -> 50 | G252: 2012 | I252: of:=YEAR(TODAY())-[.G252] -> 13 | L252: 2012 | M252: Amar chitr katha Prakashan | N252: Creating India foundation
A253: 5722 | B253: Amar chitra katha | C253: Magic chant | D253: 1 | E253: 50 | F253: of:=[.E253]*[.D253] -> 50 | G253: 2012 | I253: of:=YEAR(TODAY())-[.G253] -> 13 | L253: 2012 | M253: Amar chitr katha Prakashan | N253: Creating India foundation
A254: 5723 | B254: Amar chitra katha | C254: Jackle | D254: 1 | E254: 50 | F254: of:=[.E254]*[.D254] -> 50 | G254: 2012 | I254: of:=YEAR(TODAY())-[.G254] -> 13 | L254: 2012 | M254: Amar chitr katha Prakashan | N254: Creating India foundation
A255: 5725 | B255: Amar chitra katha | C255: bhagat singh | D255: 1 | E255: 50 | F255: of:=[.E255]*[.D255] -> 50 | G255: 2012 | I255: of:=YEAR(TODAY())-[.G255] -> 13 | L255: 2012 | M255: Amar chitr katha Prakashan | N255: Creating India foundation
A256: 5727 | B256: Amar chitra katha | C256: Vishvamitra | D256: 1 | E256: 50 | F256: of:=[.E256]*[.D256] -> 50 | G256: 2012 | I256: of:=YEAR(TODAY())-[.G256] -> 13 | L256: 2012 | M256: Amar chitr katha Prakashan | N256: Creating India foundation
A257: 5728 | B257: Amar chitra katha | C257: Viveka nand | D257: 1 | E257: 50 | F257: of:=[.E257]*[.D257] -> 50 | G257: 2012 | I257: of:=YEAR(TODAY())-[.G257] -> 13 | L257: 2012 | M257: Amar chitr katha Prakashan | N257: Creating India foundation
A258: 5729 | B258: Amar chitra katha | C258: Choose of friends | D258: 1 | E258: 50 | F258: of:=[.E258]*[.D258] -> 50 | G258: 2012 | I258: of:=YEAR(TODAY())-[.G258] -> 13 | L258: 2012 | M258: Amar chitr katha Prakashan | N258: Creating India foundation
A259: 5730 | B259: Amar chitra katha | C259: Tales of shiva | D259: 1 | E259: 50 | F259: of:=[.E259]*[.D259] -> 50 | G259: 2012 | I259: of:=YEAR(TODAY())-[.G259] -> 13 | L259: 2012 | M259: Amar chitr katha Prakashan | N259: Creating India foundation
A260: 5732 | B260: Amar chitra katha | C260: Ganga | D260: 1 | E260: 50 | F260: of:=[.E260]*[.D260] -> 50 | G260: 2012 | I260: of:=YEAR(TODAY())-[.G260] -> 13 | L260: 2012 | M260: Amar chitr katha Prakashan | N260: Creating India foundation
A261: 5733 | B261: Amar chitra katha | C261: Tales of Narad | D261: 1 | E261: 50 | F261: of:=[.E261]*[.D261] -> 50 | G261: 2012 | I261: of:=YEAR(TODAY())-[.G261] -> 13 | L261: 2012 | M261: Amar chitr katha Prakashan | N261: Creating India foundation
A262: 5735 | B262: Amar chitra katha | C262: Lok Manya Tilak | D262: 1 | E262: 50 | F262: of:=[.E262]*[.D262] -> 50 | G262: 2012 | I262: of:=YEAR(TODAY())-[.G262] -> 13 | L262: 2012 | M262: Amar chitr katha Prakashan | N262: Creating India foundation
A263: 5736 | B263: Amar chitra katha | C263: Dhruv and Ashthama | D263: 1 | E263: 50 | F263: of:=[.E263]*[.D263] -> 50 | G263: 2012 | I263: of:=YEAR(TODAY())-[.G263] -> 13 | L263: 2012 | M263: Amar chitr katha Prakashan | N263: Creating India foundation
A264: 5764 | B264: Swep modern | C264: Haste Haste jeena sikho | D264: 1 | E264: 60 | F264: of:=[.E264]*[.D264] -> 60 | G264: 2012 | I264: of:=YEAR(TODAY())-[.G264] -> 13 | L264: 2012 | M264: Manoj Publication | N264: Diamod Stationer JWP
A265: 5775 | B265: swet Modenr | C265: The PLANT KINDOM | D265: 1 | E265: 120 | F265: of:=[.E265]*[.D265] -> 120 | G265: 2012 | I265: of:=YEAR(TODAY())-[.G265] -> 13 | L265: 2012 | M265: Pustak mehal Delhi | N265: Diamod Stationer JWP
A266: 5826 | B266: A6 R5 | C266: The age of imperial unity | D266: 1 | F266: of:=[.E266]*[.D266] -> 0 | G266: 2012 | I266: of:=YEAR(TODAY())-[.G266] -> 13
A267: 5827 | C267: The age of imperial unity | D267: 1 | F267: of:=[.E267]*[.D267] -> 0 | G267: 2012 | I267: of:=YEAR(TODAY())-[.G267] -> 13
A268: 5910 | B268: chunni lal saluja | C268: Bachoo ko bigrne se kese roke | D268: 1 | E268: 96 | F268: of:=[.E268]*[.D268] -> 96 | G268: 2012 | I268: of:=YEAR(TODAY())-[.G268] -> 13 | L268: 2011 | M268: VS Publication | N268: Diamod Stationer JWP
A269: 6100 | B269: Braham charya | C269: Gaytri thirth shanti kunj | D269: 1 | E269: 4 | F269: of:=[.E269]*[.D269] -> 4 | G269: 2013 | I269: of:=YEAR(TODAY())-[.G269] -> 12 | L269: 2011 | M269: Yug Nirman Mathura | N269: Shanti Kunj Haridwar
A270: 6101 | B270: Shri Ram sharma | C270: Nirog jeevan ka rajmarg | D270: 1 | E270: 9 | F270: of:=[.E270]*[.D270] -> 9 | G270: 2013 | I270: of:=YEAR(TODAY())-[.G270] -> 12 | L270: 2011 | M270: Yug Nirman Mathura | N270: Shanti Kunj Haridwar
A271: 6115 | B271: Shri Ram sharma | C271: Adhya shakti gyatri ki samarth vichar | D271: 1 | E271: 6 | F271: of:=[.E271]*[.D271] -> 6 | G271: 2013 | I271: of:=YEAR(TODAY())-[.G271] -> 12 | L271: 2011 | M271: Shanti kunj Haridwar | N271: Shanti Kunj Haridwar
A272: 6119 | B272: Shri Ram sharma | C272: Veer shivajee | D272: 1 | E272: 6 | F272: of:=[.E272]*[.D272] -> 6 | G272: 2013 | I272: of:=YEAR(TODAY())-[.G272] -> 12 | L272: 2011 | M272: Shanti kunj Haridwar | N272: Shanti Kunj Haridwar
A273: 6120 | B273: Shri Ram sharma | C273: Lok manay tilak | D273: 1 | E273: 6 | F273: of:=[.E273]*[.D273] -> 6 | G273: 2013 | I273: of:=YEAR(TODAY())-[.G273] -> 12 | L273: 2011 | M273: Shanti kunj Haridwar | N273: Shanti Kunj Haridwar
A274: 6121 | B274: Shri Ram sharma | C274: Yog chiktsa | D274: 1 | E274: 12 | F274: of:=[.E274]*[.D274] -> 12 | G274: 2013 | I274: of:=YEAR(TODAY())-[.G274] -> 12 | L274: 2011 | M274: Shanti kunj Haridwar | N274: Shanti Kunj Haridwar
A275: 6123 | B275: Shri Ram sharma | C275: Masala vatika se garelu upchar | D275: 1 | E275: 6 | F275: of:=[.E275]*[.D275] -> 6 | G275: 2013 | I275: of:=YEAR(TODAY())-[.G275] -> 12 | L275: 2011 | M275: Shanti kunj Haridwar | N275: Shanti Kunj Haridwar
A276: 6124 | B276: Shri Ram sharma | C276: Tulsi ke chamtkari gun | D276: 1 | E276: 6 | F276: of:=[.E276]*[.D276] -> 6 | G276: 2013 | I276: of:=YEAR(TODAY())-[.G276] -> 12 | L276: 2011 | M276: Shanti kunj Haridwar | N276: Shanti Kunj Haridwar
A277: 6126 | B277: Shri Ram sharma | C277: Param prasad pragya | D277: 1 | E277: 9 | F277: of:=[.E277]*[.D277] -> 9 | G277: 2013 | I277: of:=YEAR(TODAY())-[.G277] -> 12 | L277: 2011 | M277: Shanti kunj Haridwar | N277: Shanti Kunj Haridwar
A278: 6128 | B278: Shri Ram sharma | C278: 21 sadi ko ujwal baneye | D278: 1 | E278: 10 | F278: of:=[.E278]*[.D278] -> 10 | G278: 2013 | I278: of:=YEAR(TODAY())-[.G278] -> 12 | L278: 2011 | M278: Shanti kunj Haridwar | N278: Shanti Kunj Haridwar
A279: 6130 | B279: Shri Ram sharma | C279: jeewan devta ki saadhna | D279: 1 | E279: 9 | F279: of:=[.E279]*[.D279] -> 9 | G279: 2013 | I279: of:=YEAR(TODAY())-[.G279] -> 12 | L279: 2011 | M279: Shanti kunj Haridwar
A280: 6132 | B280: Shri Ram sharma | C280: Bhav samvedno ki gangotri | D280: 1 | E280: 6 | F280: of:=[.E280]*[.D280] -> 6 | G280: 2013 | I280: of:=YEAR(TODAY())-[.G280] -> 12 | L280: 2011 | M280: Shanti kunj Haridwar | N280: Shanti Kunj Haridwar
A281: 6133 | B281: Shri Ram sharma | C281: Sanjeevani vidya ka vistar | D281: 1 | E281: 6 | F281: of:=[.E281]*[.D281] -> 6 | G281: 2013 | I281: of:=YEAR(TODAY())-[.G281] -> 12 | L281: 2011 | M281: Shanti kunj Haridwar | N281: Shanti Kunj Haridwar
A282: 6135 | B282: Shri Ram sharma | C282: Badharkal ki pretibhagi | D282: 1 | E282: 6 | F282: of:=[.E282]*[.D282] -> 6 | G282: 2013 | I282: of:=YEAR(TODAY())-[.G282] -> 12 | L282: 2011 | M282: Shanti kunj Haridwar | N282: Shanti Kunj Haridwar
A283: 6137 | B283: Shri Ram sharma | C283: Parivartan ke mahan sant | D283: 1 | E283: 6 | F283: of:=[.E283]*[.D283] -> 6 | G283: 2013 | I283: of:=YEAR(TODAY())-[.G283] -> 12 | L283: 2011 | M283: Shanti kunj Haridwar | N283: Shanti Kunj Haridwar
A284: 6138 | B284: Shri Ram sharma | C284: Man sithi badle to parisithi badle | D284: 1 | E284: 6 | F284: of:=[.E284]*[.D284] -> 6 | G284: 2013 | I284: of:=YEAR(TODAY())-[.G284] -> 12 | L284: 2011 | M284: Shanti kunj Haridwar | N284: Shanti Kunj Haridwar
A285: 6139 | B285: Shri Ram sharma | C285: Nishtya faldhai jeevan sadye | D285: 1 | E285: 30 | F285: of:=[.E285]*[.D285] -> 30 | G285: 2013 | I285: of:=YEAR(TODAY())-[.G285] -> 12 | L285: 2011 | M285: Shanti kunj Haridwar | N285: Shanti Kunj Haridwar
A286: 6140 | B286: Shri Ram sharma | C286: Pratibha samvardhan | D286: 1 | E286: 31 | F286: of:=[.E286]*[.D286] -> 31 | G286: 2013 | I286: of:=YEAR(TODAY())-[.G286] -> 12 | L286: 2011 | M286: Shanti kunj Haridwar | N286: Shanti Kunj Haridwar
A287: 6141 | B287: Shri Ram sharma | C287: apni kamjoriyon se lade | D287: 1 | E287: 3 | F287: of:=[.E287]*[.D287] -> 3 | G287: 2013 | I287: of:=YEAR(TODAY())-[.G287] -> 12 | L287: 2011 | M287: Shanti kunj Haridwar | N287: Shanti Kunj Haridwar
A288: 6142 | B288: Shri Ram sharma | C288: Vipatti se dare nahi joojhe | D288: 1 | E288: 3 | F288: of:=[.E288]*[.D288] -> 3 | G288: 2013 | I288: of:=YEAR(TODAY())-[.G288] -> 12 | L288: 2011 | M288: Shanti kunj Haridwar | N288: Shanti Kunj Haridwar
A289: 6143 | B289: Shri Ram sharma | C289: Sadgun vadeye sishtachar apnaye | D289: 1 | E289: 3 | F289: of:=[.E289]*[.D289] -> 3 | G289: 2013 | I289: of:=YEAR(TODAY())-[.G289] -> 12 | L289: 2011 | M289: Shanti kunj Haridwar | N289: Shanti Kunj Haridwar
A290: 6144 | B290: Shri Ram sharma | C290: Unati ke char gun char charan | D290: 1 | E290: 3 | F290: of:=[.E290]*[.D290] -> 3 | G290: 2013 | I290: of:=YEAR(TODAY())-[.G290] -> 12 | L290: 2011 | M290: Shanti kunj Haridwar | N290: Shanti Kunj Haridwar
A291: 6145 | B291: Shri Ram sharma | C291: Pade or use jeevan me utare | D291: 1 | E291: 3 | F291: of:=[.E291]*[.D291] -> 3 | G291: 2013 | I291: of:=YEAR(TODAY())-[.G291] -> 12 | L291: 2011 | M291: Shanti kunj Haridwar | N291: Shanti Kunj Haridwar
A292: 6146 | B292: Shri Ram sharma | C292: saflata ki janani Sankalp shakti | D292: 1 | E292: 3 | F292: of:=[.E292]*[.D292] -> 3 | G292: 2013 | I292: of:=YEAR(TODAY())-[.G292] -> 12 | L292: 2011 | M292: Shanti kunj Haridwar | N292: Shanti Kunj Haridwar
A293: 6147 | B293: Shri Ram sharma | C293: Vidhathi jeevan me saflta ki | D293: 1 | E293: 3 | F293: of:=[.E293]*[.D293] -> 3 | G293: 2013 | I293: of:=YEAR(TODAY())-[.G293] -> 12 | L293: 2011 | M293: Shanti kunj Haridwar | N293: Shanti Kunj Haridwar
A294: 6148 | B294: Shri Ram sharma | C294: Vyasno se bache | D294: 1 | E294: 3 | F294: of:=[.E294]*[.D294] -> 3 | G294: 2013 | I294: of:=YEAR(TODAY())-[.G294] -> 12 | L294: 2011 | M294: Shanti kunj Haridwar | N294: Shanti Kunj Haridwar
A295: 6149 | B295: Shri Ram sharma | C295: Yug nirman sanskaran | D295: 1 | E295: 3 | F295: of:=[.E295]*[.D295] -> 3 | G295: 2013 | I295: of:=YEAR(TODAY())-[.G295] -> 12 | M295: Shanti kunj Haridwar
A296: 6150 | B296: Shri Ram sharma | C296: Aahar chiktsa | D296: 1 | E296: 3 | F296: of:=[.E296]*[.D296] -> 3 | G296: 2013 | I296: of:=YEAR(TODAY())-[.G296] -> 12 | L296: 2011 | M296: Shanti kunj Haridwar | N296: Shanti Kunj Haridwar
A297: 6151 | B297: Shri Ram sharma | C297: Durvyasan | D297: 1 | E297: 3 | F297: of:=[.E297]*[.D297] -> 3 | G297: 2013 | I297: of:=YEAR(TODAY())-[.G297] -> 12 | L297: 2011 | M297: Shanti kunj Haridwar | N297: Shanti Kunj Haridwar
A298: 6152 | B298: Shri Ram sharma | C298: Harye na himat | D298: 1 | E298: 3 | F298: of:=[.E298]*[.D298] -> 3 | G298: 2013 | I298: of:=YEAR(TODAY())-[.G298] -> 12 | L298: 2011 | M298: Shanti kunj Haridwar | N298: Shanti Kunj Haridwar
A299: 6153 | B299: Shri Ram sharma | C299: Patience and think | D299: 1 | E299: 3 | F299: of:=[.E299]*[.D299] -> 3 | G299: 2013 | I299: of:=YEAR(TODAY())-[.G299] -> 12 | L299: 2011 | M299: Shanti kunj Haridwar | N299: Shanti Kunj Haridwar
A300: 6154 | B300: Shri Ram sharma | C300: self development | D300: 1 | E300: 3 | F300: of:=[.E300]*[.D300] -> 3 | G300: 2013 | I300: of:=YEAR(TODAY())-[.G300] -> 12 | L300: 2011 | M300: Shanti kunj Haridwar | N300: Shanti Kunj Haridwar
A301: 6155 | B301: Shri Ram sharma | C301: mental balance | D301: 1 | E301: 3 | F301: of:=[.E301]*[.D301] -> 3 | G301: 2013 | I301: of:=YEAR(TODAY())-[.G301] -> 12 | L301: 2011 | M301: Shanti kunj Haridwar | N301: Shanti Kunj Haridwar
A302: 6156 | B302: Shri Ram sharma | C302: loose not your heart | D302: 1 | E302: 3 | F302: of:=[.E302]*[.D302] -> 3 | G302: 2013 | I302: of:=YEAR(TODAY())-[.G302] -> 12 | L302: 2011 | M302: Shanti kunj Haridwar | N302: Shanti Kunj Haridwar
A303: 6157 | B303: Shri Ram sharma | C303: loose not your heart | D303: 1 | E303: 3 | F303: of:=[.E303]*[.D303] -> 3 | G303: 2013 | I303: of:=YEAR(TODAY())-[.G303] -> 12 | L303: 2011 | M303: Shanti kunj Haridwar | N303: Shanti Kunj Haridwar
A304: 6158 | B304: Shri Ram sharma | C304: vyasno se haniya | D304: 1 | E304: 7 | F304: of:=[.E304]*[.D304] -> 7 | G304: 2013 | I304: of:=YEAR(TODAY())-[.G304] -> 12 | L304: 2011 | M304: Shanti kunj Haridwar | N304: Shanti Kunj Haridwar
A305: 6159 | B305: Shri Ram sharma | C305: Madhya pan | D305: 1 | E305: 7 | F305: of:=[.E305]*[.D305] -> 7 | G305: 2013 | I305: of:=YEAR(TODAY())-[.G305] -> 12 | L305: 2011 | M305: Shanti kunj Haridwar | N305: Shanti Kunj Haridwar
A306: 6160 | B306: Shri Ram sharma | C306: Shaka aahar ankurit aahar | D306: 1 | E306: 3 | F306: of:=[.E306]*[.D306] -> 3 | G306: 2013 | I306: of:=YEAR(TODAY())-[.G306] -> 12 | L306: 2011 | M306: Shanti kunj Haridwar | N306: Shanti Kunj Haridwar
A307: 6161 | B307: Shri Ram sharma | C307: Nashebaji se hani | D307: 1 | E307: 3 | F307: of:=[.E307]*[.D307] -> 3 | G307: 2013 | I307: of:=YEAR(TODAY())-[.G307] -> 12 | L307: 2011 | M307: Shanti kunj Haridwar | N307: Shanti Kunj Haridwar
A308: 6162 | B308: Shri Ram sharma | C308: Yug nirman satyakarma | D308: 1 | E308: 3 | F308: of:=[.E308]*[.D308] -> 3 | G308: 2013 | I308: of:=YEAR(TODAY())-[.G308] -> 12 | L308: 2011 | M308: Shanti kunj Haridwar | N308: Shanti Kunj Haridwar
A309: 6163 | B309: Shri Ram sharma | C309: Bolti divare | D309: 1 | E309: 4 | F309: of:=[.E309]*[.D309] -> 4 | G309: 2013 | I309: of:=YEAR(TODAY())-[.G309] -> 12 | L309: 2011 | M309: Shanti kunj Haridwar | N309: Shanti Kunj Haridwar
A310: 6164 | B310: Shri Ram sharma | C310: sakahar ankurit aahar | D310: 1 | E310: 3 | F310: of:=[.E310]*[.D310] -> 3 | G310: 2013 | I310: of:=YEAR(TODAY())-[.G310] -> 12 | L310: 2011 | M310: Shanti kunj Haridwar | N310: Shanti Kunj Haridwar
A311: 6165 | B311: Shri Ram sharma | C311: Safal jeevan ki diaha me vidya vidhyan | D311: 1 | E311: 3 | F311: of:=[.E311]*[.D311] -> 3 | G311: 2013 | I311: of:=YEAR(TODAY())-[.G311] -> 12 | L311: 2011 | M311: Shanti kunj Haridwar | N311: Shanti Kunj Haridwar
A312: 6166 | B312: Shri Ram sharma | C312: Aahar chiktsa | D312: 1 | E312: 3 | F312: of:=[.E312]*[.D312] -> 3 | G312: 2013 | I312: of:=YEAR(TODAY())-[.G312] -> 12 | L312: 2011 | M312: Shanti kunj Haridwar | N312: Shanti Kunj Haridwar
A313: 6167 | B313: Shri Ram sharma | C313: Vidyathri jeevan me apna lakshya | D313: 1 | E313: 3 | F313: of:=[.E313]*[.D313] -> 3 | G313: 2013 | I313: of:=YEAR(TODAY())-[.G313] -> 12 | L313: 2011 | M313: Shanti kunj Haridwar | N313: Shanti Kunj Haridwar
A314: 6168 | B314: Shri Ram sharma | C314: Vivshno ke pishach se kese bache | D314: 1 | E314: 3 | F314: of:=[.E314]*[.D314] -> 3 | G314: 2013 | I314: of:=YEAR(TODAY())-[.G314] -> 12 | L314: 2011 | M314: Shanti kunj Haridwar | N314: Shanti Kunj Haridwar
A315: 6169 | B315: Shri Ram sharma | C315: Pratibha samvardhan | D315: 1 | E315: 3 | F315: of:=[.E315]*[.D315] -> 3 | G315: 2013 | I315: of:=YEAR(TODAY())-[.G315] -> 12 | L315: 2011 | M315: Shanti kunj Haridwar | N315: Shanti Kunj Haridwar
A316: 6170 | B316: Shri Ram sharma | C316: Nishtya faldhai jeevan sadna | D316: 1 | E316: 3 | F316: of:=[.E316]*[.D316] -> 3 | G316: 2013 | I316: of:=YEAR(TODAY())-[.G316] -> 12 | L316: 2011 | M316: Shanti kunj Haridwar | N316: Shanti Kunj Haridwar
A317: 6171 | B317: Shri Ram sharma | C317: Biptyo se darye nahi jujhiye | D317: 1 | E317: 3 | F317: of:=[.E317]*[.D317] -> 3 | G317: 2013 | I317: of:=YEAR(TODAY())-[.G317] -> 12 | L317: 2011 | M317: Shanti kunj Haridwar | N317: Shanti Kunj Haridwar
A318: 6172 | B318: Shri Ram sharma | C318: apni kamjoriyon se lade | D318: 1 | E318: 3 | F318: of:=[.E318]*[.D318] -> 3 | G318: 2013 | I318: of:=YEAR(TODAY())-[.G318] -> 12 | L318: 2011 | M318: Shanti kunj Haridwar | N318: Shanti Kunj Haridwar
A319: 6173 | B319: Shri Ram sharma | C319: Sadgun badhaye sishtachar vadye | D319: 1 | E319: 3 | F319: of:=[.E319]*[.D319] -> 3 | G319: 2013 | I319: of:=YEAR(TODAY())-[.G319] -> 12 | L319: 2011 | M319: Shanti kunj Haridwar | N319: Shanti Kunj Haridwar
A320: 6174 | B320: Shri Ram sharma | C320: Pade or use jeevan me utare | D320: 1 | E320: 3 | F320: of:=[.E320]*[.D320] -> 3 | G320: 2013 | I320: of:=YEAR(TODAY())-[.G320] -> 12 | L320: 2011 | M320: Shanti kunj Haridwar | N320: Shanti Kunj Haridwar
A321: 6175 | B321: Shri Ram sharma | C321: Unmado ke teen gun char chalan | D321: 1 | E321: 3 | F321: of:=[.E321]*[.D321] -> 3 | G321: 2013 | I321: of:=YEAR(TODAY())-[.G321] -> 12 | L321: 2011 | M321: Shanti kunj Haridwar | N321: Shanti Kunj Haridwar
A322: 6176 | B322: Shri Ram sharma | C322: sadgun apneye | D322: 1 | E322: 3 | F322: of:=[.E322]*[.D322] -> 3 | G322: 2013 | I322: of:=YEAR(TODAY())-[.G322] -> 12 | L322: 2011 | M322: Shanti kunj Haridwar | N322: Shanti Kunj Haridwar
A323: 6177 | B323: Shri Ram sharma | C323: apni kamjoriyon se lade | D323: 1 | E323: 3 | F323: of:=[.E323]*[.D323] -> 3 | G323: 2013 | I323: of:=YEAR(TODAY())-[.G323] -> 12 | L323: 2011 | M323: Shanti kunj Haridwar | N323: Shanti Kunj Haridwar
A324: 6178 | B324: Shri Ram sharma | C324: nishit faldai jeevan | D324: 1 | E324: 3 | F324: of:=[.E324]*[.D324] -> 3 | G324: 2013 | I324: of:=YEAR(TODAY())-[.G324] -> 12 | L324: 2011 | M324: Shanti kunj Haridwar | N324: Shanti Kunj Haridwar
A325: 6179 | B325: Shri Ram sharma | C325: Vipti se dare nahi jujhe | D325: 1 | E325: 3 | F325: of:=[.E325]*[.D325] -> 3 | G325: 2013 | I325: of:=YEAR(TODAY())-[.G325] -> 12 | L325: 2011 | M325: Shanti kunj Haridwar | N325: Shanti Kunj Haridwar
A326: 6180 | B326: Shri Ram sharma | C326: Vigyan sambardan ke upaye | D326: 1 | E326: 3 | F326: of:=[.E326]*[.D326] -> 3 | G326: 2013 | I326: of:=YEAR(TODAY())-[.G326] -> 12 | L326: 2011 | M326: Shanti kunj Haridwar | N326: Shanti Kunj Haridwar
A327: 6181 | B327: Shri Ram sharma | C327: uniti ke chal chalan | D327: 1 | E327: 3 | F327: of:=[.E327]*[.D327] -> 3 | G327: 2013 | I327: of:=YEAR(TODAY())-[.G327] -> 12 | L327: 2011 | M327: Shanti kunj Haridwar | N327: Shanti Kunj Haridwar
A328: 6182 | B328: Shri Ram sharma | C328: Padhe or use jeevan me utare | D328: 1 | E328: 3 | F328: of:=[.E328]*[.D328] -> 3 | G328: 2013 | I328: of:=YEAR(TODAY())-[.G328] -> 12 | L328: 2011 | M328: Shanti kunj Haridwar | N328: Shanti Kunj Haridwar
A329: 6183 | B329: Shri Ram sharma | C329: saflta se sakast shakti | D329: 1 | E329: 3 | F329: of:=[.E329]*[.D329] -> 3 | G329: 2013 | I329: of:=YEAR(TODAY())-[.G329] -> 12 | L329: 2011 | M329: Shanti kunj Haridwar | N329: Shanti Kunj Haridwar
A330: 6184 | B330: Shri Ram sharma | C330: vidhyarthi jeevan me apna lakshy kaise saadhe | D330: 1 | E330: 3 | F330: of:=[.E330]*[.D330] -> 3 | G330: 2013 | I330: of:=YEAR(TODAY())-[.G330] -> 12 | L330: 2011 | M330: Shanti kunj Haridwar | N330: Shanti Kunj Haridwar
A331: 6185 | B331: Shri Ram sharma | C331: Viysano ke pishash se bache | D331: 1 | E331: 3 | F331: of:=[.E331]*[.D331] -> 3 | G331: 2013 | I331: of:=YEAR(TODAY())-[.G331] -> 12 | L331: 2011 | M331: Shanti kunj Haridwar | N331: Shanti Kunj Haridwar
A332: 6186 | B332: Shri Ram sharma | C332: be strrong | D332: 1 | E332: 3 | F332: of:=[.E332]*[.D332] -> 3 | G332: 2013 | I332: of:=YEAR(TODAY())-[.G332] -> 12
A333: 6187 | B333: Shri Ram sharma | C333: Increase your memory | D333: 1 | E333: 3 | F333: of:=[.E333]*[.D333] -> 3 | G333: 2013 | I333: of:=YEAR(TODAY())-[.G333] -> 12 | L333: 2011 | M333: Shanti kunj Haridwar | N333: Shanti Kunj Haridwar
A334: 6188 | B334: Shri Ram sharma | C334: Steer the life | D334: 1 | E334: 3 | F334: of:=[.E334]*[.D334] -> 3 | G334: 2013 | I334: of:=YEAR(TODAY())-[.G334] -> 12 | L334: 2011 | M334: Shanti kunj Haridwar | N334: Shanti Kunj Haridwar
A335: 6190 | B335: Shri Ram sharma | C335: Scientific approach | D335: 1 | E335: 3 | F335: of:=[.E335]*[.D335] -> 3 | G335: 2013 | I335: of:=YEAR(TODAY())-[.G335] -> 12 | L335: 2011 | M335: Shanti kunj Haridwar | N335: Shanti Kunj Haridwar
A336: 6191 | B336: Shri Ram sharma | C336: Donmic and adventures | D336: 1 | E336: 3 | F336: of:=[.E336]*[.D336] -> 3 | G336: 2013 | I336: of:=YEAR(TODAY())-[.G336] -> 12 | L336: 2011 | M336: Shanti kunj Haridwar | N336: Shanti Kunj Haridwar
A337: 6192 | B337: Shri Ram sharma | C337: Processing goods in students life | D337: 1 | E337: 3 | F337: of:=[.E337]*[.D337] -> 3 | G337: 2013 | I337: of:=YEAR(TODAY())-[.G337] -> 12 | L337: 2011 | M337: Shanti kunj Haridwar | N337: Shanti Kunj Haridwar
A338: 6193 | B338: Shri Ram sharma | C338: Dominate way of success | D338: 1 | E338: 3 | F338: of:=[.E338]*[.D338] -> 3 | G338: 2013 | I338: of:=YEAR(TODAY())-[.G338] -> 12 | L338: 2011 | M338: Shanti kunj Haridwar | N338: Shanti Kunj Haridwar
A339: 6194 | B339: Shri Ram sharma | C339: Observe academic in life | D339: 1 | E339: 3 | F339: of:=[.E339]*[.D339] -> 3 | G339: 2013 | I339: of:=YEAR(TODAY())-[.G339] -> 12 | L339: 2011 | M339: Shanti kunj Haridwar | N339: Shanti Kunj Haridwar
A340: 6195 | B340: Shri Ram sharma | C340: three fairs & part selected pairs | D340: 1 | E340: 3 | F340: of:=[.E340]*[.D340] -> 3 | G340: 2013 | I340: of:=YEAR(TODAY())-[.G340] -> 12 | L340: 2011 | M340: Shanti kunj Haridwar | N340: Shanti Kunj Haridwar
A341: 6213 | B341: Robin sharma | C341: Great People of India | D341: 1 | E341: - | F341: of:=[.E341]*[.D341] ->  | G341: 2013 | I341: of:=YEAR(TODAY())-[.G341] -> 12 | L341: 2011 | M341: India Now foundation | N341: India Now foundation
A342: 6218 | B342: SS beri | C342: mathematics | D342: 1 | E342: 1999 | F342: of:=[.E342]*[.D342] -> 1999 | G342: 2013 | I342: of:=YEAR(TODAY())-[.G342] -> 12 | L342: 2011 | M342: Adorling Kindersley | N342: Pulse International Dehradun
A343: 6219 | B343: RD sharma | C343: Mathematics class IX | D343: 1 | E343: 295 | F343: of:=[.E343]*[.D343] -> 295 | G343: 2013 | I343: of:=YEAR(TODAY())-[.G343] -> 12 | L343: 2011 | M343: Dhanpat Rai Delhi | N343: Subash Book depot
A344: 6221 | B344: RD sharma | C344: Mathematics class XI | D344: 1 | E344: 345 | F344: of:=[.E344]*[.D344] -> 345 | G344: 2013 | I344: of:=YEAR(TODAY())-[.G344] -> 12 | L344: 2011 | M344: Dhanpat Rai Delhi | N344: Subash Book depot
A345: 6222 | B345: RD sharma | C345: Mathematics class XII part 1 | D345: 1 | E345: 345 | F345: of:=[.E345]*[.D345] -> 345 | G345: 2013 | I345: of:=YEAR(TODAY())-[.G345] -> 12 | L345: 2011 | M345: Dhanpat Rai Delhi | N345: Subash Book depot
A346: 6223 | B346: RD sharma | C346: Mathematics class XII part 2 | D346: 1 | E346: 590` | F346: of:=[.E346]*[.D346] ->  | G346: 2013 | I346: of:=YEAR(TODAY())-[.G346] -> 12 | L346: 2011 | M346: Dhanpat Rai Delhi | N346: Subash Book depot
A347: 6227 | B347: R Carbi | C347: The 7 habits of highly effective people | D347: 1 | E347: 499 | F347: of:=[.E347]*[.D347] -> 499 | G347: 2013 | I347: of:=YEAR(TODAY())-[.G347] -> 12 | L347: 2013 | M347: Manoj Publication | N347: AH Wheeler Prayagraj
A348: 6230 | B348: RD sharma | C348: Mathematics vol 2 RD Sharma | D348: 1 | E348: 225 | F348: of:=[.E348]*[.D348] -> 225 | G348: 2013 | I348: of:=YEAR(TODAY())-[.G348] -> 12 | L348: 2014 | M348: Dhanpat Rai Delhi | N348: Evergreen publishers
A349: 6231 | B349: RD sharma | C349: Mathematics class XI | D349: 1 | E349: 300 | F349: of:=[.E349]*[.D349] -> 300 | G349: 2013 | I349: of:=YEAR(TODAY())-[.G349] -> 12 | L349: 2014 | M349: Dhanpat Rai Delhi | N349: Evergreen publishers
A350: 6232 | B350: RD sharma | C350: Mathematics class XI | D350: 1 | E350: 300 | F350: of:=[.E350]*[.D350] -> 300 | G350: 2014 | I350: of:=YEAR(TODAY())-[.G350] -> 11 | L350: 2014 | M350: Dhanpat Rai Delhi | N350: Evergreen publishers
A351: 6236 | B351: Lakhvir singh | C351: Objective General Science | D351: 1 | E351: 150 | F351: of:=[.E351]*[.D351] -> 150 | G351: 2014 | I351: of:=YEAR(TODAY())-[.G351] -> 11 | L351: 2013 | M351: Arihant Publications | N351: Evergreen publishers
A352: 6239 | B352: KC Agarwal | C352: Vidhyarthi vikas va career chunaav | D352: 1 | E352: 120 | F352: of:=[.E352]*[.D352] -> 120 | G352: 2014 | I352: of:=YEAR(TODAY())-[.G352] -> 11 | L352: 2013 | M352: Arihant Publications | N352: Evergreen publishers
A353: 6244 | B353: Astha | C353: Akbar birbal | D353: 1 | E353: 15 | F353: of:=[.E353]*[.D353] -> 15 | G353: 2014 | I353: of:=YEAR(TODAY())-[.G353] -> 11 | L353: 2013 | M353: Lakshmi Publications | N353: Evergreen publishers
A354: 6248 | B354: Astha | C354: Tenali Rama | D354: 1 | E354: 20 | F354: of:=[.E354]*[.D354] -> 20 | G354: 2014 | I354: of:=YEAR(TODAY())-[.G354] -> 11 | L354: 2013 | M354: Lakshmi Publications | N354: Evergreen publishers
A355: 6249 | B355: Astha | C355: Ek aisi bidai | D355: 1 | E355: 15 | F355: of:=[.E355]*[.D355] -> 15 | G355: 2014 | I355: of:=YEAR(TODAY())-[.G355] -> 11 | L355: 2013 | M355: Dhanpat Rai Delhi | N355: Evergreen publishers
A356: 6251 | B356: RD sharma | C356: Mathematics clas VII | D356: 1 | E356: 75 | F356: of:=[.E356]*[.D356] -> 75 | G356: 2014 | I356: of:=YEAR(TODAY())-[.G356] -> 11 | L356: 2013 | M356: Dhanpat Rai Delhi | N356: Evergreen publishers
A357: 6259 | B357: RL Stefen | C357: Treasury Island | D357: 1 | E357: 100 | F357: of:=[.E357]*[.D357] -> 100 | G357: 2014 | I357: of:=YEAR(TODAY())-[.G357] -> 11 | L357: 2013 | M357: S.Chand and Company | N357: Evergreen publishers
A358: 6261 | B358: Denial duffi | C358: Robin Crusoe | D358: 1 | E358: 70 | F358: of:=[.E358]*[.D358] -> 70 | G358: 2014 | I358: of:=YEAR(TODAY())-[.G358] -> 11 | L358: 2013 | M358: S.Chand and Company | N358: Evergreen publishers
A359: 6274 | B359: A Hope | C359: The princess of Zenda | D359: 1 | E359: 90 | F359: of:=[.E359]*[.D359] -> 90 | G359: 2014 | I359: of:=YEAR(TODAY())-[.G359] -> 11 | L359: 2013 | M359: S.Chand and Company | N359: S.Chand and Company
A360: 6278 | B360: RM Modline | C360: The coral Island | D360: 1 | E360: 90 | F360: of:=[.E360]*[.D360] -> 90 | G360: 2014 | I360: of:=YEAR(TODAY())-[.G360] -> 11 | L360: 2013 | M360: S.Chand and Company | N360: S.Chand and Company
A361: 6284 | B361: Rm Omakar | C361: Personality development and career management | D361: 1 | E361: 340 | F361: of:=[.E361]*[.D361] -> 340 | G361: 2014 | I361: of:=YEAR(TODAY())-[.G361] -> 11 | L361: 2011 | M361: S.Chand and Company | N361: S.Chand and Company
A362: 6291 | B362: Alex | C362: Soft skills | D362: 1 | E362: 425 | F362: of:=[.E362]*[.D362] -> 425 | G362: 2014 | I362: of:=YEAR(TODAY())-[.G362] -> 11 | L362: 2013 | M362: S.Chand and Company | N362: S.Chand and Company
A363: 6305 | B363: Lakhvir singh | C363: Awareness of science class VIII | D363: 1 | E363: 280 | F363: of:=[.E363]*[.D363] -> 280 | G363: 2014 | I363: of:=YEAR(TODAY())-[.G363] -> 11 | L363: 2014 | M363: S.Chand and Company | N363: S.Chand and Company
A364: 6327 | B364: RS Agarwal | C364: A modern approach to verbal and non-verbal | D364: 1 | E364: 800 | F364: of:=[.E364]*[.D364] -> 800 | G364: 2014 | I364: of:=YEAR(TODAY())-[.G364] -> 11 | L364: 2014 | M364: S.Chand and Company | N364: S.Chand and Company
A365: 6349 | B365: BS sharma | C365: Mission NTSE class X | D365: 1 | E365: 75 | F365: of:=[.E365]*[.D365] -> 75 | G365: 2014 | I365: of:=YEAR(TODAY())-[.G365] -> 11 | L365: 2013 | M365: S.Chand and Company | N365: S.Chand and Company
A366: 6350 | B366: BS sharma | C366: Mission NTSE class X | D366: 1 | E366: 525 | F366: of:=[.E366]*[.D366] -> 525 | G366: 2014 | I366: of:=YEAR(TODAY())-[.G366] -> 11 | L366: 2013 | M366: S.Chand and Company | N366: S.Chand and Company
A367: 6354 | B367: EL James | C367: Fifty shades of grey | D367: 1 | E367: 450 | F367: of:=[.E367]*[.D367] -> 450 | G367: 2014 | I367: of:=YEAR(TODAY())-[.G367] -> 11 | L367: 2012 | M367: Nataraj Publishers dehradun | N367: Nataraj Publishers dehradun
A368: 6400 | B368: RK education add | C368: GRANDMA MORAL STORIES | D368: 1 | E368: 50 | F368: of:=[.E368]*[.D368] -> 50 | G368: 2014 | I368: of:=YEAR(TODAY())-[.G368] -> 11 | L368: 2008 | M368: KK Education aid | N368: Bookworld Dehradun
A369: 6456 | B369: BC sharma | C369: Material Marvels | D369: 1 | E369: 40 | F369: of:=[.E369]*[.D369] -> 40 | G369: 2014 | I369: of:=YEAR(TODAY())-[.G369] -> 11 | L369: 1999 | M369: Amity Publisher | N369: NVS Lucknow
A370: 6464 | B370: Jean | C370: Democracy | D370: 1 | E370: 50 | F370: of:=[.E370]*[.D370] -> 50 | G370: 2014 | I370: of:=YEAR(TODAY())-[.G370] -> 11 | L370: 1998 | M370: Amity Publisher | N370: RO Lucknow
A371: 6475 | B371: Renuka gupta | C371: Household pests and their management | D371: 1 | E371: 40 | F371: of:=[.E371]*[.D371] -> 40 | G371: 2014 | I371: of:=YEAR(TODAY())-[.G371] -> 11 | L371: 2002 | M371: Amity Publisher | N371: NVS Lucknow
A372: 6821 | B372: Mohni Rao | C372: Yug Yug ki kranti | D372: 1 | E372: 10 | F372: of:=[.E372]*[.D372] -> 10 | G372: 2014 | I372: of:=YEAR(TODAY())-[.G372] -> 11 | L372: 1972 | M372: NBT Publication | N372: RO Lucknow
A373: 6824 | B373: BF chipper | C373: Wonders of the deep sea | D373: 1 | E373: 35 | F373: of:=[.E373]*[.D373] -> 35 | G373: 2014 | I373: of:=YEAR(TODAY())-[.G373] -> 11 | L373: 2006 | M373: NBT Publication | N373: RO Lucknow
A374: 6840 | B374: Geeta Press gorakhpur | C374: Geeta Prabodhi | D374: 1 | E374: 45 | F374: of:=[.E374]*[.D374] -> 45 | G374: 2014 | I374: of:=YEAR(TODAY())-[.G374] -> 11 | L374: 2014 | M374: Geeta Press gorakhpur | N374: Geeta Press gorakhpur
A375: 6862 | B375: RW Agarwal | C375: English course with Activity VIII | D375: 1 | E375: 250 | F375: of:=[.E375]*[.D375] -> 250 | G375: 2014 | I375: of:=YEAR(TODAY())-[.G375] -> 11 | L375: 2014 | M375: S.Chand and Company Delhi | N375: S.Chand and Company Dehradun
A376: 6864 | B376: Kiran Ashok kumar | C376: Inclusive Science Class VII | D376: 1 | E376: 205 | F376: of:=[.E376]*[.D376] -> 205 | G376: 2014 | I376: of:=YEAR(TODAY())-[.G376] -> 11 | L376: 2014 | M376: S.Chand and Company Delhi | N376: S.Chand and Company Dehradun
A377: 6865 | B377: Kiran Ashok kumar | C377: Inclusive Science Class VIII | D377: 1 | E377: 215 | F377: of:=[.E377]*[.D377] -> 215 | G377: 2014 | I377: of:=YEAR(TODAY())-[.G377] -> 11 | L377: 2014 | M377: S.Chand and Company Delhi | N377: S.Chand and Company Dehradun
A378: 6875 | B378: Linda | C378: The atlas of people and place | D378: 1 | E378: 149 | F378: of:=[.E378]*[.D378] -> 149 | G378: 2014 | I378: of:=YEAR(TODAY())-[.G378] -> 11 | L378: 2010 | M378: S.Chand and Company Delhi | N378: S.Chand and Company Dehradun
A379: 6883 | B379: Iang | C379: Our World COAL | D379: 1 | E379: 99 | F379: of:=[.E379]*[.D379] -> 99 | G379: 2014 | I379: of:=YEAR(TODAY())-[.G379] -> 11 | L379: 2010 | M379: S.Chand and Company Delhi | N379: S.Chand and Company Dehradun
A380: 6889 | B380: Sara Lavit | C380: NUCLEAR POWER | D380: 1 | E380: 99 | F380: of:=[.E380]*[.D380] -> 99 | G380: 2014 | I380: of:=YEAR(TODAY())-[.G380] -> 11 | L380: 2010 | M380: S.Chand and Company Delhi | N380: S.Chand and Company Dehradun
A381: 6915 | B381: K Watchman | C381: EVERYDAY CHEMICALS | D381: 1 | E381: 99 | F381: of:=[.E381]*[.D381] -> 99 | G381: 2014 | I381: of:=YEAR(TODAY())-[.G381] -> 11 | L381: 2010 | M381: S.Chand and Company Delhi | N381: S.Chand and Company Dehradun
A382: 6946 | B382: Jhon Richord | C382: SOUND AND MUSIC | D382: 1 | E382: 99 | F382: of:=[.E382]*[.D382] -> 99 | G382: 2014 | I382: of:=YEAR(TODAY())-[.G382] -> 11 | L382: 2010 | M382: S.Chand and Company Delhi | N382: S.Chand and Company Dehradun
A383: 6958 | B383: Antheny | C383: DRAWING | D383: 1 | E383: 99 | F383: of:=[.E383]*[.D383] -> 99 | G383: 2014 | I383: of:=YEAR(TODAY())-[.G383] -> 11 | L383: 2010 | M383: S.Chand and Company Delhi | N383: S.Chand and Company Dehradun
A384: 6962 | B384: RK Puri | C384: THE GREAT SPEECHES | D384: 1 | E384: 350 | F384: of:=[.E384]*[.D384] -> 350 | G384: 2014 | I384: of:=YEAR(TODAY())-[.G384] -> 11 | L384: 2014 | M384: Nataraj Publications | N384: S.Chand and Company Dehradun
A385: 6973 | B385: Sudhir Dikshit | C385: Safalta ke mantra (HINDI) | D385: 1 | E385: 150 | F385: of:=[.E385]*[.D385] -> 150 | G385: 2014 | I385: of:=YEAR(TODAY())-[.G385] -> 11 | L385: 2013 | M385: Manjul Publications | N385: S.Chand and Company Dehradun
A386: 6975 | B386: Sandeep Gupta | C386: hito-upsesh ki kahaniyan (HINDI) | D386: 1 | E386: 150 | F386: of:=[.E386]*[.D386] -> 150 | G386: 2014 | I386: of:=YEAR(TODAY())-[.G386] -> 11 | L386: 2014 | M386: Manoj Pocket books | N386: S.Chand and Company Dehradun
A387: 6983 | B387: Rs Agarwal | C387: A modern approach to verbal and non-verbal | D387: 1 | E387: 475 | F387: of:=[.E387]*[.D387] -> 475 | G387: 2014 | I387: of:=YEAR(TODAY())-[.G387] -> 11 | L387: 2014 | M387: S.Chand and Company Delhi | N387: College Book Depot Dehradun
A388: 6989 | B388: Vidya Prakashan | C388: Saiyukt higher secondary pariksha (HINDI) | D388: 1 | E388: 200 | F388: of:=[.E388]*[.D388] -> 200 | G388: 2014 | I388: of:=YEAR(TODAY())-[.G388] -> 11 | L388: 2013 | M388: Vidya Prakashan Mandir | N388: College Book Depot Dehradun
A389: 6991 | B389: Majid Husen | C389: Bharat ka Bhoogol | D389: 1 | E389: 425 | F389: of:=[.E389]*[.D389] -> 425 | G389: 2014 | I389: of:=YEAR(TODAY())-[.G389] -> 11 | L389: 2014 | M389: Tata MC Hill Delhi | N389: College Book Depot Dehradun
A390: 6992 | B390: Amit agarwal | C390: 36 Years chapterwise solved papers | D390: 1 | E390: 365 | F390: of:=[.E390]*[.D390] -> 365 | G390: 2014 | I390: of:=YEAR(TODAY())-[.G390] -> 11 | L390: 2014 | M390: Arihant Prakashan Delhi | N390: College Book Depot Dehradun
A391: 6993 | B391: DC Pandey | C391: IIT-JEE Physics | D391: 1 | E391: 345 | F391: of:=[.E391]*[.D391] -> 345 | G391: 2014 | I391: of:=YEAR(TODAY())-[.G391] -> 11 | L391: 2014 | M391: Arihant Prakashan Delhi | N391: College Book Depot Dehradun
A392: 6995 | B392: Asha | C392: MALALA - Bahadur ladki ki kahani (HINDI) | D392: 1 | E392: 150 | F392: of:=[.E392]*[.D392] -> 150 | G392: 2014 | I392: of:=YEAR(TODAY())-[.G392] -> 11 | L392: 2014 | M392: Hindpocket delhi | N392: diamond book depot
A393: 6996 | B393: Mahindra Bhardwaj | C393: Narendra Modi - sangharsh se shikhar tak | D393: 1 | E393: 60 | F393: of:=[.E393]*[.D393] -> 60 | G393: 2014 | I393: of:=YEAR(TODAY())-[.G393] -> 11 | L393: 2014 | M393: Rajat Prakshan Delhi | N393: diamond book depot
A394: 6998 | B394: Chetan Bhagat | C394: Half Girlfriend | D394: 1 | E394: 76 | F394: of:=[.E394]*[.D394] -> 76 | G394: 2014 | I394: of:=YEAR(TODAY())-[.G394] -> 11 | L394: 2014 | M394: Rupa and company Delhi | N394: diamond book depot
A395: 7000 | B395: Indian Book house | C395: navin Rashtriya School Atlas | D395: 1 | E395: 200 | F395: of:=[.E395]*[.D395] -> 200 | G395: 2015 | I395: of:=YEAR(TODAY())-[.G395] -> 10 | L395: 2014 | M395: Indian Book depot | N395: indian book depot
A396: 7001 | B396: Oxford University Press | C396: navin Rashtriya School Atlas | D396: 1 | E396: 200 | F396: of:=[.E396]*[.D396] -> 200 | G396: 2015 | I396: of:=YEAR(TODAY())-[.G396] -> 10 | L396: 2014 | M396: Indian Book depot | N396: indian book depot
A397: 7002 | B397: Oxford University Press | C397: oxford school atlas | D397: 1 | E397: 239 | F397: of:=[.E397]*[.D397] -> 239 | G397: 2015 | I397: of:=YEAR(TODAY())-[.G397] -> 10 | L397: 2014 | M397: Oxford university Press | N397: diamond book dwpot
A398: 7003 | B398: Oxford University Press | C398: oxford school atlas | D398: 1 | E398: 239 | F398: of:=[.E398]*[.D398] -> 239 | G398: 2015 | I398: of:=YEAR(TODAY())-[.G398] -> 10 | L398: 2014 | M398: Oxford university Press | N398: diamond book dwpot
A399: 7004 | B399: Wren and Martin | C399: High school English grammar and compostion | D399: 1 | E399: 215 | F399: of:=[.E399]*[.D399] -> 215 | G399: 2015 | I399: of:=YEAR(TODAY())-[.G399] -> 10 | L399: 2014 | M399: S.Chand and Company Delhi | N399: s.chand dehradun
A400: 7005 | B400: SK Gupta | C400: iit foundation mathmatics | D400: 1 | E400: 295 | F400: of:=[.E400]*[.D400] -> 295 | G400: 2015 | I400: of:=YEAR(TODAY())-[.G400] -> 10 | L400: 2014 | M400: S.Chand and Company Delhi | N400: s.chand dehradun
A401: 7008 | B401: MD house and NK Choudhary | C401: atlas for ics (english) | D401: 1 | E401: 125 | F401: of:=[.E401]*[.D401] -> 125 | G401: 2015 | I401: of:=YEAR(TODAY())-[.G401] -> 10 | L401: 2014 | M401: S.Chand and Company Delhi | N401: s.chand dehradun
A402: 7010 | B402: Trishul book company | C402: MALALA - Bahadur ladki ki kahani (HINDI) | D402: 1 | E402: 125 | F402: of:=[.E402]*[.D402] -> 125 | G402: 2015 | I402: of:=YEAR(TODAY())-[.G402] -> 10 | L402: 2015 | M402: Bodhgaya Publication Delhi | N402: gifted
A403: 7011 | B403: Shiv Khera | C403: You can win | D403: 1 | E403: 365 | F403: of:=[.E403]*[.D403] -> 365 | G403: 2015 | I403: of:=YEAR(TODAY())-[.G403] -> 10 | L403: 2012 | M403: Mac Millan and company | N403: gifted
A404: 7014 | B404: Shriram sharma | C404: prayavaran asantulan zimedar kon | D404: 1 | E404: 31 | F404: of:=[.E404]*[.D404] -> 31 | G404: 2015 | I404: of:=YEAR(TODAY())-[.G404] -> 10 | L404: 2010 | M404: Akhand Jyoti Sansthan Haridwar | N404: santi kunj haridwar
A405: 7017 | B405: Shriram sharma | C405: yog avam prakartic chikitsa | D405: 1 | E405: 34 | F405: of:=[.E405]*[.D405] -> 34 | G405: 2015 | I405: of:=YEAR(TODAY())-[.G405] -> 10 | L405: 2011 | M405: Akhand Jyoti Sansthan Haridwar | N405: santi kunj haridwar
A406: 7018 | B406: Shriram sharma | C406: asan pranayam se adhi Vyadhi Nivarana | D406: 1 | E406: 40 | F406: of:=[.E406]*[.D406] -> 40 | G406: 2015 | I406: of:=YEAR(TODAY())-[.G406] -> 10 | L406: 2011 | M406: Akhand Jyoti Sansthan Haridwar | N406: santi kunj haridwar
A407: 7021 | B407: Shriram sharma | C407: pranyam se aadi vyadi nivaran | D407: 1 | E407: 16 | F407: of:=[.E407]*[.D407] -> 16 | G407: 2015 | I407: of:=YEAR(TODAY())-[.G407] -> 10 | L407: 2010 | M407: Akhand Jyoti Sansthan Haridwar | N407: santi kunj haridwar
A408: 7022 | B408: Shriram sharma | C408: nari uthan ki samasiya ka samadhan | D408: 1 | E408: 16 | F408: of:=[.E408]*[.D408] -> 16 | G408: 2015 | I408: of:=YEAR(TODAY())-[.G408] -> 10 | L408: 2010 | M408: Akhand Jyoti Sansthan Haridwar | N408: santi kunj haridwar
A409: 7023 | B409: Shriram sharma | C409: asayam banam aatmghat | D409: 1 | E409: 9 | F409: of:=[.E409]*[.D409] -> 9 | G409: 2015 | I409: of:=YEAR(TODAY())-[.G409] -> 10 | L409: 2010 | M409: Akhand Jyoti Sansthan Haridwar | N409: santi kunj haridwar
A410: 7024 | B410: Shriram sharma | C410: vedo ka divye sandesh | D410: 1 | E410: 75 | F410: of:=[.E410]*[.D410] -> 75 | G410: 2015 | I410: of:=YEAR(TODAY())-[.G410] -> 10 | L410: 1997 | M410: Akhand Jyoti Sansthan Haridwar | N410: santi kunj haridwar
A411: 7025 | B411: Shriram sharma | C411: manusyya chalta firta ped nhi h | D411: 1 | E411: 24 | F411: of:=[.E411]*[.D411] -> 24 | G411: 2015 | I411: of:=YEAR(TODAY())-[.G411] -> 10 | L411: 2011 | M411: Akhand Jyoti Sansthan Haridwar | N411: santi kunj haridwar
A412: 7026 | B412: Shriram sharma | C412: mastisk pratiyaksh kalpvriksh | D412: 1 | E412: 21 | F412: of:=[.E412]*[.D412] -> 21 | G412: 2015 | I412: of:=YEAR(TODAY())-[.G412] -> 10 | L412: 2013 | M412: Akhand Jyoti Sansthan Haridwar | N412: santi kunj haridwar
A413: 7028 | B413: Shriram sharma | C413: shruti suda | D413: 1 | E413: 22 | F413: of:=[.E413]*[.D413] -> 22 | G413: 2015 | I413: of:=YEAR(TODAY())-[.G413] -> 10 | L413: 2013 | M413: Akhand Jyoti Sansthan Haridwar | N413: santi kunj haridwar
A414: 7029 | B414: Shriram sharma | C414: ham sab ek dusre par nirbhar hai | D414: 1 | E414: 19 | F414: of:=[.E414]*[.D414] -> 19 | G414: 2015 | I414: of:=YEAR(TODAY())-[.G414] -> 10 | L414: 2010 | M414: Akhand Jyoti Sansthan Haridwar | N414: santi kunj haridwar
A415: 7030 | B415: Shriram sharma | C415: sahirdyta Adhyatmik pragati ke liye avasyak | D415: 1 | E415: 15 | F415: of:=[.E415]*[.D415] -> 15 | G415: 2015 | I415: of:=YEAR(TODAY())-[.G415] -> 10 | L415: 2010 | M415: Akhand Jyoti Sansthan Haridwar | N415: santi kunj haridwar
A416: 7033 | B416: Shriram sharma | C416: parmatma sarvotam kriti nari | D416: 1 | E416: 9 | F416: of:=[.E416]*[.D416] -> 9 | G416: 2015 | I416: of:=YEAR(TODAY())-[.G416] -> 10 | L416: 2005 | M416: Akhand Jyoti Sansthan Haridwar | N416: santi kunj haridwar
A417: 7034 | B417: Shriram sharma | C417: pran ghatak yashng | D417: 1 | E417: 4 | F417: of:=[.E417]*[.D417] -> 4 | G417: 2015 | I417: of:=YEAR(TODAY())-[.G417] -> 10 | L417: 2014 | M417: Akhand Jyoti Sansthan Haridwar | N417: shanti kunj haridwar
A418: 7035 | B418: Shriram sharma | C418: sahyog v sahishunta | D418: 1 | E418: 4 | F418: of:=[.E418]*[.D418] -> 4 | G418: 2015 | I418: of:=YEAR(TODAY())-[.G418] -> 10 | L418: 2013 | M418: Akhand Jyoti Sansthan Haridwar | N418: shanti kunj haridwar
A419: 7036 | B419: Shriram sharma | C419: indriya sanyam | D419: 1 | E419: 4 | F419: of:=[.E419]*[.D419] -> 4 | G419: 2015 | I419: of:=YEAR(TODAY())-[.G419] -> 10 | L419: 2013 | M419: Akhand Jyoti Sansthan Haridwar | N419: shanti kunj haridwar
A420: 7037 | B420: Shriram sharma | C420: pawitra jeevan | D420: 1 | E420: 4 | F420: of:=[.E420]*[.D420] -> 4 | G420: 2015 | I420: of:=YEAR(TODAY())-[.G420] -> 10 | L420: 2010 | M420: Akhand Jyoti Sansthan Haridwar | N420: shanti kunj haridwar
A421: 7038 | B421: Shriram sharma | C421: aaptiyo m dherya | D421: 1 | E421: 4 | F421: of:=[.E421]*[.D421] -> 4 | G421: 2015 | I421: of:=YEAR(TODAY())-[.G421] -> 10 | L421: 2011 | M421: Akhand Jyoti Sansthan Haridwar | N421: shanti kunj haridwar
A422: 7039 | B422: Shriram sharma | C422: visva ki mhan nariya | D422: 1 | E422: 4 | F422: of:=[.E422]*[.D422] -> 4 | G422: 2015 | I422: of:=YEAR(TODAY())-[.G422] -> 10 | L422: 2015 | M422: Akhand Jyoti Sansthan Haridwar | N422: shanti kunj haridwar
A423: 7040 | B423: Shriram sharma | C423: bde aadmi nhi mha manav bano | D423: 1 | E423: 12 | F423: of:=[.E423]*[.D423] -> 12 | G423: 2015 | I423: of:=YEAR(TODAY())-[.G423] -> 10 | L423: 2010 | M423: Akhand Jyoti Sansthan Haridwar | N423: shanti kunj haridwar
A424: 7041 | B424: Shriram sharma | C424: shist bne sajan kahlye | D424: 1 | E424: 6 | F424: of:=[.E424]*[.D424] -> 6 | G424: 2015 | I424: of:=YEAR(TODAY())-[.G424] -> 10 | L424: 2013 | M424: Akhand Jyoti Sansthan Haridwar | N424: shanti kunj haridwar
A425: 7043 | B425: Shriram sharma | C425: safalta ke tin sadhak | D425: 1 | E425: 10 | F425: of:=[.E425]*[.D425] -> 10 | G425: 2015 | I425: of:=YEAR(TODAY())-[.G425] -> 10 | L425: 2013 | M425: Akhand Jyoti Sansthan Haridwar | N425: shanti kunj haridwar
A426: 7044 | B426: Shriram sharma | C426: chatro ka nirman adhyapak kare | D426: 1 | E426: 16 | F426: of:=[.E426]*[.D426] -> 16 | G426: 2015 | I426: of:=YEAR(TODAY())-[.G426] -> 10 | L426: 2014 | M426: Akhand Jyoti Sansthan Haridwar | N426: shanti kunj haridwar
A427: 7046 | B427: Shriram sharma | C427: jivan me mrityu | D427: 1 | E427: 4 | F427: of:=[.E427]*[.D427] -> 4 | G427: 2015 | I427: of:=YEAR(TODAY())-[.G427] -> 10 | L427: 2010 | M427: Akhand Jyoti Sansthan Haridwar | N427: shanti kunj haridwar
A428: 7047 | B428: Shriram sharma | C428: savdhani v suraksa | D428: 1 | E428: 4 | F428: of:=[.E428]*[.D428] -> 4 | G428: 2015 | I428: of:=YEAR(TODAY())-[.G428] -> 10 | L428: 2014 | M428: Akhand Jyoti Sansthan Haridwar | N428: shanti kunj haridwar
A429: 7048 | B429: Shriram sharma | C429: sachhta manusyta ka gorav | D429: 1 | E429: 4 | F429: of:=[.E429]*[.D429] -> 4 | G429: 2015 | I429: of:=YEAR(TODAY())-[.G429] -> 10 | L429: 2013 | M429: Akhand Jyoti Sansthan Haridwar | N429: shanti kunj haridwar
A430: 7049 | B430: Shriram sharma | C430: parkarti ka anusaran | D430: 1 | E430: 5 | F430: of:=[.E430]*[.D430] -> 5 | G430: 2015 | I430: of:=YEAR(TODAY())-[.G430] -> 10 | L430: 2010 | M430: Akhand Jyoti Sansthan Haridwar | N430: shanti kunj haridwar
A431: 7050 | B431: Shriram sharma | C431: nari ki mahanta | D431: 1 | E431: 4 | F431: of:=[.E431]*[.D431] -> 4 | G431: 2015 | I431: of:=YEAR(TODAY())-[.G431] -> 10 | L431: 2013 | M431: Akhand Jyoti Sansthan Haridwar | N431: shanti kunj haridwar
A432: 7051 | B432: Shriram sharma | C432: dhan ka sadyopog | D432: 1 | E432: 4 | F432: of:=[.E432]*[.D432] -> 4 | G432: 2015 | I432: of:=YEAR(TODAY())-[.G432] -> 10 | L432: 2010 | M432: Akhand Jyoti Sansthan Haridwar | N432: shanti kunj haridwar
A433: 7052 | B433: Shriram sharma | C433: sakti ka sadopyog | D433: 1 | E433: 4 | F433: of:=[.E433]*[.D433] -> 4 | G433: 2015 | I433: of:=YEAR(TODAY())-[.G433] -> 10 | L433: 2013 | M433: Akhand Jyoti Sansthan Haridwar | N433: shanti kunj haridwar
A434: 7053 | B434: Shriram sharma | C434: apurnta se purnta ke aur | D434: 1 | E434: 4 | F434: of:=[.E434]*[.D434] -> 4 | G434: 2015 | I434: of:=YEAR(TODAY())-[.G434] -> 10 | L434: 2011 | M434: Akhand Jyoti Sansthan Haridwar | N434: shanti kunj haridwar
A435: 7057 | B435: Shriram sharma | C435: gopniya gaytri se sankat nivaran | D435: 1 | E435: 7 | F435: of:=[.E435]*[.D435] -> 7 | G435: 2015 | I435: of:=YEAR(TODAY())-[.G435] -> 10 | L435: 2013 | M435: Akhand Jyoti Sansthan Haridwar | N435: shanti kunj haridwar
A436: 7058 | B436: Shriram sharma | C436: gaytri maha mantra se sankat nivaran | D436: 1 | E436: 6 | F436: of:=[.E436]*[.D436] -> 6 | G436: 2015 | I436: of:=YEAR(TODAY())-[.G436] -> 10 | L436: 2014 | M436: Akhand Jyoti Sansthan Haridwar | N436: shanti kunj haridwar
A437: 7059 | C437: gayatri maha mantra | D437: 1 | E437: 7 | F437: of:=[.E437]*[.D437] -> 7 | G437: 2015 | I437: of:=YEAR(TODAY())-[.G437] -> 10
A438: 7060 | B438: Shriram sharma | C438: paramartha aur swarth ka samanya | D438: 1 | E438: 4 | F438: of:=[.E438]*[.D438] -> 4 | G438: 2015 | I438: of:=YEAR(TODAY())-[.G438] -> 10 | L438: 2013 | M438: Akhand Jyoti Sansthan Haridwar | N438: shanti kunj haridwar
A439: 7061 | B439: Shriram sharma | C439: atma gyan v atma katha | D439: 1 | E439: 4 | F439: of:=[.E439]*[.D439] -> 4 | G439: 2015 | I439: of:=YEAR(TODAY())-[.G439] -> 10 | L439: 2013 | M439: Akhand Jyoti Sansthan Haridwar | N439: shanti kunj haridwar
A440: 7062 | B440: Shriram sharma | C440: swadyay aur satsang | D440: 1 | E440: 4 | F440: of:=[.E440]*[.D440] -> 4 | G440: 2015 | I440: of:=YEAR(TODAY())-[.G440] -> 10 | L440: 2015 | M440: Akhand Jyoti Sansthan Haridwar | N440: shanti kunj haridwar
A441: 7063 | B441: Shriram sharma | C441: udarta v dur darshita | D441: 1 | E441: 4 | F441: of:=[.E441]*[.D441] -> 4 | G441: 2015 | I441: of:=YEAR(TODAY())-[.G441] -> 10 | L441: 2013 | M441: Akhand Jyoti Sansthan Haridwar | N441: shanti kunj haridwar
A442: 7064 | B442: Shriram sharma | C442: darma ki sudradh dharna | D442: 1 | E442: 4 | F442: of:=[.E442]*[.D442] -> 4 | G442: 2015 | I442: of:=YEAR(TODAY())-[.G442] -> 10 | L442: 2010 | M442: Akhand Jyoti Sansthan Haridwar | N442: shanti kunj haridwar
A443: 7065 | B443: Shriram sharma | C443: suraksa swasth ki raksa parkarti ke anusaran se kare | D443: 1 | E443: 4 | F443: of:=[.E443]*[.D443] -> 4 | G443: 2015 | I443: of:=YEAR(TODAY())-[.G443] -> 10 | L443: 2011 | M443: Akhand Jyoti Sansthan Haridwar | N443: shanti kunj haridwar
A444: 7066 | B444: Shriram sharma | C444: pragyabhiyan me yog vyayam | D444: 1 | E444: 4 | F444: of:=[.E444]*[.D444] -> 4 | G444: 2015 | I444: of:=YEAR(TODAY())-[.G444] -> 10 | L444: 2011 | M444: Akhand Jyoti Sansthan Haridwar | N444: shanti kunj haridwar
A445: 7067 | B445: Shriram sharma | C445: gamlo me swasth | D445: 1 | E445: 9 | F445: of:=[.E445]*[.D445] -> 9 | G445: 2015 | I445: of:=YEAR(TODAY())-[.G445] -> 10 | L445: 2014 | M445: Akhand Jyoti Sansthan Haridwar | N445: shanti kunj haridwar
A446: 7069 | B446: Shriram sharma | C446: vicharo ki sarjanatamak sakti | D446: 1 | E446: 7 | F446: of:=[.E446]*[.D446] -> 7 | G446: 2015 | I446: of:=YEAR(TODAY())-[.G446] -> 10 | L446: 2015 | M446: Akhand Jyoti Sansthan Haridwar | N446: shanti kunj haridwar
A447: 7070 | B447: Shriram sharma | C447: ham durbal nhi sakti Sali bane | D447: 1 | E447: 6 | F447: of:=[.E447]*[.D447] -> 6 | G447: 2015 | I447: of:=YEAR(TODAY())-[.G447] -> 10 | L447: 2013 | M447: Akhand Jyoti Sansthan Haridwar | N447: shanti kunj haridwar
A448: 7071 | B448: Shriram sharma | C448: vak sakti aur niyojana | D448: 1 | E448: 4 | F448: of:=[.E448]*[.D448] -> 4 | G448: 2015 | I448: of:=YEAR(TODAY())-[.G448] -> 10 | L448: 2012 | M448: Akhand Jyoti Sansthan Haridwar | N448: shanti kunj haridwar
A449: 7072 | B449: Shriram sharma | C449: mitarta kre soch samaj kar | D449: 1 | E449: 12 | F449: of:=[.E449]*[.D449] -> 12 | G449: 2015 | I449: of:=YEAR(TODAY())-[.G449] -> 10 | L449: 2014 | M449: Akhand Jyoti Sansthan Haridwar | N449: shanti kunj haridwar
A450: 7073 | B450: Shriram sharma | C450: kathinayo ki kasoti pe khare utre | D450: 1 | E450: 4 | F450: of:=[.E450]*[.D450] -> 4 | G450: 2015 | I450: of:=YEAR(TODAY())-[.G450] -> 10 | L450: 2013 | M450: Akhand Jyoti Sansthan Haridwar | N450: shanti kunj haridwar
A451: 7075 | B451: Shriram sharma | C451: buraeyo ke andhkar me unati ke kirne | D451: 1 | E451: 6 | F451: of:=[.E451]*[.D451] -> 6 | G451: 2015 | I451: of:=YEAR(TODAY())-[.G451] -> 10 | L451: 2010 | M451: Akhand Jyoti Sansthan Haridwar | N451: shanti kunj haridwar
A452: 7077 | B452: Shriram sharma | C452: parkarti ki parsanata se jude | D452: 1 | E452: 12 | F452: of:=[.E452]*[.D452] -> 12 | G452: 2015 | I452: of:=YEAR(TODAY())-[.G452] -> 10 | L452: 2013 | M452: Akhand Jyoti Sansthan Haridwar | N452: shanti kunj haridwar
A453: 7078 | B453: Shriram sharma | C453: nirasa ko pas bhatakne na de | D453: 1 | E453: 4 | F453: of:=[.E453]*[.D453] -> 4 | G453: 2015 | I453: of:=YEAR(TODAY())-[.G453] -> 10 | L453: 2014 | M453: Akhand Jyoti Sansthan Haridwar | N453: shanti kunj haridwar
A454: 7079 | B454: Shriram sharma | C454: do mahan avlamb atmsakti | D454: 1 | E454: 10 | F454: of:=[.E454]*[.D454] -> 10 | G454: 2015 | I454: of:=YEAR(TODAY())-[.G454] -> 10 | L454: 2011 | M454: Akhand Jyoti Sansthan Haridwar | N454: shanti kunj haridwar
A455: 7080 | B455: Shriram sharma | C455: ham bhagyavdi nhi karmavadi bne | D455: 1 | E455: 4 | F455: of:=[.E455]*[.D455] -> 4 | G455: 2015 | I455: of:=YEAR(TODAY())-[.G455] -> 10 | L455: 2014 | M455: Akhand Jyoti Sansthan Haridwar | N455: shanti kunj haridwar
A456: 7081 | B456: Shriram sharma | C456: pariskrit vyaktitva ek uplabdhi | D456: 1 | E456: 7 | F456: of:=[.E456]*[.D456] -> 7 | G456: 2015 | I456: of:=YEAR(TODAY())-[.G456] -> 10 | L456: 2013 | M456: Akhand Jyoti Sansthan Haridwar | N456: shanti kunj haridwar
A457: 7082 | B457: Shriram sharma | C457: vartaman chunoti v yuva warg | D457: 1 | E457: 6 | F457: of:=[.E457]*[.D457] -> 6 | G457: 2015 | I457: of:=YEAR(TODAY())-[.G457] -> 10 | L457: 2014 | M457: Akhand Jyoti Sansthan Haridwar | N457: shanti kunj haridwar
A458: 7083 | B458: Shriram sharma | C458: hare na himmat | D458: 1 | E458: 3 | F458: of:=[.E458]*[.D458] -> 3 | G458: 2015 | I458: of:=YEAR(TODAY())-[.G458] -> 10 | L458: 2014 | M458: Akhand Jyoti Sansthan Haridwar | N458: shanti kunj haridwar
A459: 7084 | B459: Shriram sharma | C459: hare na himmat | D459: 1 | E459: 10 | F459: of:=[.E459]*[.D459] -> 10 | G459: 2015 | I459: of:=YEAR(TODAY())-[.G459] -> 10 | L459: 2011 | M459: Akhand Jyoti Sansthan Haridwar | N459: shanti kunj haridwar
A460: 7085 | B460: Shriram sharma | C460: jivan sadhan ke sopan | D460: 1 | E460: 7 | F460: of:=[.E460]*[.D460] -> 7 | G460: 2015 | I460: of:=YEAR(TODAY())-[.G460] -> 10 | L460: 2013 | M460: Akhand Jyoti Sansthan Haridwar | N460: shanti kunj haridwar
A461: 7087 | B461: Shriram sharma | C461: avsar prasikshan academy | D461: 1 | E461: 7 | F461: of:=[.E461]*[.D461] -> 7 | G461: 2015 | I461: of:=YEAR(TODAY())-[.G461] -> 10 | L461: 2010 | M461: Akhand Jyoti Sansthan Haridwar | N461: shanti kunj haridwar
A462: 7089 | B462: Shriram sharma | C462: jila prishiksan academy | D462: 1 | E462: 90 | F462: of:=[.E462]*[.D462] -> 90 | G462: 2015 | I462: of:=YEAR(TODAY())-[.G462] -> 10 | L462: 2013 | M462: Akhand Jyoti Sansthan Haridwar | N462: shanti kunj haridwar
A463: 7090 | B463: Shriram sharma | C463: physical handbook | D463: 1 | E463: 17 | F463: of:=[.E463]*[.D463] -> 17 | G463: 2015 | I463: of:=YEAR(TODAY())-[.G463] -> 10 | L463: 2011 | M463: Akhand Jyoti Sansthan Haridwar | N463: shanti kunj haridwar
A464: 7095 | B464: Shriram sharma | C464: vhavarik vedant ke parcharak | D464: 1 | E464: 6 | F464: of:=[.E464]*[.D464] -> 6 | G464: 2015 | I464: of:=YEAR(TODAY())-[.G464] -> 10 | L464: 2011 | M464: Akhand Jyoti Sansthan Haridwar | N464: shanti kunj haridwar
A465: 7096 | B465: Shriram sharma | C465: maharni ahilya bai | D465: 1 | E465: 6 | F465: of:=[.E465]*[.D465] -> 6 | G465: 2015 | I465: of:=YEAR(TODAY())-[.G465] -> 10 | L465: 2013 | M465: Akhand Jyoti Sansthan Haridwar | N465: shanti kunj haridwar
A466: 7156 | B466: N Krishna Swami | C466: enistein papers | D466: 1 | E466: 50 | F466: of:=[.E466]*[.D466] -> 50 | G466: 2015 | I466: of:=YEAR(TODAY())-[.G466] -> 10 | L466: 2015 | M466: c.v. Natarajan offical trust | N466: india now foundation
A467: 7178 | B467: Anant Rai | C467: stories of rama | D467: 1 | E467: 225 | F467: of:=[.E467]*[.D467] -> 225 | G467: 2015 | I467: of:=YEAR(TODAY())-[.G467] -> 10 | L467: 2015 | M467: c.v. Natarajan offical trust | N467: india now foundation
A468: 7181 | B468: Anant Rai | C468: stories of shiva | D468: 1 | E468: 225 | F468: of:=[.E468]*[.D468] -> 225 | G468: 2015 | I468: of:=YEAR(TODAY())-[.G468] -> 10 | L468: 2015 | M468: A.c.k delhi | N468: india now foundation
A469: 7200 | B469: Anant Rai | C469: Tales of revolutionary Aryans | D469: 1 | E469: 225 | F469: of:=[.E469]*[.D469] -> 225 | G469: 2015 | I469: of:=YEAR(TODAY())-[.G469] -> 10 | L469: 2015 | M469: A.c.k delhi | N469: india now foundation
A470: 7664 | B470: Sanskrit Bharti | C470: Kallika | D470: 1 | E470: 50 | F470: of:=[.E470]*[.D470] -> 50 | G470: 2015 | I470: of:=YEAR(TODAY())-[.G470] -> 10 | L470: 2015 | M470: nvs lucknow | N470: sanskrit bharti delhi
A471: 9185 | B471: CNR Rao | C471: Rashayan Vigyan ki duniya | D471: 1 | E471: 335 | F471: of:=[.E471]*[.D471] -> 335 | G471: 2017 | I471: of:=YEAR(TODAY())-[.G471] -> 8 | L471: 2017 | M471: National Books Trust | N471: National Books Trust
A472: 9209 | B472: Pushpa mist Bhargava | C472: devdoot saitan or vigyan | D472: 1 | E472: 215 | F472: of:=[.E472]*[.D472] -> 215 | G472: 2017 | I472: of:=YEAR(TODAY())-[.G472] -> 8 | L472: 2017 | M472: National Books Trust | N472: National Books Trust
A473: 9215 | B473: Mahesh dubey | C473: Adbhut jivan v vilakshan gadit | D473: 1 | E473: 205 | F473: of:=[.E473]*[.D473] -> 205 | G473: 2017 | I473: of:=YEAR(TODAY())-[.G473] -> 8 | L473: 2017 | M473: National Books Trust | N473: National Books Trust
A474: 9217 | B474: Namber singh | C474: Premchandra pratiniti sankalan | D474: 1 | E474: 70 | F474: of:=[.E474]*[.D474] -> 70 | G474: 2017 | I474: of:=YEAR(TODAY())-[.G474] -> 8 | L474: 2017 | M474: National Books Trust | N474: National Books Trust
A475: 9231 | B475: Aman vashu | C475: Humara paryavaran | D475: 1 | E475: 105 | F475: of:=[.E475]*[.D475] -> 105 | G475: 2017 | I475: of:=YEAR(TODAY())-[.G475] -> 8 | L475: 2017 | M475: National Books Trust | N475: National Books Trust
A476: 9233 | B476: Variden hem | C476: Mithak manushya | D476: 1 | E476: 135 | F476: of:=[.E476]*[.D476] -> 135 | G476: 2017 | I476: of:=YEAR(TODAY())-[.G476] -> 8 | L476: 2017 | M476: National Books Trust | N476: National Books Trust
A477: 9238 | B477: Ila Tripathi | C477: Deen dayal upadhyay yogdan | D477: 1 | E477: 215 | F477: of:=[.E477]*[.D477] -> 215 | G477: 2017 | I477: of:=YEAR(TODAY())-[.G477] -> 8 | L477: 2017 | M477: National Books Trust | N477: National Books Trust
A478: 9242 | B478: Jainth narilikar | C478: krishn viver | D478: 1 | E478: 65 | F478: of:=[.E478]*[.D478] -> 65 | G478: 2017 | I478: of:=YEAR(TODAY())-[.G478] -> 8 | L478: 2017 | M478: National Books Trust | N478: National Books Trust
A479: 9247 | B479: R Boss | C479: Subhash chandr boss | D479: 1 | E479: 80 | F479: of:=[.E479]*[.D479] -> 80 | G479: 2017 | I479: of:=YEAR(TODAY())-[.G479] -> 8 | L479: 2017 | M479: National Books Trust | N479: National Books Trust

Sheet: combined_weedout_list_938books
A1: Acc No. | B1: Author | C1: Title | D1: Quantity | E1: Cost per Unit | F1: Total Cost | G1: Yr. of Purchase | H1: Stock Register Pg. No. | I1: Life Span (yrs) | J1: Depreciated Value | K1: Justification by Stock Holder | L1: Yr. of Publishing | M1: Source | N1: Publisher
A2: 2 | B2: jk"Vªh; f'k{kd | C2: f'k{kd vkSj lekt | D2: 1 | E2: 53 | F2: of:=[.E2]*[.D2] -> 53 | G2: 1994 | I2: of:=YEAR(TODAY())-[.G2] -> 31 | L2: 1985 | M2: NCERT Delhi | N2: {ks=h; dk;kZy; y[kuÅ | P2: 1994 | Q2: of:=SUMIF([.$G$2:.$G$2000]; [.P2]; [.$F$2:.$F$2000]) -> 2365.75
A3: 3 | B3: vk;ksxu dh fjiksZV | D3: 1 | E3: 50 | F3: of:=[.E3]*[.D3] -> 50 | G3: 1994 | I3: of:=YEAR(TODAY())-[.G3] -> 31 | L3: 1987 | M3: NCERT Delhi | N3: {ks=h; dk;kZy; y[kuÅ | P3: 1995 | Q3: of:=SUMIF([.$G$2:.$G$2000]; [.P3]; [.$F$2:.$F$2000]) -> 2139.4
A4: 5 | B4: Mk0 ghjkyky nhf{kr | C4: vkpk;Z ds'ko nkl | D4: 1 | E4: 27.5 | F4: of:=[.E4]*[.D4] -> 27.5 | G4: 1994 | I4: of:=YEAR(TODAY())-[.G4] -> 31 | L4: 1985 | M4: NCERT Delhi | N4: {ks=h; dk;kZy; y[kuÅ | P4: 1996 | Q4: of:=SUMIF([.$G$2:.$G$2000]; [.P4]; [.$F$2:.$F$2000]) -> 4392.3
A5: 6 | B5: ,e0ih iafMr | C5: xzh vjfoUn | D5: 1 | E5: 30 | F5: of:=[.E5]*[.D5] -> 30 | G5: 1994 | I5: of:=YEAR(TODAY())-[.G5] -> 31 | L5: 2007 | M5: NCERT Delhi | N5: {ks=h; dk;kZy; y[kuÅ | P5: 1997 | Q5: of:=SUMIF([.$G$2:.$G$2000]; [.P5]; [.$F$2:.$F$2000]) -> 2036.6
A6: 7 | B6: Mk0 lE;w izlkn | C6: AKBARI DARBAR KE HINDI KAVI | D6: 1 | E6: 40 | F6: of:=[.E6]*[.D6] -> 40 | G6: 1994 | I6: of:=YEAR(TODAY())-[.G6] -> 31 | L6: 1990 | M6: NCERT Delhi | N6: {ks=h; dk;kZy; y[kuÅ | P6: 1998 | Q6: of:=SUMIF([.$G$2:.$G$2000]; [.P6]; [.$F$2:.$F$2000]) -> 2496.5
A7: 10 | B7: ?kuifr ik.Ms; | C7: Lokeh n;kuUn ljLorh | D7: 1 | E7: 70 | F7: of:=[.E7]*[.D7] -> 70 | G7: 1994 | I7: of:=YEAR(TODAY())-[.G7] -> 31 | L7: 1993 | M7: NCERT Delhi | N7: {ks=h; dk;kZy; y[kuÅ | P7: 1999 | Q7: of:=SUMIF([.$G$2:.$G$2000]; [.P7]; [.$F$2:.$F$2000]) -> 1834
A8: 12 | B8: Hkxorh 'kj.k flag | C8: vkpk;Z ujsUnz nso | D8: 1 | E8: 11 | F8: of:=[.E8]*[.D8] -> 11 | G8: 1994 | I8: of:=YEAR(TODAY())-[.G8] -> 31 | L8: 1980 | M8: NCERT Delhi | N8: {ks=h; dk;kZy; y[kuÅ | P8: 2000 | Q8: of:=SUMIF([.$G$2:.$G$2000]; [.P8]; [.$F$2:.$F$2000]) -> 1164
A9: 13 | B9: ch0 ,l0 ldyk okyk | C9: telsnuh rkjk | D9: 1 | E9: 27 | F9: of:=[.E9]*[.D9] -> 27 | G9: 1994 | I9: of:=YEAR(TODAY())-[.G9] -> 31 | L9: 1987 | M9: NCERT Delhi | N9: {ks=h; dk;kZy; y[kuÅ | P9: 2001 | Q9: of:=SUMIF([.$G$2:.$G$2000]; [.P9]; [.$F$2:.$F$2000]) -> 2695
A10: 14 | B10: oh0,l0 ukjk;.k jk; | C10: Mk0 ,u0,l0gkfMdj | D10: 1 | E10: 15.25 | F10: of:=[.E10]*[.D10] -> 15.25 | G10: 1994 | I10: of:=YEAR(TODAY())-[.G10] -> 31 | L10: 1985 | M10: NCERT Delhi | N10: {ks=h; dk;kZy; y[kuÅ | P10: 2002 | Q10: of:=SUMIF([.$G$2:.$G$2000]; [.P10]; [.$F$2:.$F$2000]) -> 1608
A11: 18 | B11: Jh cky'kkSfj | C11: rsyxq lkfgR;k dk bfrgkl | D11: 1 | E11: 4 | F11: of:=[.E11]*[.D11] -> 4 | G11: 1994 | I11: of:=YEAR(TODAY())-[.G11] -> 31 | L11: 1972 | M11: NCERT Delhi | N11: {ks=h; dk;kZy; y[kuÅ | P11: 2003 | Q11: of:=SUMIF([.$G$2:.$G$2000]; [.P11]; [.$F$2:.$F$2000]) -> 3656
A12: 19 | B12: Mk0 ds Hkkldj | C12: ey;kye lkfgR; dk bfrgkl | D12: 1 | E12: 9 | F12: of:=[.E12]*[.D12] -> 9 | G12: 1994 | I12: of:=YEAR(TODAY())-[.G12] -> 31 | L12: 1979 | M12: NCERT Delhi | N12: {ks=h; dk;kZy; y[kuÅ | P12: 2004 | Q12: of:=SUMIF([.$G$2:.$G$2000]; [.P12]; [.$F$2:.$F$2000]) -> 275
A13: 20 | B13: ,l0ds cksl | C13: ofdaepUnz pVthZ | D13: 1 | E13: 17 | F13: of:=[.E13]*[.D13] -> 17 | G13: 1994 | I13: of:=YEAR(TODAY())-[.G13] -> 31 | L13: 1984 | M13: NCERT Delhi | N13: {ks=h; dk;kZy; y[kuÅ | P13: 2005 | Q13: of:=SUMIF([.$G$2:.$G$2000]; [.P13]; [.$F$2:.$F$2000]) -> 2776
A14: 21 | B14: vkj0ikFkZ lkjFkh | C14: ,l lR;ewfrZ | D14: 1 | E14: 4.5 | F14: of:=[.E14]*[.D14] -> 4.5 | G14: 1994 | I14: of:=YEAR(TODAY())-[.G14] -> 31 | L14: 1974 | M14: NCERT Delhi | N14: {ks=h; dk;kZy; y[kuÅ | P14: 2006 | Q14: of:=SUMIF([.$G$2:.$G$2000]; [.P14]; [.$F$2:.$F$2000]) -> 4534
A15: 22 | B15: Vh0,u0 txnh'ku | C15: Jhfuokl 'kkL=h | D15: 1 | E15: 20 | F15: of:=[.E15]*[.D15] -> 20 | G15: 1994 | I15: of:=YEAR(TODAY())-[.G15] -> 31 | L15: 1992 | M15: NCERT Delhi | N15: {ks=h; dk;kZy; y[kuÅ | P15: 2007 | Q15: of:=SUMIF([.$G$2:.$G$2000]; [.P15]; [.$F$2:.$F$2000]) -> 285
A16: 26 | B16: fu0 lk/ku cksl | C16: jkekuUn pVksi/;k; | D16: 1 | E16: 11 | F16: of:=[.E16]*[.D16] -> 11 | G16: 1994 | I16: of:=YEAR(TODAY())-[.G16] -> 31 | L16: 1882 | M16: NCERT Delhi | N16: {ks=h; dk;kZy; y[kuÅ | P16: 2008 | Q16: of:=SUMIF([.$G$2:.$G$2000]; [.P16]; [.$F$2:.$F$2000]) -> 670
A17: 28 | B17: t0d``n d".knso | C17: xqtjkrh lkfgR; dk bfrgkl | D17: 1 | E17: 90 | F17: of:=[.E17]*[.D17] -> 90 | G17: 1994 | I17: of:=YEAR(TODAY())-[.G17] -> 31 | L17: 1993 | M17: NCERT Delhi | N17: {ks=h; dk;kZy; y[kuÅ | P17: 2009 | Q17: of:=SUMIF([.$G$2:.$G$2000]; [.P17]; [.$F$2:.$F$2000]) -> 1015
A18: 29 | B18: e/kqdj fn?ks | C18: iwokZpay dh vksj | D18: 1 | E18: 17.5 | F18: of:=[.E18]*[.D18] -> 17.5 | G18: 1994 | I18: of:=YEAR(TODAY())-[.G18] -> 31 | L18: 1985 | M18: NCERT Delhi | N18: {ks=h; dk;kZy; y[kuÅ | P18: 2010 | Q18: of:=SUMIF([.$G$2:.$G$2000]; [.P18]; [.$F$2:.$F$2000]) -> 1593
A19: 33 | B19: ,e0,l0,u0psfV;kj | C19: rfeyukMq yksd laLd`fr | D19: 1 | E19: 11 | F19: of:=[.E19]*[.D19] -> 11 | G19: 1994 | I19: of:=YEAR(TODAY())-[.G19] -> 31 | L19: 1982 | M19: NCERT Delhi | N19: {ks=h; dk;kZy; y[kuÅ | P19: 2011 | Q19: of:=SUMIF([.$G$2:.$G$2000]; [.P19]; [.$F$2:.$F$2000]) -> 1939
A20: 34 | B20: dsih,l esuu | C20: lh 'kdju uk;j | D20: 1 | E20: 19 | F20: of:=[.E20]*[.D20] -> 19 | G20: 1994 | I20: of:=YEAR(TODAY())-[.G20] -> 31 | L20: 1977 | M20: NCERT Delhi | N20: {ks=h; dk;kZy; y[kuÅ | P20: 2012 | Q20: of:=SUMIF([.$G$2:.$G$2000]; [.P20]; [.$F$2:.$F$2000]) -> 5906
A21: 36 | B21: Mk0 gfjny | C21: x<+okyh Hkk"kk | D21: 1 | E21: 15 | F21: of:=[.E21]*[.D21] -> 15 | G21: 1994 | I21: of:=YEAR(TODAY())-[.G21] -> 31 | L21: 1980 | M21: NCERT Delhi | N21: {ks=h; dk;kZy; y[kuÅ | P21: 2013 | Q21: of:=SUMIF([.$G$2:.$G$2000]; [.P21]; [.$F$2:.$F$2000]) -> 4979
A22: 42 | B22: Jh lqnkjkuh | C22: xksLokeh rqylhnkl | D22: 1 | E22: 8 | F22: of:=[.E22]*[.D22] -> 8 | G22: 1994 | I22: of:=YEAR(TODAY())-[.G22] -> 31 | L22: 1972 | M22: NCERT Delhi | N22: {ks=h; dk;kZy; y[kuÅ | P22: 2014 | Q22: of:=SUMIF([.$G$2:.$G$2000]; [.P22]; [.$F$2:.$F$2000]) -> 8479
A23: 47 | B23: u0fd'kksj uojRu | C23: egkohj izlkn f}osnh | D23: 1 | E23: 15 | F23: of:=[.E23]*[.D23] -> 15 | G23: 1994 | I23: of:=YEAR(TODAY())-[.G23] -> 31 | L23: 1985 | M23: NCERT Delhi | N23: {ks=h; dk;kZy; y[kuÅ | P23: 2015 | Q23: of:=SUMIF([.$G$2:.$G$2000]; [.P23]; [.$F$2:.$F$2000]) -> 3745
A24: 51 | B24: izfrHkk vxzoky | C24: eksgu jkds'k | D24: 1 | E24: 16 | F24: of:=[.E24]*[.D24] -> 16 | G24: 1994 | I24: of:=YEAR(TODAY())-[.G24] -> 31 | L24: 1985 | M24: NCERT Delhi | N24: {ks=h; dk;kZy; y[kuÅ | P24: 2016 | Q24: of:=SUMIF([.$G$2:.$G$2000]; [.P24]; [.$F$2:.$F$2000]) -> 35
A25: 52 | B25: dRrfj flag | C25: Kkuh xq:eq[k | D25: 1 | E25: 12 | F25: of:=[.E25]*[.D25] -> 12 | G25: 1994 | I25: of:=YEAR(TODAY())-[.G25] -> 31 | L25: 1988 | M25: NCERT Delhi | N25: {ks=h; dk;kZy; y[kuÅ | P25: 2017 | Q25: of:=SUMIF([.$G$2:.$G$2000]; [.P25]; [.$F$2:.$F$2000]) -> 1425
A26: 53 | B26: ek0 papjhd | C26: egkRek T;ksfrok | D26: 1 | E26: 15 | F26: of:=[.E26]*[.D26] -> 15 | G26: 1994 | I26: of:=YEAR(TODAY())-[.G26] -> 31 | L26: 1991 | M26: NCERT Delhi | N26: {ks=h; dk;kZy; y[kuÅ | P26: 2018 | Q26: of:=SUMIF([.$G$2:.$G$2000]; [.P26]; [.$F$2:.$F$2000]) -> 0
A27: 54 | B27: Mk0 n'kjFk | C27: vkfn 'kadjkp;Z | D27: 1 | E27: 11 | F27: of:=[.E27]*[.D27] -> 11 | G27: 1994 | I27: of:=YEAR(TODAY())-[.G27] -> 31 | L27: 1992 | M27: NCERT Delhi | N27: {ks=h; dk;kZy; y[kuÅ | P27: 2019 | Q27: of:=SUMIF([.$G$2:.$G$2000]; [.P27]; [.$F$2:.$F$2000]) -> 0
A28: 58 | B28: ve`r jk; | C28: izse pUn | D28: 1 | E28: 15 | F28: of:=[.E28]*[.D28] -> 15 | G28: 1994 | I28: of:=YEAR(TODAY())-[.G28] -> 31 | L28: 1984 | M28: NCERT Delhi | N28: {ks=h; dk;kZy; y[kuÅ | P28: 2020 | Q28: of:=SUMIF([.$G$2:.$G$2000]; [.P28]; [.$F$2:.$F$2000]) -> 0
A29: 60 | B29: lqjsUnz pkSnjh] lqjs'k jke | C29: Q.kh'oj ukFk] Jhfuokl | D29: 1 | E29: 9 | F29: of:=[.E29]*[.D29] -> 9 | G29: 1994 | I29: of:=YEAR(TODAY())-[.G29] -> 31 | L29: 1972 | M29: NCERT Delhi | N29: {ks=h; dk;kZy; y[kuÅ | P29: 2021 | Q29: of:=SUMIF([.$G$2:.$G$2000]; [.P29]; [.$F$2:.$F$2000]) -> 0
A30: 61 | B30: Vh0,e0 ih0 egknsou | C30: Shankaracharya | D30: 1 | E30: 9 | F30: of:=[.E30]*[.D30] -> 9 | G30: 1994 | I30: of:=YEAR(TODAY())-[.G30] -> 31 | L30: 1968 | M30: NCERT Delhi | N30: {ks=h; dk;kZy; y[kuÅ | P30: 2022 | Q30: of:=SUMIF([.$G$2:.$G$2000]; [.P30]; [.$F$2:.$F$2000]) -> 0
A31: 62 | B31: izHkkdj ekpos | C31: rahul sankrityanand | D31: 1 | E31: 15 | F31: of:=[.E31]*[.D31] -> 15 | G31: 1994 | I31: of:=YEAR(TODAY())-[.G31] -> 31 | L31: 1990 | M31: NCERT Delhi | N31: {ks=h; dk;kZy; y[kuÅ | P31: 2023 | Q31: of:=SUMIF([.$G$2:.$G$2000]; [.P31]; [.$F$2:.$F$2000]) -> 0
A32: 65 | B32: jke o{k | C32: daadu dayal | D32: 1 | E32: 15 | F32: of:=[.E32]*[.D32] -> 15 | G32: 1994 | I32: of:=YEAR(TODAY())-[.G32] -> 31 | L32: 1991 | M32: NCERT Delhi | N32: {ks=h; dk;kZy; y[kuÅ | P32: 2024 | Q32: of:=SUMIF([.$G$2:.$G$2000]; [.P32]; [.$F$2:.$F$2000]) -> 0
A33: 66 | D33: 1 | E33: 15 | F33: of:=[.E33]*[.D33] -> 15 | G33: 1994 | I33: of:=YEAR(TODAY())-[.G33] -> 31 | L33: 1990 | M33: NCERT Delhi | N33: {ks=h; dk;kZy; y[kuÅ | P33: 2025 | Q33: of:=SUMIF([.$G$2:.$G$2000]; [.P33]; [.$F$2:.$F$2000]) -> 0
A34: 67 | B34: e/kqjs'k | C34: rangey raghav | D34: 1 | E34: 6 | F34: of:=[.E34]*[.D34] -> 6 | G34: 1994 | I34: of:=YEAR(TODAY())-[.G34] -> 31 | L34: 1973 | M34: NCERT Delhi | N34: {ks=h; dk;kZy; y[kuÅ
A35: 69 | B35: ekHkkfMiqqMh | C35: dr pattabhi sitaraman | D35: 1 | E35: 15 | F35: of:=[.E35]*[.D35] -> 15 | G35: 1994 | I35: of:=YEAR(TODAY())-[.G35] -> 31 | L35: 1990 | M35: NCERT Delhi | N35: {ks=h; dk;kZy; y[kuÅ
A36: 71 | B36: fot;sUnzz | C36: shri vallabha charya | D36: 1 | E36: 6 | F36: of:=[.E36]*[.D36] -> 6 | G36: 1994 | I36: of:=YEAR(TODAY())-[.G36] -> 31 | L36: 1973 | M36: NCERT Delhi | N36: {ks=h; dk;kZy; y[kuÅ
A37: 73 | B37: izse 'kadj | C37: nanhe dulare bajpeyi | D37: 1 | E37: 15 | F37: of:=[.E37]*[.D37] -> 15 | G37: 1994 | I37: of:=YEAR(TODAY())-[.G37] -> 31 | L37: 1981 | M37: NCERT Delhi | N37: {ks=h; dk;kZy; y[kuÅ
A38: 75 | B38: fo".kqny 'kekZ | C38: surya mal mishran | D38: 1 | E38: 15 | F38: of:=[.E38]*[.D38] -> 15 | G38: 1994 | I38: of:=YEAR(TODAY())-[.G38] -> 31 | L38: 1990 | M38: NCERT Delhi | N38: {ks=h; dk;kZy; y[kuÅ
A39: 76 | B39: d`".k ny | C39: sumitra nandan pant | D39: 1 | E39: 15 | F39: of:=[.E39]*[.D39] -> 15 | G39: 1994 | I39: of:=YEAR(TODAY())-[.G39] -> 31 | L39: 1982 | M39: NCERT Delhi | N39: {ks=h; dk;kZy; y[kuÅ
A40: 79 | B40: jes'k pUnz | C40: jay shanker prasad | D40: 1 | E40: 15 | F40: of:=[.E40]*[.D40] -> 15 | G40: 1994 | I40: of:=YEAR(TODAY())-[.G40] -> 31 | L40: 1990 | M40: NCERT Delhi | N40: {ks=h; dk;kZy; y[kuÅ
A41: 80 | B41: enu xks;y | C41: baalmukund | D41: 1 | E41: 15 | F41: of:=[.E41]*[.D41] -> 15 | G41: 1994 | I41: of:=YEAR(TODAY())-[.G41] -> 31 | L41: 1991 | M41: NCERT Delhi | N41: {ks=h; dk;kZy; y[kuÅ
A42: 88 | C42: ljkstuh uk;Mw | D42: 1 | E42: 10 | F42: of:=[.E42]*[.D42] -> 10 | G42: 1994 | I42: of:=YEAR(TODAY())-[.G42] -> 31 | L42: 1991 | M42: NCERT Delhi | N42: {ks=h; dk;kZy; y[kuÅ
A43: 90 | B43: kSy xqIrk] vy;k ikBd | C43: ehjk ogu] dLrqjck xka/kh | D43: 1 | E43: 9 | F43: of:=[.E43]*[.D43] -> 9 | G43: 1994 | I43: of:=YEAR(TODAY())-[.G43] -> 31 | L43: 1990 | M43: NCERT Delhi | N43: {ks=h; dk;kZy; y[kuÅ
A44: 91 | B44: izks0 Mh0 ih PkVVksik?;k; | C44: f'k{kd vkSj lekt | D44: 1 | E44: 53 | F44: of:=[.E44]*[.D44] -> 53 | G44: 1994 | I44: of:=YEAR(TODAY())-[.G44] -> 31 | L44: 1983-85 | M44: NCERT Delhi | N44: {ks=h; dk;kZy; y[kuÅ
A45: 92 | B45: fn0lh0 eqys | C45: LokLF; ,oa tula[;k | D45: 1 | F45: of:=[.E45]*[.D45] -> 0 | G45: 1994 | I45: of:=YEAR(TODAY())-[.G45] -> 31 | L45: 1992 | M45: NCERT Delhi | N45: {ks=h; dk;kZy; y[kuÅ
A46: 97 | B46: xksfoUnnkl | C46: v'kskd | D46: 1 | E46: 20 | F46: of:=[.E46]*[.D46] -> 20 | G46: 1994 | I46: of:=YEAR(TODAY())-[.G46] -> 31 | L46: 1990 | M46: NCERT Delhi | N46: {ks=h; dk;kZy; y[kuÅ
A47: 99 | B47: Mk0 xksfoUnnkl | C47: lqa[k fdlesa | D47: 1 | E47: 30 | F47: of:=[.E47]*[.D47] -> 30 | G47: 1994 | I47: of:=YEAR(TODAY())-[.G47] -> 31 | L47: 1990 | M47: NCERT Delhi | N47: {ks=h; dk;kZy; y[kuÅ
A48: 105 | B48: Mk0 xksfoUnnkl | C48: fodkl | D48: 1 | E48: 30 | F48: of:=[.E48]*[.D48] -> 30 | G48: 1994 | I48: of:=YEAR(TODAY())-[.G48] -> 31 | L48: 1990 | M48: NCERT Delhi | N48: {ks=h; dk;kZy; y[kuÅ
A49: 106 | B49: Mk0 xksfoUnnkl | C49: drZO; | D49: 1 | E49: 30 | F49: of:=[.E49]*[.D49] -> 30 | G49: 1994 | I49: of:=YEAR(TODAY())-[.G49] -> 31 | L49: 1990 | M49: NCERT Delhi | N49: {ks=h; dk;kZy; y[kuÅ
A50: 107 | B50: Mk0 xksfoUnnkl | C50: flagy ]}hi | D50: 1 | E50: 30 | F50: of:=[.E50]*[.D50] -> 30 | G50: 1994 | I50: of:=YEAR(TODAY())-[.G50] -> 31 | L50: 1990 | M50: NCERT Delhi | N50: {ks=h; dk;kZy; y[kuÅ
A51: 109 | B51: Mk0 xksfoUnnkl | C51: Hkfo";ok.kh | D51: 1 | E51: 40 | F51: of:=[.E51]*[.D51] -> 40 | G51: 1994 | I51: of:=YEAR(TODAY())-[.G51] -> 31 | L51: 1990 | M51: NCERT Delhi | N51: {ks=h; dk;kZy; y[kuÅ
A52: 110 | B52: e/kqdj fn?ks | C52: iwokZpay dh vksj | D52: 1 | E52: 90 | F52: of:=[.E52]*[.D52] -> 90 | G52: 1994 | I52: of:=YEAR(TODAY())-[.G52] -> 31 | L52: 1993 | M52: NCERT Delhi | N52: {ks=h; dk;kZy; y[kuÅ
A53: 116 | B53: Lokeh eqeq{kkuUn | C53: foosdkuUn lkfgR; 4 | D53: 1 | E53: 175 | F53: of:=[.E53]*[.D53] -> 175 | G53: 1994 | I53: of:=YEAR(TODAY())-[.G53] -> 31 | L53: 1993 | M53: NCERT Delhi | N53: {ks=h; dk;kZy; y[kuÅ
A54: 117 | B54: Lokeh eqeq{kkuUn | C54: foosdkuUn lkfgR; 5 | D54: 1 | E54: 175 | F54: of:=[.E54]*[.D54] -> 175 | G54: 1994 | I54: of:=YEAR(TODAY())-[.G54] -> 31 | L54: 1993 | M54: NCERT Delhi | N54: {ks=h; dk;kZy; y[kuÅ
A55: 118 | B55: Lokeh eqeq{kkuUn | C55: foosdkuUn lkfgR; 6 | D55: 1 | E55: 175 | F55: of:=[.E55]*[.D55] -> 175 | G55: 1994 | I55: of:=YEAR(TODAY())-[.G55] -> 31 | L55: 1993 | M55: NCERT Delhi | N55: {ks=h; dk;kZy; y[kuÅ
A56: 119 | B56: Lokeh eqeq{kkuUn | C56: foosdkuUn lkfgR; 7 | D56: 1 | E56: 175 | F56: of:=[.E56]*[.D56] -> 175 | G56: 1994 | I56: of:=YEAR(TODAY())-[.G56] -> 31 | L56: 1993 | M56: NCERT Delhi | N56: {ks=h; dk;kZy; y[kuÅ
A57: 120 | B57: Lokeh eqeq{kkuUn | C57: foosdkuUn lkfgR; 8 | D57: 1 | E57: 175 | F57: of:=[.E57]*[.D57] -> 175 | G57: 1994 | I57: of:=YEAR(TODAY())-[.G57] -> 31 | L57: 1993 | M57: NCERT Delhi | N57: {ks=h; dk;kZy; y[kuÅ
A58: 121 | B58: Lokeh eqeq{kkuUn | C58: foosdkuUn lkfgR; 9 | D58: 1 | E58: 175 | F58: of:=[.E58]*[.D58] -> 175 | G58: 1994 | I58: of:=YEAR(TODAY())-[.G58] -> 31 | L58: 1993 | M58: NCERT Delhi | N58: {ks=h; dk;kZy; y[kuÅ
A59: 122 | B59: Lokeh eqeq{kkuUn | C59: foosdkuUn lkfgR; 10 | D59: 1 | E59: 175 | F59: of:=[.E59]*[.D59] -> 175 | G59: 1994 | I59: of:=YEAR(TODAY())-[.G59] -> 31 | L59: 1993 | M59: NCERT Delhi | N59: {ks=h; dk;kZy; y[kuÅ
A60: 129 | B60: K.R. Srinivasan | C60: Temples of south India | D60: 1 | E60: 37 | F60: of:=[.E60]*[.D60] -> 37 | G60: 1995 | I60: of:=YEAR(TODAY())-[.G60] -> 30 | L60: 1972 | M60: N.B.T. | N60: Deepak Book agency
A61: 133 | B61: C.D. Gupta | C61: The C.of satyajit Ray | D61: 1 | E61: 44 | F61: of:=[.E61]*[.D61] -> 44 | G61: 1995 | I61: of:=YEAR(TODAY())-[.G61] -> 30 | L61: 1994 | M61: N.B.T. | N61: Deepak Book agency
A62: 143 | B62: K.A. Abbas | C62: HOW FILMS ARE MADE | D62: 1 | E62: 7 | F62: of:=[.E62]*[.D62] -> 7 | G62: 1995 | I62: of:=YEAR(TODAY())-[.G62] -> 30 | L62: 1977 | M62: N.B.T. | N62: Deepak Book agency
A63: 144 | B63: l. Majumdar | C63: The S. of our Rivers. (P-1) | D63: 1 | E63: 8 | F63: of:=[.E63]*[.D63] -> 8 | G63: 1995 | I63: of:=YEAR(TODAY())-[.G63] -> 30 | L63: 1970 | M63: N.B.T. | N63: Deepak Book agency
A64: 145 | B64: A.hayashi | C64: Hello Moon | D64: 1 | E64: 6 | F64: of:=[.E64]*[.D64] -> 6 | G64: 1995 | I64: of:=YEAR(TODAY())-[.G64] -> 30 | L64: 1986 | M64: N.B.T. | N64: Deepak Book agency
A65: 146 | B65: AL. Valliappa | C65: The S. of our Rivers. (P-2) | D65: 1 | E65: 7 | F65: of:=[.E65]*[.D65] -> 7 | G65: 1995 | I65: of:=YEAR(TODAY())-[.G65] -> 30 | L65: 1973 | M65: N.B.T. | N65: Deepak Book agency
A66: 147 | B66: R.Bond | C66: The W. of trees | D66: 1 | E66: 5 | F66: of:=[.E66]*[.D66] -> 5 | G66: 1995 | I66: of:=YEAR(TODAY())-[.G66] -> 30 | L66: 1975 | M66: N.B.T. | N66: Deepak Book agency
A67: 150 | B67: R. Bond | C67: W.W.at the zoo | D67: 1 | E67: 6 | F67: of:=[.E67]*[.D67] -> 6 | G67: 1995 | I67: of:=YEAR(TODAY())-[.G67] -> 30 | L67: 1974 | M67: N.B.T. | N67: Deepak Book agency
A68: 154 | B68: K. Satyanand | C68: The S. of the red cross | D68: 1 | E68: 6.5 | F68: of:=[.E68]*[.D68] -> 6.5 | G68: 1995 | I68: of:=YEAR(TODAY())-[.G68] -> 30 | L68: 1975 | M68: N.B.T. | N68: Deepak Book agency
A69: 157 | B69: N.Manuishakam | C69: Environmenttal Pollution | D69: 1 | E69: 30 | F69: of:=[.E69]*[.D69] -> 30 | G69: 1995 | I69: of:=YEAR(TODAY())-[.G69] -> 30 | L69: 1984 | M69: N.B.T. | N69: Deepak Book agency
A70: 164 | B70: K. Chaitanya | C70: H.I.W.H. Freedom | D70: 1 | E70: 10 | F70: of:=[.E70]*[.D70] -> 10 | G70: 1995 | I70: of:=YEAR(TODAY())-[.G70] -> 30 | L70: 1973 | M70: N.B.T. | N70: Deepak Book agency
A71: 166 | B71: K.B. | C71: Waiting for the rain | D71: 1 | E71: 7.5 | F71: of:=[.E71]*[.D71] -> 7.5 | G71: 1995 | I71: of:=YEAR(TODAY())-[.G71] -> 30 | L71: 1990 | M71: N.B.T. | N71: Deepak Book agency
A72: 167 | B72: Marti | C72: What is a tree | D72: 1 | E72: 7.5 | F72: of:=[.E72]*[.D72] -> 7.5 | G72: 1995 | I72: of:=YEAR(TODAY())-[.G72] -> 30 | L72: 1994 | M72: N.B.T. | N72: Deepak Book agency
A73: 168 | B73: P. Chakravati | C73: Our tree | D73: 1 | E73: 6.5 | F73: of:=[.E73]*[.D73] -> 6.5 | G73: 1995 | I73: of:=YEAR(TODAY())-[.G73] -> 30 | L73: 1985 | M73: N.B.T. | N73: Deepak Book agency
A74: 169 | B74: Rama | C74: Water | D74: 1 | E74: 8.5 | F74: of:=[.E74]*[.D74] -> 8.5 | G74: 1995 | I74: of:=YEAR(TODAY())-[.G74] -> 30 | L74: 1987 | M74: N.B.T. | N74: Deepak Book agency
A75: 170 | B75: K.S.Shekharam | C75: Our useful Plants | D75: 1 | E75: 8 | F75: of:=[.E75]*[.D75] -> 8 | G75: 1995 | I75: of:=YEAR(TODAY())-[.G75] -> 30 | L75: 1982 | M75: N.B.T. | N75: Deepak Book agency
A76: 172 | B76: J.Manokaran | C76: Sun flower & butterflies | D76: 1 | E76: 8.5 | F76: of:=[.E76]*[.D76] -> 8.5 | G76: 1995 | I76: of:=YEAR(TODAY())-[.G76] -> 30 | L76: 1993 | M76: N.B.T. | N76: Deepak Book agency
A77: 173 | B77: N.S, Gupta | C77: The beautiful peacock | D77: 1 | E77: 5 | F77: of:=[.E77]*[.D77] -> 5 | G77: 1995 | I77: of:=YEAR(TODAY())-[.G77] -> 30 | L77: 1988 | M77: N.B.T. | N77: Deepak Book agency
A78: 174 | B78: D.Dev | C78: The story of mango | D78: 1 | E78: 6 | F78: of:=[.E78]*[.D78] -> 6 | G78: 1995 | I78: of:=YEAR(TODAY())-[.G78] -> 30 | L78: 1993 | M78: N.B.T. | N78: Deepak Book agency
A79: 176 | B79: M.Mujeeb | C79: Dr. zakir Hussain | D79: 1 | E79: 10 | F79: of:=[.E79]*[.D79] -> 10 | G79: 1995 | I79: of:=YEAR(TODAY())-[.G79] -> 30 | M79: N.B.T. | N79: Deepak Book agency
A80: 177 | B80: S.Prakash | C80: Story of swargiya | D80: 1 | E80: 28 | F80: of:=[.E80]*[.D80] -> 28 | G80: 1995 | I80: of:=YEAR(TODAY())-[.G80] -> 30 | L80: 1973 | M80: N.B.T. | N80: Deepak Book agency
A81: 181 | B81: Amrit Rai | C81: Prem chanda | D81: 1 | E81: 5 | F81: of:=[.E81]*[.D81] -> 5 | G81: 1995 | I81: of:=YEAR(TODAY())-[.G81] -> 30 | L81: 1978 | M81: N.B.T. | N81: Deepak Book agency
A82: 185 | B82: Amrit Rai | C82: Festival of Eid | D82: 1 | E82: 5 | F82: of:=[.E82]*[.D82] -> 5 | G82: 1995 | I82: of:=YEAR(TODAY())-[.G82] -> 30 | L82: 1980 | M82: N.B.T. | N82: Deepak Book agency
A83: 186 | B83: S. Surti | C83: A visit to the zoo | D83: 1 | E83: 6.5 | F83: of:=[.E83]*[.D83] -> 6.5 | G83: 1995 | I83: of:=YEAR(TODAY())-[.G83] -> 30 | L83: 1991 | M83: N.B.T. | N83: Deepak Book agency
A84: 187 | B84: R. Paranjapa | C84: A story about water | D84: 1 | E84: 6 | F84: of:=[.E84]*[.D84] -> 6 | G84: 1995 | I84: of:=YEAR(TODAY())-[.G84] -> 30 | L84: 1992 | M84: N.B.T. | N84: Deepak Book agency
A85: 188 | B85: S. sharma | C85: a journey to Gomukha | D85: 1 | E85: 6 | F85: of:=[.E85]*[.D85] -> 6 | G85: 1995 | I85: of:=YEAR(TODAY())-[.G85] -> 30 | L85: 1987 | M85: N.B.T. | N85: Deepak Book agency
A86: 205 | B86: izhre flag | C86: egkjktk j.kthr flag | D86: 1 | E86: 5.5 | F86: of:=[.E86]*[.D86] -> 5.5 | G86: 1995 | I86: of:=YEAR(TODAY())-[.G86] -> 30 | L86: 1989 | M86: N.B.T. India | N86: Deepak Book agency
A87: 217 | B87: lnkf'ko okSfM;kj | C87: jkuh psUuEek | D87: 1 | E87: 10 | F87: of:=[.E87]*[.D87] -> 10 | G87: 1995 | I87: of:=YEAR(TODAY())-[.G87] -> 30 | L87: 1980 | M87: N.B.T. India | N87: Deepak Book agency
A88: 225 | B88: ,l-,- v;;j | C88: vktkn fgan QkSt dh dgkuh | D88: 1 | E88: 22 | F88: of:=[.E88]*[.D88] -> 22 | G88: 1995 | I88: of:=YEAR(TODAY())-[.G88] -> 30 | L88: 1972 | M88: N.B.T. India | N88: Deepak Book agency
A89: 227 | B89: T;ksfr"k nRr xqIr | C89: Hkjrh; U;kSgkj | D89: 1 | E89: 26 | F89: of:=[.E89]*[.D89] -> 26 | G89: 1995 | I89: of:=YEAR(TODAY())-[.G89] -> 30 | L89: 1983 | M89: N.B.T. India | N89: Deepak Book agency
A90: 229 | B90: v:Ik dqekj nRr | C90: pk; dh dgkuh | D90: 1 | E90: 5.5 | F90: of:=[.E90]*[.D90] -> 5.5 | G90: 1995 | I90: of:=YEAR(TODAY())-[.G90] -> 30 | L90: 1985 | M90: N.B.T. India | N90: Deepak Book agency
A91: 243 | B91: deyk 'kekZ | C91: vijkftrk | D91: 1 | E91: 11 | F91: of:=[.E91]*[.D91] -> 11 | G91: 1995 | I91: of:=YEAR(TODAY())-[.G91] -> 30 | L91: 1990 | M91: C.B.T.India | N91: Deepak Book agency
A92: 244 | B92: czts'oj cekZ | C92: lwjnkl | D92: 1 | E92: 8 | F92: of:=[.E92]*[.D92] -> 8 | G92: 1995 | I92: of:=YEAR(TODAY())-[.G92] -> 30 | L92: 1969 | M92: C.B.T.India | N92: Deepak Book agency
A93: 253 | B93: jktsUnz'kadj HkVV | C93: egkjk.kk izrki | D93: 1 | E93: 12 | F93: of:=[.E93]*[.D93] -> 12 | G93: 1995 | I93: of:=YEAR(TODAY())-[.G93] -> 30 | L93: 1967 | M93: N.B.T. India | N93: Deepak Book agency
A94: 255 | B94: vkj-ds izHkq | C94: egkRek xka/kh ds fopkj | D94: 1 | E94: 76 | F94: of:=[.E94]*[.D94] -> 76 | G94: 1995 | I94: of:=YEAR(TODAY())-[.G94] -> 30 | L94: 1994 | M94: N.B.T. India | N94: Deepak Book agency
A95: 270 | B95: okyehfd pkS/kjh | C95: Hkjr ds izFke jk"Vifr Mk0 jktsUnz izlkn | D95: 1 | E95: 8.5 | F95: of:=[.E95]*[.D95] -> 8.5 | G95: 1995 | I95: of:=YEAR(TODAY())-[.G95] -> 30 | L95: 1984 | M95: N.B.T. India | N95: Deepak Book agency
A96: 271 | B96: yhyk etqe nkj | C96: gekjh ufn;ksa dh dgkuh | D96: 1 | E96: 8 | F96: of:=[.E96]*[.D96] -> 8 | G96: 1995 | I96: of:=YEAR(TODAY())-[.G96] -> 30 | L96: 1970 | M96: N.B.T. India | N96: Deepak Book agency
A97: 272 | B97: ve`rjk; | C97: izsepUn | D97: 1 | E97: 6 | F97: of:=[.E97]*[.D97] -> 6 | G97: 1995 | I97: of:=YEAR(TODAY())-[.G97] -> 30 | L97: 1978 | M97: N.B.T. India | N97: Deepak Book agency
A98: 276 | B98: Vh-,e-ih- egknsou | C98: kadjk pk;Z | D98: 1 | E98: 9 | F98: of:=[.E98]*[.D98] -> 9 | G98: 1995 | I98: of:=YEAR(TODAY())-[.G98] -> 30 | L98: 1968 | M98: N.B.T. India | N98: Deepak Book agency
A99: 277 | B99: Mk- jktdqekj | C99: ,uh cslsaV | D99: 1 | E99: 11 | F99: of:=[.E99]*[.D99] -> 11 | G99: 1995 | I99: of:=YEAR(TODAY())-[.G99] -> 30 | L99: 1912 | M99: N.B.T. India | N99: Deepak Book agency
A100: 279 | B100: vydk 'kadj | C100: bfUnjk fiz;nf'kZuh | D100: 1 | E100: 28 | F100: of:=[.E100]*[.D100] -> 28 | G100: 1995 | I100: of:=YEAR(TODAY())-[.G100] -> 30 | L100: 1992 | M100: N.B.T. India | N100: Deepak Book agency
A101: 284 | B101: egk'ork nsoh | C101: brok eqaMk us yM+kbZ thrh | D101: 1 | E101: 7 | F101: of:=[.E101]*[.D101] -> 7 | G101: 1995 | I101: of:=YEAR(TODAY())-[.G101] -> 30 | L101: 1993 | N101: Deepak Book agency
A102: 286 | B102: ,e- eqthc | C102: Mk0 tkfdj gqlSu | D102: 1 | E102: 35 | F102: of:=[.E102]*[.D102] -> 35 | G102: 1995 | I102: of:=YEAR(TODAY())-[.G102] -> 30 | L102: 1972 | N102: Deepak Book agency
A103: 303 | B103: foeyk jLrkSxh | C103: flLvj fuosfnrk | D103: 1 | E103: 12 | F103: of:=[.E103]*[.D103] -> 12 | G103: 1995 | I103: of:=YEAR(TODAY())-[.G103] -> 30 | L103: 1993 | M103: Ikzdk'ku foHkkx | N103: Deepak Book agency
A104: 305 | B104: fouksn feJ | C104: 'kghnks ds [kr | D104: 1 | E104: 5 | F104: of:=[.E104]*[.D104] -> 5 | G104: 1995 | I104: of:=YEAR(TODAY())-[.G104] -> 30 | L104: 1990 | M104: Ikzdk'ku foHkkx | N104: Deepak Book agency
A105: 313 | B105: fQjkst pUn | C105: yktir jk; | D105: 1 | E105: 50 | F105: of:=[.E105]*[.D105] -> 50 | G105: 1995 | I105: of:=YEAR(TODAY())-[.G105] -> 30 | L105: 1987 | M105: Ikzdk'ku foHkkx | N105: Deepak Book agency
A106: 315 | C106: HkkjrsUnq gfj'pUnz | D106: 1 | E106: 8 | F106: of:=[.E106]*[.D106] -> 8 | G106: 1995 | I106: of:=YEAR(TODAY())-[.G106] -> 30 | L106: 1983 | M106: Ikzdk'ku foHkkx | N106: Deepak Book agency
A107: 316 | B107: ch-vkj- oekZ | D107: 1 | E107: 13 | F107: of:=[.E107]*[.D107] -> 13 | G107: 1995 | I107: of:=YEAR(TODAY())-[.G107] -> 30 | L107: 1980 | M107: Ikzdk'ku foHkkx | N107: Deepak Book agency
A108: 325 | B108: {kse pUnz lqeu | C108: fgUnh ds ;'kLoh i=dkj | D108: 1 | E108: 5 | F108: of:=[.E108]*[.D108] -> 5 | G108: 1995 | I108: of:=YEAR(TODAY())-[.G108] -> 30 | L108: 1986 | M108: Ikzdk'ku foHkkx | N108: Deepak Book agency
A109: 329 | B109: foiu panz | C109: LorU=rk laxzke | D109: 1 | E109: 28 | F109: of:=[.E109]*[.D109] -> 28 | G109: 1995 | I109: of:=YEAR(TODAY())-[.G109] -> 30 | L109: 1972 | M109: N.B.T. India | N109: Deepak Book agency
A110: 334 | B110: Mk0 chjokyk Hkkolkj | C110: vkfnoklh dyk | D110: 1 | E110: 20 | F110: of:=[.E110]*[.D110] -> 20 | G110: 1995 | I110: of:=YEAR(TODAY())-[.G110] -> 30 | L110: 1993 | M110: Ikzdk'ku foHkkx | N110: Deepak Book agency
A111: 337 | B111: Mk0 n'kjFk vks>k | C111: vkfn 'kadjkpk;Z thou vkSj lans'k | D111: 1 | E111: 15 | F111: of:=[.E111]*[.D111] -> 15 | G111: 1995 | I111: of:=YEAR(TODAY())-[.G111] -> 30 | L111: 1991 | M111: Ikzdk'ku foHkkx | N111: Deepak Book agency
A112: 358 | B112: Anita Patel | C112: C.B Raman | D112: 1 | E112: 20 | F112: of:=[.E112]*[.D112] -> 20 | G112: 1995 | I112: of:=YEAR(TODAY())-[.G112] -> 30 | L112: 1993 | M112: Learning Press | N112: Deepak Book agency
A113: 359 | B113: Many Joseph | C113: Louis Pastuer | D113: 1 | E113: 15 | F113: of:=[.E113]*[.D113] -> 15 | G113: 1995 | I113: of:=YEAR(TODAY())-[.G113] -> 30 | L113: 1993 | M113: Learning Press | N113: Deepak Book agency
A114: 366 | B114: Anita Patel | C114: Homi Bhabba | D114: 1 | E114: 15 | F114: of:=[.E114]*[.D114] -> 15 | G114: 1995 | I114: of:=YEAR(TODAY())-[.G114] -> 30 | L114: 1993 | M114: Learning Press | N114: Deepak Book agency
A115: 370 | B115: Vandana Malhotra | C115: Michael faraday | D115: 1 | E115: 15 | F115: of:=[.E115]*[.D115] -> 15 | G115: 1995 | I115: of:=YEAR(TODAY())-[.G115] -> 30 | L115: 1994 | M115: Learning Press | N115: Deepak Book agency
A116: 371 | B116: Madhuri | C116: Alexander Flaming | D116: 1 | E116: 15 | F116: of:=[.E116]*[.D116] -> 15 | G116: 1995 | I116: of:=YEAR(TODAY())-[.G116] -> 30 | L116: 1994 | M116: Learning Press | N116: Deepak Book agency
A117: 378 | B117: Mary Joseph | C117: Alfred Nobel | D117: 1 | E117: 15 | F117: of:=[.E117]*[.D117] -> 15 | G117: 1995 | I117: of:=YEAR(TODAY())-[.G117] -> 30 | L117: 1994 | M117: Learning Press | N117: Deepak Book agency
A118: 382 | B118: C.Mathur | C118: Pronoun | D118: 1 | E118: 25 | F118: of:=[.E118]*[.D118] -> 25 | G118: 1995 | I118: of:=YEAR(TODAY())-[.G118] -> 30 | L118: 1994 | M118: Learning Press | N118: Deepak Book agency
A119: 427 | B119: vy oyhvIik | C119: gekjh ufn;ksa dh dgkuh &2 | D119: 1 | E119: 6.5 | F119: of:=[.E119]*[.D119] -> 6.5 | G119: 1995 | I119: of:=YEAR(TODAY())-[.G119] -> 30 | L119: 1993 | M119: N.B.T. | N119: Deepak Book agency
A120: 434 | B120: d`".k d``iykuh | C120: }kfjdkukFk VSxksj | D120: 1 | E120: 37 | F120: of:=[.E120]*[.D120] -> 37 | G120: 1995 | I120: of:=YEAR(TODAY())-[.G120] -> 30 | L120: 1989 | M120: N.B.T. | N120: Deepak Book agency
A121: 437 | B121: lq/khjiar | C121: vklQ vyh | D121: 1 | E121: 12 | F121: of:=[.E121]*[.D121] -> 12 | G121: 1995 | I121: of:=YEAR(TODAY())-[.G121] -> 30 | L121: 1989 | M121: N.B.T. | N121: Deepak Book agency
A122: 438 | B122: [kyhQ vgen futkeh | C122: ks[k futkeqnhu vkSfy;k | D122: 1 | E122: 10.5 | F122: of:=[.E122]*[.D122] -> 10.5 | G122: 1995 | I122: of:=YEAR(TODAY())-[.G122] -> 30 | L122: 1990 | M122: N.B.T. | N122: Deepak Book agency
A123: 441 | B123: ghjk yky 'kekZ | C123: vfgY;k ckbZ | D123: 1 | E123: 15 | F123: of:=[.E123]*[.D123] -> 15 | G123: 1995 | I123: of:=YEAR(TODAY())-[.G123] -> 30 | L123: 1994 | M123: N.B.T. | N123: Deepak Book agency
A124: 444 | B124: uotkr | C124: Jh vjfoUn | D124: 1 | E124: 12.5 | F124: of:=[.E124]*[.D124] -> 12.5 | G124: 1995 | I124: of:=YEAR(TODAY())-[.G124] -> 30 | L124: 1990 | M124: N.B.T. | N124: Deepak Book agency
A125: 459 | B125: ih-,e-tks'kh | C125: cgqr fnu gq,&1 | D125: 1 | E125: 8 | F125: of:=[.E125]*[.D125] -> 8 | G125: 1995 | I125: of:=YEAR(TODAY())-[.G125] -> 30 | L125: 1994 | M125: N.B.T. | N125: Deepak Book agency
A126: 462 | B126: olq/kk pdzorhZ | C126: flLvj fuosfnrk | D126: 1 | E126: 8 | F126: of:=[.E126]*[.D126] -> 8 | G126: 1995 | I126: of:=YEAR(TODAY())-[.G126] -> 30 | L126: 1990 | M126: N.B.T. | N126: Deepak Book agency
A127: 476 | B127: ckcwjke vktkn | C127: Jh R;kxjkt | D127: 1 | E127: 12 | F127: of:=[.E127]*[.D127] -> 12 | G127: 1995 | I127: of:=YEAR(TODAY())-[.G127] -> 30 | L127: 1986 | M127: izdk'ku foHkkx | N127: Deepak Book agency
A128: 480 | B128: lhrkjke [ksMkoky | C128: iszepUn us dgk Fkk | D128: 1 | E128: 34.6 | F128: of:=[.E128]*[.D128] -> 34.6 | G128: 1995 | I128: of:=YEAR(TODAY())-[.G128] -> 30 | L128: 1990 | M128: izdk'ku foHkkx | N128: Deepak Book agency
A129: 488 | B129: Mk0 ghjkyky cnksfr;k | C129: ugha :drh gS unh | D129: 1 | E129: 6 | F129: of:=[.E129]*[.D129] -> 6 | G129: 1995 | I129: of:=YEAR(TODAY())-[.G129] -> 30 | L129: 1988 | M129: izdk'ku foHkkx | N129: Deepak Book agency
A130: 490 | B130: lq'khy dqekj | C130: rFkkxr Hkxoku | D130: 1 | E130: 10 | F130: of:=[.E130]*[.D130] -> 10 | G130: 1995 | I130: of:=YEAR(TODAY())-[.G130] -> 30 | L130: 1994 | M130: vk;Z cqd fMiks | N130: {ks=h; dk;kZy; y[kuÅ
A131: 491 | B131: lqjthr | C131: f'kdkj dh jksekapdkjh iqtko dsljh dgkfu;ka | D131: 1 | E131: 15 | F131: of:=[.E131]*[.D131] -> 15 | G131: 1995 | I131: of:=YEAR(TODAY())-[.G131] -> 30 | M131: vk;Z cqd fMiks | N131: {ks=h; dk;kZy; y[kuÅ
A132: 492 | B132: lq'khy dqekj | C132: ykyk yktir jk; | D132: 1 | E132: 8 | F132: of:=[.E132]*[.D132] -> 8 | G132: 1995 | I132: of:=YEAR(TODAY())-[.G132] -> 30 | L132: 1992 | M132: vk;Z cqd fMiks | N132: {ks=h; dk;kZy; y[kuÅ
A133: 493 | B133: jkts'k 'kekZ | C133: ckIik jkoy | D133: 1 | E133: 16 | F133: of:=[.E133]*[.D133] -> 16 | G133: 1995 | I133: of:=YEAR(TODAY())-[.G133] -> 30 | L133: 1992 | M133: vk;Z cqd fMiks | N133: {ks=h; dk;kZy; y[kuÅ
A134: 495 | B134: O;fFkr g~j; | C134: lalkj dh Js"B yksd dFkk,a | D134: 1 | E134: 12 | F134: of:=[.E134]*[.D134] -> 12 | G134: 1995 | I134: of:=YEAR(TODAY())-[.G134] -> 30 | L134: 1991 | M134: vk;Z cqd fMiks | N134: {ks=h; dk;kZy; y[kuÅ
A135: 500 | B135: lq'khy dqekj | C135: egkeuk enu eksgu ekyoh; | D135: 1 | E135: 12 | F135: of:=[.E135]*[.D135] -> 12 | G135: 1995 | I135: of:=YEAR(TODAY())-[.G135] -> 30 | L135: 1992 | M135: vk;Z cqd fMiks | N135: {ks=h; dk;kZy; y[kuÅ
A136: 501 | B136: Jh O;fFkr gn; | C136: ehjk ckbZ | D136: 1 | E136: 16 | F136: of:=[.E136]*[.D136] -> 16 | G136: 1995 | I136: of:=YEAR(TODAY())-[.G136] -> 30 | L136: 1995 | M136: vk;Z cqd fMiks | N136: {ks=h; dk;kZy; y[kuÅ
A137: 508 | B137: Bkdqj izlkn flag | C137: ckcw fo"k.kq ijkM+dj | D137: 1 | E137: 15 | F137: of:=[.E137]*[.D137] -> 15 | G137: 1995 | I137: of:=YEAR(TODAY())-[.G137] -> 30 | L137: 1994 | M137: lkfgR; vdkneh | N137: {ks=h; dk;kZy; y[kuÅ
A138: 509 | B138: lkfyy 'kqDy | C138: Hkxorh pj.k xqIr | D138: 1 | E138: 15 | F138: of:=[.E138]*[.D138] -> 15 | G138: 1995 | I138: of:=YEAR(TODAY())-[.G138] -> 30 | L138: 1989 | M138: vk;Z cqd fMiks | N138: {ks=h; dk;kZy; y[kuÅ
A139: 512 | B139: fo".kq izHkkdj | C139: Lokeh n;kUkUn ljLorh | D139: 1 | E139: 15 | F139: of:=[.E139]*[.D139] -> 15 | G139: 1995 | I139: of:=YEAR(TODAY())-[.G139] -> 30 | L139: 1991 | M139: lkfgR; vdkneh | N139: {ks=h; dk;kZy; y[kuÅ
A140: 514 | B140: cyoUr flag vkuUn | C140: ckck Qjhn | D140: 1 | E140: 15 | F140: of:=[.E140]*[.D140] -> 15 | G140: 1995 | I140: of:=YEAR(TODAY())-[.G140] -> 30 | L140: 1991 | M140: lkfgR; vdkneh | N140: {ks=h; dk;kZy; y[kuÅ
A141: 520 | B141: vkse fodkl | C141: dEi;wVj ls ckrphr | D141: 1 | E141: 10 | F141: of:=[.E141]*[.D141] -> 10 | G141: 1995 | I141: of:=YEAR(TODAY())-[.G141] -> 30 | L141: 1989 | M141: ,u0lhbZ0vkj0Vh2 | N141: {ks=h; dk;kZy; y[kuÅ
A142: 560 | B142: vouhUnz dqekj | C142: egkuek enu eksgu ekyoh; | D142: 1 | E142: 12 | F142: of:=[.E142]*[.D142] -> 12 | G142: 1995 | I142: of:=YEAR(TODAY())-[.G142] -> 30 | L142: 1989 | M142: vk;Z cqd fMiks | N142: {ks=h; dk;kZy; y[kuÅ
A143: 567 | B143: fo'o fiz; eq[kthZ | C143: txnh'k pUnz cksl | D143: 1 | E143: 30 | F143: of:=[.E143]*[.D143] -> 30 | G143: 1995 | I143: of:=YEAR(TODAY())-[.G143] -> 30 | L143: 1993 | M143: lwpu ,oa izlkj.k ea=ky; | N143: {ks=h; dk;kZy; y[kuÅ
A144: 568 | B144: vkj- ikFkZ lkjFkh | C144: ds- dkejkt | D144: 1 | E144: 7 | F144: of:=[.E144]*[.D144] -> 7 | G144: 1995 | I144: of:=YEAR(TODAY())-[.G144] -> 30 | L144: 1986 | M144: lwpu ,oa izlkj.k ea=ky; | N144: {ks=h; dk;kZy; y[kuÅ
A145: 569 | B145: Mk0 jkts'k izlkn | C145: Hkkjr ds egku f'k{kk 'kkL=h | D145: 1 | E145: 12 | F145: of:=[.E145]*[.D145] -> 12 | G145: 1995 | I145: of:=YEAR(TODAY())-[.G145] -> 30 | L145: 1992 | M145: lwpu ,oa izlkj.k ea=ky; | N145: {ks=h; dk;kZy; y[kuÅ
A146: 571 | B146: ds0 d`".k ewfrZ | C146: ck.k HkVV | D146: 1 | E146: 15 | F146: of:=[.E146]*[.D146] -> 15 | G146: 1995 | I146: of:=YEAR(TODAY())-[.G146] -> 30 | L146: 1992 | M146: lkfgR; vdkneh | N146: {ks=h; dk;kZy; y[kuÅ
A147: 574 | B147: euksgj yky oekZ | C147: Mk0 izQqYy PkUnz jk; | D147: 1 | E147: 1 | F147: of:=[.E147]*[.D147] -> 1 | G147: 1995 | I147: of:=YEAR(TODAY())-[.G147] -> 30 | L147: 1993 | M147: vEoj izdk'ku | N147: {ks=h; dk;kZy; y[kuÅ
A148: 587 | B148: ekSykuk vktkn | C148: izsjd egku ekuo | D148: 1 | E148: 1 | F148: of:=[.E148]*[.D148] -> 1 | G148: 1995 | I148: of:=YEAR(TODAY())-[.G148] -> 30 | L148: 1989 | M148: ihrkEcj | N148: {ks=h; dk;kZy; y[kuÅ
A149: 592 | B149: vkse izdk'k | C149: vk/kqfud fgUnh lkfgR; | D149: 1 | E149: 1 | F149: of:=[.E149]*[.D149] -> 1 | G149: 1995 | I149: of:=YEAR(TODAY())-[.G149] -> 30 | L149: 1990 | M149: ihrkEcj | N149: {ks=h; dk;kZy; y[kuÅ
A150: 609 | B150: t-oa?ksik/;k; | C150: Hkkjrh; lkaLd`frd fuf/k Ik;kZoj.k Ja[kyk | D150: 1 | E150: 10 | F150: of:=[.E150]*[.D150] -> 10 | G150: 1995 | I150: of:=YEAR(TODAY())-[.G150] -> 30 | L150: 1984 | M150: Hkkjrh; lakLd`fr | N150: {ks=h; dk;kZy; y[kuÅ
A151: 610 | B151: ,e-y{e.k psfVokj | C151: rfeyukMq yksdlaLd`fr | D151: 1 | E151: 1 | F151: of:=[.E151]*[.D151] -> 1 | G151: 1995 | I151: of:=YEAR(TODAY())-[.G151] -> 30 | L151: 1973 | M151: us0 cqd VªªLV | N151: {ks=h; dk;kZy; y[kuÅ
A152: 620 | B152: c`t fd'kksj feJ | C152: vo/k ds izeq[k dfo | D152: 1 | E152: 1 | F152: of:=[.E152]*[.D152] -> 1 | G152: 1995 | I152: of:=YEAR(TODAY())-[.G152] -> 30 | L152: 1960 | M152: fgUnh foHkkx y[kuÅ | N152: {ks=h; dk;kZy; y[kuÅ
A153: 621 | B153: Mk0 nhun;ky xqIr | C153: cztHkk"kk lwj dks'k Hkkx-1 | D153: 1 | E153: 1 | F153: of:=[.E153]*[.D153] -> 1 | G153: 1995 | I153: of:=YEAR(TODAY())-[.G153] -> 30 | M153: fgUnh foHkkx y[kuÅ | N153: {ks=h; dk;kZy; y[kuÅ
A154: 622 | B154: Mk0 nhun;ky xqIr | C154: cztHkk"kk lwj dks'k Hkkx-2 | D154: 1 | E154: 1 | F154: of:=[.E154]*[.D154] -> 1 | G154: 1995 | I154: of:=YEAR(TODAY())-[.G154] -> 30 | M154: fgUnh foHkkx y[kuÅ | N154: {ks=h; dk;kZy; y[kuÅ
A155: 623 | B155: Mk0 nhun;ky xqIr | C155: cztHkk"kk lwj dks'k Hkkx-3 | D155: 1 | E155: 1 | F155: of:=[.E155]*[.D155] -> 1 | G155: 1995 | I155: of:=YEAR(TODAY())-[.G155] -> 30 | M155: fgUnh foHkkx y[kuÅ | N155: {ks=h; dk;kZy; y[kuÅ
A156: 624 | B156: Mk0 nhun;ky xqIr | C156: cztHkk"kk lwj dks'k Hkkx-4 | D156: 1 | E156: 1 | F156: of:=[.E156]*[.D156] -> 1 | G156: 1995 | I156: of:=YEAR(TODAY())-[.G156] -> 30 | M156: fgUnh foHkkx y[kuÅ | N156: {ks=h; dk;kZy; y[kuÅ
A157: 625 | B157: Mk0 nhun;ky xqIr | C157: cztHkk"kk lwj dks'k Hkkx-5 | D157: 1 | E157: 1 | F157: of:=[.E157]*[.D157] -> 1 | G157: 1995 | I157: of:=YEAR(TODAY())-[.G157] -> 30 | M157: fgUnh foHkkx y[kuÅ | N157: {ks=h; dk;kZy; y[kuÅ
A158: 626 | B158: Mk0 nhun;ky xqIr | C158: cztHkk"kk lwj dks'k Hkkx-6 | D158: 1 | E158: 1 | F158: of:=[.E158]*[.D158] -> 1 | G158: 1995 | I158: of:=YEAR(TODAY())-[.G158] -> 30 | M158: fgUnh foHkkx y[kuÅ | N158: {ks=h; dk;kZy; y[kuÅ
A159: 627 | B159: Mk0 nhun;ky xqIr | C159: cztHkk"kk lwj dks'k Hkkx-7 | D159: 1 | E159: 1 | F159: of:=[.E159]*[.D159] -> 1 | G159: 1995 | I159: of:=YEAR(TODAY())-[.G159] -> 30 | M159: fgUnh foHkkx y[kuÅ | N159: {ks=h; dk;kZy; y[kuÅ
A160: 628 | B160: Mk0 nhun;ky xqIr | C160: cztHkk"kk lwj dks'k Hkkx-8 | D160: 1 | E160: 1 | F160: of:=[.E160]*[.D160] -> 1 | G160: 1995 | I160: of:=YEAR(TODAY())-[.G160] -> 30 | M160: fgUnh foHkkx y[kuÅ | N160: {ks=h; dk;kZy; y[kuÅ
A161: 629 | B161: Mk0 nhun;ky xqIr | C161: cztHkk"kk lwj dks'k Hkkx-9 | D161: 1 | E161: 1 | F161: of:=[.E161]*[.D161] -> 1 | G161: 1995 | I161: of:=YEAR(TODAY())-[.G161] -> 30 | M161: fgUnh foHkkx y[kuÅ | N161: {ks=h; dk;kZy; y[kuÅ
A162: 630 | B162: Mk0 nhun;ky xqIr | C162: cztHkk"kk lwj dks'k Hkkx-10 | D162: 1 | E162: 1 | F162: of:=[.E162]*[.D162] -> 1 | G162: 1995 | I162: of:=YEAR(TODAY())-[.G162] -> 30 | M162: fgUnh foHkkx y[kuÅ | N162: {ks=h; dk;kZy; y[kuÅ
A163: 631 | B163: Mk0 ljyk 'kqDy | C163: fgUnh lwQh dfo vkSj dkO; | D163: 1 | E163: 1 | F163: of:=[.E163]*[.D163] -> 1 | G163: 1995 | I163: of:=YEAR(TODAY())-[.G163] -> 30 | M163: fgUnh foHkkx y[kuÅ | N163: {ks=h; dk;kZy; y[kuÅ
A164: 636 | B164: ia- lhrkjke | C164: f'k{kk n'kZu | D164: 1 | E164: 12 | F164: of:=[.E164]*[.D164] -> 12 | G164: 1995 | I164: of:=YEAR(TODAY())-[.G164] -> 30 | L164: 1970 | M164: lwpuk foHkkx m0iz2 | N164: {ks=h; dk;kZy; y[kuÅ
A165: 639 | B165: ftusUnz Hkkjrh | C165: fn0 lkB esa _rq o.kZu | D165: 1 | E165: 20 | F165: of:=[.E165]*[.D165] -> 20 | G165: 1995 | I165: of:=YEAR(TODAY())-[.G165] -> 30 | M165: m0iz0 fgUnh la2 | N165: {ks=h; dk;kZy; y[kuÅ
A166: 642 | B166: eqgEen xqDrQk [ka | C166: mnwZ fgUnh 'kCndks'k | D166: 1 | E166: 140 | F166: of:=[.E166]*[.D166] -> 140 | G166: 1995 | I166: of:=YEAR(TODAY())-[.G166] -> 30 | L166: 1992 | M166: m0iz0 fgUnh la5 | N166: {ks=h; dk;kZy; y[kuÅ
A167: 643 | B167: vftrk JhokLro | C167: vPNs jkLrs tks LoLFk cuk,xs | D167: 1 | F167: of:=[.E167]*[.D167] -> 0 | G167: 1995 | I167: of:=YEAR(TODAY())-[.G167] -> 30 | L167: 1994 | M167: ihrkEcj | N167: {ks=h; dk;kZy; y[kuÅ
A168: 644 | B168: lqjs'k flag | C168: Hkjrh; i{kh | D168: 1 | E168: 230 | F168: of:=[.E168]*[.D168] -> 230 | G168: 1995 | I168: of:=YEAR(TODAY())-[.G168] -> 30 | L168: 1992 | M168: m0iz fgUnh laLFkku | N168: {ks=h; dk;kZy; y[kuÅ
A169: 651 | B169: P.N Dev | C169: OPERATION BLACK BOARD | D169: 1 | E169: 11 | F169: of:=[.E169]*[.D169] -> 11 | G169: 1995 | I169: of:=YEAR(TODAY())-[.G169] -> 30 | L169: 1988 | M169: N.C.E.R.T | N169: {ks=h; dk;kZy; y[kuÅ
A170: 652 | B170: yhyk/kj 'kekZ | C170: Hkkjr ds izeq[k rhFkZ Lfky | D170: 1 | E170: 6 | F170: of:=[.E170]*[.D170] -> 6 | G170: 1995 | I170: of:=YEAR(TODAY())-[.G170] -> 30 | L170: 1990 | M170: N.C.E.R.T | N170: {ks=h; dk;kZy; y[kuÅ
A171: 658 | B171: nhun;ky f=osnh | C171: gekjk v:ukpy izns'k | D171: 1 | E171: 8 | F171: of:=[.E171]*[.D171] -> 8 | G171: 1995 | I171: of:=YEAR(TODAY())-[.G171] -> 30 | L171: 1990 | M171: N.C.E.R.T | N171: {ks=h; dk;kZy; y[kuÅ
A172: 663 | B172: euh'k pUnz mRre | C172: jkdsV | D172: 1 | E172: 8.45 | F172: of:=[.E172]*[.D172] -> 8.45 | G172: 1995 | I172: of:=YEAR(TODAY())-[.G172] -> 30 | L172: 1988 | M172: N.C.E.R.T | N172: {ks=h; dk;kZy; y[kuÅ
A173: 664 | B173: Jh izlkn | C173: <e<ee<e cky dfork,a | D173: 1 | E173: 13 | F173: of:=[.E173]*[.D173] -> 13 | G173: 1995 | I173: of:=YEAR(TODAY())-[.G173] -> 30 | L173: 1989 | M173: N.C.E.R.T | N173: {ks=h; dk;kZy; y[kuÅ
A174: 667 | B174: K. sudha Rao | C174: INFLUENCE OF CONT. EVALUATION ON LEARNING | D174: 1 | E174: 33.35 | F174: of:=[.E174]*[.D174] -> 33.35 | G174: 1995 | I174: of:=YEAR(TODAY())-[.G174] -> 30 | L174: 1986 | M174: N.C.E.R.T | N174: {ks=h; dk;kZy; y[kuÅ
A175: 668 | B175: Seizp Tashima | C175: Fly grasshopper | D175: 1 | E175: 16 | F175: of:=[.E175]*[.D175] -> 16 | G175: 1995 | I175: of:=YEAR(TODAY())-[.G175] -> 30 | L175: 1992 | M175: N.B.P. | N175: {ks=h; dk;kZy; y[kuÅ
A176: 671 | B176: Madhu Powle | C176: Festival of colours | D176: 1 | E176: 6.5 | F176: of:=[.E176]*[.D176] -> 6.5 | G176: 1995 | I176: of:=YEAR(TODAY())-[.G176] -> 30 | L176: 1990 | M176: N.B.P. | N176: {ks=h; dk;kZy; y[kuÅ
A177: 672 | B177: Ashish sen gupta | C177: Set me free | D177: 1 | E177: 6.5 | F177: of:=[.E177]*[.D177] -> 6.5 | G177: 1995 | I177: of:=YEAR(TODAY())-[.G177] -> 30 | L177: 1995 | M177: N.B.P. | N177: {ks=h; dk;kZy; y[kuÅ
A178: 673 | B178: Mickey Patel | C178: The best thirteen | D178: 1 | E178: 22 | F178: of:=[.E178]*[.D178] -> 22 | G178: 1995 | I178: of:=YEAR(TODAY())-[.G178] -> 30 | L178: 1994 | M178: N.B.P. | N178: {ks=h; dk;kZy; y[kuÅ
A179: 675 | B179: Lila Majumdat | C179: Barapani | D179: 1 | E179: 8 | F179: of:=[.E179]*[.D179] -> 8 | G179: 1995 | I179: of:=YEAR(TODAY())-[.G179] -> 30 | L179: 1992 | M179: N.B.P. | N179: {ks=h; dk;kZy; y[kuÅ
A180: 676 | B180: Prem chand | C180: Festival of Eid | D180: 1 | E180: 5 | F180: of:=[.E180]*[.D180] -> 5 | G180: 1995 | I180: of:=YEAR(TODAY())-[.G180] -> 30 | L180: 1991 | M180: N.B.P. | N180: {ks=h; dk;kZy; y[kuÅ
A181: 677 | B181: Mahasveta devi | C181: Ek-Kori's dream | D181: 1 | E181: 7 | F181: of:=[.E181]*[.D181] -> 7 | G181: 1995 | I181: of:=YEAR(TODAY())-[.G181] -> 30 | L181: 1992 | M181: N.B.P. | N181: {ks=h; dk;kZy; y[kuÅ
A182: 681 | B182: Uma anand | C182: Be prepared | D182: 1 | E182: 8 | F182: of:=[.E182]*[.D182] -> 8 | G182: 1995 | I182: of:=YEAR(TODAY())-[.G182] -> 30 | L182: 1993 | M182: N.B.P. | N182: {ks=h; dk;kZy; y[kuÅ
A183: 698 | B183: ashish sen gupta | C183: L.s the red kite | D183: 1 | E183: 6.5 | F183: of:=[.E183]*[.D183] -> 6.5 | G183: 1995 | I183: of:=YEAR(TODAY())-[.G183] -> 30 | L183: 1995 | M183: N.B.T.I. | N183: {ks=h; dk;kZy; y[kuÅ
A184: 699 | B184: Qudria Z. | C184: Begam fulabo mousie | D184: 1 | E184: 7.5 | F184: of:=[.E184]*[.D184] -> 7.5 | G184: 1995 | I184: of:=YEAR(TODAY())-[.G184] -> 30 | L184: 1993 | M184: N.B.T.I. | N184: {ks=h; dk;kZy; y[kuÅ
A185: 700 | B185: Sant surti | C185: A visit to the zoo | D185: 1 | E185: 6 | F185: of:=[.E185]*[.D185] -> 6 | G185: 1995 | I185: of:=YEAR(TODAY())-[.G185] -> 30 | L185: 1994 | M185: N.B.T.I. | N185: {ks=h; dk;kZy; y[kuÅ
A186: 702 | B186: M.C. gabbriel | C186: A tale of trouble | D186: 1 | E186: 7.5 | F186: of:=[.E186]*[.D186] -> 7.5 | G186: 1995 | I186: of:=YEAR(TODAY())-[.G186] -> 30 | L186: 1992 | M186: N.B.T.I. | N186: {ks=h; dk;kZy; y[kuÅ
A187: 729 | B187: Dr. V.N. Bave | C187: You and your health | D187: 1 | E187: 67 | F187: of:=[.E187]*[.D187] -> 67 | G187: 1995 | I187: of:=YEAR(TODAY())-[.G187] -> 30 | L187: 1993 | M187: N.B.T.I. | N187: {ks=h; dk;kZy; y[kuÅ
A188: 746 | B188: Bal krishna | C188: Glimpse of India Technalogy | D188: 1 | E188: 110 | F188: of:=[.E188]*[.D188] -> 110 | G188: 1995 | I188: of:=YEAR(TODAY())-[.G188] -> 30 | L188: 1988 | M188: P.D.M.I.B.G.I. | N188: {ks=h; dk;kZy; y[kuÅ
A189: 755 | B189: Pratibha Nath | C189: The visitor | D189: 1 | E189: 10 | F189: of:=[.E189]*[.D189] -> 10 | G189: 1995 | I189: of:=YEAR(TODAY())-[.G189] -> 30 | L189: 1993 | M189: C.B.T.N.D | N189: {ks=h; dk;kZy; y[kuÅ
A190: 757 | B190: sharaddhaavan | C190: The rivers | D190: 1 | E190: 10 | F190: of:=[.E190]*[.D190] -> 10 | G190: 1995 | I190: of:=YEAR(TODAY())-[.G190] -> 30 | L190: 1993 | M190: C.B.T.N.D | N190: {ks=h; dk;kZy; y[kuÅ
A191: 758 | B191: shankar | C191: The tortoise and the swans | D191: 1 | E191: 10 | F191: of:=[.E191]*[.D191] -> 10 | G191: 1995 | I191: of:=YEAR(TODAY())-[.G191] -> 30 | L191: 1992 | M191: C.B.T.N.D | N191: {ks=h; dk;kZy; y[kuÅ
A192: 760 | B192: Shankar | C192: Four deafmen | D192: 1 | E192: 10 | F192: of:=[.E192]*[.D192] -> 10 | G192: 1995 | I192: of:=YEAR(TODAY())-[.G192] -> 30 | L192: 1984 | M192: C.B.T.N.D | N192: {ks=h; dk;kZy; y[kuÅ
A193: 762 | B193: A.K.Shri Kumar | C193: The Sami Tree | D193: 1 | E193: 12 | F193: of:=[.E193]*[.D193] -> 12 | G193: 1995 | I193: of:=YEAR(TODAY())-[.G193] -> 30 | L193: 1990 | M193: C.B.T.N.D | N193: {ks=h; dk;kZy; y[kuÅ
A194: 763 | B194: Deepak Krishchan | C194: Kala pani | D194: 1 | E194: 11 | F194: of:=[.E194]*[.D194] -> 11 | G194: 1995 | I194: of:=YEAR(TODAY())-[.G194] -> 30 | L194: 1993 | M194: C.B.T.N.D | N194: {ks=h; dk;kZy; y[kuÅ
A195: 766 | B195: B.G.Verma | C195: ONAM | D195: 1 | E195: 8 | F195: of:=[.E195]*[.D195] -> 8 | G195: 1995 | I195: of:=YEAR(TODAY())-[.G195] -> 30 | L195: 1990 | M195: C.B.T.N.D | N195: {ks=h; dk;kZy; y[kuÅ
A196: 770 | B196: xksiky d`".k | C196: The forest Nymph | D196: 1 | E196: 25 | F196: of:=[.E196]*[.D196] -> 25 | G196: 1995 | I196: of:=YEAR(TODAY())-[.G196] -> 30 | L196: 1993 | M196: lkfgR; vdkneh | N196: {ks=h; dk;kZy; y[kuÅ
A197: 814 | B197: Prem Nanda Kumar | C197: the mother | D197: 1 | E197: 5 | F197: of:=[.E197]*[.D197] -> 5 | G197: 1996 | I197: of:=YEAR(TODAY())-[.G197] -> 29 | L197: 1977 | M197: N.B.T. India | N197: Deepak book depot
A198: 815 | B198: Shakti M Gupta | C198: Birbal sahni | D198: 1 | E198: 4 | F198: of:=[.E198]*[.D198] -> 4 | G198: 1996 | I198: of:=YEAR(TODAY())-[.G198] -> 29 | L198: 1978 | M198: N.B.T. India | N198: Deepak book depot
A199: 816 | B199: Leela George | C199: Gautama buddha | D199: 1 | E199: 8 | F199: of:=[.E199]*[.D199] -> 8 | G199: 1996 | I199: of:=YEAR(TODAY())-[.G199] -> 29 | L199: 1982 | M199: N.B.T. India | N199: Deepak book depot
A200: 822 | B200: Sigrunshri Vastava | C200: India's young heroes | D200: 1 | E200: 7 | F200: of:=[.E200]*[.D200] -> 7 | G200: 1996 | I200: of:=YEAR(TODAY())-[.G200] -> 29 | L200: 1983 | M200: N.B.T. India | N200: Deepak book depot
A201: 825 | B201: sumangal Prakash | C201: story of swarajya part 2 | D201: 1 | E201: 10 | F201: of:=[.E201]*[.D201] -> 10 | G201: 1996 | I201: of:=YEAR(TODAY())-[.G201] -> 29 | L201: 1973 | M201: N.B.T. India | N201: Deepak book depot
A202: 835 | B202: Amrit Rai | C202: Prem chand | D202: 1 | E202: 5 | F202: of:=[.E202]*[.D202] -> 5 | G202: 1996 | I202: of:=YEAR(TODAY())-[.G202] -> 29 | L202: 1978 | M202: N.B.T. India | N202: Deepak book depot
A203: 837 | B203: Mehrooj wadia | C203: we Indians | D203: 1 | E203: 7.5 | F203: of:=[.E203]*[.D203] -> 7.5 | G203: 1996 | I203: of:=YEAR(TODAY())-[.G203] -> 29 | L203: 1984 | M203: N.B.T. India | N203: Deepak book depot
A204: 840 | B204: Valli Kannan | C204: Madam Rides the bus | D204: 1 | E204: 10.5 | F204: of:=[.E204]*[.D204] -> 10.5 | G204: 1996 | I204: of:=YEAR(TODAY())-[.G204] -> 29 | L204: 1982 | M204: N.B.T. India | N204: Deepak book depot
A205: 844 | B205: Jagdish Joshi | C205: search | D205: 1 | E205: 5.5 | F205: of:=[.E205]*[.D205] -> 5.5 | G205: 1996 | I205: of:=YEAR(TODAY())-[.G205] -> 29 | L205: 1991 | M205: N.B.T. India | N205: Deepak book depot
A206: 848 | B206: Shinta cho. | C206: little cabbage | D206: 1 | E206: 10 | F206: of:=[.E206]*[.D206] -> 10 | G206: 1996 | I206: of:=YEAR(TODAY())-[.G206] -> 29 | L206: 1992 | M206: N.B.T. India | N206: Deepak book depot
A207: 849 | B207: P. Division | C207: Temples of India | D207: 1 | E207: 30 | F207: of:=[.E207]*[.D207] -> 30 | G207: 1996 | I207: of:=YEAR(TODAY())-[.G207] -> 29 | L207: 1990 | M207: N.B.T. India | N207: Deepak book depot
A208: 856 | B208: ewYdjkt | C208: xyh eqgYys ds dqN [ksy | D208: 1 | E208: 8.5 | F208: of:=[.E208]*[.D208] -> 8.5 | G208: 1996 | I208: of:=YEAR(TODAY())-[.G208] -> 29 | L208: 1983 | M208: N.B.T. India | N208: Deepak book depot
A209: 870 | B209: Hkky;nz | C209: dkslyk | D209: 1 | E209: 48 | F209: of:=[.E209]*[.D209] -> 48 | G209: 1996 | I209: of:=YEAR(TODAY())-[.G209] -> 29 | L209: 1993 | M209: N.B.T. India | N209: Deepak book depot
A210: 875 | B210: kadj ekadk'kh | C210: xaxrok xaxkekbZ | D210: 1 | E210: 28 | F210: of:=[.E210]*[.D210] -> 28 | G210: 1996 | I210: of:=YEAR(TODAY())-[.G210] -> 29 | L210: 176 | M210: N.B.T. India | N210: Deepak book depot
A211: 877 | B211: e/q eaxs'k | C211: ekfge dh [kkMh | D211: 1 | E211: 26 | F211: of:=[.E211]*[.D211] -> 26 | G211: 1996 | I211: of:=YEAR(TODAY())-[.G211] -> 29 | L211: 1993 | M211: N.B.T. India | N211: Deepak book depot
A212: 880 | B212: ds-ih- ds'ko | C212: vrhr ds fnu | D212: 1 | E212: 38 | F212: of:=[.E212]*[.D212] -> 38 | G212: 1996 | I212: of:=YEAR(TODAY())-[.G212] -> 29 | L212: 1987 | M212: N.B.T. India | N212: Deepak book depot
A213: 887 | B213: cztsój | C213: lwjnkl | D213: 1 | E213: 8 | F213: of:=[.E213]*[.D213] -> 8 | G213: 1996 | I213: of:=YEAR(TODAY())-[.G213] -> 29 | L213: 1969 | M213: N.B.T. India | N213: Deepak book depot
A214: 890 | B214: okfljsMMh | C214: feVVh dk vkneh | D214: 1 | E214: 64 | F214: of:=[.E214]*[.D214] -> 64 | G214: 1996 | I214: of:=YEAR(TODAY())-[.G214] -> 29 | L214: 1995 | M214: N.B.T. India | N214: Deepak book depot
A215: 897 | B215: egkdfo Hkkl | C215: LoIuckl cnyk | D215: 1 | E215: 12 | F215: of:=[.E215]*[.D215] -> 12 | G215: 1996 | I215: of:=YEAR(TODAY())-[.G215] -> 29 | L215: 1992 | M215: N.B.T. India | N215: Deepak book depot
A216: 900 | B216: fo;ksxh gfj | C216: ckiw dh ,frgkfld ;k=k | D216: 1 | E216: 12 | F216: of:=[.E216]*[.D216] -> 12 | G216: 1996 | I216: of:=YEAR(TODAY())-[.G216] -> 29 | L216: 1989 | M216: lwpuk vkSj izlkj.k | N216: Deepak book depot
A217: 901 | B217: lq/kkdj ikaMs; | C217: xksfoUn cYyHk iar | D217: 1 | E217: 26 | F217: of:=[.E217]*[.D217] -> 26 | G217: 1996 | I217: of:=YEAR(TODAY())-[.G217] -> 29 | L217: 1987 | M217: lwpuk vkSj izlkj.k | N217: Deepak book depot
A218: 903 | B218: foalsV 'kfu | C218: xka/kh th | D218: 1 | E218: 50 | F218: of:=[.E218]*[.D218] -> 50 | G218: 1996 | I218: of:=YEAR(TODAY())-[.G218] -> 29 | L218: 1994 | M218: lwpuk vkSj izlkj.k | N218: Deepak book depot
A219: 905 | B219: Jh e/kqdj | C219: vkdk'kok.kh fofo/kk | D219: 1 | E219: 20 | F219: of:=[.E219]*[.D219] -> 20 | G219: 1996 | I219: of:=YEAR(TODAY())-[.G219] -> 29 | L219: 1993 | M219: vkdk'kok.kh egk0 | N219: Deepak book depot
A220: 919 | B220: dqosEiq | C220: dkuw: gsXxfMfr | D220: 1 | E220: 40 | F220: of:=[.E220]*[.D220] -> 40 | G220: 1996 | I220: of:=YEAR(TODAY())-[.G220] -> 29 | L220: 1981 | M220: lkfgR; vdkneh | N220: Deepak book depot
A221: 921 | B221: xtsUnz dqekj | C221: dydRrs ds ikl gh | D221: 1 | E221: 100 | F221: of:=[.E221]*[.D221] -> 100 | G221: 1996 | I221: of:=YEAR(TODAY())-[.G221] -> 29 | L221: 1992 | M221: lkfgR; vdkneh | N221: Deepak book depot
A222: 934 | B222: jtuh dkar | C222: esjh fcfV;k | D222: 1 | E222: 30 | F222: of:=[.E222]*[.D222] -> 30 | G222: 1996 | I222: of:=YEAR(TODAY())-[.G222] -> 29 | L222: 1994 | M222: lkfgR; vdkneh | N222: Deepak book depot
A223: 940 | B223: bClu | C223: eqxkZch | D223: 1 | E223: 15 | F223: of:=[.E223]*[.D223] -> 15 | G223: 1996 | I223: of:=YEAR(TODAY())-[.G223] -> 29 | L223: 1983 | M223: lkfgR; vdkneh | N223: Deepak book depot
A224: 941 | B224: fo".kq izHkkdj | C224: izlkn jpuk lap;u | D224: 1 | E224: 130 | F224: of:=[.E224]*[.D224] -> 130 | G224: 1996 | I224: of:=YEAR(TODAY())-[.G224] -> 29 | L224: 1991 | M224: lkfgR; vdkneh | N224: Deepak book depot
A225: 944 | B225: xaxk?kj xkMxhy | C225: cPpksa us nckspk pksj | D225: 1 | E225: 25 | F225: of:=[.E225]*[.D225] -> 25 | G225: 1996 | I225: of:=YEAR(TODAY())-[.G225] -> 29 | L225: 1993 | M225: lkfgR; vdkneh | N225: Deepak book depot
A226: 946 | B226: Ukk0ikFkZ lkjFkh | C226: ;g xyh fcdkm ugha | D226: 1 | E226: 40 | F226: of:=[.E226]*[.D226] -> 40 | G226: 1996 | I226: of:=YEAR(TODAY())-[.G226] -> 29 | L226: 1985 | M226: lkfgR; vdkneh | N226: Deepak book depot
A227: 947 | B227: l/kkukFk jk; | C227: fpfydk | D227: 1 | E227: 10 | F227: of:=[.E227]*[.D227] -> 10 | G227: 1996 | I227: of:=YEAR(TODAY())-[.G227] -> 29 | L227: 1970 | M227: lkfgR; vdkneh | N227: Deepak book depot
A228: 949 | B228: izHkkdj ekpos | C228: jkgqy lkad`R;k;u | D228: 1 | E228: 15 | F228: of:=[.E228]*[.D228] -> 15 | G228: 1996 | I228: of:=YEAR(TODAY())-[.G228] -> 29 | L228: 1990 | M228: lkfgR; vdkneh | N228: Deepak book depot
A229: 952 | B229: jkeflag rksej | C229: johUnz ukFk dh dgkfu;ka Hkkx 1 | D229: 1 | E229: 80 | F229: of:=[.E229]*[.D229] -> 80 | G229: 1996 | I229: of:=YEAR(TODAY())-[.G229] -> 29 | L229: 1992 | M229: lkfgR; vdkneh | N229: Deepak book depot
A230: 953 | B230: df.kdj rksej | C230: johUnz ukFk dh dgkfu;ka Hkkx 2 | D230: 1 | E230: 65 | F230: of:=[.E230]*[.D230] -> 65 | G230: 1996 | I230: of:=YEAR(TODAY())-[.G230] -> 29 | L230: 1990 | M230: lkfgR; vdkneh | N230: Deepak book depot
A231: 957 | B231: y{ke.k xk;dokM | C231: mBkbz xhjh | D231: 1 | E231: 100 | F231: of:=[.E231]*[.D231] -> 100 | G231: 1996 | I231: of:=YEAR(TODAY())-[.G231] -> 29 | L231: 1992 | M231: lkfgR; vdkneh | N231: Deepak book depot
A232: 958 | B232: ;qxthr uoyiqjh | C232: ckcjukek | D232: 1 | E232: 100 | F232: of:=[.E232]*[.D232] -> 100 | G232: 1996 | I232: of:=YEAR(TODAY())-[.G232] -> 29 | L232: 1994 | M232: lkfgR; vdkneh | N232: Deepak book depot
A233: 961 | B233: Mk0 ijekuan | C233: fons'kh ;kf=;ksa dh utj esa Hkkjr | D233: 1 | E233: 15 | F233: of:=[.E233]*[.D233] -> 15 | G233: 1996 | I233: of:=YEAR(TODAY())-[.G233] -> 29 | L233: 1992 | M233: lkfgR; vdkneh | N233: Deepak book depot
A234: 962 | B234: Mk0 n'kjFk | C234: vkfn 'kadjkpk;Z | D234: 1 | E234: 15 | F234: of:=[.E234]*[.D234] -> 15 | G234: 1996 | I234: of:=YEAR(TODAY())-[.G234] -> 29 | L234: 1991 | M234: lkfgR; vdkneh | N234: Deepak book depot
A235: 967 | B235: ls;n vcnqy | C235: ;k;koj | D235: 1 | E235: 60 | F235: of:=[.E235]*[.D235] -> 60 | G235: 1996 | I235: of:=YEAR(TODAY())-[.G235] -> 29 | L235: 1992 | M235: lkfgR; vdkneh | N235: Deepak book depot
A236: 970 | B236: egsUnz flag | C236: dkaxMk | D236: 1 | E236: 50 | F236: of:=[.E236]*[.D236] -> 50 | G236: 1996 | I236: of:=YEAR(TODAY())-[.G236] -> 29 | L236: 1984 | M236: lkfgR; vdkneh | N236: Deepak book depot
A237: 971 | B237: Nk0 ljyk 'kqDy | C237: ik'pkR; thou dyk | D237: 1 | E237: 5 | F237: of:=[.E237]*[.D237] -> 5 | G237: 1996 | I237: of:=YEAR(TODAY())-[.G237] -> 29 | L237: 1973 | M237: mRrj izns'k 'kklu | N237: y[kuÅ {ks=h; dk;kZy;
A238: 972 | B238: izHkkdj lnk f'ko if.Mr | C238: egkjk"V ds lUrksa dh dFkk | D238: 1 | E238: 32 | F238: of:=[.E238]*[.D238] -> 32 | G238: 1996 | I238: of:=YEAR(TODAY())-[.G238] -> 29 | L238: 1991 | M238: mRrj izns'k 'kklu | N238: y[kuÅ {ks=h; dk;kZy;
A239: 975 | B239: Mk0 fo|kfuokl | C239: ckcw ';ke lqUnj nkl | D239: 1 | E239: 43 | F239: of:=[.E239]*[.D239] -> 43 | G239: 1996 | I239: of:=YEAR(TODAY())-[.G239] -> 29 | L239: 1983 | M239: mRrj izns'k 'kklu | N239: y[kuÅ {ks=h; dk;kZy;
A240: 983 | B240: okpLifr xSjksy | C240: Hkkjrh; laLd`fr vkSj dyk | D240: 1 | E240: 50 | F240: of:=[.E240]*[.D240] -> 50 | G240: 1996 | I240: of:=YEAR(TODAY())-[.G240] -> 29 | L240: 1973 | M240: mRrj izns'k 'kklu | N240: y[kuÅ {ks=h; dk;kZy;
A241: 985 | B241: ds vkj ,u xqykVh | C241: gekjh ukS lsuk | D241: 1 | E241: 5.5 | F241: of:=[.E241]*[.D241] -> 5.5 | G241: 1996 | I241: of:=YEAR(TODAY())-[.G241] -> 29 | L241: 1976 | N241: y[kuÅ {ks=h; dk;kZy;
A242: 998 | B242: v:.k dqekj nRr | C242: pk; dh dgkuh | D242: 1 | E242: 5.5 | F242: of:=[.E242]*[.D242] -> 5.5 | G242: 1996 | I242: of:=YEAR(TODAY())-[.G242] -> 29 | L242: 1986 | N242: y[kuÅ {ks=h; dk;kZy;
A243: 1001 | B243: [kyhQ vgen futkeh | C243: 'ks[k futkeqnnhu vkSfy;k | D243: 1 | E243: 10.5 | F243: of:=[.E243]*[.D243] -> 10.5 | G243: 1996 | I243: of:=YEAR(TODAY())-[.G243] -> 29 | L243: 1988 | N243: y[kuÅ {ks=h; dk;kZy;
A244: 1002 | B244: jkcVs th- Hks;l | C244: cPpks ds fy, lgh 'kq:vkr | D244: 1 | E244: 26 | F244: of:=[.E244]*[.D244] -> 26 | G244: 1996 | I244: of:=YEAR(TODAY())-[.G244] -> 29 | L244: 1984 | N244: y[kuÅ {ks=h; dk;kZy;
A245: 1003 | B245: fo|k HkkLdj | C245: 'ksj'kkg lwjh | D245: 1 | E245: 15 | F245: of:=[.E245]*[.D245] -> 15 | G245: 1996 | I245: of:=YEAR(TODAY())-[.G245] -> 29 | L245: 1972 | N245: y[kuÅ {ks=h; dk;kZy;
A246: 1006 | B246: nh- ,e- ih egknou | C246: 'kadjkpk;Z | D246: 1 | E246: 9 | F246: of:=[.E246]*[.D246] -> 9 | G246: 1996 | I246: of:=YEAR(TODAY())-[.G246] -> 29 | L246: 1968 | N246: y[kuÅ {ks=h; dk;kZy;
A247: 1015 | B247: usfepUnz tsu | C247: u;s fgUnh y/kq ukVd | D247: 1 | E247: 28.5 | F247: of:=[.E247]*[.D247] -> 28.5 | G247: 1996 | I247: of:=YEAR(TODAY())-[.G247] -> 29 | L247: 1986 | N247: y[kuÅ {ks=h; dk;kZy;
A248: 1019 | B248: , ih nklxqIr | C248: vk'kqrks"k eqdthZ | D248: 1 | E248: 9.5 | F248: of:=[.E248]*[.D248] -> 9.5 | G248: 1996 | I248: of:=YEAR(TODAY())-[.G248] -> 29 | L248: 1986 | N248: y[kuÅ {ks=h; dk;kZy;
A249: 1020 | B249: fnyhi dqekj eqdthZ | C249: pSrU; | D249: 1 | E249: 8 | F249: of:=[.E249]*[.D249] -> 8 | G249: 1996 | I249: of:=YEAR(TODAY())-[.G249] -> 29 | L249: 1972 | N249: y[kuÅ {ks=h; dk;kZy;
A250: 1021 | B250: olar ewu | C250: Mk0 ckck lkgc vkacsMdj | D250: 1 | E250: 43 | F250: of:=[.E250]*[.D250] -> 43 | G250: 1996 | I250: of:=YEAR(TODAY())-[.G250] -> 29 | L250: 1991 | N250: y[kuÅ {ks=h; dk;kZy;
A251: 1028 | B251: gtkjh izlkn | C251: eU= rU= | D251: 1 | E251: 8 | F251: of:=[.E251]*[.D251] -> 8 | G251: 1996 | I251: of:=YEAR(TODAY())-[.G251] -> 29 | L251: 1993 | N251: y[kuÅ {ks=h; dk;kZy;
A252: 1029 | B252: kjfnUnq lsu jk; | C252: jaxfojaxk jktLFkku | D252: 1 | E252: 6 | F252: of:=[.E252]*[.D252] -> 6 | G252: 1996 | I252: of:=YEAR(TODAY())-[.G252] -> 29 | L252: 1986 | N252: y[kuÅ {ks=h; dk;kZy;
A253: 1032 | B253: fo".kq izHkkdj | C253: gekjk ukVd | D253: 1 | E253: 10.5 | F253: of:=[.E253]*[.D253] -> 10.5 | G253: 1996 | I253: of:=YEAR(TODAY())-[.G253] -> 29 | L253: 1984 | N253: y[kuÅ {ks=h; dk;kZy;
A254: 1035 | B254: js[kk vxzoky | C254: jDr dh dgkuh | D254: 1 | E254: 7 | F254: of:=[.E254]*[.D254] -> 7 | G254: 1996 | I254: of:=YEAR(TODAY())-[.G254] -> 29 | L254: 1986 | N254: y[kuÅ {ks=h; dk;kZy;
A255: 1044 | B255: nsl jkt xks;y | C255: ;kn tokgjyky dh | D255: 1 | E255: 6.5 | F255: of:=[.E255]*[.D255] -> 6.5 | G255: 1996 | I255: of:=YEAR(TODAY())-[.G255] -> 29 | L255: 1989 | N255: y[kuÅ {ks=h; dk;kZy;
A256: 1082 | B256: egkdfo HkkEl | C256: LoIu okl onRrk | D256: 1 | E256: 12 | F256: of:=[.E256]*[.D256] -> 12 | G256: 1996 | I256: of:=YEAR(TODAY())-[.G256] -> 29 | L256: 1992 | N256: y[kuÅ {ks=h; dk;kZy;
A257: 1084 | B257: eukst nkl | C257: lkgl ds /kuh | D257: 1 | E257: 10 | F257: of:=[.E257]*[.D257] -> 10 | G257: 1996 | I257: of:=YEAR(TODAY())-[.G257] -> 29 | L257: 1988 | M257: N.C.E.R.T | N257: y[kuÅ {ks=h; dk;kZy;
A258: 1085 | B258: y{eh dkar oekZ | C258: iq:"kksRre nkl VaMu | D258: 1 | E258: 14.1 | F258: of:=[.E258]*[.D258] -> 14.1 | G258: 1996 | I258: of:=YEAR(TODAY())-[.G258] -> 29 | L258: 1989 | M258: N.C.E.R.T | N258: y[kuÅ {ks=h; dk;kZy;
A259: 1095 | B259: jkepj.k esgjks=k | C259: rRo u;s iqjkus | D259: 1 | E259: 8 | F259: of:=[.E259]*[.D259] -> 8 | G259: 1996 | I259: of:=YEAR(TODAY())-[.G259] -> 29 | L259: 1989 | M259: N.C.E.R.T | N259: y[kuÅ {ks=h; dk;kZy;
A260: 1123 | C260: science for 9th class part 3 | D260: 1 | E260: 0 | F260: of:=[.E260]*[.D260] -> 0 | G260: 1996 | I260: of:=YEAR(TODAY())-[.G260] -> 29 | L260: 1980 | M260: tect book | N260: R. lal book depot
A261: 1124 | B261: R.S. Mittal | C261: laboretory manual in science | D261: 1 | E261: 36.8 | F261: of:=[.E261]*[.D261] -> 36.8 | G261: 1996 | I261: of:=YEAR(TODAY())-[.G261] -> 29 | L261: 1989 | M261: tect book | N261: R. lal book depot
A262: 1130 | B262: ohjssUnz roj | C262: vfgY;kckbZ | D262: 1 | E262: 6 | F262: of:=[.E262]*[.D262] -> 6 | G262: 1996 | I262: of:=YEAR(TODAY())-[.G262] -> 29 | L262: 1991 | M262: N.C.E.R.T | N262: {ks=h; dk;kZy; y[kuÅ
A263: 1132 | B263: izks0 deyk [ksrjiky | C263: 'kjhj fdz;k vkSj [ksydwn | D263: 1 | E263: 21 | F263: of:=[.E263]*[.D263] -> 21 | G263: 1996 | I263: of:=YEAR(TODAY())-[.G263] -> 29 | L263: 1994 | M263: N.C.E.R.T | N263: {ks=h; dk;kZy; y[kuÅ
A264: 1134 | B264: Mk0 izHkkdj ekpos | C264: xka/kh th ds vkJe esa | D264: 1 | E264: 6.5 | F264: of:=[.E264]*[.D264] -> 6.5 | G264: 1996 | I264: of:=YEAR(TODAY())-[.G264] -> 29 | L264: 1991 | M264: N.C.E.R.T | N264: {ks=h; dk;kZy; y[kuÅ
A265: 1140 | B265: fgeka'kq tks'kh | C265: lwjt peds vk/kh jkr | D265: 1 | E265: 13 | F265: of:=[.E265]*[.D265] -> 13 | G265: 1996 | I265: of:=YEAR(TODAY())-[.G265] -> 29 | M265: N.C.E.R.T | N265: {ks=h; dk;kZy; y[kuÅ
A266: 1144 | B266: lS;n tgwj dkfle | C266: iasafXou ds ns'k esa | D266: 1 | E266: 11.2 | F266: of:=[.E266]*[.D266] -> 11.2 | G266: 1996 | I266: of:=YEAR(TODAY())-[.G266] -> 29 | L266: 1987 | M266: N.C.E.R.T | N266: {ks=h; dk;kZy; y[kuÅ
A267: 1149 | B267: Mk0 foófe= mik/;k; | C267: jke izlkn fcfLey dh vkRedFkk | D267: 1 | E267: 13 | F267: of:=[.E267]*[.D267] -> 13 | G267: 1996 | I267: of:=YEAR(TODAY())-[.G267] -> 29 | L267: 1994 | M267: N.C.E.R.T | N267: {ks=h; dk;kZy; y[kuÅ
A268: 1153 | B268: Mk0 pdorkS | C268: pdzorhZ jktxksikykpkjh | D268: 1 | E268: 6 | F268: of:=[.E268]*[.D268] -> 6 | G268: 1996 | I268: of:=YEAR(TODAY())-[.G268] -> 29 | L268: 1991 | M268: N.C.E.R.T | N268: {ks=h; dk;kZy; y[kuÅ
A269: 1175 | B269: HkosUnzukFk | C269: vkdk'k | D269: 1 | E269: 50 | F269: of:=[.E269]*[.D269] -> 50 | G269: 1996 | I269: of:=YEAR(TODAY())-[.G269] -> 29 | L269: 1996 | M269: N.C.E.R.T | N269: {ks=h; dk;kZy; y[kuÅ
A270: 1176 | B270: Mk0 t;dkaru | C270: cnyrs psgjs | D270: 1 | E270: 50 | F270: of:=[.E270]*[.D270] -> 50 | G270: 1996 | I270: of:=YEAR(TODAY())-[.G270] -> 29 | L270: 1995 | M270: N.C.E.R.T | N270: {ks=h; dk;kZy; y[kuÅ
A271: 1189 | B271: Rarala D Nandedkar | C271: Brave new generatioon | D271: 1 | E271: 20 | F271: of:=[.E271]*[.D271] -> 20 | G271: 1996 | I271: of:=YEAR(TODAY())-[.G271] -> 29 | L271: 1994 | M271: N.C.E.R.T | N271: {ks=h; dk;kZy; y[kuÅ
A272: 1191 | B272: V.G Kulkarni | C272: Doing science is fun | D272: 1 | E272: 30 | F272: of:=[.E272]*[.D272] -> 30 | G272: 1996 | I272: of:=YEAR(TODAY())-[.G272] -> 29 | L272: 1993 | M272: N.C.E.R.T | N272: {ks=h; dk;kZy; y[kuÅ
A273: 1198 | B273: Dr P Magaraja Rao | C273: Dr. Radhakrishnan | D273: 1 | E273: 45 | F273: of:=[.E273]*[.D273] -> 45 | G273: 1996 | I273: of:=YEAR(TODAY())-[.G273] -> 29 | L273: 1994 | M273: N.C.E.R.T | N273: {ks=h; dk;kZy; y[kuÅ
A274: 1215 | B274: Mrs Geeta lal | C274: civilization | D274: 1 | E274: 30 | F274: of:=[.E274]*[.D274] -> 30 | G274: 1996 | I274: of:=YEAR(TODAY())-[.G274] -> 29 | L274: 1994 | M274: N.C.E.R.T | N274: {ks=h; dk;kZy; y[kuÅ
A275: 1219 | B275: Mk0 /keZiky xka/kh | C275: Jh ukjk;.k xq: | D275: 1 | E275: 10.5 | F275: of:=[.E275]*[.D275] -> 10.5 | G275: 1996 | I275: of:=YEAR(TODAY())-[.G275] -> 29 | L275: 1985 | M275: N.C.E.R.T | N275: {ks=h; dk;kZy; y[kuÅ
A276: 1229 | B276: J.T. Glover | C276: Vedic Mathematics | D276: 1 | E276: 65 | F276: of:=[.E276]*[.D276] -> 65 | G276: 1996 | I276: of:=YEAR(TODAY())-[.G276] -> 29 | M276: N.C.E.R.T | N276: {ks=h; dk;kZy; y[kuÅ
A277: 1230 | B277: J.T. Glover | C277: Vedic Mathematics | D277: 1 | E277: 65 | F277: of:=[.E277]*[.D277] -> 65 | G277: 1996 | I277: of:=YEAR(TODAY())-[.G277] -> 29 | M277: N.C.E.R.T | N277: {ks=h; dk;kZy; y[kuÅ
A278: 1233 | B278: Feisal Alkazi | C278: Chipko | D278: 1 | E278: 20 | F278: of:=[.E278]*[.D278] -> 20 | G278: 1996 | I278: of:=YEAR(TODAY())-[.G278] -> 29 | M278: N.C.E.R.T | N278: {ks=h; dk;kZy; y[kuÅ
A279: 1234 | B279: Feisal Alkazi | C279: Chipko | D279: 1 | E279: 20 | F279: of:=[.E279]*[.D279] -> 20 | G279: 1996 | I279: of:=YEAR(TODAY())-[.G279] -> 29 | M279: N.C.E.R.T | N279: {ks=h; dk;kZy; y[kuÅ
A280: 1239 | B280: Feisal Alkazi | C280: Chipko | D280: 1 | E280: 20 | F280: of:=[.E280]*[.D280] -> 20 | G280: 1996 | I280: of:=YEAR(TODAY())-[.G280] -> 29 | M280: N.C.E.R.T | N280: {ks=h; dk;kZy; y[kuÅ
A281: 1240 | B281: Feisal Alkazi | C281: Chipko | D281: 1 | E281: 20 | F281: of:=[.E281]*[.D281] -> 20 | G281: 1996 | I281: of:=YEAR(TODAY())-[.G281] -> 29 | M281: N.C.E.R.T | N281: {ks=h; dk;kZy; y[kuÅ
A282: 1241 | B282: Feisal Alkazi | C282: Chipko | D282: 1 | E282: 20 | F282: of:=[.E282]*[.D282] -> 20 | G282: 1996 | I282: of:=YEAR(TODAY())-[.G282] -> 29 | M282: N.C.E.R.T | N282: {ks=h; dk;kZy; y[kuÅ
A283: 1242 | B283: Feisal Alkazi | C283: Chipko | D283: 1 | E283: 20 | F283: of:=[.E283]*[.D283] -> 20 | G283: 1996 | I283: of:=YEAR(TODAY())-[.G283] -> 29 | M283: N.C.E.R.T | N283: {ks=h; dk;kZy; y[kuÅ
A284: 1247 | B284: Priti Jain | C284: The rain drop | D284: 1 | E284: 20 | F284: of:=[.E284]*[.D284] -> 20 | G284: 1996 | I284: of:=YEAR(TODAY())-[.G284] -> 29 | M284: N.C.E.R.T | N284: {ks=h; dk;kZy; y[kuÅ
A285: 1248 | B285: Priti Jain | C285: The rain drop | D285: 1 | E285: 20 | F285: of:=[.E285]*[.D285] -> 20 | G285: 1996 | I285: of:=YEAR(TODAY())-[.G285] -> 29 | M285: N.C.E.R.T | N285: {ks=h; dk;kZy; y[kuÅ
A286: 1249 | B286: Priti Jain | C286: The rain drop | D286: 1 | E286: 20 | F286: of:=[.E286]*[.D286] -> 20 | G286: 1996 | I286: of:=YEAR(TODAY())-[.G286] -> 29 | M286: N.C.E.R.T | N286: {ks=h; dk;kZy; y[kuÅ
A287: 1253 | B287: Feisal Alkazi | C287: Naina's Village | D287: 1 | E287: 20 | F287: of:=[.E287]*[.D287] -> 20 | G287: 1996 | I287: of:=YEAR(TODAY())-[.G287] -> 29 | M287: N.C.E.R.T | N287: {ks=h; dk;kZy; y[kuÅ
A288: 1256 | B288: Feisal Aliazi | C288: Nainas village | D288: 1 | E288: 20 | F288: of:=[.E288]*[.D288] -> 20 | G288: 1996 | I288: of:=YEAR(TODAY())-[.G288] -> 29 | M288: N.C.E.R.T | N288: {ks=h; dk;kzy; y[kuÅ
A289: 1258 | B289: Feisal Aliazi | C289: Nainas village | D289: 1 | E289: 20 | F289: of:=[.E289]*[.D289] -> 20 | G289: 1996 | I289: of:=YEAR(TODAY())-[.G289] -> 29 | M289: N.C.E.R.T | N289: {ks=h; dk;kzy; y[kuÅ
A290: 1261 | B290: Feisal Aliazi | C290: Nainas village | D290: 1 | E290: 20 | F290: of:=[.E290]*[.D290] -> 20 | G290: 1996 | I290: of:=YEAR(TODAY())-[.G290] -> 29 | M290: N.C.E.R.T | N290: {ks=h; dk;kzy; y[kuÅ
A291: 1262 | B291: Feisal Aliazi | C291: Nainas village | D291: 1 | E291: 20 | F291: of:=[.E291]*[.D291] -> 20 | G291: 1996 | I291: of:=YEAR(TODAY())-[.G291] -> 29 | M291: N.C.E.R.T | N291: {ks=h; dk;kzy; y[kuÅ
A292: 1263 | B292: Feisal Aliazi | C292: with in the well | D292: 1 | E292: 20 | F292: of:=[.E292]*[.D292] -> 20 | G292: 1996 | I292: of:=YEAR(TODAY())-[.G292] -> 29 | M292: N.C.E.R.T | N292: {ks=h; dk;kzy; y[kuÅ
A293: 1264 | B293: Feisal Aliazi | C293: with in the well | D293: 1 | E293: 20 | F293: of:=[.E293]*[.D293] -> 20 | G293: 1996 | I293: of:=YEAR(TODAY())-[.G293] -> 29 | M293: N.C.E.R.T | N293: {ks=h; dk;kzy; y[kuÅ
A294: 1265 | B294: Feisal Aliazi | C294: with in the well | D294: 1 | E294: 20 | F294: of:=[.E294]*[.D294] -> 20 | G294: 1996 | I294: of:=YEAR(TODAY())-[.G294] -> 29 | M294: N.C.E.R.T | N294: {ks=h; dk;kzy; y[kuÅ
A295: 1266 | B295: Feisal Aliazi | C295: with in the well | D295: 1 | E295: 20 | F295: of:=[.E295]*[.D295] -> 20 | G295: 1996 | I295: of:=YEAR(TODAY())-[.G295] -> 29 | M295: N.C.E.R.T | N295: {ks=h; dk;kzy; y[kuÅ
A296: 1268 | B296: Feisal Aliazi | C296: with in the well | D296: 1 | E296: 20 | F296: of:=[.E296]*[.D296] -> 20 | G296: 1996 | I296: of:=YEAR(TODAY())-[.G296] -> 29 | M296: N.C.E.R.T | N296: {ks=h; dk;kzy; y[kuÅ
A297: 1269 | B297: Feisal Aliazi | C297: with in the well | D297: 1 | E297: 20 | F297: of:=[.E297]*[.D297] -> 20 | G297: 1996 | I297: of:=YEAR(TODAY())-[.G297] -> 29 | M297: N.C.E.R.T | N297: {ks=h; dk;kzy; y[kuÅ
A298: 1271 | B298: Feisal Aliazi | C298: with in the well | D298: 1 | E298: 20 | F298: of:=[.E298]*[.D298] -> 20 | G298: 1996 | I298: of:=YEAR(TODAY())-[.G298] -> 29 | M298: N.C.E.R.T | N298: {ks=h; dk;kzy; y[kuÅ
A299: 1273 | B299: Feisal Aliazi | C299: The wrath of nature | D299: 1 | E299: 20 | F299: of:=[.E299]*[.D299] -> 20 | G299: 1996 | I299: of:=YEAR(TODAY())-[.G299] -> 29 | M299: N.C.E.R.T | N299: {ks=h; dk;kzy; y[kuÅ
A300: 1274 | B300: Feisal Aliazi | C300: The wrath of nature | D300: 1 | E300: 28 | F300: of:=[.E300]*[.D300] -> 28 | G300: 1996 | I300: of:=YEAR(TODAY())-[.G300] -> 29 | M300: N.C.E.R.T | N300: {ks=h; dk;kzy; y[kuÅ
A301: 1276 | B301: Feisal Aliazi | C301: The wrath of nature | D301: 1 | E301: 28 | F301: of:=[.E301]*[.D301] -> 28 | G301: 1996 | I301: of:=YEAR(TODAY())-[.G301] -> 29 | M301: N.C.E.R.T | N301: {ks=h; dk;kzy; y[kuÅ
A302: 1277 | B302: Feisal Aliazi | C302: The wrath of nature | D302: 1 | E302: 28 | F302: of:=[.E302]*[.D302] -> 28 | G302: 1996 | I302: of:=YEAR(TODAY())-[.G302] -> 29 | M302: N.C.E.R.T | N302: {ks=h; dk;kzy; y[kuÅ
A303: 1278 | B303: Feisal Aliazi | C303: The wrath of nature | D303: 1 | E303: 28 | F303: of:=[.E303]*[.D303] -> 28 | G303: 1996 | I303: of:=YEAR(TODAY())-[.G303] -> 29 | M303: N.C.E.R.T | N303: {ks=h; dk;kzy; y[kuÅ
A304: 1279 | B304: Feisal Aliazi | C304: The wrath of nature | D304: 1 | E304: 28 | F304: of:=[.E304]*[.D304] -> 28 | G304: 1996 | I304: of:=YEAR(TODAY())-[.G304] -> 29 | M304: N.C.E.R.T | N304: {ks=h; dk;kzy; y[kuÅ
A305: 1280 | B305: Feisal Aliazi | C305: The wrath of nature | D305: 1 | E305: 28 | F305: of:=[.E305]*[.D305] -> 28 | G305: 1996 | I305: of:=YEAR(TODAY())-[.G305] -> 29 | M305: N.C.E.R.T | N305: {ks=h; dk;kzy; y[kuÅ
A306: 1281 | B306: Feisal Aliazi | C306: The wrath of nature | D306: 1 | E306: 28 | F306: of:=[.E306]*[.D306] -> 28 | G306: 1996 | I306: of:=YEAR(TODAY())-[.G306] -> 29 | M306: N.C.E.R.T | N306: {ks=h; dk;kzy; y[kuÅ
A307: 1282 | B307: Feisal Aliazi | C307: The wrath of nature | D307: 1 | E307: 28 | F307: of:=[.E307]*[.D307] -> 28 | G307: 1996 | I307: of:=YEAR(TODAY())-[.G307] -> 29 | M307: N.C.E.R.T | N307: {ks=h; dk;kzy; y[kuÅ
A308: 1288 | B308: Anil Agarwal | C308: To wards green village | D308: 1 | E308: 20 | F308: of:=[.E308]*[.D308] -> 20 | G308: 1996 | I308: of:=YEAR(TODAY())-[.G308] -> 29 | L308: 1996 | M308: N.C.E.R.T | N308: {ks=h; dk;kzy; y[kuÅ
A309: 1289 | B309: Anil Agarwal | C309: To wards green village | D309: 1 | E309: 20 | F309: of:=[.E309]*[.D309] -> 20 | G309: 1996 | I309: of:=YEAR(TODAY())-[.G309] -> 29 | L309: 1996 | M309: N.C.E.R.T | N309: {ks=h; dk;kzy; y[kuÅ
A310: 1290 | B310: Anil Agarwal | C310: To wards green village | D310: 1 | E310: 20 | F310: of:=[.E310]*[.D310] -> 20 | G310: 1996 | I310: of:=YEAR(TODAY())-[.G310] -> 29 | L310: 1996 | M310: N.C.E.R.T | N310: {ks=h; dk;kzy; y[kuÅ
A311: 1295 | B311: Anil Agarwal | C311: Global warming | D311: 1 | E311: 30 | F311: of:=[.E311]*[.D311] -> 30 | G311: 1996 | I311: of:=YEAR(TODAY())-[.G311] -> 29 | L311: 1996 | M311: N.C.E.R.T | N311: {ks=h; dk;kzy; y[kuÅ
A312: 1300 | B312: Anil Agarwal | C312: Global warming | D312: 1 | E312: 30 | F312: of:=[.E312]*[.D312] -> 30 | G312: 1996 | I312: of:=YEAR(TODAY())-[.G312] -> 29 | L312: 1996 | M312: N.C.E.R.T | N312: {ks=h; dk;kzy; y[kuÅ
A313: 1303 | B313: Usha Rai | C313: Call of the commons | D313: 1 | E313: 10 | F313: of:=[.E313]*[.D313] -> 10 | G313: 1996 | I313: of:=YEAR(TODAY())-[.G313] -> 29 | L313: 1996 | M313: N.C.E.R.T | N313: {ks=h; dk;kzy; y[kuÅ
A314: 1304 | B314: Usha Rai | C314: Call of the commons | D314: 1 | E314: 10 | F314: of:=[.E314]*[.D314] -> 10 | G314: 1996 | I314: of:=YEAR(TODAY())-[.G314] -> 29 | L314: 1996 | M314: N.C.E.R.T | N314: {ks=h; dk;kzy; y[kuÅ
A315: 1305 | B315: Usha Rai | C315: Call of the commons | D315: 1 | E315: 10 | F315: of:=[.E315]*[.D315] -> 10 | G315: 1996 | I315: of:=YEAR(TODAY())-[.G315] -> 29 | L315: 1996 | M315: N.C.E.R.T | N315: {ks=h; dk;kzy; y[kuÅ
A316: 1306 | B316: Usha Rai | C316: Call of the commons | D316: 1 | E316: 10 | F316: of:=[.E316]*[.D316] -> 10 | G316: 1996 | I316: of:=YEAR(TODAY())-[.G316] -> 29 | L316: 1996 | M316: N.C.E.R.T | N316: {ks=h; dk;kzy; y[kuÅ
A317: 1308 | B317: P.R Mishra | C317: Chakriy vikas Pranali | D317: 1 | E317: 10 | F317: of:=[.E317]*[.D317] -> 10 | G317: 1996 | I317: of:=YEAR(TODAY())-[.G317] -> 29 | L317: 1996 | M317: N.C.E.R.T | N317: {ks=h; dk;kzy; y[kuÅ
A318: 1310 | B318: P.R Mishra | C318: Chakriy vikas Pranali | D318: 1 | E318: 10 | F318: of:=[.E318]*[.D318] -> 10 | G318: 1996 | I318: of:=YEAR(TODAY())-[.G318] -> 29 | L318: 1996 | M318: N.C.E.R.T | N318: {ks=h; dk;kzy; y[kuÅ
A319: 1311 | B319: P.R Mishra | C319: Chakriy vikas Pranali | D319: 1 | E319: 10 | F319: of:=[.E319]*[.D319] -> 10 | G319: 1996 | I319: of:=YEAR(TODAY())-[.G319] -> 29 | L319: 1996 | M319: N.C.E.R.T | N319: {ks=h; dk;kzy; y[kuÅ
A320: 1312 | B320: P.R Mishra | C320: Chakriy vikas Pranali | D320: 1 | E320: 10 | F320: of:=[.E320]*[.D320] -> 10 | G320: 1996 | I320: of:=YEAR(TODAY())-[.G320] -> 29 | L320: 1996 | M320: N.C.E.R.T | N320: {ks=h; dk;kzy; y[kuÅ
A321: 1313 | B321: P.R Mishra | C321: Chakriy vikas Pranali | D321: 1 | E321: 10 | F321: of:=[.E321]*[.D321] -> 10 | G321: 1996 | I321: of:=YEAR(TODAY())-[.G321] -> 29 | L321: 1996 | M321: N.C.E.R.T | N321: {ks=h; dk;kzy; y[kuÅ
A322: 1314 | B322: P.R Mishra | C322: Chakriy vikas Pranali | D322: 1 | E322: 10 | F322: of:=[.E322]*[.D322] -> 10 | G322: 1996 | I322: of:=YEAR(TODAY())-[.G322] -> 29 | M322: N.C.E.R.T | N322: {ks=h; dk;kzy; y[kuÅ
A323: 1315 | B323: P.R Mishra | C323: Chakriy vikas Pranali | D323: 1 | E323: 10 | F323: of:=[.E323]*[.D323] -> 10 | G323: 1996 | I323: of:=YEAR(TODAY())-[.G323] -> 29 | M323: N.C.E.R.T | N323: {ks=h; dk;kzy; y[kuÅ
A324: 1316 | B324: P.R Mishra | C324: Chakriy vikas Pranali | D324: 1 | E324: 10 | F324: of:=[.E324]*[.D324] -> 10 | G324: 1996 | I324: of:=YEAR(TODAY())-[.G324] -> 29 | M324: N.C.E.R.T | N324: {ks=h; dk;kzy; y[kuÅ
A325: 1317 | B325: P.R Mishra | C325: Chakriy vikas Pranali | D325: 1 | E325: 10 | F325: of:=[.E325]*[.D325] -> 10 | G325: 1996 | I325: of:=YEAR(TODAY())-[.G325] -> 29 | M325: N.C.E.R.T | N325: {ks=h; dk;kzy; y[kuÅ
A326: 1318 | B326: P.R Mishra | C326: Northern lifestyle | D326: 1 | E326: 10 | F326: of:=[.E326]*[.D326] -> 10 | G326: 1996 | I326: of:=YEAR(TODAY())-[.G326] -> 29 | M326: N.C.E.R.T | N326: {ks=h; dk;kzy; y[kuÅ
A327: 1319 | B327: P.R Mishra | C327: Northern lifestyle | D327: 1 | E327: 10 | F327: of:=[.E327]*[.D327] -> 10 | G327: 1996 | I327: of:=YEAR(TODAY())-[.G327] -> 29 | M327: N.C.E.R.T | N327: {ks=h; dk;kzy; y[kuÅ
A328: 1320 | B328: P.R Mishra | C328: Northern lifestyle | D328: 1 | E328: 10 | F328: of:=[.E328]*[.D328] -> 10 | G328: 1996 | I328: of:=YEAR(TODAY())-[.G328] -> 29 | M328: N.C.E.R.T | N328: {ks=h; dk;kzy; y[kuÅ
A329: 1321 | B329: P.R Mishra | C329: Northern lifestyle | D329: 1 | E329: 10 | F329: of:=[.E329]*[.D329] -> 10 | G329: 1996 | I329: of:=YEAR(TODAY())-[.G329] -> 29 | M329: N.C.E.R.T | N329: {ks=h; dk;kzy; y[kuÅ
A330: 1322 | B330: P.R Mishra | C330: Northern lifestyle | D330: 1 | E330: 10 | F330: of:=[.E330]*[.D330] -> 10 | G330: 1996 | I330: of:=YEAR(TODAY())-[.G330] -> 29 | M330: N.C.E.R.T | N330: {ks=h; dk;kzy; y[kuÅ
A331: 1324 | B331: P.R Mishra | C331: Northern lifestyle | D331: 1 | E331: 10 | F331: of:=[.E331]*[.D331] -> 10 | G331: 1996 | I331: of:=YEAR(TODAY())-[.G331] -> 29 | M331: N.C.E.R.T | N331: {ks=h; dk;kzy; y[kuÅ
A332: 1325 | B332: P.R Mishra | C332: Northern lifestyle | D332: 1 | E332: 10 | F332: of:=[.E332]*[.D332] -> 10 | G332: 1996 | I332: of:=YEAR(TODAY())-[.G332] -> 29 | M332: N.C.E.R.T | N332: {ks=h; dk;kzy; y[kuÅ
A333: 1326 | B333: P.R Mishra | C333: Northern lifestyle | D333: 1 | E333: 10 | F333: of:=[.E333]*[.D333] -> 10 | G333: 1996 | I333: of:=YEAR(TODAY())-[.G333] -> 29 | M333: N.C.E.R.T | N333: {ks=h; dk;kzy; y[kuÅ
A334: 1327 | B334: P.R Mishra | C334: Northern lifestyle | D334: 1 | E334: 10 | F334: of:=[.E334]*[.D334] -> 10 | G334: 1996 | I334: of:=YEAR(TODAY())-[.G334] -> 29 | M334: N.C.E.R.T | N334: {ks=h; dk;kzy; y[kuÅ
A335: 1328 | B335: Mostafa Tolba | C335: A duty to hope | D335: 1 | E335: 10 | F335: of:=[.E335]*[.D335] -> 10 | G335: 1996 | I335: of:=YEAR(TODAY())-[.G335] -> 29 | M335: N.C.E.R.T | N335: {ks=h; dk;kzy; y[kuÅ
A336: 1329 | B336: Mostafa Tolba | C336: A duty to hope | D336: 1 | E336: 10 | F336: of:=[.E336]*[.D336] -> 10 | G336: 1996 | I336: of:=YEAR(TODAY())-[.G336] -> 29 | M336: N.C.E.R.T | N336: {ks=h; dk;kzy; y[kuÅ
A337: 1330 | B337: Mostafa Tolba | C337: A duty to hope | D337: 1 | E337: 10 | F337: of:=[.E337]*[.D337] -> 10 | G337: 1996 | I337: of:=YEAR(TODAY())-[.G337] -> 29 | M337: N.C.E.R.T | N337: {ks=h; dk;kzy; y[kuÅ
A338: 1334 | B338: Mostafa Tolba | C338: A duty to hope | D338: 1 | E338: 10 | F338: of:=[.E338]*[.D338] -> 10 | G338: 1996 | I338: of:=YEAR(TODAY())-[.G338] -> 29 | M338: N.C.E.R.T | N338: {ks=h; dk;kzy; y[kuÅ
A339: 1335 | B339: Mostafa Tolba | C339: A duty to hope | D339: 1 | E339: 10 | F339: of:=[.E339]*[.D339] -> 10 | G339: 1996 | I339: of:=YEAR(TODAY())-[.G339] -> 29 | M339: N.C.E.R.T | N339: {ks=h; dk;kzy; y[kuÅ
A340: 1338 | B340: Mostafa Tolba | C340: A duty to hope | D340: 1 | E340: 10 | F340: of:=[.E340]*[.D340] -> 10 | G340: 1996 | I340: of:=YEAR(TODAY())-[.G340] -> 29 | M340: N.C.E.R.T | N340: {ks=h; dk;kzy; y[kuÅ
A341: 1339 | B341: Mostafa Tolba | C341: A duty to hope | D341: 1 | E341: 10 | F341: of:=[.E341]*[.D341] -> 10 | G341: 1996 | I341: of:=YEAR(TODAY())-[.G341] -> 29 | M341: N.C.E.R.T | N341: {ks=h; dk;kzy; y[kuÅ
A342: 1340 | B342: Mostafa Tolba | C342: A duty to hope | D342: 1 | E342: 10 | F342: of:=[.E342]*[.D342] -> 10 | G342: 1996 | I342: of:=YEAR(TODAY())-[.G342] -> 29 | M342: N.C.E.R.T | N342: {ks=h; dk;kzy; y[kuÅ
A343: 1342 | B343: Mostafa Tolba | C343: A duty to hope | D343: 1 | E343: 10 | F343: of:=[.E343]*[.D343] -> 10 | G343: 1996 | I343: of:=YEAR(TODAY())-[.G343] -> 29 | M343: N.C.E.R.T | N343: {ks=h; dk;kzy; y[kuÅ
A344: 1343 | B344: S.K. Ram | C344: Grammar through stories 3 | D344: 1 | E344: 37.5 | F344: of:=[.E344]*[.D344] -> 37.5 | G344: 1996 | I344: of:=YEAR(TODAY())-[.G344] -> 29 | L344: 1995 | M344: N.C.E.R.T | N344: {ks=h; dk;kzy; y[kuÅ
A345: 1344 | B345: S.K. Ram | C345: Grammar through stories 3 | D345: 1 | E345: 37.5 | F345: of:=[.E345]*[.D345] -> 37.5 | G345: 1996 | I345: of:=YEAR(TODAY())-[.G345] -> 29 | L345: 1995 | M345: N.C.E.R.T | N345: {ks=h; dk;kzy; y[kuÅ
A346: 1348 | B346: S.K. Ram | C346: Grammar through stories 3 | D346: 1 | E346: 37.5 | F346: of:=[.E346]*[.D346] -> 37.5 | G346: 1996 | I346: of:=YEAR(TODAY())-[.G346] -> 29 | L346: 1995 | M346: N.C.E.R.T | N346: {ks=h; dk;kzy; y[kuÅ
A347: 1350 | B347: S.K. Ram | C347: Grammar through stories 3 | D347: 1 | E347: 37.5 | F347: of:=[.E347]*[.D347] -> 37.5 | G347: 1996 | I347: of:=YEAR(TODAY())-[.G347] -> 29 | L347: 1995 | M347: N.C.E.R.T | N347: {ks=h; dk;kzy; y[kuÅ
A348: 1352 | B348: S.K. Ram | C348: Grammar through stories 2 | D348: 1 | E348: 34.5 | F348: of:=[.E348]*[.D348] -> 34.5 | G348: 1996 | I348: of:=YEAR(TODAY())-[.G348] -> 29 | L348: 1995 | M348: N.C.E.R.T | N348: {ks=h; dk;kzy; y[kuÅ
A349: 1361 | B349: S.K. Ram | C349: Grammar through stories 1 | D349: 1 | E349: 34.5 | F349: of:=[.E349]*[.D349] -> 34.5 | G349: 1996 | I349: of:=YEAR(TODAY())-[.G349] -> 29 | L349: 1995 | M349: N.C.E.R.T | N349: {ks=h; dk;kzy; y[kuÅ
A350: 1363 | B350: S.K. Ram | C350: Grammar through stories 1 | D350: 1 | E350: 34.5 | F350: of:=[.E350]*[.D350] -> 34.5 | G350: 1996 | I350: of:=YEAR(TODAY())-[.G350] -> 29 | L350: 1995 | M350: N.C.E.R.T | N350: {ks=h; dk;kzy; y[kuÅ
A351: 1370 | B351: S.K. Ram | C351: Grammar through stories 4 | D351: 1 | E351: 40 | F351: of:=[.E351]*[.D351] -> 40 | G351: 1996 | I351: of:=YEAR(TODAY())-[.G351] -> 29 | L351: 1995 | M351: N.C.E.R.T | N351: {ks=h; dk;kzy; y[kuÅ
A352: 1371 | B352: S.K. Ram | C352: Grammar through stories 4 | D352: 1 | E352: 40 | F352: of:=[.E352]*[.D352] -> 40 | G352: 1996 | I352: of:=YEAR(TODAY())-[.G352] -> 29 | L352: 1995 | M352: N.C.E.R.T | N352: {ks=h; dk;kzy; y[kuÅ
A353: 1372 | B353: S.K. Ram | C353: Grammar through stories 4 | D353: 1 | E353: 40 | F353: of:=[.E353]*[.D353] -> 40 | G353: 1996 | I353: of:=YEAR(TODAY())-[.G353] -> 29 | L353: 1995 | M353: N.C.E.R.T | N353: {ks=h; dk;kzy; y[kuÅ
A354: 1373 | B354: S.K. Ram | C354: Grammar through stories 4 | D354: 1 | E354: 40 | F354: of:=[.E354]*[.D354] -> 40 | G354: 1996 | I354: of:=YEAR(TODAY())-[.G354] -> 29 | L354: 1995 | M354: N.C.E.R.T | N354: {ks=h; dk;kzy; y[kuÅ
A355: 1378 | B355: T.L.H. Smith | C355: The english errors of indian students | D355: 1 | E355: 13 | F355: of:=[.E355]*[.D355] -> 13 | G355: 1996 | I355: of:=YEAR(TODAY())-[.G355] -> 29 | L355: 1996 | M355: N.C.E.R.T | N355: {ks=h; dk;kzy; y[kuÅ
A356: 1411 | B356: txrjke vk;Z | C356: lPps cPps fdrus vPNs | D356: 1 | E356: 12 | F356: of:=[.E356]*[.D356] -> 12 | G356: 1996 | I356: of:=YEAR(TODAY())-[.G356] -> 29 | L356: 1996 | M356: fo0 isij cqDl fnYyh | N356: txrjke ,.M lUl fnYyh
A357: 1427 | B357: j/kquUnu fnys | C357: dnerky | D357: 1 | E357: 32 | F357: of:=[.E357]*[.D357] -> 32 | G357: 1996 | I357: of:=YEAR(TODAY())-[.G357] -> 29 | L357: 1991 | M357: txrjke fnYyh | N357: txrjke ,.M lUl fnYyh
A358: 1432 | B358: d``".knRr ikyhoky | C358: vEcsMdj lekt O;oLFkk | D358: 1 | E358: 80 | F358: of:=[.E358]*[.D358] -> 80 | G358: 1996 | I358: of:=YEAR(TODAY())-[.G358] -> 29 | L358: 1996 | M358: fd0 xkW/khuxj fnYyh | N358: txrjke ,.M lUl fnYyh
A359: 1433 | B359: bUnziky flag | C359: xq:n'kZu | D359: 1 | E359: 9.6 | F359: of:=[.E359]*[.D359] -> 9.6 | G359: 1996 | I359: of:=YEAR(TODAY())-[.G359] -> 29 | L359: 1996 | M359: fg0 iq0 Hk.Mkj fnYyh | N359: txrjke ,.M lUl fnYyh
A360: 1437 | B360: lj.k | C360: gekjs izjs.kk lskz= | D360: 1 | E360: 32 | F360: of:=[.E360]*[.D360] -> 32 | G360: 1996 | I360: of:=YEAR(TODAY())-[.G360] -> 29 | L360: 1996 | M360: vk0iz0fnYyh | N360: txrjke ,.M lUl fnYyh
A361: 1444 | B361: ukjk;.k ijekj | C361: gkfj;s uk fgEer | D361: 1 | E361: 8 | F361: of:=[.E361]*[.D361] -> 8 | G361: 1996 | I361: of:=YEAR(TODAY())-[.G361] -> 29 | L361: 1996 | M361: txrjke fnYyh | N361: txrjke ,.M lUl fnYyh
A362: 1445 | B362: jkefujatu | C362: lPph dlkbZ | D362: 1 | E362: 16 | F362: of:=[.E362]*[.D362] -> 16 | G362: 1996 | I362: of:=YEAR(TODAY())-[.G362] -> 29 | L362: 1995 | M362: fd0 xkW/khuxj fnYyh | N362: txrjke ,.M lUl fnYyh
A363: 1446 | B363: lw;Znso izlkn | C363: dzkfUrdkjh | D363: 1 | E363: 24 | F363: of:=[.E363]*[.D363] -> 24 | G363: 1996 | I363: of:=YEAR(TODAY())-[.G363] -> 29 | L363: 1992 | M363: fg0 iq0 Hk.Mkj fnYyh | N363: txrjke ,.M lUl fnYyh
A364: 1468 | B364: JhpUnz tSu | C364: Hkkjr ds o``{k | D364: 1 | E364: 9.6 | F364: of:=[.E364]*[.D364] -> 9.6 | G364: 1996 | I364: of:=YEAR(TODAY())-[.G364] -> 29 | L364: 1996 | M364: fo0 isij cqDl fnYyh | N364: txrjke ,.M lUl fnYyh
A365: 1486 | B365: fo".kq nRr 'kekZ | C365: iznw"k.k i``Foh dk xzg.k | D365: 1 | E365: 48 | F365: of:=[.E365]*[.D365] -> 48 | G365: 1996 | I365: of:=YEAR(TODAY())-[.G365] -> 29 | L365: 1995 | M365: fg0 iq0 Hk.Mkj fnYyh | N365: txrjke ,.M lUl fnYyh
A366: 1487 | B366: fo".kq nRr 'kekZ | C366: I;kZoj.k iznw"k.k | D366: 1 | E366: 80 | F366: of:=[.E366]*[.D366] -> 80 | G366: 1996 | I366: of:=YEAR(TODAY())-[.G366] -> 29 | L366: 1994 | M366: vk0iz0fnYyh | N366: txrjke ,.M lUl fnYyh
A367: 1494 | B367: lq/khj lsu | C367: vkvks cPpksa [ksy okLdsV cky | D367: 1 | E367: 8 | F367: of:=[.E367]*[.D367] -> 8 | G367: 1996 | I367: of:=YEAR(TODAY())-[.G367] -> 29 | L367: 1995 | M367: fg0 iq0 Hk.Mkj fnYyh | N367: txrjke ,.M lUl fnYyh
A368: 1496 | B368: lq/khj lsu | C368: vkvks cPpksa [ksy [kks [kks | D368: 1 | E368: 8 | F368: of:=[.E368]*[.D368] -> 8 | G368: 1996 | I368: of:=YEAR(TODAY())-[.G368] -> 29 | L368: 1995 | M368: fg0 iq0 Hk.Mkj fnYyh | N368: txrjke ,.M lUl fnYyh
A369: 1504 | B369: Lokeh lfPpnkuUn | C369: xhrk vkSj gekjs izlu | D369: 1 | E369: 60 | F369: of:=[.E369]*[.D369] -> 60 | G369: 1996 | I369: of:=YEAR(TODAY())-[.G369] -> 29 | L369: 1995 | M369: fdrkc?kj xkW/khuxj fnYyh | N369: txrjke ,.M lUl fnYyh
A370: 1510 | B370: eSfDle xksdhZ | C370: ubZ vk'kk | D370: 1 | E370: 100 | F370: of:=[.E370]*[.D370] -> 100 | G370: 1996 | I370: of:=YEAR(TODAY())-[.G370] -> 29 | L370: 1996 | M370: fdrkc?kj xkW/khuxj fnYyh | N370: txrjke ,.M lUl fnYyh
A371: 1517 | B371: fouksn R;kxh | C371: Hkkjr esa 'kklu o 'kkld dSls gks | D371: 1 | E371: 16 | F371: of:=[.E371]*[.D371] -> 16 | G371: 1996 | I371: of:=YEAR(TODAY())-[.G371] -> 29 | L371: 1996 | M371: fdrkc?kj xkW/khuxj fnYyh | N371: txrjke ,.M lUl fnYyh
A372: 1519 | B372: vjfoan tSu | C372: vLi``'rk vkSj ekuork | D372: 1 | E372: 40 | F372: of:=[.E372]*[.D372] -> 40 | G372: 1996 | I372: of:=YEAR(TODAY())-[.G372] -> 29 | L372: 1996 | M372: fo0 isij cqDl fnYyh | N372: txrjke ,.M lUl fnYyh
A373: 1524 | B373: jktsUnz voLFkh | C373: nqfu;k ds vtuoh nksLr | D373: 1 | E373: 64 | F373: of:=[.E373]*[.D373] -> 64 | G373: 1996 | I373: of:=YEAR(TODAY())-[.G373] -> 29 | L373: 1996 | M373: fg0 iq0 Hk.Mkj fnYyh | N373: txrjke ,.M lUl fnYyh
A374: 1533 | B374: d`0f'k0egsrk | C374: vn``'; gkFkksa dk tkwn | D374: 1 | E374: 40 | F374: of:=[.E374]*[.D374] -> 40 | G374: 1996 | I374: of:=YEAR(TODAY())-[.G374] -> 29 | L374: 1996 | M374: vk0iz0fnYyh | N374: txrjke ,.M lUl fnYyh
A375: 1537 | B375: Karuna Kumar | C375: Learn English for science | D375: 1 | E375: 20 | F375: of:=[.E375]*[.D375] -> 20 | G375: 1997 | I375: of:=YEAR(TODAY())-[.G375] -> 28 | L375: 1991 | M375: NVS New Delhi | N375: NVS LR
A376: 1538 | B376: Karuna Kumar | C376: Learn English for science | D376: 1 | E376: 20 | F376: of:=[.E376]*[.D376] -> 20 | G376: 1997 | I376: of:=YEAR(TODAY())-[.G376] -> 28 | L376: 1991 | M376: NVS New Delhi | N376: NVS LR
A377: 1544 | B377: Karuna Kumar | C377: Learn English for science | D377: 1 | E377: 20 | F377: of:=[.E377]*[.D377] -> 20 | G377: 1997 | I377: of:=YEAR(TODAY())-[.G377] -> 28 | L377: 1991 | M377: NVS New Delhi | N377: NVS LR
A378: 1552 | B378: Karuna Kumar | C378: Learn English for science | D378: 1 | E378: 20 | F378: of:=[.E378]*[.D378] -> 20 | G378: 1997 | I378: of:=YEAR(TODAY())-[.G378] -> 28 | L378: 1991 | M378: NVS New Delhi | N378: NVS LR
A379: 1553 | B379: Karuna Kumar | C379: Learn English for science | D379: 1 | E379: 20 | F379: of:=[.E379]*[.D379] -> 20 | G379: 1997 | I379: of:=YEAR(TODAY())-[.G379] -> 28 | L379: 1991 | M379: NVS New Delhi | N379: NVS LR
A380: 1563 | B380: Karl Eric | C380: Children & the environment | D380: 1 | E380: 0 | F380: of:=[.E380]*[.D380] -> 0 | G380: 1997 | I380: of:=YEAR(TODAY())-[.G380] -> 28 | L380: 1996 | M380: Centre new Delhi | N380: NVS LR
A381: 1579 | B381: Qdhj pUnz | C381: dqEc o vU; esys | D381: 1 | E381: 3 | F381: of:=[.E381]*[.D381] -> 3 | G381: 1997 | I381: of:=YEAR(TODAY())-[.G381] -> 28 | M381: izdk'ku foHkkx | N381: ;'kiky ,aM cznlZ :Mdh
A382: 1580 | B382: ih vkj vktkn | C382: gtkjh izzlkn f}osnh | D382: 1 | E382: 11.5 | F382: of:=[.E382]*[.D382] -> 11.5 | G382: 1997 | I382: of:=YEAR(TODAY())-[.G382] -> 28 | L382: 1985 | M382: izdk'ku foHkkx | N382: ;'kiky ,aM cznlZ :Mdh
A383: 1583 | C383: ENGLISH MATTERS | D383: 1 | F383: of:=[.E383]*[.D383] -> 0 | G383: 1997 | I383: of:=YEAR(TODAY())-[.G383] -> 28 | L383: Mar | M383: CBSE Delhi | N383: NVS LR
A384: 1634 | B384: jkepju eksg | C384: ukHkdh; fooj.k | D384: 1 | E384: 8 | F384: of:=[.E384]*[.D384] -> 8 | G384: 1997 | I384: of:=YEAR(TODAY())-[.G384] -> 28 | L384: 1991 | M384: NCERT | N384: NVS LR
A385: 1638 | B385: Mk0 ljdk'kqDy | C385: ik"pkR; thou | D385: 1 | E385: 5 | F385: of:=[.E385]*[.D385] -> 5 | G385: 1997 | I385: of:=YEAR(TODAY())-[.G385] -> 28 | L385: 1967 | M385: m0 iz fg0 laLFkku y[kuÅ | N385: NVS LR
A386: 1640 | B386: Jh ch0jke jktw | C386: vkU/kz izns'k laLd`fr | D386: 1 | E386: 15 | F386: of:=[.E386]*[.D386] -> 15 | G386: 1997 | I386: of:=YEAR(TODAY())-[.G386] -> 28 | L386: 1991 | M386: NBT New Delhi | N386: NVS LR
A387: 1642 | B387: nqxkzizlkn | C387: rsfUtx uksjxs | D387: 1 | E387: 4.9 | F387: of:=[.E387]*[.D387] -> 4.9 | G387: 1997 | I387: of:=YEAR(TODAY())-[.G387] -> 28 | L387: 1970 | M387: NCERT | N387: NVS LR
A388: 1649 | B388: izdk'ku ch | C388: nf{k.k Hkkjr ds efUnj | D388: 1 | E388: 50 | F388: of:=[.E388]*[.D388] -> 50 | G388: 1997 | I388: of:=YEAR(TODAY())-[.G388] -> 28 | L388: 1995 | M388: lwpuk izlkj.k ea=ky; | N388: NVS LR
A389: 1654 | B389: T. Jucoks M.R Astin | C389: 100 Atheletics | D389: 1 | E389: 60 | F389: of:=[.E389]*[.D389] -> 60 | G389: 1997 | I389: of:=YEAR(TODAY())-[.G389] -> 28 | L389: 1997 | M389: Gemini books Delhi | N389: NVS LR
A390: 1655 | B390: T.R. Bhawat | C390: Inventions 1 | D390: 1 | E390: 60 | F390: of:=[.E390]*[.D390] -> 60 | G390: 1997 | I390: of:=YEAR(TODAY())-[.G390] -> 28 | L390: 1995 | M390: Dream land pub. Delhi | N390: NVS LR
A391: 1664 | B391: Ministing & labour | D391: 1 | E391: 0 | F391: of:=[.E391]*[.D391] -> 0 | G391: 1997 | I391: of:=YEAR(TODAY())-[.G391] -> 28 | L391: 1988 | M391: Ministary of labour | N391: NVS LR
A392: 1665 | B392: Ministing & labour | C392: CAREER THROUGH COMPETITIVE EXAMINATIONS | D392: 1 | E392: 0 | F392: of:=[.E392]*[.D392] -> 0 | G392: 1997 | I392: of:=YEAR(TODAY())-[.G392] -> 28 | L392: 1998 | M392: Ministary of labour | N392: NVS LR
A393: 1669 | B393: Ministing & labour | C393: CAREER IN PARAMEDICAL OCCUPATION | D393: 1 | E393: 0 | F393: of:=[.E393]*[.D393] -> 0 | G393: 1997 | I393: of:=YEAR(TODAY())-[.G393] -> 28 | L393: 1988 | M393: Ministary of labour | N393: NVS LR
A394: 1670 | B394: Ministing & labour | C394: career in environment Sci. | D394: 1 | E394: 0 | F394: of:=[.E394]*[.D394] -> 0 | G394: 1997 | I394: of:=YEAR(TODAY())-[.G394] -> 28 | L394: 1994 | M394: Ministary of labour | N394: NVS LR
A395: 1671 | B395: Ministing & labour | C395: work series 35 | D395: 1 | E395: 0 | F395: of:=[.E395]*[.D395] -> 0 | G395: 1997 | I395: of:=YEAR(TODAY())-[.G395] -> 28 | L395: 1990 | M395: Ministary of labour | N395: NVS LR
A396: 1672 | B396: Ministing & labour | C396: careers in lib. Sci | D396: 1 | E396: 0 | F396: of:=[.E396]*[.D396] -> 0 | G396: 1997 | I396: of:=YEAR(TODAY())-[.G396] -> 28 | L396: 1994 | M396: Ministary of labour | N396: NVS LR
A397: 1673 | B397: Ministing & labour | C397: work sries 39 | D397: 1 | E397: 0 | F397: of:=[.E397]*[.D397] -> 0 | G397: 1997 | I397: of:=YEAR(TODAY())-[.G397] -> 28 | L397: 1991 | M397: Ministary of labour | N397: NVS LR
A398: 1674 | B398: Labour Mind | C398: lSjUMj djus okyks ds fy, jkstxkj | D398: 1 | E398: 0 | F398: of:=[.E398]*[.D398] -> 0 | G398: 1997 | I398: of:=YEAR(TODAY())-[.G398] -> 28 | L398: 1995 | M398: Carrier study centre | N398: NVS LR
A399: 1676 | B399: Labour Mind | C399: self employ in small scale Ind | D399: 1 | E399: 0 | F399: of:=[.E399]*[.D399] -> 0 | G399: 1997 | I399: of:=YEAR(TODAY())-[.G399] -> 28 | L399: 1982 | M399: Ministary of labour | N399: NVS LR
A400: 1677 | B400: Labour Mind | C400: careers in HOTELIERING | D400: 1 | E400: 0 | F400: of:=[.E400]*[.D400] -> 0 | G400: 1997 | I400: of:=YEAR(TODAY())-[.G400] -> 28 | L400: 1981 | M400: Ministary of labour | N400: NVS LR
A401: 1693 | B401: 'kqdnso izlkn | C401: oSKkfud dk cpiu | D401: 1 | E401: 50 | F401: of:=[.E401]*[.D401] -> 50 | G401: 1997 | I401: of:=YEAR(TODAY())-[.G401] -> 28 | L401: 1997 | M401: xz-Fk vdkneh ubZ fnYyh | N401: NVS LR
A402: 1704 | B402: R.S.Dhillon | C402: NDA Kit | D402: 1 | E402: 275 | F402: of:=[.E402]*[.D402] -> 275 | G402: 1997 | I402: of:=YEAR(TODAY())-[.G402] -> 28 | L402: 1997 | M402: Dhellon Gr of Delhi | N402: NVS LR
A403: 1705 | B403: R.S.Dhillon | C403: function with plants | D403: 1 | E403: 16 | F403: of:=[.E403]*[.D403] -> 16 | G403: 1997 | I403: of:=YEAR(TODAY())-[.G403] -> 28 | L403: 1997 | M403: Viks publisher Delhi | N403: NVS LR
A404: 1709 | B404: lat; 'kqDy | C404: okiw ds O;ax fouksn | D404: 1 | E404: 15 | F404: of:=[.E404]*[.D404] -> 15 | G404: 1997 | I404: of:=YEAR(TODAY())-[.G404] -> 28 | L404: 1996 | M404: loksZn; dzk fnYyh | N404: NVS LR
A405: 1716 | B405: Prabhakar muchwe | C405: Rahul sanskrityan | D405: 1 | E405: 15 | F405: of:=[.E405]*[.D405] -> 15 | G405: 1997 | I405: of:=YEAR(TODAY())-[.G405] -> 28 | L405: 1995 | M405: Sahitya Academy | N405: NVS LR
A406: 1718 | B406: prema nannd kumar | C406: S. Radhakrishanan | D406: 1 | E406: 25 | F406: of:=[.E406]*[.D406] -> 25 | G406: 1997 | I406: of:=YEAR(TODAY())-[.G406] -> 28 | L406: 1997 | M406: sahitya Academy | N406: NVS LR
A407: 1740 | B407: Maheshwari Asurathi | C407: A complete guide for biology 2 | D407: 1 | E407: 109.8 | F407: of:=[.E407]*[.D407] -> 109.8 | G407: 1997 | I407: of:=YEAR(TODAY())-[.G407] -> 28 | L407: 1996 | M407: Arya book depot Delhi | N407: Arya B. Dep. N Delhi
A408: 1742 | B408: Maheshwar & Bhalla | C408: sci book for sec. sch. Biology | D408: 1 | E408: 29 | F408: of:=[.E408]*[.D408] -> 29 | G408: 1997 | I408: of:=YEAR(TODAY())-[.G408] -> 28 | L408: 1996 | M408: Arya book depot Delhi | N408: Arya B. Dep. N Delhi
A409: 1749 | B409: Gopal K, puri | C409: Gen. Int Test of reasoning | D409: 1 | E409: 150 | F409: of:=[.E409]*[.D409] -> 150 | G409: 1997 | I409: of:=YEAR(TODAY())-[.G409] -> 28 | L409: 1998 | M409: Pioneer Medical Pub Delhi | N409: Arya B. Dep. N Delhi
A410: 1753 | B410: Neelam soni | C410: Tech. trg inst. & courses | D410: 1 | E410: 100 | F410: of:=[.E410]*[.D410] -> 100 | G410: 1997 | I410: of:=YEAR(TODAY())-[.G410] -> 28 | L410: 1997 | M410: Student aid pub Delhi | N410: Arya B. Dep. N Delhi
A411: 1780 | B411: Gauri shankar | C411: New light eng grammar | D411: 1 | E411: 64.8 | F411: of:=[.E411]*[.D411] -> 64.8 | G411: 1997 | I411: of:=YEAR(TODAY())-[.G411] -> 28 | L411: 1997 | M411: Arya book depot Delhi | N411: Arya B. Dep. N Delhi
A412: 1781 | B412: K Bhatt urmila | C412: getting head at +2 XI | D412: 1 | E412: 44.8 | F412: of:=[.E412]*[.D412] -> 44.8 | G412: 1997 | I412: of:=YEAR(TODAY())-[.G412] -> 28 | L412: 1996 | M412: Arya book depot Delhi | N412: Arya B. Dep. N Delhi
A413: 1782 | B413: K.Bhatt urmila | C413: getting head at +2 XII | D413: 1 | E413: 59.8 | F413: of:=[.E413]*[.D413] -> 59.8 | G413: 1997 | I413: of:=YEAR(TODAY())-[.G413] -> 28 | L413: 1996 | M413: Arya book depot Delhi | N413: Arya B. Dep. N Delhi
A414: 1801 | B414: jkeewfrZ flag | C414: yksdfDr dks'k | D414: 1 | E414: 100 | F414: of:=[.E414]*[.D414] -> 100 | G414: 1997 | I414: of:=YEAR(TODAY())-[.G414] -> 28 | L414: 1996 | M414: izHkkr izdk'ku fnYyh | N414: Prabhat Pra. Delhi
A415: 1802 | B415: naxy tkYVs | C415: O;kdj.k fgUnh i=kpkj | D415: 1 | E415: 100 | F415: of:=[.E415]*[.D415] -> 100 | G415: 1997 | I415: of:=YEAR(TODAY())-[.G415] -> 28 | L415: 1996 | M415: fo|k fogkj fnYyh | N415: Prabhat Pra. Delhi
A416: 1805 | B416: jktsUnz voLFkh | C416: ekjh'kl dh dgkfu;kWa | D416: 1 | E416: 40 | F416: of:=[.E416]*[.D416] -> 40 | G416: 1997 | I416: of:=YEAR(TODAY())-[.G416] -> 28 | L416: 1986 | M416: izHkkr izdk'ku fnYyh | N416: Prabhat Pra. Delhi
A417: 1821 | B417: jks'kuyky | C417: vktknh dh dgkuh | D417: 1 | E417: 0 | F417: of:=[.E417]*[.D417] -> 0 | G417: 1997 | I417: of:=YEAR(TODAY())-[.G417] -> 28 | L417: 1996 | M417: lfgR; izdk'ku fnYyh | N417: Prabhat Pra. Delhi
A418: 1836 | B418: ehjk tSu | C418: lkekftd ln~Hkko dh dgkfu;kWa | D418: 1 | E418: 100 | F418: of:=[.E418]*[.D418] -> 100 | G418: 1997 | I418: of:=YEAR(TODAY())-[.G418] -> 28 | L418: 1996 | M418: izHkkr izdk'ku fnYyh | N418: Prabhat Pra. Delhi
A419: 1837 | B419: fxfjjkt 'kekZ | C419: lkxj foKku | D419: 1 | E419: 125 | F419: of:=[.E419]*[.D419] -> 125 | G419: 1997 | I419: of:=YEAR(TODAY())-[.G419] -> 28 | L419: 1996 | M419: lkfgR; izdk'ku fnYyh | N419: Prabhat Pra. Delhi
A420: 1840 | B420: fxfjjkt 'kekZ | C420: jkt ifjoa'k dh ,adkdh | D420: 1 | E420: 100 | F420: of:=[.E420]*[.D420] -> 100 | G420: 1997 | I420: of:=YEAR(TODAY())-[.G420] -> 28 | L420: 1996 | M420: izHkkr izdk'ku fnYyh | N420: Prabhat Pra. Delhi
A421: 1847 | B421: 'kadj n;ky flag | C421: ;s dgkuh ugh gS | D421: 1 | E421: 200 | F421: of:=[.E421]*[.D421] -> 200 | G421: 1997 | I421: of:=YEAR(TODAY())-[.G421] -> 28 | L421: 1995 | M421: izHkkr izdk'ku fnYyh | N421: Prabhat Pra. Delhi
A422: 1852 | B422: ,0ih0JhokLro | C422: ?kkrd jksxksa lss dSls cps | D422: 1 | E422: 0 | F422: of:=[.E422]*[.D422] -> 0 | G422: 1997 | I422: of:=YEAR(TODAY())-[.G422] -> 28 | L422: 1995 | M422: izHkkr izdk'ku fnYyh | N422: Prabhat Pra. Delhi
A423: 1940 | B423: enkfj;k | C423: gekjk LokLF; | D423: 1 | E423: 8 | F423: of:=[.E423]*[.D423] -> 8 | G423: 1998 | I423: of:=YEAR(TODAY())-[.G423] -> 27 | L423: 1994 | M423: ijesójh izdk'ku fnYyh
A424: 1950 | C424: THE SOUND SYTEM OF INDIAN ENGLISH | D424: 1 | E424: 0 | F424: of:=[.E424]*[.D424] -> 0 | G424: 1998 | I424: of:=YEAR(TODAY())-[.G424] -> 27
A425: 1951 | C425: THE SOUND SYTEM OF INDIAN ENGLISH | D425: 1 | E425: 0 | F425: of:=[.E425]*[.D425] -> 0 | G425: 1998 | I425: of:=YEAR(TODAY())-[.G425] -> 27
A426: 1952 | B426: CIEFL | C426: work book english reader | D426: 1 | E426: 0 | F426: of:=[.E426]*[.D426] -> 0 | G426: 1998 | I426: of:=YEAR(TODAY())-[.G426] -> 27
A427: 1953 | B427: CIEFL | C427: work book english reader | D427: 1 | E427: 0 | F427: of:=[.E427]*[.D427] -> 0 | G427: 1998 | I427: of:=YEAR(TODAY())-[.G427] -> 27
A428: 1954 | B428: CIEFL | C428: work book english reader | D428: 1 | E428: 0 | F428: of:=[.E428]*[.D428] -> 0 | G428: 1998 | I428: of:=YEAR(TODAY())-[.G428] -> 27
A429: 1960 | B429: CIEEL | C429: Exercise in spoken english | D429: 1 | E429: 176 | F429: of:=[.E429]*[.D429] -> 176 | G429: 1998 | I429: of:=YEAR(TODAY())-[.G429] -> 27 | L429: 1997 | M429: CIEFL hydrabad | N429: CIEFL
A430: 1961 | B430: CIEEL | C430: Exercise in spoken english | D430: 1 | E430: 176 | F430: of:=[.E430]*[.D430] -> 176 | G430: 1998 | I430: of:=YEAR(TODAY())-[.G430] -> 27 | L430: 1997 | M430: CIEFL hydrabad | N430: CIEFL
A431: 1963 | B431: CIEEL | C431: MAKERS AND FINDERS | D431: 1 | E431: 185 | F431: of:=[.E431]*[.D431] -> 185 | G431: 1998 | I431: of:=YEAR(TODAY())-[.G431] -> 27 | L431: 1997 | M431: CIEFL hydrabad | N431: CIEFL
A432: 1965 | B432: CIEEL | C432: MAKERS AND FINDERS | D432: 1 | E432: 185 | F432: of:=[.E432]*[.D432] -> 185 | G432: 1998 | I432: of:=YEAR(TODAY())-[.G432] -> 27 | L432: 1997 | M432: CIEFL hydrabad | N432: CIEFL
A433: 1967 | B433: Shatya Akadami | C433: 23 short stories | D433: 1 | E433: 100 | F433: of:=[.E433]*[.D433] -> 100 | G433: 1998 | I433: of:=YEAR(TODAY())-[.G433] -> 27 | L433: 1997 | M433: lkfgR; izdk'ku fnYyh | N433: NVS LR
A434: 1969 | B434: Prem Seth | C434: Applied for jobs | D434: 1 | E434: 200 | F434: of:=[.E434]*[.D434] -> 200 | G434: 1998 | I434: of:=YEAR(TODAY())-[.G434] -> 27 | L434: 1997 | M434: Sterling pub Delhi | N434: NVS LR
A435: 1982 | B435: T.P Kalinand | C435: Folk tales of Karnatka | D435: 1 | E435: 35 | F435: of:=[.E435]*[.D435] -> 35 | G435: 1998 | I435: of:=YEAR(TODAY())-[.G435] -> 27 | L435: 1998 | M435: Learner Press Delhi | N435: NVS LR
A436: 2007 | B436: G Vakantraman | C436: Question bank in office Practice | D436: 1 | E436: 60 | F436: of:=[.E436]*[.D436] -> 60 | G436: 1998 | I436: of:=YEAR(TODAY())-[.G436] -> 27 | L436: 1995 | M436: NCERT | N436: NVS LR
A437: 2027 | B437: Pratibha Natha | C437: Treasure of tales III | D437: 1 | E437: 30 | F437: of:=[.E437]*[.D437] -> 30 | G437: 1998 | I437: of:=YEAR(TODAY())-[.G437] -> 27 | L437: 1997 | M437: S.Chand | N437: NVS LR
A438: 2032 | B438: R. k murti | C438: KNOW THE NOVEL LAUREATES III | D438: 1 | E438: 25 | F438: of:=[.E438]*[.D438] -> 25 | G438: 1998 | I438: of:=YEAR(TODAY())-[.G438] -> 27 | L438: 1998 | M438: Pitamber Prakshan | N438: NVS LR
A439: 2035 | B439: Arghna | C439: Living English for Juniors | D439: 1 | E439: 22 | F439: of:=[.E439]*[.D439] -> 22 | G439: 1998 | I439: of:=YEAR(TODAY())-[.G439] -> 27 | L439: 1998 | M439: Jayeet Publication | N439: NVS LR
A440: 2042 | B440: B.B sharma | C440: Guide to home gardening | D440: 1 | E440: 60 | F440: of:=[.E440]*[.D440] -> 60 | G440: 1998 | I440: of:=YEAR(TODAY())-[.G440] -> 27 | L440: 1998 | M440: Arya book depot Delhi | N440: NVS LR
A441: 2043 | B441: R.L Bhatia | C441: A NEW PATTERN ENGLISH GRAMMAR AND TRANSLATION | D441: 1 | E441: 26 | F441: of:=[.E441]*[.D441] -> 26 | G441: 1998 | I441: of:=YEAR(TODAY())-[.G441] -> 27 | L441: 1993 | M441: Arya book depot Delhi | N441: NVS LR
A442: 2048 | B442: C.Raman Murti | C442: Indian Painting | D442: 1 | E442: 55 | F442: of:=[.E442]*[.D442] -> 55 | G442: 1998 | I442: of:=YEAR(TODAY())-[.G442] -> 27 | L442: 1990 | M442: NBT Publisher | N442: NVS LR
A443: 2052 | B443: Vdyh f'ko'kadj fiYys | C443: nks 'ksj nku | D443: 1 | E443: 40 | F443: of:=[.E443]*[.D443] -> 40 | G443: 1998 | I443: of:=YEAR(TODAY())-[.G443] -> 27 | L443: 1998 | M443: lkfgR; ,dkneh ] fnYyh | N443: NVS LR
A444: 2062 | B444: izse pUn | C444: lsoklnu | D444: 1 | E444: 150 | F444: of:=[.E444]*[.D444] -> 150 | G444: 1998 | I444: of:=YEAR(TODAY())-[.G444] -> 27 | L444: 1997 | M444: jk"V~zHkk"kk izdk"ku | N444: NVS LR
A445: 2072 | B445: fo".kq izHkkdj | C445: u, ,dkadh | D445: 1 | E445: 60 | F445: of:=[.E445]*[.D445] -> 60 | G445: 1998 | I445: of:=YEAR(TODAY())-[.G445] -> 27 | L445: 1997 | M445: vk;Z cqd fMiksa | N445: NVS LR
A446: 2085 | B446: lqHkk"k d";i | C446: gekjh laln | D446: 1 | E446: 47 | F446: of:=[.E446]*[.D446] -> 47 | G446: 1998 | I446: of:=YEAR(TODAY())-[.G446] -> 27 | L446: 1991 | M446: N.B.T. Delhi | N446: NVS LR
A447: 2089 | B447: lqHkk"k d";i | C447: Hkkjr dk lafo/kku | D447: 1 | E447: 7.5 | F447: of:=[.E447]*[.D447] -> 7.5 | G447: 1998 | I447: of:=YEAR(TODAY())-[.G447] -> 27 | L447: 1997 | M447: N.B.T. Delhi | N447: NVS LR
A448: 2116 | B448: vt; dqqekj prqosnhZ | C448: Hkkjrh; oSKkfud | D448: 1 | E448: 20 | F448: of:=[.E448]*[.D448] -> 20 | G448: 1998 | I448: of:=YEAR(TODAY())-[.G448] -> 27 | L448: 1996 | M448: Rachna Prakashan | N448: NVS LR
A449: 2127 | B449: Mk fo|k fuokl | C449: ckcw';kelqUnjnkl ds fucU/k | D449: 1 | E449: 83 | F449: of:=[.E449]*[.D449] -> 83 | G449: 1998 | I449: of:=YEAR(TODAY())-[.G449] -> 27 | L449: 1983 | M449: Uttar pradesh sansthan | N449: NVS LR
A450: 2130 | B450: Mk0 jes'k pUnz | C450: ijek.kq fo[k.Mu | D450: 1 | E450: 9 | F450: of:=[.E450]*[.D450] -> 9 | G450: 1998 | I450: of:=YEAR(TODAY())-[.G450] -> 27 | L450: 1990 | M450: Uttar pradesh sansthan | N450: NVS LR
A451: 2146 | B451: ve``rjk; | C451: nl izfrfuf/k dgkfu;ka | D451: 1 | E451: 60 | F451: of:=[.E451]*[.D451] -> 60 | G451: 1998 | I451: of:=YEAR(TODAY())-[.G451] -> 27 | L451: 1997 | M451: Kitab Ghar | N451: NVS LR
A452: 2147 | B452: eqdqUn csnh | C452: gtkjh izlkn f}osnh ds pqus fucU/k | D452: 1 | E452: 80 | F452: of:=[.E452]*[.D452] -> 80 | G452: 1998 | I452: of:=YEAR(TODAY())-[.G452] -> 27 | L452: 1996 | M452: Kitab Ghar | N452: NVS LR
A453: 2148 | B453: dey fd'kksj | C453: ftKklk,a esjh | D453: 1 | E453: 75 | F453: of:=[.E453]*[.D453] -> 75 | G453: 1998 | I453: of:=YEAR(TODAY())-[.G453] -> 27 | L453: 1996 | M453: Kitab Ghar | N453: NVS LR
A454: 2178 | B454: xaxk izlkn | C454: bruk dqN | D454: 1 | E454: 50 | F454: of:=[.E454]*[.D454] -> 50 | G454: 1998 | I454: of:=YEAR(TODAY())-[.G454] -> 27 | L454: 1991 | M454: xqtZj xzUFk]vgenkckn | N454: fdrkc?kj xkW/khuxj fnYyh
A455: 2179 | B455: ch0ts0gjthr | C455: fizfliy ij'kq jke | D455: 1 | E455: 35 | F455: of:=[.E455]*[.D455] -> 35 | G455: 1998 | I455: of:=YEAR(TODAY())-[.G455] -> 27 | L455: 1994 | M455: fgekpy iqLrd Hk.Mkj | N455: fdrkc?kj xkW/khuxj fnYyh
A456: 2182 | B456: jfoUnz R;kxh | C456: ns'k fons'k dh dFkk | D456: 1 | E456: 60 | F456: of:=[.E456]*[.D456] -> 60 | G456: 1998 | I456: of:=YEAR(TODAY())-[.G456] -> 27 | L456: 1994 | M456: fdrkc?kj xkW/khuxj fnYyh | N456: fdrkc?kj xkW/khuxj fnYyh
A457: 2186 | B457: izHkkdj mik/;k; | C457: fgUnh fn'kk ,oa n'kk | D457: 1 | E457: 75 | F457: of:=[.E457]*[.D457] -> 75 | G457: 1998 | I457: of:=YEAR(TODAY())-[.G457] -> 27 | L457: 1995 | M457: fgekpy iqLrd Hk.Mkj | N457: fdrkc?kj xkW/khuxj fnYyh
A458: 2187 | B458: vuqie | C458: ty rajxksa dh vkRedFkk | D458: 1 | E458: 50 | F458: of:=[.E458]*[.D458] -> 50 | G458: 1998 | I458: of:=YEAR(TODAY())-[.G458] -> 27 | L458: 1992 | M458: izeSójh izdk'ku | N458: fdrkc?kj xkW/khuxj fnYyh
A459: 2188 | B459: vksedkj egjk | C459: ryk'k tkjh gSA | D459: 1 | E459: 30 | F459: of:=[.E459]*[.D459] -> 30 | G459: 1998 | I459: of:=YEAR(TODAY())-[.G459] -> 27 | L459: 1987 | M459: fdrkc?kj xkW/khuxj fnYyh | N459: fdrkc?kj xkW/khuxj fnYyh
A460: 2189 | B460: lwjt nso izlkn | C460: jke egy | D460: 1 | E460: 30 | F460: of:=[.E460]*[.D460] -> 30 | G460: 1998 | I460: of:=YEAR(TODAY())-[.G460] -> 27 | L460: 1919 | M460: txrjke ,.M lUl | N460: fdrkc?kj xkW/khuxj fnYyh
A461: 2192 | B461: kadj 'ks"k | C461: jRu xHkkZ | D461: 1 | E461: 20 | F461: of:=[.E461]*[.D461] -> 20 | G461: 1998 | I461: of:=YEAR(TODAY())-[.G461] -> 27 | L461: 1998 | M461: txrjke vk;kZ] fnYyh | N461: fdrkc?kj xkW/khuxj fnYyh
A462: 2193 | B462: iznhi iUFk | C462: ykSVus ls igys | D462: 1 | E462: 40 | F462: of:=[.E462]*[.D462] -> 40 | G462: 1998 | I462: of:=YEAR(TODAY())-[.G462] -> 27 | L462: 1997 | M462: fdrkc?kj xkW/khuxj fnYyh | N462: fdrkc?kj xkW/khuxj fnYyh
A463: 2200 | B463: egs'k Mse , | C463: xzg okfVdk o Qy okyh lfct;k | D463: 1 | E463: 15 | F463: of:=[.E463]*[.D463] -> 15 | G463: 1998 | I463: of:=YEAR(TODAY())-[.G463] -> 27 | L463: 1997 | M463: izHkkr izdk'ku fnYyh | N463: fdrkc?kj xkW/khuxj fnYyh
A464: 2205 | B464: ck.kks ljrkt | C464: taxy esa exay | D464: 1 | E464: 25 | F464: of:=[.E464]*[.D464] -> 25 | G464: 1998 | I464: of:=YEAR(TODAY())-[.G464] -> 27 | L464: 1997 | M464: txrjke ,.M lUl | N464: fdrkc?kj xkW/khuxj fnYyh
A465: 2210 | B465: pUnziky flga e;ad | C465: ,drk dk egRo | D465: 1 | E465: 20 | F465: of:=[.E465]*[.D465] -> 20 | G465: 1998 | I465: of:=YEAR(TODAY())-[.G465] -> 27 | L465: 1998 | M465: fgekpy iqLrd Hk.Mkj | N465: fdrkc?kj xkW/khuxj fnYyh
A466: 2213 | B466: fpUe; ?kks"k | C466: Vhdk yxok;s | D466: 1 | E466: 10 | F466: of:=[.E466]*[.D466] -> 10 | G466: 1998 | I466: of:=YEAR(TODAY())-[.G466] -> 27 | L466: 1997 | M466: fdrkc?kj xkW/khuxj fnYyh | N466: fdrkc?kj xkW/khuxj fnYyh
A467: 2216 | B467: JhpUnz tSu | C467: Hkkjr ds o`{k | D467: 1 | E467: 12 | F467: of:=[.E467]*[.D467] -> 12 | G467: 1998 | I467: of:=YEAR(TODAY())-[.G467] -> 27 | L467: 1996 | M467: izeSójh izdk'ku | N467: fdrkc?kj xkW/khuxj fnYyh
A468: 2227 | B468: Hkhë lkguh | C468: jax ns calrh pksyk | D468: 1 | E468: 50 | F468: of:=[.E468]*[.D468] -> 50 | G468: 1998 | I468: of:=YEAR(TODAY())-[.G468] -> 27 | L468: 1998 | M468: fdrkc?kj xkW/khuxj fnYyh | N468: fdrkc?kj xkW/khuxj fnYyh
A469: 2234 | B469: ';ke flag 'k'kh | C469: vfXu lkxj | D469: 1 | E469: 40 | F469: of:=[.E469]*[.D469] -> 40 | G469: 1999 | I469: of:=YEAR(TODAY())-[.G469] -> 26 | L469: 1997 | M469: fdrkc?kj xkW/khuxj fnYyh | N469: txrjke ,.M lUl fnYyh
A470: 2253 | B470: th Mh fo"V | C470: flEiy LihM xkbM | D470: 1 | E470: 32 | F470: of:=[.E470]*[.D470] -> 32 | G470: 1999 | I470: of:=YEAR(TODAY())-[.G470] -> 26 | L470: 1996 | M470: vk;kZ izdk'ku fnYyh | N470: vk;Z cqd fMiks
A471: 2257 | B471: Luies karicole | C471: x``g izcU/ku | D471: 1 | E471: 15 | F471: of:=[.E471]*[.D471] -> 15 | G471: 1999 | I471: of:=YEAR(TODAY())-[.G471] -> 26 | L471: 1998 | M471: vk;kZ izdk'ku fnYyh | N471: vk;Z cqd fMiks
A472: 2258 | B472: egsUnz oekZ | C472: izkphu Hkkjr dh okLrq dyk | D472: 1 | E472: 150 | F472: of:=[.E472]*[.D472] -> 150 | G472: 1999 | I472: of:=YEAR(TODAY())-[.G472] -> 26 | L472: 1996 | M472: vk;kZ izdk'ku fnYyh | N472: vk;Z cqd fMiks
A473: 2263 | B473: Sarna & others | C473: uksV cqd dk eSFl | D473: 1 | E473: 250 | F473: of:=[.E473]*[.D473] -> 250 | G473: 1999 | I473: of:=YEAR(TODAY())-[.G473] -> 26 | L473: 1997 | M473: vk;kZ izdk'ku fnYyh | N473: vk;Z cqd fMiks
A474: 2264 | B474: Mahesh chaner & others | C474: lkLd`frd jk"V~z dk v[k.M Hkkjr | D474: 1 | E474: 100 | F474: of:=[.E474]*[.D474] -> 100 | G474: 1999 | I474: of:=YEAR(TODAY())-[.G474] -> 26 | L474: 1992 | M474: vk;kZ izdk'ku fnYyh | N474: vk;Z cqd fMiks
A475: 2269 | B475: Yadunath chobe | C475: ewjyh | D475: 1 | E475: 45 | F475: of:=[.E475]*[.D475] -> 45 | G475: 1999 | I475: of:=YEAR(TODAY())-[.G475] -> 26 | L475: 1994 | M475: vk;kZ izdk'ku fnYyh | N475: vk;Z cqd fMiks
A476: 2270 | B476: I.P. Agarwal | C476: cky fodkl ,oa 'kSf{kd fdz;k,a | D476: 1 | E476: 90 | F476: of:=[.E476]*[.D476] -> 90 | G476: 1999 | I476: of:=YEAR(TODAY())-[.G476] -> 26 | L476: 1997 | M476: vk;kZ izdk'ku fnYyh | N476: vk;Z cqd fMiks
A477: 2313 | B477: lqns'k lj.k | C477: dkSeh ,drk | D477: 1 | E477: 8 | F477: of:=[.E477]*[.D477] -> 8 | G477: 1999 | I477: of:=YEAR(TODAY())-[.G477] -> 26 | L477: 1997 | M477: vk;kZ izdk'ku fnYyh | N477: Arya B. Dep. N Delhi
A478: 2317 | B478: gfjd`".k izseh | C478: izfr'kks/k | D478: 1 | E478: 40 | F478: of:=[.E478]*[.D478] -> 40 | G478: 1999 | I478: of:=YEAR(TODAY())-[.G478] -> 26 | L478: 1993 | M478: vk;kZ izdk'ku fnYyh | N478: Arya B. Dep. N Delhi
A479: 2320 | B479: b0ih0th0 | C479: ifjos'ku v/;;u | D479: 1 | E479: 20 | F479: of:=[.E479]*[.D479] -> 20 | G479: 1999 | I479: of:=YEAR(TODAY())-[.G479] -> 26 | L479: 1988 | M479: vk;kZ izdk'ku fnYyh | N479: Arya B. Dep. N Delhi
A480: 2334 | B480: egsUnz flag ,gykor | C480: flyflyk | D480: 1 | E480: 45 | F480: of:=[.E480]*[.D480] -> 45 | G480: 1999 | I480: of:=YEAR(TODAY())-[.G480] -> 26 | L480: 1993 | M480: vk;kZ izdk'ku fnYyh | N480: Arya B. Dep. N Delhi
A481: 2338 | B481: vkj0,y0 LVheSUlu | C481: dSMuSi | D481: 1 | E481: 25 | F481: of:=[.E481]*[.D481] -> 25 | G481: 1999 | I481: of:=YEAR(TODAY())-[.G481] -> 26 | L481: 1998 | M481: vk;kZ izdk'ku fnYyh | N481: Arya B. Dep. N Delhi
A482: 2384 | B482: ,e0 lkjLor | C482: speaking english frequently | D482: 1 | E482: 48 | F482: of:=[.E482]*[.D482] -> 48 | G482: 1999 | I482: of:=YEAR(TODAY())-[.G482] -> 26 | L482: 1999 | M482: Diamond Stationer,JWP | N482: NVS LR Lucknow
A483: 2387 | B483: ,u0oh0,l0fnYyh | C483: CBSE exam 1998 | D483: 1 | E483: 0 | F483: of:=[.E483]*[.D483] -> 0 | G483: 1999 | I483: of:=YEAR(TODAY())-[.G483] -> 26 | L483: 1998 | M483: ,u0oh0,l0 y[kuÅ | N483: NVS LR Lucknow
A484: 2407 | B484: xksfoUn ik.Mas; | C484: oks} /keZ dk fodkl | D484: 1 | E484: 40 | F484: of:=[.E484]*[.D484] -> 40 | G484: 1999 | I484: of:=YEAR(TODAY())-[.G484] -> 26 | L484: 1998 | M484: ,u0oh0,l0 y[kuÅ | N484: NVS LR Lucknow
A485: 2423 | B485: Prem barman | C485: Albert stechwetch | D485: 1 | E485: 45 | F485: of:=[.E485]*[.D485] -> 45 | G485: 1999 | I485: of:=YEAR(TODAY())-[.G485] -> 26 | L485: 1998 | M485: ,u0oh0,l0 y[kuÅ | N485: NVS LR Lucknow
A486: 2449 | B486: A.K Dutta | C486: xsEl ,.M LVwMSUVl Qkj fpYMu | D486: 1 | E486: 75 | F486: of:=[.E486]*[.D486] -> 75 | G486: 1999 | I486: of:=YEAR(TODAY())-[.G486] -> 26 | L486: 1990 | M486: ,u0oh0,l0 y[kuÅ | N486: NVS LR Lucknow
A487: 2456 | B487: , ,l diwj | C487: vkRe n'kZu 'kkgh 'kgj fnYyh | D487: 1 | E487: 25 | F487: of:=[.E487]*[.D487] -> 25 | G487: 1999 | I487: of:=YEAR(TODAY())-[.G487] -> 26 | L487: 1999 | M487: ,u0oh0,l0 y[kuÅ | N487: NVS LR Lucknow
A488: 2463 | B488: , fo'okl | C488: dkslZ bu tujy LVMh | D488: 1 | E488: 16 | F488: of:=[.E488]*[.D488] -> 16 | G488: 1999 | I488: of:=YEAR(TODAY())-[.G488] -> 26 | L488: 1998 | M488: ,u0oh0,l0 y[kuÅ | N488: NVS LR Lucknow
A489: 2465 | B489: R.S.Dhillon | C489: D.P. kit of Idoms & phrase | D489: 1 | E489: 90 | F489: of:=[.E489]*[.D489] -> 90 | G489: 1999 | I489: of:=YEAR(TODAY())-[.G489] -> 26 | L489: 1997 | M489: ,u0oh0,l0 y[kuÅ | N489: NVS LR Lucknow
A490: 2466 | B490: B.M Hrcd | C490: Art of public speaking | D490: 1 | E490: 50 | F490: of:=[.E490]*[.D490] -> 50 | G490: 1999 | I490: of:=YEAR(TODAY())-[.G490] -> 26 | L490: 1998 | M490: ,u0oh0,l0 y[kuÅ | N490: NVS LR Lucknow
A491: 2483 | B491: vfurk flag | C491: fgUnh 'kOnks adk iz;ksx | D491: 1 | E491: 75 | F491: of:=[.E491]*[.D491] -> 75 | G491: 1999 | I491: of:=YEAR(TODAY())-[.G491] -> 26 | L491: 1999 | M491: ,u0oh0,l0 y[kuÅ | N491: NVS LR Lucknow
A492: 2485 | B492: ih0czges'k | C492: Fansting stories | D492: 1 | E492: 65 | F492: of:=[.E492]*[.D492] -> 65 | G492: 1999 | I492: of:=YEAR(TODAY())-[.G492] -> 26 | L492: 1998 | M492: ,u0oh0,l0 y[kuÅ | N492: NVS LR Lucknow
A493: 2488 | B493: 'kkfUr flag | C493: yfyr ,dkadh | D493: 1 | E493: 50 | F493: of:=[.E493]*[.D493] -> 50 | G493: 1999 | I493: of:=YEAR(TODAY())-[.G493] -> 26 | L493: 1996 | M493: ,u0oh0,l0 y[kuÅ | N493: NVS LR Lucknow
A494: 2492 | B494: izdk'k pUnz | C494: Kabir | D494: 1 | E494: 42 | F494: of:=[.E494]*[.D494] -> 42 | G494: 1999 | I494: of:=YEAR(TODAY())-[.G494] -> 26 | L494: 1997 | M494: ,u0oh0,l0 y[kuÅ | N494: NVS LR Lucknow
A495: 2495 | B495: ds0lh0flag | C495: What life the way have me | D495: 1 | E495: 50 | F495: of:=[.E495]*[.D495] -> 50 | G495: 1999 | I495: of:=YEAR(TODAY())-[.G495] -> 26 | L495: 1994 | M495: ,u0oh0,l0 y[kuÅ | N495: NVS LR Lucknow
A496: 2506 | B496: nh{kk fc"V | C496: m"ek vkSj m"ek xfrdh | D496: 1 | E496: 20 | F496: of:=[.E496]*[.D496] -> 20 | G496: 1999 | I496: of:=YEAR(TODAY())-[.G496] -> 26 | L496: 1976 | M496: ,u0oh0,l0 y[kuÅ | N496: NVS LR Lucknow
A497: 2510 | B497: ';kepUnz diwj | C497: dFkk lfjrk lkxj dh dgkfu;ka | D497: 1 | E497: 100 | F497: of:=[.E497]*[.D497] -> 100 | G497: 1999 | I497: of:=YEAR(TODAY())-[.G497] -> 26 | L497: 1998 | M497: ,u0oh0,l0 y[kuÅ | N497: NVS LR Lucknow
A498: 2518 | B498: /kUut; fd'kksj | C498: COSMIC KIRANE | D498: 1 | E498: 9 | F498: of:=[.E498]*[.D498] -> 9 | G498: 1999 | I498: of:=YEAR(TODAY())-[.G498] -> 26 | L498: 1998 | M498: ,u0oh0,l0 y[kuÅ | N498: NVS LR Lucknow
A499: 2568 | B499: ,l0lh0ekgsójh | C499: Lab Manual | D499: 1 | E499: 54 | F499: of:=[.E499]*[.D499] -> 54 | G499: 1999 | I499: of:=YEAR(TODAY())-[.G499] -> 26 | L499: 1999 | M499: Diamond Stationer,JWP | N499: Diomond station Jaipur
A500: 2654 | B500: 'krjpUnz | C500: cMh nhnh | D500: 1 | E500: 40 | F500: of:=[.E500]*[.D500] -> 40 | G500: 1999 | I500: of:=YEAR(TODAY())-[.G500] -> 26 | L500: 1998 | M500: Sahatiya prakashan | N500: NVS lucknow
A501: 2655 | B501: 'krjpUnz | C501: pUnz ukFk | D501: 1 | E501: 40 | F501: of:=[.E501]*[.D501] -> 40 | G501: 1999 | I501: of:=YEAR(TODAY())-[.G501] -> 26 | L501: 1998 | M501: Sahatiya prakashan | N501: NVS lucknow
A502: 2656 | B502: 'krjpUnz | C502: lfork | D502: 1 | E502: 40 | F502: of:=[.E502]*[.D502] -> 40 | G502: 1999 | I502: of:=YEAR(TODAY())-[.G502] -> 26 | L502: 1998 | M502: Sahatiya prakashan | N502: NVS lucknow
A503: 2685 | B503: cktisbZ | C503: compline ref course of Phy | D503: 1 | E503: 90 | F503: of:=[.E503]*[.D503] -> 90 | G503: 2000 | I503: of:=YEAR(TODAY())-[.G503] -> 25 | L503: 2000 | M503: Diamond Stationary | N503: NVS lucknow
A504: 2738 | B504: Tyar Bhatt | C504: No about science innovations, coordinate Chemistry | D504: 1 | E504: of:=195+60 -> 255 | F504: of:=[.E504]*[.D504] -> 255 | G504: 2000 | I504: of:=YEAR(TODAY())-[.G504] -> 25 | L504: 1995 | M504: Dreamland prakashan delhi | N504: NVS lucknow
A505: 2771 | B505: fryd jkt 'kekZ | C505: Js"B vk/kqfud fuca/k | D505: 1 | E505: 190 | F505: of:=[.E505]*[.D505] -> 190 | G505: 2000 | I505: of:=YEAR(TODAY())-[.G505] -> 25 | L505: 1999 | M505: Arya book depot | N505: NVS lucknow
A506: 2791 | B506: jktsUnz izdk'k prqosZnh | C506: Hkk"k.k dyk | D506: 1 | E506: 35 | F506: of:=[.E506]*[.D506] -> 35 | G506: 2000 | I506: of:=YEAR(TODAY())-[.G506] -> 25 | L506: 1999 | M506: Upkar prakashan | N506: NVS lucknow
A507: 2802 | B507: vkj ds tSu | C507: lkekU; Kku | D507: 1 | E507: 195 | F507: of:=[.E507]*[.D507] -> 195 | G507: 2000 | I507: of:=YEAR(TODAY())-[.G507] -> 25 | M507: Upkar prakashan | N507: NVS lucknow
A508: 2803 | B508: Taresh D | C508: Reaching womenhood | D508: 1 | E508: 35 | F508: of:=[.E508]*[.D508] -> 35 | G508: 2000 | I508: of:=YEAR(TODAY())-[.G508] -> 25 | M508: NBT Delhi | N508: NVS lucknow
A509: 2827 | B509: P Sen gupta | C509: JOURNEY TO THE MAGNETIC NORTH POLE | D509: 1 | E509: 8 | F509: of:=[.E509]*[.D509] -> 8 | G509: 2000 | I509: of:=YEAR(TODAY())-[.G509] -> 25 | L509: 1999 | M509: NBT Delhi | N509: NVS lucknow
A510: 2916 | B510: y{ehdkar ik.Ms; | C510: lapkj ek/e esa fgUnh dk iz;ksx | D510: 1 | E510: 150 | F510: of:=[.E510]*[.D510] -> 150 | G510: 2000 | I510: of:=YEAR(TODAY())-[.G510] -> 25 | L510: 2000 | M510: Jaheerpur Malya Kanpur | N510: NVS lucknow
A511: 2928 | B511: egs'koj flag | C511: Hkjrh; yksdra= leL;k,a ,oa leknku | D511: 1 | E511: 200 | F511: of:=[.E511]*[.D511] -> 200 | G511: 2000 | I511: of:=YEAR(TODAY())-[.G511] -> 25 | L511: 2000 | M511: Jaheerpur Malya Kanpur | N511: NVS lucknow
A512: 2937 | B512: ds lh [kUuk | C512: Hkkjr esa fons'kh ;k=kh | D512: 1 | E512: 6 | F512: of:=[.E512]*[.D512] -> 6 | G512: 2000 | I512: of:=YEAR(TODAY())-[.G512] -> 25 | L512: 1990 | M512: Sheetal book centre Delhi | N512: NVS lucknow
A513: 3000 | B513: Shelly batra | C513: Guide to women sexual harshment | D513: 1 | E513: 250 | F513: of:=[.E513]*[.D513] -> 250 | G513: 2001 | I513: of:=YEAR(TODAY())-[.G513] -> 24 | L513: 2000 | M513: Granth Akdhami | N513: NVS lucknow
A514: 3004 | B514: V.Arya | C514: The famous fables | D514: 1 | E514: 32 | F514: of:=[.E514]*[.D514] -> 32 | G514: 2001 | I514: of:=YEAR(TODAY())-[.G514] -> 24 | L514: 2000 | M514: Ratna Sagar | N514: NVS lucknow
A515: 3012 | B515: ch0,y0xksLokeh | C515: HkkSfrd jlk;u | D515: 1 | E515: 130 | F515: of:=[.E515]*[.D515] -> 130 | G515: 2001 | I515: of:=YEAR(TODAY())-[.G515] -> 24 | L515: 2000 | M515: Malik sons company | N515: NVS lucknow
A516: 3019 | B516: ys[kdx.k | C516: lkxk vkQ bf.M;k | D516: 1 | E516: 30 | F516: of:=[.E516]*[.D516] -> 30 | G516: 2001 | I516: of:=YEAR(TODAY())-[.G516] -> 24 | L516: 2000 | M516: Ocean book Delhi | N516: NVS lucknow
A517: 3037 | B517: ,e0th0fiYyS | C517: fxQVM fpYMu ,.M MoyieSaV | D517: 1 | E517: 550 | F517: of:=[.E517]*[.D517] -> 550 | G517: 2001 | I517: of:=YEAR(TODAY())-[.G517] -> 24 | L517: 2001 | M517: Ocean book Delhi | N517: NVS lucknow
A518: 3038 | B518: ih0fl}kUr | C518: yks,LV okbYM , U;wt | D518: 1 | E518: 225 | F518: of:=[.E518]*[.D518] -> 225 | G518: 2001 | I518: of:=YEAR(TODAY())-[.G518] -> 24 | L518: 2001 | M518: R & Night Pub.Delhi | N518: NVS lucknow
A519: 3054 | B519: izeksn ,Ufkuh | C519: iksiqyj QSUp LVksfjt | D519: 1 | E519: 60 | F519: of:=[.E519]*[.D519] -> 60 | G519: 2001 | I519: of:=YEAR(TODAY())-[.G519] -> 24 | L519: 2001 | M519: ljLorh izdk'ku fnYyh | N519: NVS lucknow
A520: 3106 | B520: Rita singh | C520: Vishav ka Ithyas | D520: 1 | E520: 35 | F520: of:=[.E520]*[.D520] -> 35 | G520: 2001 | I520: of:=YEAR(TODAY())-[.G520] -> 24 | L520: 1989 | M520: S. Chand & company | N520: NVS lucknow
A521: 3107 | B521: Rita singh | C521: Vishav ka Ithyas | D521: 1 | E521: 60 | F521: of:=[.E521]*[.D521] -> 60 | G521: 2001 | I521: of:=YEAR(TODAY())-[.G521] -> 24 | L521: 1995 | M521: S. Chand & company | N521: NVS lucknow
A522: 3116 | B522: P. Robinson | C522: Carrier in physics IIT | D522: 1 | E522: 275 | F522: of:=[.E522]*[.D522] -> 275 | G522: 2001 | I522: of:=YEAR(TODAY())-[.G522] -> 24 | L522: 2001 | M522: Tata Micro Hill | N522: JN Stationary Mart JWP
A523: 3146 | B523: M.L Khanna | C523: English in use Grammar &Vocational | D523: 1 | E523: 120 | F523: of:=[.E523]*[.D523] -> 120 | G523: 2001 | I523: of:=YEAR(TODAY())-[.G523] -> 24 | L523: 2000 | M523: Kehner Pub | N523: JN Stationary Mart JWP
A524: 3147 | B524: M.L Khanna | C524: English in use Grammar &Vocational | D524: 1 | E524: 120 | F524: of:=[.E524]*[.D524] -> 120 | G524: 2001 | I524: of:=YEAR(TODAY())-[.G524] -> 24 | L524: 2000 | M524: Kehner Pub | N524: JN Stationary Mart JWP
A525: 3150 | B525: M.L Khanna | C525: English in use Grammar &Vocational | D525: 1 | E525: 120 | F525: of:=[.E525]*[.D525] -> 120 | G525: 2001 | I525: of:=YEAR(TODAY())-[.G525] -> 24 | L525: 2000 | M525: Kehner Pub | N525: JN Stationary Mart JWP
A526: 3157 | B526: Kumar & Rohit | C526: Planed Physiolgy | D526: 1 | E526: 120 | F526: of:=[.E526]*[.D526] -> 120 | G526: 2001 | I526: of:=YEAR(TODAY())-[.G526] -> 24 | L526: 2001 | M526: Orbis Jhonson | N526: JN Stationary Mart JWP
A527: 3167 | B527: P.K. Sinha | C527: Computer Fundamental | D527: 1 | E527: 99 | F527: of:=[.E527]*[.D527] -> 99 | G527: 2001 | I527: of:=YEAR(TODAY())-[.G527] -> 24 | L527: 1992 | M527: BPP | N527: Cambridge book Depot
A528: 3207 | B528: P.K Sinha | C528: Computer Fundamental | D528: 1 | E528: 99 | F528: of:=[.E528]*[.D528] -> 99 | G528: 2001 | I528: of:=YEAR(TODAY())-[.G528] -> 24 | L528: 1992 | M528: BPP | N528: BPB Publication
A529: 3225 | B529: E balaswami | C529: Object oriented programme inC++ | D529: 1 | E529: 65 | F529: of:=[.E529]*[.D529] -> 65 | G529: 2001 | I529: of:=YEAR(TODAY())-[.G529] -> 24 | L529: 2001 | M529: Tata Micro Hill | N529: Tata Micro Ltd Delhi
A530: 3227 | B530: E balaswami | C530: Object oriented programme inC++ | D530: 1 | E530: 65 | F530: of:=[.E530]*[.D530] -> 65 | G530: 2001 | I530: of:=YEAR(TODAY())-[.G530] -> 24 | L530: 2001 | M530: Tata Micro Hill | N530: Tata Micro Ltd Delhi
A531: 3237 | B531: Kal sehwareaz | C531: Microsoft exel | D531: 1 | E531: 60 | F531: of:=[.E531]*[.D531] -> 60 | G531: 2001 | I531: of:=YEAR(TODAY())-[.G531] -> 24 | L531: 1998 | M531: BPP | N531: BPB Publication
A532: 3241 | B532: Kal sehwareaz | C532: Microsoft exel | D532: 1 | E532: 60 | F532: of:=[.E532]*[.D532] -> 60 | G532: 2001 | I532: of:=YEAR(TODAY())-[.G532] -> 24 | L532: 1998 | M532: BPP | N532: BPB Publication
A533: 3242 | B533: Kal sehwareaz | C533: Microsoft exel | D533: 1 | E533: 60 | F533: of:=[.E533]*[.D533] -> 60 | G533: 2001 | I533: of:=YEAR(TODAY())-[.G533] -> 24 | L533: 1998 | M533: BPP | N533: BPB Publication
A534: 3251 | B534: Kal sehwareaz | C534: Microsoft exel | D534: 1 | E534: 60 | F534: of:=[.E534]*[.D534] -> 60 | G534: 2001 | I534: of:=YEAR(TODAY())-[.G534] -> 24 | L534: 1998 | M534: BPP | N534: BPB Publication
A535: 3303 | B535: Jayant Kumar bhatia | C535: Bharat ki Jansankhya ankre | D535: 1 | E535: 74 | F535: of:=[.E535]*[.D535] -> 74 | G535: 2002 | I535: of:=YEAR(TODAY())-[.G535] -> 23 | L535: 2002 | M535: Prakashan Vivhag | N535: JN stationary Mart JWP
A536: 3330 | B536: S. dass Gupta | C536: PI AN UNENDING STORY IN MATHS | D536: 1 | E536: 29 | F536: of:=[.E536]*[.D536] -> 29 | G536: 2002 | I536: of:=YEAR(TODAY())-[.G536] -> 23 | L536: 2002 | M536: NCERT Delhi | N536: JN stationary Mart JWP
A537: 3331 | B537: Y & Hall | C537: Understanding Mathematics | D537: 1 | E537: 895 | F537: of:=[.E537]*[.D537] -> 895 | G537: 2002 | I537: of:=YEAR(TODAY())-[.G537] -> 23 | L537: 2002 | M537: NCERT Delhi | N537: JN stationary Mart JWP
A538: 3350 | B538: DADL | C538: robinson cruso | D538: 1 | E538: 85 | F538: of:=[.E538]*[.D538] -> 85 | G538: 2002 | I538: of:=YEAR(TODAY())-[.G538] -> 23 | L538: 2002 | M538: Oxford University | N538: JN stationary Mart JWP
A539: 3389 | B539: RL Singhal | C539: Solid state physics | D539: 1 | E539: 150 | F539: of:=[.E539]*[.D539] -> 150 | G539: 2002 | I539: of:=YEAR(TODAY())-[.G539] -> 23 | L539: 2002 | M539: Kedar Nath Ram nath Meerut | N539: Prabhat Prakashan Delhi
A540: 3391 | B540: BS Pandit | C540: student concent dictionary | D540: 1 | E540: 250 | F540: of:=[.E540]*[.D540] -> 250 | G540: 2002 | I540: of:=YEAR(TODAY())-[.G540] -> 23 | L540: 2002 | M540: Student Book depot | N540: Prabhat Prakashan Delhi
A541: 3397 | B541: Hullar Muradabadi | C541: Jai andar ki baat hai | D541: 1 | E541: 125 | F541: of:=[.E541]*[.D541] -> 125 | G541: 2002 | I541: of:=YEAR(TODAY())-[.G541] -> 23 | L541: 2002 | M541: Vani Prakashan | N541: Vani Prakashan
A542: 3404 | B542: GT Glover | C542: vedic Mathematics | D542: 1 | E542: 125 | F542: of:=[.E542]*[.D542] -> 125 | G542: 2003 | I542: of:=YEAR(TODAY())-[.G542] -> 22 | L542: 2002 | M542: Moti lal Banarsi Dass Delhi | N542: NVS lucknow
A543: 3407 | B543: VS Agarwal | C543: vedic Mathematics | D543: 1 | E543: 95 | F543: of:=[.E543]*[.D543] -> 95 | G543: 2003 | I543: of:=YEAR(TODAY())-[.G543] -> 22 | L543: 2002 | M543: Moti lal Banarsi Dass Delhi | N543: NVS lucknow
A544: 3411 | B544: Misra & Misra | C544: Chemistry | D544: 1 | E544: 360 | F544: of:=[.E544]*[.D544] -> 360 | G544: 2003 | I544: of:=YEAR(TODAY())-[.G544] -> 22 | L544: 2003 | M544: Arya book Publication Delhi | N544: NVS lucknow
A545: 3434 | B545: Sarna Gupta | C545: New course sec. Mathematics | D545: 1 | E545: 110 | F545: of:=[.E545]*[.D545] -> 110 | G545: 2003 | I545: of:=YEAR(TODAY())-[.G545] -> 22 | L545: 2003 | M545: Arya book Publication Delhi | N545: NVS lucknow
A546: 3455 | B546: R Misra | C546: Chemistry | D546: 1 | E546: 68 | F546: of:=[.E546]*[.D546] -> 68 | G546: 2003 | I546: of:=YEAR(TODAY())-[.G546] -> 22 | L546: 2003 | M546: Arya book Publication Delhi | N546: NVS lucknow
A547: 3500 | B547: Honby | C547: Oxford Dictionary | D547: 1 | E547: 380 | F547: of:=[.E547]*[.D547] -> 380 | G547: 2003 | I547: of:=YEAR(TODAY())-[.G547] -> 22 | L547: 2003 | M547: Oxford University | N547: Sury enterprices Hw
A548: 3515 | B548: fo".kq izzHkkdj | C548: fo"kqqizHkkdj ds lEiw.kZ ukVd | D548: 1 | E548: 150 | F548: of:=[.E548]*[.D548] -> 150 | G548: 2003 | I548: of:=YEAR(TODAY())-[.G548] -> 22 | L548: 2003 | M548: Prabhat prakashan | N548: Prabhat Prakashan Delhi
A549: 3516 | B549: fo".kq izzHkkdj | C549: fo"kqqizHkkdj ds lEiw.kZ ukVd | D549: 1 | E549: 150 | F549: of:=[.E549]*[.D549] -> 150 | G549: 2003 | I549: of:=YEAR(TODAY())-[.G549] -> 22 | L549: 2003 | M549: Prabhat prakashan | N549: Prabhat Prakashan Delhi
A550: 3522 | B550: fo".kq izzHkkdj | C550: ,d vkSj dqerh | D550: 1 | E550: 300 | F550: of:=[.E550]*[.D550] -> 300 | G550: 2003 | I550: of:=YEAR(TODAY())-[.G550] -> 22 | L550: 2002 | M550: Prabhat prakashan | N550: Prabhat Prakashan Delhi
A551: 3534 | B551: Hkxorh pj.k oekZ | C551: Hkwys fcljs fp= | D551: 1 | E551: 395 | F551: of:=[.E551]*[.D551] -> 395 | G551: 2003 | I551: of:=YEAR(TODAY())-[.G551] -> 22 | L551: 2003 | M551: Pratibha Prakashan | N551: Prabhat Prakashan Delhi
A552: 3578 | B552: lhrk jke vk;kZ | C552: HkkX;orh | D552: 1 | E552: 80 | F552: of:=[.E552]*[.D552] -> 80 | G552: 2003 | I552: of:=YEAR(TODAY())-[.G552] -> 22 | L552: 2003 | M552: Shardha Prakashn | N552: Shardha Prakashan
A553: 3581 | B553: pj.knkl flag | C553: lEiw.kZ ukVd | D553: 1 | E553: 500 | F553: of:=[.E553]*[.D553] -> 500 | G553: 2003 | I553: of:=YEAR(TODAY())-[.G553] -> 22 | L553: 2003 | M553: Vani Prakashan | N553: Vani Prakashan
A554: 3584 | B554: pj.knkl flag | C554: bhagat singh shadid teen naatak | D554: 1 | E554: 500 | F554: of:=[.E554]*[.D554] -> 500 | G554: 2003 | I554: of:=YEAR(TODAY())-[.G554] -> 22 | L554: 2003 | M554: Vani Prakashan | N554: Vani Prakashan
A555: 3587 | B555: 'kjn tks'kh | C555: iqjkus isM dh ckrs | D555: 1 | E555: 160 | F555: of:=[.E555]*[.D555] -> 160 | G555: 2003 | I555: of:=YEAR(TODAY())-[.G555] -> 22 | L555: 2001 | M555: Matrey Prakashan | N555: Vani Prakashan
A556: 3605 | B556: eskguyky HkVukxj | C556: vk/kqfud dfork | D556: 1 | E556: 15 | F556: of:=[.E556]*[.D556] -> 15 | G556: 2003 | I556: of:=YEAR(TODAY())-[.G556] -> 22 | L556: 1999 | M556: Meharban Prakashan | N556: Agar book Delhi
A557: 3609 | B557: jke pUnz oekZ | C557: fgUnh lkfgR; dk fodkl | D557: 1 | E557: 75 | F557: of:=[.E557]*[.D557] -> 75 | G557: 2003 | I557: of:=YEAR(TODAY())-[.G557] -> 22 | L557: 1999 | M557: Radhakrishnan | N557: Agar book Delhi
A558: 3611 | B558: dkUrk jkt | C558: }kij | D558: 1 | E558: 50 | F558: of:=[.E558]*[.D558] -> 50 | G558: 2003 | I558: of:=YEAR(TODAY())-[.G558] -> 22 | L558: 1999 | M558: Shardha Prakashn | N558: Agar book Delhi
A559: 3616 | B559: d`".k nso 'kekZ | C559: e/kqekyrh | D559: 1 | E559: 30 | F559: of:=[.E559]*[.D559] -> 30 | G559: 2003 | I559: of:=YEAR(TODAY())-[.G559] -> 22 | L559: 2003 | M559: Kala Mindir | N559: Agar book Delhi
A560: 3619 | B560: ,l0ds0egsójh | C560: gad dhara | D560: 1 | E560: 18 | F560: of:=[.E560]*[.D560] -> 18 | G560: 2003 | I560: of:=YEAR(TODAY())-[.G560] -> 22 | L560: 2003 | M560: Kitabh ghar Delhi | N560: Agar book Delhi
A561: 3662 | B561: jkts'k 'kekZ | C561: fnudj vkSj mudh jféjfr | D561: 1 | E561: 35 | F561: of:=[.E561]*[.D561] -> 35 | G561: 2003 | I561: of:=YEAR(TODAY())-[.G561] -> 22 | L561: 1998 | M561: Ashok Prakashan | N561: Agar book Delhi
A562: 3664 | B562: vfHkeU;q | C562: 'kCn Hkax | D562: 1 | E562: 20 | F562: of:=[.E562]*[.D562] -> 20 | G562: 2003 | I562: of:=YEAR(TODAY())-[.G562] -> 22 | L562: 1999 | M562: Ashok Prakashan | N562: Agar book Delhi
A563: 3669 | B563: d`".k nso 'kekZ | C563: jkx njckjh | D563: 1 | E563: 40 | F563: of:=[.E563]*[.D563] -> 40 | G563: 2003 | I563: of:=YEAR(TODAY())-[.G563] -> 22 | L563: 1999 | M563: Frank & sons Dehi | N563: Agar book Delhi
A564: 3675 | B564: dsoykuUn | C564: ;ksxklu | D564: 1 | E564: 100 | F564: of:=[.E564]*[.D564] -> 100 | G564: 2004 | I564: of:=YEAR(TODAY())-[.G564] -> 21 | L564: 1997 | M564: kewelya Dham Lonawala | N564: Yoga Mission Lonawala
A565: 3679 | B565: gfj'pUnz 'kekZ | C565: e/;dkyhu Hkkjr | D565: 1 | E565: 80 | F565: of:=[.E565]*[.D565] -> 80 | G565: 2004 | I565: of:=YEAR(TODAY())-[.G565] -> 21 | L565: 2004 | M565: Hindi Madham | N565: Rai book depot Meerut
A566: 3683 | B566: ,l0lh0jkW; | C566: ekWMZu VkbEl | D566: 1 | E566: 95 | F566: of:=[.E566]*[.D566] -> 95 | G566: 2004 | I566: of:=YEAR(TODAY())-[.G566] -> 21 | L566: 2002 | M566: Sarswati Prakashan Delhi | N566: Rai book depot Meerut
A567: 3718 | B567: lh0,Q0,l0 | C567: Green School | D567: 1 | E567: 75 | F567: of:=[.E567]*[.D567] -> 75 | G567: 2005 | I567: of:=YEAR(TODAY())-[.G567] -> 20 | L567: 2005 | M567: CSF Delhi | N567: NVS lucknow
A568: 3720 | B568: lh0,Q0,l1 | C568: Green School | D568: 1 | E568: 75 | F568: of:=[.E568]*[.D568] -> 75 | G568: 2005 | I568: of:=YEAR(TODAY())-[.G568] -> 20 | L568: 2005 | M568: CSF Delhi | N568: NVS lucknow
A569: 3721 | B569: CSE | C569: Green School | D569: 1 | E569: 75 | F569: of:=[.E569]*[.D569] -> 75 | G569: 2005 | I569: of:=YEAR(TODAY())-[.G569] -> 20 | L569: 2005 | M569: CSF Delhi | N569: NVS lucknow
A570: 3727 | B570: Gopal chutarvedi | C570: Bharat AUR BHAIS | D570: 1 | E570: 150 | F570: of:=[.E570]*[.D570] -> 150 | G570: 2005 | I570: of:=YEAR(TODAY())-[.G570] -> 20 | L570: 2002 | M570: Sahity Prakashan | N570: Prabhat Prakashan Delhi
A571: 3738 | B571: CBT | C571: six Plays | D571: 1 | E571: 36 | F571: of:=[.E571]*[.D571] -> 36 | G571: 2005 | I571: of:=YEAR(TODAY())-[.G571] -> 20 | L571: 2002 | M571: Icon Prakashan | N571: Prabhat Prakashan Delhi
A572: 3740 | B572: Mohan rakesh | C572: Andhere band kamre | D572: 1 | E572: 250 | F572: of:=[.E572]*[.D572] -> 250 | G572: 2005 | I572: of:=YEAR(TODAY())-[.G572] -> 20 | L572: 2003 | M572: Prabhat prakashan | N572: Prabhat Prakashan Delhi
A573: 3741 | B573: Ak Dutta | C573: Pakistan Jinha se Jahid tak | D573: 1 | E573: 300 | F573: of:=[.E573]*[.D573] -> 300 | G573: 2005 | I573: of:=YEAR(TODAY())-[.G573] -> 20 | L573: 2003 | M573: Pratibha Prakashan | N573: Prabhat Prakashan Delhi
A574: 3759 | B574: YK Kntner | C574: let us c++ | D574: 1 | E574: 180 | F574: of:=[.E574]*[.D574] -> 180 | G574: 2005 | I574: of:=YEAR(TODAY())-[.G574] -> 20 | L574: 2004 | M574: BPB Publication | N574: Prabhat Prakashan Delhi
A575: 3770 | B575: tSd fyUlu | C575: white fangs | D575: 1 | E575: 150 | F575: of:=[.E575]*[.D575] -> 150 | G575: 2005 | I575: of:=YEAR(TODAY())-[.G575] -> 20 | L575: 2000 | M575: S Kumar Publication Delhi | N575: Prabhat Prakashan Delhi
A576: 3789 | B576: vkj0ds0pUnz | C576: Indian artist | D576: 1 | E576: 400 | F576: of:=[.E576]*[.D576] -> 400 | G576: 2005 | I576: of:=YEAR(TODAY())-[.G576] -> 20 | L576: 2004 | M576: B M Prakashan Delhi | N576: JN stationary Mart JWP
A577: 3790 | B577: prqjlsu | C577: Ohanery ki rochak kahaniya | D577: 1 | E577: 150 | F577: of:=[.E577]*[.D577] -> 150 | G577: 2005 | I577: of:=YEAR(TODAY())-[.G577] -> 20 | L577: 2003 | M577: Suyogaya Prakashan | N577: JN stationary Mart JWP
A578: 3802 | B578: jke izlkn /;kuh | C578: Uttaratal ki khoj | D578: 1 | E578: 400 | F578: of:=[.E578]*[.D578] -> 400 | G578: 2005 | I578: of:=YEAR(TODAY())-[.G578] -> 20 | L578: 2004 | M578: Vidya Vihar Delhi | N578: M.Y Gyani Kotdwar
A579: 3807 | B579: t;loky | C579: Chemistry | D579: 1 | E579: 535 | F579: of:=[.E579]*[.D579] -> 535 | G579: 2005 | I579: of:=YEAR(TODAY())-[.G579] -> 20 | L579: 2005 | M579: Modern Publication | N579: Goyal Pustak Haridwar
A580: 3817 | B580: ykycgknqj | C580: four tales of bangal | D580: 1 | E580: 195 | F580: of:=[.E580]*[.D580] -> 195 | G580: 2006 | I580: of:=YEAR(TODAY())-[.G580] -> 19 | L580: 2003 | M580: Roopa & company | N580: Cambrage book depot
A581: 3848 | B581: fp=ke/kqxy | C581: Abha | D581: 1 | E581: 500 | F581: of:=[.E581]*[.D581] -> 500 | G581: 2006 | I581: of:=YEAR(TODAY())-[.G581] -> 19 | L581: 2005 | M581: Samajik Prakashan Delhi | N581: Cambrage book depot
A582: 3856 | B582: fojsUnz flag xkSM | C582: vishav me aatankwaad | D582: 1 | E582: 50 | F582: of:=[.E582]*[.D582] -> 50 | G582: 2006 | I582: of:=YEAR(TODAY())-[.G582] -> 19 | L582: 2004 | M582: Samajik Prakashan Delhi | N582: Cambrage book depot
A583: 3876 | B583: foóokfe= 'kekZ | C583: Grabhi or aakal | D583: 1 | E583: 200 | F583: of:=[.E583]*[.D583] -> 200 | G583: 2006 | I583: of:=YEAR(TODAY())-[.G583] -> 19 | L583: 2004 | M583: Rajpal & sons | N583: Cambrage book depot
A584: 3877 | B584: veZrlsu | C584: Shukantala | D584: 1 | E584: 75 | F584: of:=[.E584]*[.D584] -> 75 | G584: 2006 | I584: of:=YEAR(TODAY())-[.G584] -> 19 | L584: 2004 | M584: Paying wing delhi | N584: Cambrage book depot
A585: 3899 | B585: Oxford University | C585: Oxford Essential Eng.Hindi Dis | D585: 1 | E585: 110 | F585: of:=[.E585]*[.D585] -> 110 | G585: 2006 | I585: of:=YEAR(TODAY())-[.G585] -> 19 | L585: 2006 | M585: Oxford University Delhi | N585: NVS LR lucknow
A586: 3926 | B586: Y sundar raj &Abdul K. | C586: Mahashakti bhart | D586: 1 | E586: 250 | F586: of:=[.E586]*[.D586] -> 250 | G586: 2006 | I586: of:=YEAR(TODAY())-[.G586] -> 19 | L586: 2006 | M586: Prabhat Parkashan | N586: NVS LR lucknow
A587: 3947 | B587: Asha Gupta | C587: Mopasa ki Unthi kahaniya | D587: 1 | E587: 200 | F587: of:=[.E587]*[.D587] -> 200 | G587: 2006 | I587: of:=YEAR(TODAY())-[.G587] -> 19 | L587: 2006 | M587: Sahitya ka Itihas Delhi | N587: NVS LR lucknow
A588: 3970 | B588: Vijay Agarwal | C588: Same aapki muthi me | D588: 1 | E588: 150 | F588: of:=[.E588]*[.D588] -> 150 | G588: 2006 | I588: of:=YEAR(TODAY())-[.G588] -> 19 | L588: 2006 | M588: Jai Co. House Delhi | N588: NVS LR lucknow
A589: 3986 | B589: Papual Nangle | C589: New teacher complete source book | D589: 1 | E589: 225 | F589: of:=[.E589]*[.D589] -> 225 | G589: 2006 | I589: of:=YEAR(TODAY())-[.G589] -> 19 | L589: 2006 | M589: C.B.S.E Pub. New Delhi | N589: NVS LR lucknow
A590: 4003 | B590: AS Honby | C590: New oxford learner dictionary | D590: 1 | E590: 599 | F590: of:=[.E590]*[.D590] -> 599 | G590: 2006 | I590: of:=YEAR(TODAY())-[.G590] -> 19 | L590: 2006 | M590: Oxford University Delhi | N590: NVS LR lucknow
A591: 4054 | B591: Micle Ashbhy | C591: oxford learner student dictionary | D591: 1 | E591: 165 | F591: of:=[.E591]*[.D591] -> 165 | G591: 2006 | I591: of:=YEAR(TODAY())-[.G591] -> 19 | L591: 2006 | M591: Oxford University Delhi | N591: NVS LR lucknow
A592: 4055 | B592: Micle Ashbhy | C592: oxford learner student dictionary | D592: 1 | E592: 165 | F592: of:=[.E592]*[.D592] -> 165 | G592: 2006 | I592: of:=YEAR(TODAY())-[.G592] -> 19 | L592: 2006 | M592: Oxford University Delhi | N592: NVS LR lucknow
A593: 4063 | B593: Micle Ashbhy | C593: oxford learner student dictionary | D593: 1 | E593: 165 | F593: of:=[.E593]*[.D593] -> 165 | G593: 2006 | I593: of:=YEAR(TODAY())-[.G593] -> 19 | L593: 2006 | M593: Oxford University Delhi | N593: NVS LR lucknow
A594: 4070 | B594: Oxford University | C594: Cambridge learner dictionary | D594: 1 | E594: 195 | F594: of:=[.E594]*[.D594] -> 195 | G594: 2006 | I594: of:=YEAR(TODAY())-[.G594] -> 19 | L594: 2006 | M594: Oxford University Delhi | N594: NVS LR lucknow
A595: 4072 | B595: Oxford University | C595: Cambridge learner dictionary | D595: 1 | E595: 195 | F595: of:=[.E595]*[.D595] -> 195 | G595: 2006 | I595: of:=YEAR(TODAY())-[.G595] -> 19 | L595: 2006 | M595: Oxford University Delhi | N595: NVS LR lucknow
A596: 4073 | B596: Oxford University | C596: Cambridge learner dictionary | D596: 1 | E596: 195 | F596: of:=[.E596]*[.D596] -> 195 | G596: 2006 | I596: of:=YEAR(TODAY())-[.G596] -> 19 | L596: 2006 | M596: Oxford University Delhi | N596: NVS LR lucknow
A597: 4087 | B597: Lal & Jain | C597: NVS entrance digest | D597: 1 | E597: 70 | F597: of:=[.E597]*[.D597] -> 70 | G597: 2006 | I597: of:=YEAR(TODAY())-[.G597] -> 19 | L597: 2006 | M597: Upkar Prakshan Agra | N597: NVS LR lucknow
A598: 4093 | B598: BS Behel | C598: Elements of Physical chemistry | D598: 1 | E598: 350 | F598: of:=[.E598]*[.D598] -> 350 | G598: 2006 | I598: of:=YEAR(TODAY())-[.G598] -> 19 | L598: 2007 | M598: S.Chan & Co. Ram Nagar Delhi | N598: S.Chand DDN
A599: 4148 | B599: Vibha Gupta | C599: carrer pathway | D599: 1 | E599: 480 | F599: of:=[.E599]*[.D599] -> 480 | G599: 2006 | I599: of:=YEAR(TODAY())-[.G599] -> 19 | L599: 2006 | M599: Tata Micro Hill Prakshan Delhi | N599: Hansa Stationer JWP
A600: 4160 | B600: Shiv Khera | C600: You can win | D600: 1 | E600: 225 | F600: of:=[.E600]*[.D600] -> 225 | G600: 2007 | I600: of:=YEAR(TODAY())-[.G600] -> 18 | L600: 2004 | M600: Mac Millon India Hydrabad | N600: Rawat Jawalapur Haridwaar
A601: 4240 | B601: Charls Digens | C601: David Copper field | D601: 1 | E601: 60 | F601: of:=[.E601]*[.D601] -> 60 | G601: 2007 | I601: of:=YEAR(TODAY())-[.G601] -> 18 | L601: 2006 | M601: S.chand & comapany N Delhi | N601: S. Chand Ramnagar Delhi
A602: 4258 | B602: Prativanath | C602: Leaving with value | D602: 1 | E602: 65 | F602: of:=[.E602]*[.D602] -> 65 | G602: 2008 | I602: of:=YEAR(TODAY())-[.G602] -> 17 | L602: 2007 | M602: S.chand & company Delhi | N602: S.Chand DDN
A603: 4276 | B603: M Thomas | C603: Effective teaching in school | D603: 1 | E603: 160 | F603: of:=[.E603]*[.D603] -> 160 | G603: 2008 | I603: of:=YEAR(TODAY())-[.G603] -> 17 | L603: 2008 | M603: S.chand & company Delhi | N603: S.Chand DDN
A604: 4301 | B604: W Turner | C604: As you like it | D604: 1 | E604: 90 | F604: of:=[.E604]*[.D604] -> 90 | G604: 2008 | I604: of:=YEAR(TODAY())-[.G604] -> 17 | L604: 2008 | M604: S.chand & company Delhi | N604: S.Chand DDN
A605: 4309 | B605: JC Pices | C605: Postive today | D605: 1 | E605: 30 | F605: of:=[.E605]*[.D605] -> 30 | G605: 2008 | I605: of:=YEAR(TODAY())-[.G605] -> 17 | L605: 2008 | M605: Kabir Prakashan | N605: NVS LR lucknow
A606: 4311 | B606: Hill | C606: Speaking course | D606: 1 | E606: 125 | F606: of:=[.E606]*[.D606] -> 125 | G606: 2008 | I606: of:=YEAR(TODAY())-[.G606] -> 17 | L606: 2008 | M606: Oxford University Delhi | N606: NVS LR lucknow
A607: 4323 | B607: SAD | C607: Jeet aap ki | D607: 1 | E607: 200 | F607: of:=[.E607]*[.D607] -> 200 | G607: 2008 | I607: of:=YEAR(TODAY())-[.G607] -> 17 | L607: 2006 | M607: Meckmillon Delhi | N607: Oswal book agra
A608: 4453 | B608: PK Mehta | C608: Principle of Biology | D608: 1 | E608: 510 | F608: of:=[.E608]*[.D608] -> 510 | G608: 2009 | I608: of:=YEAR(TODAY())-[.G608] -> 16 | L608: 2008 | M608: S Chandra & company Delhi | N608: S.Chand DDN
A609: 4466 | B609: JC Agarwal | C609: Nano Technology | D609: 1 | E609: 150 | F609: of:=[.E609]*[.D609] -> 150 | G609: 2009 | I609: of:=YEAR(TODAY())-[.G609] -> 16 | L609: 2009 | M609: S Chandra & company Delhi | N609: S.Chand DDN
A610: 4481 | B610: NK Choudhary | C610: Socal science 9 | D610: 1 | E610: 115 | F610: of:=[.E610]*[.D610] -> 115 | G610: 2009 | I610: of:=YEAR(TODAY())-[.G610] -> 16 | L610: 2009 | M610: S Chandra & company Delhi | N610: S.Chand DDN
A611: 4494 | B611: Vipin chandra | C611: Hindi kendrik 12 | D611: 1 | E611: 240 | F611: of:=[.E611]*[.D611] -> 240 | G611: 2009 | I611: of:=YEAR(TODAY())-[.G611] -> 16 | L611: 2009 | M611: Rachana Sagar Delhi | N611: NVS LR lucknow
A612: 4501 | B612: ';kelqUnj 'kekZ | C612: 51 vigyan model | D612: 1 | E612: 150 | F612: of:=[.E612]*[.D612] -> 150 | G612: 2010 | I612: of:=YEAR(TODAY())-[.G612] -> 15 | L612: 2009 | M612: Vidya Vihar Delhi | N612: Diamond Stationary JWP
A613: 4556 | B613: lqjsUnz dqekj | C613: Vastu chitran | D613: 1 | E613: 38 | F613: of:=[.E613]*[.D613] -> 38 | G613: 2010 | I613: of:=YEAR(TODAY())-[.G613] -> 15 | L613: 2009 | M613: Anupam Prakashan India | N613: Diamond Stationary JWP
A614: 4565 | B614: Asha Purna | C614: Fabric paintings | D614: 1 | E614: 80 | F614: of:=[.E614]*[.D614] -> 80 | G614: 2010 | I614: of:=YEAR(TODAY())-[.G614] -> 15 | L614: 2009 | M614: Asha Pura Publication | N614: Diamond Stationary JWP
A615: 4629 | B615: RP rana | C615: Physics class 7 | D615: 1 | E615: 140 | F615: of:=[.E615]*[.D615] -> 140 | G615: 2010 | I615: of:=YEAR(TODAY())-[.G615] -> 15 | L615: 2009 | M615: S Chandra & company Delhi | N615: S.Chand DDN
A616: 4630 | B616: RP rana | C616: Physics class 8 | D616: 1 | E616: 150 | F616: of:=[.E616]*[.D616] -> 150 | G616: 2010 | I616: of:=YEAR(TODAY())-[.G616] -> 15 | L616: 2010 | M616: S Chandra & company Delhi | N616: S.Chand DDN
A617: 4633 | B617: RP rana | C617: Chemistry 8 | D617: 1 | E617: 150 | F617: of:=[.E617]*[.D617] -> 150 | G617: 2010 | I617: of:=YEAR(TODAY())-[.G617] -> 15 | L617: 2010 | M617: S Chandra & company Delhi | N617: S.Chand DDN
A618: 4656 | B618: D Mehra | C618: computer science 12 | D618: 1 | E618: 240 | F618: of:=[.E618]*[.D618] -> 240 | G618: 2010 | I618: of:=YEAR(TODAY())-[.G618] -> 15 | L618: 2010 | M618: S Chandra & company Delhi | N618: S.Chand DDN
A619: 4676 | B619: Jack Kaligan | C619: Atlas of the space | D619: 1 | E619: 149 | F619: of:=[.E619]*[.D619] -> 149 | G619: 2010 | I619: of:=YEAR(TODAY())-[.G619] -> 15 | L619: 2010 | M619: S Chandra & company Delhi | N619: S.Chand DDN
A620: 4750 | B620: B Serli | C620: Heat & energy | D620: 1 | E620: 119 | F620: of:=[.E620]*[.D620] -> 119 | G620: 2010 | I620: of:=YEAR(TODAY())-[.G620] -> 15 | L620: 2010 | M620: S Chandra & company Delhi | N620: S.Chand DDN
A621: 4752 | B621: Jim Green | C621: Green revolution | D621: 1 | E621: 119 | F621: of:=[.E621]*[.D621] -> 119 | G621: 2010 | I621: of:=YEAR(TODAY())-[.G621] -> 15 | L621: 2010 | M621: S Chandra & company Delhi | N621: S.Chand DDN
A622: 4769 | B622: Johan Richord | C622: Skin hair hygenie | D622: 1 | E622: 99 | F622: of:=[.E622]*[.D622] -> 99 | G622: 2010 | I622: of:=YEAR(TODAY())-[.G622] -> 15 | L622: 2010 | M622: S Chandra & company Delhi | N622: S.Chand DDN
A623: 4779 | B623: Jhon Green | C623: Cell | D623: 1 | E623: 99 | F623: of:=[.E623]*[.D623] -> 99 | G623: 2010 | I623: of:=YEAR(TODAY())-[.G623] -> 15 | L623: 2010 | M623: S Chandra & company Delhi | N623: S.Chand DDN
A624: 4789 | B624: K Viseman | C624: Practice of coperation | D624: 1 | E624: 60 | F624: of:=[.E624]*[.D624] -> 60 | G624: 2010 | I624: of:=YEAR(TODAY())-[.G624] -> 15 | L624: 2010 | M624: S Chandra & company Delhi | N624: S.Chand DDN
A625: 4896 | B625: Anil Kumar | C625: Success is non ending | D625: 1 | E625: 130 | F625: of:=[.E625]*[.D625] -> 130 | G625: 2011 | I625: of:=YEAR(TODAY())-[.G625] -> 14 | L625: 2011 | M625: Kku xaxk izdk'ku fnYyh | N625: NVS LR lucknow
A626: 4945 | B626: Prem Chand | C626: Gaban | D626: 1 | E626: 360 | F626: of:=[.E626]*[.D626] -> 360 | G626: 2011 | I626: of:=YEAR(TODAY())-[.G626] -> 14 | L626: 2011 | M626: izse ifCyds'ku bykgkckn | N626: NVS LR lucknow
A627: 4951 | B627: Arun Gour | C627: Bacho ke liye yog | D627: 1 | E627: 175 | F627: of:=[.E627]*[.D627] -> 175 | G627: 2011 | I627: of:=YEAR(TODAY())-[.G627] -> 14 | L627: 2011 | M627: Kku xaxk izdk'ku fnYyh | N627: NVS LR lucknow
A628: 4961 | B628: H walic | C628: The Time machine | D628: 1 | E628: 92 | F628: of:=[.E628]*[.D628] -> 92 | G628: 2011 | I628: of:=YEAR(TODAY())-[.G628] -> 14 | L628: 2010 | M628: lj.k cqd fMiks fnYyh | N628: NVS LR lucknow
A629: 4985 | B629: V karant | C629: I can I will | D629: 1 | E629: 92 | F629: of:=[.E629]*[.D629] -> 92 | G629: 2011 | I629: of:=YEAR(TODAY())-[.G629] -> 14 | L629: 2011 | M629: Mack Millon Publisher | N629: NVS LR lucknow
A630: 5022 | B630: Jain Mathur | C630: Adunik vishav ka ithyas | D630: 1 | E630: 920 | F630: of:=[.E630]*[.D630] -> 920 | G630: 2011 | I630: of:=YEAR(TODAY())-[.G630] -> 14 | L630: 2011 | M630: Jain Prakashan Mandir Jaipur | N630: Jain Prakashan Mandir
A631: 5023 | B631: Jain Mathur | C631: Adunik vishav ka ithyas | D631: 1 | F631: of:=[.E631]*[.D631] -> 0 | G631: 2011 | I631: of:=YEAR(TODAY())-[.G631] -> 14 | L631: 2011 | M631: Jain Prakashan Mandir Jaipur | N631: Jain Prakashan Mandir
A632: 5130 | B632: Sursh Ritupan | C632: Japan ki lok kathayan | D632: 1 | E632: 90 | F632: of:=[.E632]*[.D632] -> 90 | G632: 2011 | I632: of:=YEAR(TODAY())-[.G632] -> 14 | L632: 2011 | M632: NBT Delhi | N632: NBT Delhi
A633: 5151 | B633: Manorma Dewan | C633: Divar b anya kahaniya | D633: 1 | E633: 40 | F633: of:=[.E633]*[.D633] -> 40 | G633: 2011 | I633: of:=YEAR(TODAY())-[.G633] -> 14 | L633: 2011 | M633: NBT Delhi | N633: NBT Delhi
A634: 5228 | B634: Ahasan Ali | C634: Sahid Abdul Hamid | D634: 1 | E634: 40 | F634: of:=[.E634]*[.D634] -> 40 | G634: 2011 | I634: of:=YEAR(TODAY())-[.G634] -> 14 | L634: 2011 | M634: NBT Delhi | N634: NBT Delhi
A635: 5307 | B635: Dream Tara | C635: Paper flowers | D635: 1 | E635: 150 | F635: of:=[.E635]*[.D635] -> 150 | G635: 2012 | I635: of:=YEAR(TODAY())-[.G635] -> 13 | L635: 2012 | M635: Sadna publishr Delhi | N635: Sadna publishr Delhi
A636: 5308 | B636: Dream Tara | C636: Stone in art | D636: 1 | E636: 150 | F636: of:=[.E636]*[.D636] -> 150 | G636: 2012 | I636: of:=YEAR(TODAY())-[.G636] -> 13 | L636: 2012 | M636: Sadna publishr Delhi | N636: Sadna publishr Delhi
A637: 5333 | B637: J Ramesh | C637: strenth of postive thinking | D637: 1 | E637: 300 | F637: of:=[.E637]*[.D637] -> 300 | G637: 2012 | I637: of:=YEAR(TODAY())-[.G637] -> 13 | L637: 2012 | M637: Knowledge Prakashan Delhi | N637: RO Lucknow
A638: 5343 | B638: Chartarjee | C638: Media studies | D638: 1 | E638: 425 | F638: of:=[.E638]*[.D638] -> 425 | G638: 2012 | I638: of:=YEAR(TODAY())-[.G638] -> 13 | L638: 2012 | M638: Meena prakashn | N638: RO Lucknow
A639: 5345 | B639: Vishnu dutt sharma | C639: Prudashan rodhi braksh | D639: 1 | E639: 150 | F639: of:=[.E639]*[.D639] -> 150 | G639: 2012 | I639: of:=YEAR(TODAY())-[.G639] -> 13 | L639: 2012 | M639: Viskas paper bag prakashan delhi | N639: RO Lucknow
A640: 5393 | B640: CK Pathak | C640: Media communication | D640: 1 | E640: 450 | F640: of:=[.E640]*[.D640] -> 450 | G640: 2012 | I640: of:=YEAR(TODAY())-[.G640] -> 13 | L640: 2011 | M640: Meena prakashn | N640: RO Lucknow
A641: 5399 | B641: Pavitra Kumar sharma | C641: Vivharik manovigyan | D641: 1 | E641: 200 | F641: of:=[.E641]*[.D641] -> 200 | G641: 2012 | I641: of:=YEAR(TODAY())-[.G641] -> 13 | L641: 2012 | M641: Ocien book private limited | N641: RO Lucknow
A642: 5403 | B642: Babu Deviki Nandan | C642: Chadrakanta Sutati | D642: 1 | E642: 400 | F642: of:=[.E642]*[.D642] -> 400 | G642: 2012 | I642: of:=YEAR(TODAY())-[.G642] -> 13 | L642: 2012 | M642: Nav Nidhi prakashan Gagiabad | N642: RO Lucknow
A643: 5500 | B643: Flowrangi Teneja | C643: Antriksh ka romanch | D643: 1 | E643: 200 | F643: of:=[.E643]*[.D643] -> 200 | G643: 2012 | I643: of:=YEAR(TODAY())-[.G643] -> 13 | L643: 2012 | M643: Doon Publication | N643: RO Lucknow
A644: 5506 | B644: Sham Sundar Sharma | C644: Bukamp | D644: 1 | E644: 200 | F644: of:=[.E644]*[.D644] -> 200 | G644: 2012 | I644: of:=YEAR(TODAY())-[.G644] -> 13 | L644: 2012 | M644: Gyan ganga delhi | N644: RO Lucknow
A645: 5559 | B645: Ravindra Nath Tagore | C645: Ravinder Nath ke siksha prad kah | D645: 1 | E645: 150 | F645: of:=[.E645]*[.D645] -> 150 | G645: 2012 | I645: of:=YEAR(TODAY())-[.G645] -> 13 | L645: 2012 | M645: Granth Bharti publisher | N645: RO Lucknow
A646: 5595 | B646: VL Gupta | C646: 13 Micro ecomomics | D646: 1 | E646: 300 | F646: of:=[.E646]*[.D646] -> 300 | G646: 2012 | I646: of:=YEAR(TODAY())-[.G646] -> 13 | L646: 2012 | M646: Arya Publication | N646: RO Lucknow
A647: 5614 | B647: Amar chitra katha | C647: Praldah | D647: 1 | E647: 50 | F647: of:=[.E647]*[.D647] -> 50 | G647: 2012 | I647: of:=YEAR(TODAY())-[.G647] -> 13 | L647: 2012 | M647: Amar chitr katha Prakashan | N647: Creating India foundation
A648: 5615 | B648: Amar chitra katha | C648: Rani Durga vati | D648: 1 | E648: 50 | F648: of:=[.E648]*[.D648] -> 50 | G648: 2012 | I648: of:=YEAR(TODAY())-[.G648] -> 13 | L648: 2012 | M648: Amar chitr katha Prakashan | N648: Creating India foundation
A649: 5616 | B649: Amar chitra katha | C649: Krishan | D649: 1 | E649: 50 | F649: of:=[.E649]*[.D649] -> 50 | G649: 2012 | I649: of:=YEAR(TODAY())-[.G649] -> 13 | L649: 2012 | M649: Amar chitr katha Prakashan | N649: Creating India foundation
A650: 5617 | B650: Amar chitra katha | C650: Anirudha | D650: 1 | E650: 40 | F650: of:=[.E650]*[.D650] -> 40 | G650: 2012 | I650: of:=YEAR(TODAY())-[.G650] -> 13 | L650: 2012 | M650: Amar chitr katha Prakashan | N650: Creating India foundation
A651: 5618 | B651: Amar chitra katha | C651: Basan sena | D651: 1 | E651: 40 | F651: of:=[.E651]*[.D651] -> 40 | G651: 2012 | I651: of:=YEAR(TODAY())-[.G651] -> 13 | L651: 2012 | M651: Amar chitr katha Prakashan | N651: Creating India foundation
A652: 5619 | B652: Amar chitra katha | C652: Udhyan | D652: 1 | E652: 40 | F652: of:=[.E652]*[.D652] -> 40 | G652: 2012 | I652: of:=YEAR(TODAY())-[.G652] -> 13 | L652: 2012 | M652: Amar chitr katha Prakashan | N652: Creating India foundation
A653: 5620 | B653: Amar chitra katha | C653: Prithvi raj chauhan | D653: 1 | E653: 40 | F653: of:=[.E653]*[.D653] -> 40 | G653: 2012 | I653: of:=YEAR(TODAY())-[.G653] -> 13 | L653: 2012 | M653: Amar chitr katha Prakashan | N653: Creating India foundation
A654: 5621 | B654: Amar chitra katha | C654: Pictorial stories for children | D654: 1 | E654: 35 | F654: of:=[.E654]*[.D654] -> 35 | G654: 2012 | I654: of:=YEAR(TODAY())-[.G654] -> 13 | L654: 2012 | M654: Amar chitr katha Prakashan | N654: Creating India foundation
A655: 5625 | B655: Amar chitra katha | C655: Pictorial stories for children | D655: 1 | E655: 35 | F655: of:=[.E655]*[.D655] -> 35 | G655: 2012 | I655: of:=YEAR(TODAY())-[.G655] -> 13 | L655: 2012 | M655: Amar chitr katha Prakashan | N655: Creating India foundation
A656: 5626 | B656: Amar chitra katha | C656: Pictorial stories for children | D656: 1 | E656: 35 | F656: of:=[.E656]*[.D656] -> 35 | G656: 2012 | I656: of:=YEAR(TODAY())-[.G656] -> 13 | L656: 2012 | M656: Amar chitr katha Prakashan | N656: Creating India foundation
A657: 5628 | B657: Amar chitra katha | C657: Kartiken | D657: 1 | E657: 40 | F657: of:=[.E657]*[.D657] -> 40 | G657: 2012 | I657: of:=YEAR(TODAY())-[.G657] -> 13 | L657: 2012 | M657: Amar chitr katha Prakashan | N657: Creating India foundation
A658: 5629 | B658: Amar chitra katha | C658: Krishna | D658: 1 | E658: 40 | F658: of:=[.E658]*[.D658] -> 40 | G658: 2012 | I658: of:=YEAR(TODAY())-[.G658] -> 13 | L658: 2012 | M658: Amar chitr katha Prakashan | N658: Creating India foundation
A659: 5630 | B659: Amar chitra katha | C659: Chandra gupt morya | D659: 1 | E659: 40 | F659: of:=[.E659]*[.D659] -> 40 | G659: 2012 | I659: of:=YEAR(TODAY())-[.G659] -> 13 | L659: 2012 | M659: Amar chitr katha Prakashan | N659: Creating India foundation
A660: 5631 | B660: Amar chitra katha | C660: Krishan shishupal | D660: 1 | E660: 40 | F660: of:=[.E660]*[.D660] -> 40 | G660: 2012 | I660: of:=YEAR(TODAY())-[.G660] -> 13 | L660: 2012 | M660: Amar chitr katha Prakashan | N660: Creating India foundation
A661: 5632 | B661: Amar chitra katha | C661: Prithvi raj chauhan | D661: 1 | E661: 40 | F661: of:=[.E661]*[.D661] -> 40 | G661: 2012 | I661: of:=YEAR(TODAY())-[.G661] -> 13 | L661: 2012 | M661: Amar chitr katha Prakashan | N661: Creating India foundation
A662: 5633 | B662: Amar chitra katha | C662: Krishan dev ray | D662: 1 | E662: 40 | F662: of:=[.E662]*[.D662] -> 40 | G662: 2012 | I662: of:=YEAR(TODAY())-[.G662] -> 13 | L662: 2012 | M662: Amar chitr katha Prakashan | N662: Creating India foundation
A663: 5634 | B663: Amar chitra katha | C663: Ram Krishan | D663: 1 | E663: 40 | F663: of:=[.E663]*[.D663] -> 40 | G663: 2012 | I663: of:=YEAR(TODAY())-[.G663] -> 13 | L663: 2012 | M663: Amar chitr katha Prakashan | N663: Creating India foundation
A664: 5636 | B664: Amar chitra katha | C664: Hanuman | D664: 1 | E664: 40 | F664: of:=[.E664]*[.D664] -> 40 | G664: 2012 | I664: of:=YEAR(TODAY())-[.G664] -> 13 | L664: 2012 | M664: Amar chitr katha Prakashan | N664: Creating India foundation
A665: 5638 | B665: Amar chitra katha | C665: Krishana Narasukh | D665: 1 | E665: 40 | F665: of:=[.E665]*[.D665] -> 40 | G665: 2012 | I665: of:=YEAR(TODAY())-[.G665] -> 13 | L665: 2012 | M665: Amar chitr katha Prakashan | N665: Creating India foundation
A666: 5640 | B666: Amar chitra katha | C666: Raja Boj | D666: 1 | E666: 40 | F666: of:=[.E666]*[.D666] -> 40 | G666: 2012 | I666: of:=YEAR(TODAY())-[.G666] -> 13 | L666: 2012 | M666: Amar chitr katha Prakashan | N666: Creating India foundation
A667: 5643 | B667: Amar chitra katha | C667: crow & owl | D667: 1 | E667: 40 | F667: of:=[.E667]*[.D667] -> 40 | G667: 2012 | I667: of:=YEAR(TODAY())-[.G667] -> 13 | L667: 2012 | M667: Amar chitr katha Prakashan | N667: Creating India foundation
A668: 5644 | B668: Amar chitra katha | C668: Vasav dutta | D668: 1 | E668: 40 | F668: of:=[.E668]*[.D668] -> 40 | G668: 2012 | I668: of:=YEAR(TODAY())-[.G668] -> 13 | L668: 2012 | M668: Amar chitr katha Prakashan | N668: Creating India foundation
A669: 5645 | B669: Amar chitra katha | C669: Vidya sagar | D669: 1 | E669: 40 | F669: of:=[.E669]*[.D669] -> 40 | G669: 2012 | I669: of:=YEAR(TODAY())-[.G669] -> 13 | L669: 2012 | M669: Amar chitr katha Prakashan | N669: Creating India foundation
A670: 5646 | B670: Amar chitra katha | C670: Vikrma ditya | D670: 1 | E670: 40 | F670: of:=[.E670]*[.D670] -> 40 | G670: 2012 | I670: of:=YEAR(TODAY())-[.G670] -> 13 | L670: 2012 | M670: Amar chitr katha Prakashan | N670: Creating India foundation
A671: 5648 | B671: Amar chitra katha | C671: Tales of rama | D671: 1 | E671: 40 | F671: of:=[.E671]*[.D671] -> 40 | G671: 2012 | I671: of:=YEAR(TODAY())-[.G671] -> 13 | L671: 2012 | M671: Amar chitr katha Prakashan | N671: Creating India foundation
A672: 5649 | B672: Amar chitra katha | C672: tales of Upnishad | D672: 1 | E672: 40 | F672: of:=[.E672]*[.D672] -> 40 | G672: 2012 | I672: of:=YEAR(TODAY())-[.G672] -> 13 | L672: 2012 | M672: Amar chitr katha Prakashan | N672: Creating India foundation
A673: 5651 | B673: Amar chitra katha | C673: Jagdish chandra vasu | D673: 1 | E673: 40 | F673: of:=[.E673]*[.D673] -> 40 | G673: 2012 | I673: of:=YEAR(TODAY())-[.G673] -> 13 | L673: 2012 | M673: Amar chitr katha Prakashan | N673: Creating India foundation
A674: 5652 | B674: Amar chitra katha | C674: Panna Harirani | D674: 1 | E674: 40 | F674: of:=[.E674]*[.D674] -> 40 | G674: 2012 | I674: of:=YEAR(TODAY())-[.G674] -> 13 | L674: 2012 | M674: Amar chitr katha Prakashan | N674: Creating India foundation
A675: 5654 | B675: Amar chitra katha | C675: shiv parwati | D675: 1 | E675: 50 | F675: of:=[.E675]*[.D675] -> 50 | G675: 2012 | I675: of:=YEAR(TODAY())-[.G675] -> 13 | L675: 2012 | M675: Amar chitr katha Prakashan | N675: Creating India foundation
A676: 5655 | B676: Amar chitra katha | C676: Rama | D676: 1 | E676: 50 | F676: of:=[.E676]*[.D676] -> 50 | G676: 2012 | I676: of:=YEAR(TODAY())-[.G676] -> 13 | L676: 2012 | M676: Amar chitr katha Prakashan | N676: Creating India foundation
A677: 5660 | B677: Amar chitra katha | C677: Bajiraw | D677: 1 | E677: 50 | F677: of:=[.E677]*[.D677] -> 50 | G677: 2012 | I677: of:=YEAR(TODAY())-[.G677] -> 13 | L677: 2012 | M677: Amar chitr katha Prakashan | N677: Creating India foundation
A678: 5661 | B678: Amar chitra katha | C678: Nirsima | D678: 1 | E678: 50 | F678: of:=[.E678]*[.D678] -> 50 | G678: 2012 | I678: of:=YEAR(TODAY())-[.G678] -> 13 | L678: 2012 | M678: Amar chitr katha Prakashan | N678: Creating India foundation
A679: 5662 | B679: Amar chitra katha | C679: Dhronha | D679: 1 | E679: 50 | F679: of:=[.E679]*[.D679] -> 50 | G679: 2012 | I679: of:=YEAR(TODAY())-[.G679] -> 13 | L679: 2012 | M679: Amar chitr katha Prakashan | N679: Creating India foundation
A680: 5666 | B680: Amar chitra katha | C680: Rama nath Tenali | D680: 1 | E680: 50 | F680: of:=[.E680]*[.D680] -> 50 | G680: 2012 | I680: of:=YEAR(TODAY())-[.G680] -> 13 | L680: 2012 | M680: Amar chitr katha Prakashan | N680: Creating India foundation
A681: 5668 | B681: Amar chitra katha | C681: Kacha Divyani | D681: 1 | E681: 50 | F681: of:=[.E681]*[.D681] -> 50 | G681: 2012 | I681: of:=YEAR(TODAY())-[.G681] -> 13 | L681: 2012 | M681: Amar chitr katha Prakashan | N681: Creating India foundation
A682: 5670 | B682: Amar chitra katha | C682: Man ki stories | D682: 1 | E682: 50 | F682: of:=[.E682]*[.D682] -> 50 | G682: 2012 | I682: of:=YEAR(TODAY())-[.G682] -> 13 | L682: 2012 | M682: Amar chitr katha Prakashan | N682: Creating India foundation
A683: 5671 | B683: Amar chitra katha | C683: Pictorial story of children | D683: 1 | E683: 20 | F683: of:=[.E683]*[.D683] -> 20 | G683: 2012 | I683: of:=YEAR(TODAY())-[.G683] -> 13 | L683: 2012 | M683: Amar chitr katha Prakashan | N683: Creating India foundation
A684: 5672 | B684: Amar chitra katha | C684: Pictorial story of children | D684: 1 | E684: 20 | F684: of:=[.E684]*[.D684] -> 20 | G684: 2012 | I684: of:=YEAR(TODAY())-[.G684] -> 13 | L684: 2012 | M684: Amar chitr katha Prakashan | N684: Creating India foundation
A685: 5673 | B685: Amar chitra katha | C685: Pictorial story of children | D685: 1 | E685: 20 | F685: of:=[.E685]*[.D685] -> 20 | G685: 2012 | I685: of:=YEAR(TODAY())-[.G685] -> 13 | L685: 2012 | M685: Amar chitr katha Prakashan | N685: Creating India foundation
A686: 5674 | B686: Amar chitra katha | C686: Pictorial story of children | D686: 1 | E686: 20 | F686: of:=[.E686]*[.D686] -> 20 | G686: 2012 | I686: of:=YEAR(TODAY())-[.G686] -> 13 | L686: 2012 | M686: Amar chitr katha Prakashan | N686: Creating India foundation
A687: 5675 | B687: Amar chitra katha | C687: Pictorial story of children | D687: 1 | E687: 20 | F687: of:=[.E687]*[.D687] -> 20 | G687: 2012 | I687: of:=YEAR(TODAY())-[.G687] -> 13 | L687: 2012 | M687: Amar chitr katha Prakashan | N687: Creating India foundation
A688: 5676 | B688: Amar chitra katha | C688: Pictorial story of children | D688: 1 | E688: 20 | F688: of:=[.E688]*[.D688] -> 20 | G688: 2012 | I688: of:=YEAR(TODAY())-[.G688] -> 13 | L688: 2012 | M688: Amar chitr katha Prakashan | N688: Creating India foundation
A689: 5693 | B689: Amar chitra katha | C689: Viveka nand | D689: 1 | E689: 5 | F689: of:=[.E689]*[.D689] -> 5 | G689: 2012 | I689: of:=YEAR(TODAY())-[.G689] -> 13 | L689: 2012 | M689: Amar chitr katha Prakashan | N689: Creating India foundation
A690: 5695 | B690: Amar chitra katha | C690: Prophit Mohmad | D690: 1 | E690: 5 | F690: of:=[.E690]*[.D690] -> 5 | G690: 2012 | I690: of:=YEAR(TODAY())-[.G690] -> 13 | L690: 2012 | M690: Amar chitr katha Prakashan | N690: Creating India foundation
A691: 5696 | B691: Amar chitra katha | C691: Holy mother | D691: 1 | E691: 5 | F691: of:=[.E691]*[.D691] -> 5 | G691: 2012 | I691: of:=YEAR(TODAY())-[.G691] -> 13 | L691: 2012 | M691: Amar chitr katha Prakashan | N691: Creating India foundation
A692: 5697 | B692: Amar chitra katha | C692: Sh rama | D692: 1 | E692: 5 | F692: of:=[.E692]*[.D692] -> 5 | G692: 2012 | I692: of:=YEAR(TODAY())-[.G692] -> 13 | L692: 2012 | M692: Amar chitr katha Prakashan | N692: Creating India foundation
A693: 5698 | B693: Amar chitra katha | C693: Shri Ram Krishan | D693: 1 | E693: 5 | F693: of:=[.E693]*[.D693] -> 5 | G693: 2012 | I693: of:=YEAR(TODAY())-[.G693] -> 13 | L693: 2012 | M693: Amar chitr katha Prakashan | N693: Creating India foundation
A694: 5699 | B694: Amar chitra katha | C694: Guru nanak | D694: 1 | E694: 5 | F694: of:=[.E694]*[.D694] -> 5 | G694: 2012 | I694: of:=YEAR(TODAY())-[.G694] -> 13 | L694: 2012 | M694: Amar chitr katha Prakashan | N694: Creating India foundation
A695: 5700 | B695: Amar chitra katha | C695: Jathustra | D695: 1 | E695: 5 | F695: of:=[.E695]*[.D695] -> 5 | G695: 2012 | I695: of:=YEAR(TODAY())-[.G695] -> 13 | L695: 2012 | M695: Amar chitr katha Prakashan | N695: Creating India foundation
A696: 5701 | B696: Amar chitra katha | C696: Budda | D696: 1 | E696: 5 | F696: of:=[.E696]*[.D696] -> 5 | G696: 2012 | I696: of:=YEAR(TODAY())-[.G696] -> 13 | L696: 2012 | M696: Amar chitr katha Prakashan | N696: Creating India foundation
A697: 5716 | B697: Amar chitra katha | C697: Ganesha | D697: 1 | E697: 50 | F697: of:=[.E697]*[.D697] -> 50 | G697: 2012 | I697: of:=YEAR(TODAY())-[.G697] -> 13 | L697: 2012 | M697: Amar chitr katha Prakashan | N697: Creating India foundation
A698: 5717 | B698: Amar chitra katha | C698: Birbal | D698: 1 | E698: 50 | F698: of:=[.E698]*[.D698] -> 50 | G698: 2012 | I698: of:=YEAR(TODAY())-[.G698] -> 13 | L698: 2012 | M698: Amar chitr katha Prakashan | N698: Creating India foundation
A699: 5719 | B699: Amar chitra katha | C699: Krishna Rukmani | D699: 1 | E699: 50 | F699: of:=[.E699]*[.D699] -> 50 | G699: 2012 | I699: of:=YEAR(TODAY())-[.G699] -> 13 | L699: 2012 | M699: Amar chitr katha Prakashan | N699: Creating India foundation
A700: 5720 | B700: Amar chitra katha | C700: surya | D700: 1 | E700: 50 | F700: of:=[.E700]*[.D700] -> 50 | G700: 2012 | I700: of:=YEAR(TODAY())-[.G700] -> 13 | L700: 2012 | M700: Amar chitr katha Prakashan | N700: Creating India foundation
A701: 5721 | B701: Amar chitra katha | C701: shiva Jee | D701: 1 | E701: 50 | F701: of:=[.E701]*[.D701] -> 50 | G701: 2012 | I701: of:=YEAR(TODAY())-[.G701] -> 13 | L701: 2012 | M701: Amar chitr katha Prakashan | N701: Creating India foundation
A702: 5722 | B702: Amar chitra katha | C702: Magic chant | D702: 1 | E702: 50 | F702: of:=[.E702]*[.D702] -> 50 | G702: 2012 | I702: of:=YEAR(TODAY())-[.G702] -> 13 | L702: 2012 | M702: Amar chitr katha Prakashan | N702: Creating India foundation
A703: 5723 | B703: Amar chitra katha | C703: Jackle | D703: 1 | E703: 50 | F703: of:=[.E703]*[.D703] -> 50 | G703: 2012 | I703: of:=YEAR(TODAY())-[.G703] -> 13 | L703: 2012 | M703: Amar chitr katha Prakashan | N703: Creating India foundation
A704: 5725 | B704: Amar chitra katha | C704: bhagat singh | D704: 1 | E704: 50 | F704: of:=[.E704]*[.D704] -> 50 | G704: 2012 | I704: of:=YEAR(TODAY())-[.G704] -> 13 | L704: 2012 | M704: Amar chitr katha Prakashan | N704: Creating India foundation
A705: 5727 | B705: Amar chitra katha | C705: Vishvamitra | D705: 1 | E705: 50 | F705: of:=[.E705]*[.D705] -> 50 | G705: 2012 | I705: of:=YEAR(TODAY())-[.G705] -> 13 | L705: 2012 | M705: Amar chitr katha Prakashan | N705: Creating India foundation
A706: 5728 | B706: Amar chitra katha | C706: Viveka nand | D706: 1 | E706: 50 | F706: of:=[.E706]*[.D706] -> 50 | G706: 2012 | I706: of:=YEAR(TODAY())-[.G706] -> 13 | L706: 2012 | M706: Amar chitr katha Prakashan | N706: Creating India foundation
A707: 5729 | B707: Amar chitra katha | C707: Choose of friends | D707: 1 | E707: 50 | F707: of:=[.E707]*[.D707] -> 50 | G707: 2012 | I707: of:=YEAR(TODAY())-[.G707] -> 13 | L707: 2012 | M707: Amar chitr katha Prakashan | N707: Creating India foundation
A708: 5730 | B708: Amar chitra katha | C708: Tales of shiva | D708: 1 | E708: 50 | F708: of:=[.E708]*[.D708] -> 50 | G708: 2012 | I708: of:=YEAR(TODAY())-[.G708] -> 13 | L708: 2012 | M708: Amar chitr katha Prakashan | N708: Creating India foundation
A709: 5732 | B709: Amar chitra katha | C709: Ganga | D709: 1 | E709: 50 | F709: of:=[.E709]*[.D709] -> 50 | G709: 2012 | I709: of:=YEAR(TODAY())-[.G709] -> 13 | L709: 2012 | M709: Amar chitr katha Prakashan | N709: Creating India foundation
A710: 5733 | B710: Amar chitra katha | C710: Tales of Narad | D710: 1 | E710: 50 | F710: of:=[.E710]*[.D710] -> 50 | G710: 2012 | I710: of:=YEAR(TODAY())-[.G710] -> 13 | L710: 2012 | M710: Amar chitr katha Prakashan | N710: Creating India foundation
A711: 5735 | B711: Amar chitra katha | C711: Lok Manya Tilak | D711: 1 | E711: 50 | F711: of:=[.E711]*[.D711] -> 50 | G711: 2012 | I711: of:=YEAR(TODAY())-[.G711] -> 13 | L711: 2012 | M711: Amar chitr katha Prakashan | N711: Creating India foundation
A712: 5736 | B712: Amar chitra katha | C712: Dhruv and Ashthama | D712: 1 | E712: 50 | F712: of:=[.E712]*[.D712] -> 50 | G712: 2012 | I712: of:=YEAR(TODAY())-[.G712] -> 13 | L712: 2012 | M712: Amar chitr katha Prakashan | N712: Creating India foundation
A713: 5764 | B713: Swep modern | C713: Haste Haste jeena sikho | D713: 1 | E713: 60 | F713: of:=[.E713]*[.D713] -> 60 | G713: 2012 | I713: of:=YEAR(TODAY())-[.G713] -> 13 | L713: 2012 | M713: Manoj Publication | N713: Diamod Stationer JWP
A714: 5775 | B714: swet Modenr | C714: The PLANT KINDOM | D714: 1 | E714: 120 | F714: of:=[.E714]*[.D714] -> 120 | G714: 2012 | I714: of:=YEAR(TODAY())-[.G714] -> 13 | L714: 2012 | M714: Pustak mehal Delhi | N714: Diamod Stationer JWP
A715: 5783 | B715: Connon dile | C715: Mot ki saya | D715: 1 | E715: 60 | F715: of:=[.E715]*[.D715] -> 60 | G715: 2012 | I715: of:=YEAR(TODAY())-[.G715] -> 13 | L715: 2012 | M715: Hind Pocket books | N715: Diamod Stationer JWP
A716: 5826 | B716: A6 R5 | C716: The age of imperial unity | D716: 1 | F716: of:=[.E716]*[.D716] -> 0 | G716: 2012 | I716: of:=YEAR(TODAY())-[.G716] -> 13
A717: 5827 | C717: The age of imperial unity | D717: 1 | F717: of:=[.E717]*[.D717] -> 0 | G717: 2012 | I717: of:=YEAR(TODAY())-[.G717] -> 13
A718: 5910 | B718: chunni lal saluja | C718: Bachoo ko bigrne se kese roke | D718: 1 | E718: 96 | F718: of:=[.E718]*[.D718] -> 96 | G718: 2012 | I718: of:=YEAR(TODAY())-[.G718] -> 13 | L718: 2011 | M718: VS Publication | N718: Diamod Stationer JWP
A719: 5974 | B719: Shri Ram sharma | C719: Jeevan jeene ki kala | D719: 1 | E719: 36 | F719: of:=[.E719]*[.D719] -> 36 | G719: 2013 | I719: of:=YEAR(TODAY())-[.G719] -> 12 | L719: 2011 | M719: Jan jagran Mathura | N719: Shanti Kunj Haridwar
A720: 6100 | B720: Braham charya | C720: Gaytri thirth shanti kunj | D720: 1 | E720: 4 | F720: of:=[.E720]*[.D720] -> 4 | G720: 2013 | I720: of:=YEAR(TODAY())-[.G720] -> 12 | L720: 2011 | M720: Yug Nirman Mathura | N720: Shanti Kunj Haridwar
A721: 6101 | B721: Shri Ram sharma | C721: Nirog jeevan ka rajmarg | D721: 1 | E721: 9 | F721: of:=[.E721]*[.D721] -> 9 | G721: 2013 | I721: of:=YEAR(TODAY())-[.G721] -> 12 | L721: 2011 | M721: Yug Nirman Mathura | N721: Shanti Kunj Haridwar
A722: 6115 | B722: Shri Ram sharma | C722: Adhya shakti gyatri ki samarth vichar | D722: 1 | E722: 6 | F722: of:=[.E722]*[.D722] -> 6 | G722: 2013 | I722: of:=YEAR(TODAY())-[.G722] -> 12 | L722: 2011 | M722: Shanti kunj Haridwar | N722: Shanti Kunj Haridwar
A723: 6119 | B723: Shri Ram sharma | C723: Veer shivajee | D723: 1 | E723: 6 | F723: of:=[.E723]*[.D723] -> 6 | G723: 2013 | I723: of:=YEAR(TODAY())-[.G723] -> 12 | L723: 2011 | M723: Shanti kunj Haridwar | N723: Shanti Kunj Haridwar
A724: 6120 | B724: Shri Ram sharma | C724: Lok manay tilak | D724: 1 | E724: 6 | F724: of:=[.E724]*[.D724] -> 6 | G724: 2013 | I724: of:=YEAR(TODAY())-[.G724] -> 12 | L724: 2011 | M724: Shanti kunj Haridwar | N724: Shanti Kunj Haridwar
A725: 6121 | B725: Shri Ram sharma | C725: Yog chiktsa | D725: 1 | E725: 12 | F725: of:=[.E725]*[.D725] -> 12 | G725: 2013 | I725: of:=YEAR(TODAY())-[.G725] -> 12 | L725: 2011 | M725: Shanti kunj Haridwar | N725: Shanti Kunj Haridwar
A726: 6123 | B726: Shri Ram sharma | C726: Masala vatika se garelu upchar | D726: 1 | E726: 6 | F726: of:=[.E726]*[.D726] -> 6 | G726: 2013 | I726: of:=YEAR(TODAY())-[.G726] -> 12 | L726: 2011 | M726: Shanti kunj Haridwar | N726: Shanti Kunj Haridwar
A727: 6124 | B727: Shri Ram sharma | C727: Tulsi ke chamtkari gun | D727: 1 | E727: 6 | F727: of:=[.E727]*[.D727] -> 6 | G727: 2013 | I727: of:=YEAR(TODAY())-[.G727] -> 12 | L727: 2011 | M727: Shanti kunj Haridwar | N727: Shanti Kunj Haridwar
A728: 6126 | B728: Shri Ram sharma | C728: Param prasad pragya | D728: 1 | E728: 9 | F728: of:=[.E728]*[.D728] -> 9 | G728: 2013 | I728: of:=YEAR(TODAY())-[.G728] -> 12 | L728: 2011 | M728: Shanti kunj Haridwar | N728: Shanti Kunj Haridwar
A729: 6128 | B729: Shri Ram sharma | C729: 21 sadi ko ujwal baneye | D729: 1 | E729: 10 | F729: of:=[.E729]*[.D729] -> 10 | G729: 2013 | I729: of:=YEAR(TODAY())-[.G729] -> 12 | L729: 2011 | M729: Shanti kunj Haridwar | N729: Shanti Kunj Haridwar
A730: 6130 | B730: Shri Ram sharma | C730: jeewan devta ki saadhna | D730: 1 | E730: 9 | F730: of:=[.E730]*[.D730] -> 9 | G730: 2013 | I730: of:=YEAR(TODAY())-[.G730] -> 12 | L730: 2011 | M730: Shanti kunj Haridwar
A731: 6132 | B731: Shri Ram sharma | C731: Bhav samvedno ki gangotri | D731: 1 | E731: 6 | F731: of:=[.E731]*[.D731] -> 6 | G731: 2013 | I731: of:=YEAR(TODAY())-[.G731] -> 12 | L731: 2011 | M731: Shanti kunj Haridwar | N731: Shanti Kunj Haridwar
A732: 6133 | B732: Shri Ram sharma | C732: Sanjeevani vidya ka vistar | D732: 1 | E732: 6 | F732: of:=[.E732]*[.D732] -> 6 | G732: 2013 | I732: of:=YEAR(TODAY())-[.G732] -> 12 | L732: 2011 | M732: Shanti kunj Haridwar | N732: Shanti Kunj Haridwar
A733: 6135 | B733: Shri Ram sharma | C733: Badharkal ki pretibhagi | D733: 1 | E733: 6 | F733: of:=[.E733]*[.D733] -> 6 | G733: 2013 | I733: of:=YEAR(TODAY())-[.G733] -> 12 | L733: 2011 | M733: Shanti kunj Haridwar | N733: Shanti Kunj Haridwar
A734: 6137 | B734: Shri Ram sharma | C734: Parivartan ke mahan sant | D734: 1 | E734: 6 | F734: of:=[.E734]*[.D734] -> 6 | G734: 2013 | I734: of:=YEAR(TODAY())-[.G734] -> 12 | L734: 2011 | M734: Shanti kunj Haridwar | N734: Shanti Kunj Haridwar
A735: 6138 | B735: Shri Ram sharma | C735: Man sithi badle to parisithi badle | D735: 1 | E735: 6 | F735: of:=[.E735]*[.D735] -> 6 | G735: 2013 | I735: of:=YEAR(TODAY())-[.G735] -> 12 | L735: 2011 | M735: Shanti kunj Haridwar | N735: Shanti Kunj Haridwar
A736: 6139 | B736: Shri Ram sharma | C736: Nishtya faldhai jeevan sadye | D736: 1 | E736: 30 | F736: of:=[.E736]*[.D736] -> 30 | G736: 2013 | I736: of:=YEAR(TODAY())-[.G736] -> 12 | L736: 2011 | M736: Shanti kunj Haridwar | N736: Shanti Kunj Haridwar
A737: 6140 | B737: Shri Ram sharma | C737: Pratibha samvardhan | D737: 1 | E737: 31 | F737: of:=[.E737]*[.D737] -> 31 | G737: 2013 | I737: of:=YEAR(TODAY())-[.G737] -> 12 | L737: 2011 | M737: Shanti kunj Haridwar | N737: Shanti Kunj Haridwar
A738: 6141 | B738: Shri Ram sharma | C738: apni kamjoriyon se lade | D738: 1 | E738: 3 | F738: of:=[.E738]*[.D738] -> 3 | G738: 2013 | I738: of:=YEAR(TODAY())-[.G738] -> 12 | L738: 2011 | M738: Shanti kunj Haridwar | N738: Shanti Kunj Haridwar
A739: 6142 | B739: Shri Ram sharma | C739: Vipatti se dare nahi joojhe | D739: 1 | E739: 3 | F739: of:=[.E739]*[.D739] -> 3 | G739: 2013 | I739: of:=YEAR(TODAY())-[.G739] -> 12 | L739: 2011 | M739: Shanti kunj Haridwar | N739: Shanti Kunj Haridwar
A740: 6143 | B740: Shri Ram sharma | C740: Sadgun vadeye sishtachar apnaye | D740: 1 | E740: 3 | F740: of:=[.E740]*[.D740] -> 3 | G740: 2013 | I740: of:=YEAR(TODAY())-[.G740] -> 12 | L740: 2011 | M740: Shanti kunj Haridwar | N740: Shanti Kunj Haridwar
A741: 6144 | B741: Shri Ram sharma | C741: Unati ke char gun char charan | D741: 1 | E741: 3 | F741: of:=[.E741]*[.D741] -> 3 | G741: 2013 | I741: of:=YEAR(TODAY())-[.G741] -> 12 | L741: 2011 | M741: Shanti kunj Haridwar | N741: Shanti Kunj Haridwar
A742: 6145 | B742: Shri Ram sharma | C742: Pade or use jeevan me utare | D742: 1 | E742: 3 | F742: of:=[.E742]*[.D742] -> 3 | G742: 2013 | I742: of:=YEAR(TODAY())-[.G742] -> 12 | L742: 2011 | M742: Shanti kunj Haridwar | N742: Shanti Kunj Haridwar
A743: 6146 | B743: Shri Ram sharma | C743: saflata ki janani Sankalp shakti | D743: 1 | E743: 3 | F743: of:=[.E743]*[.D743] -> 3 | G743: 2013 | I743: of:=YEAR(TODAY())-[.G743] -> 12 | L743: 2011 | M743: Shanti kunj Haridwar | N743: Shanti Kunj Haridwar
A744: 6147 | B744: Shri Ram sharma | C744: Vidhathi jeevan me saflta ki | D744: 1 | E744: 3 | F744: of:=[.E744]*[.D744] -> 3 | G744: 2013 | I744: of:=YEAR(TODAY())-[.G744] -> 12 | L744: 2011 | M744: Shanti kunj Haridwar | N744: Shanti Kunj Haridwar
A745: 6148 | B745: Shri Ram sharma | C745: Vyasno se bache | D745: 1 | E745: 3 | F745: of:=[.E745]*[.D745] -> 3 | G745: 2013 | I745: of:=YEAR(TODAY())-[.G745] -> 12 | L745: 2011 | M745: Shanti kunj Haridwar | N745: Shanti Kunj Haridwar
A746: 6149 | B746: Shri Ram sharma | C746: Yug nirman sanskaran | D746: 1 | E746: 3 | F746: of:=[.E746]*[.D746] -> 3 | G746: 2013 | I746: of:=YEAR(TODAY())-[.G746] -> 12 | M746: Shanti kunj Haridwar
A747: 6150 | B747: Shri Ram sharma | C747: Aahar chiktsa | D747: 1 | E747: 3 | F747: of:=[.E747]*[.D747] -> 3 | G747: 2013 | I747: of:=YEAR(TODAY())-[.G747] -> 12 | L747: 2011 | M747: Shanti kunj Haridwar | N747: Shanti Kunj Haridwar
A748: 6151 | B748: Shri Ram sharma | C748: Durvyasan | D748: 1 | E748: 3 | F748: of:=[.E748]*[.D748] -> 3 | G748: 2013 | I748: of:=YEAR(TODAY())-[.G748] -> 12 | L748: 2011 | M748: Shanti kunj Haridwar | N748: Shanti Kunj Haridwar
A749: 6152 | B749: Shri Ram sharma | C749: Harye na himat | D749: 1 | E749: 3 | F749: of:=[.E749]*[.D749] -> 3 | G749: 2013 | I749: of:=YEAR(TODAY())-[.G749] -> 12 | L749: 2011 | M749: Shanti kunj Haridwar | N749: Shanti Kunj Haridwar
A750: 6153 | B750: Shri Ram sharma | C750: Patience and think | D750: 1 | E750: 3 | F750: of:=[.E750]*[.D750] -> 3 | G750: 2013 | I750: of:=YEAR(TODAY())-[.G750] -> 12 | L750: 2011 | M750: Shanti kunj Haridwar | N750: Shanti Kunj Haridwar
A751: 6154 | B751: Shri Ram sharma | C751: self development | D751: 1 | E751: 3 | F751: of:=[.E751]*[.D751] -> 3 | G751: 2013 | I751: of:=YEAR(TODAY())-[.G751] -> 12 | L751: 2011 | M751: Shanti kunj Haridwar | N751: Shanti Kunj Haridwar
A752: 6155 | B752: Shri Ram sharma | C752: mental balance | D752: 1 | E752: 3 | F752: of:=[.E752]*[.D752] -> 3 | G752: 2013 | I752: of:=YEAR(TODAY())-[.G752] -> 12 | L752: 2011 | M752: Shanti kunj Haridwar | N752: Shanti Kunj Haridwar
A753: 6156 | B753: Shri Ram sharma | C753: loose not your heart | D753: 1 | E753: 3 | F753: of:=[.E753]*[.D753] -> 3 | G753: 2013 | I753: of:=YEAR(TODAY())-[.G753] -> 12 | L753: 2011 | M753: Shanti kunj Haridwar | N753: Shanti Kunj Haridwar
A754: 6157 | B754: Shri Ram sharma | C754: loose not your heart | D754: 1 | E754: 3 | F754: of:=[.E754]*[.D754] -> 3 | G754: 2013 | I754: of:=YEAR(TODAY())-[.G754] -> 12 | L754: 2011 | M754: Shanti kunj Haridwar | N754: Shanti Kunj Haridwar
A755: 6158 | B755: Shri Ram sharma | C755: vyasno se haniya | D755: 1 | E755: 7 | F755: of:=[.E755]*[.D755] -> 7 | G755: 2013 | I755: of:=YEAR(TODAY())-[.G755] -> 12 | L755: 2011 | M755: Shanti kunj Haridwar | N755: Shanti Kunj Haridwar
A756: 6159 | B756: Shri Ram sharma | C756: Madhya pan | D756: 1 | E756: 7 | F756: of:=[.E756]*[.D756] -> 7 | G756: 2013 | I756: of:=YEAR(TODAY())-[.G756] -> 12 | L756: 2011 | M756: Shanti kunj Haridwar | N756: Shanti Kunj Haridwar
A757: 6160 | B757: Shri Ram sharma | C757: Shaka aahar ankurit aahar | D757: 1 | E757: 3 | F757: of:=[.E757]*[.D757] -> 3 | G757: 2013 | I757: of:=YEAR(TODAY())-[.G757] -> 12 | L757: 2011 | M757: Shanti kunj Haridwar | N757: Shanti Kunj Haridwar
A758: 6161 | B758: Shri Ram sharma | C758: Nashebaji se hani | D758: 1 | E758: 3 | F758: of:=[.E758]*[.D758] -> 3 | G758: 2013 | I758: of:=YEAR(TODAY())-[.G758] -> 12 | L758: 2011 | M758: Shanti kunj Haridwar | N758: Shanti Kunj Haridwar
A759: 6162 | B759: Shri Ram sharma | C759: Yug nirman satyakarma | D759: 1 | E759: 3 | F759: of:=[.E759]*[.D759] -> 3 | G759: 2013 | I759: of:=YEAR(TODAY())-[.G759] -> 12 | L759: 2011 | M759: Shanti kunj Haridwar | N759: Shanti Kunj Haridwar
A760: 6163 | B760: Shri Ram sharma | C760: Bolti divare | D760: 1 | E760: 4 | F760: of:=[.E760]*[.D760] -> 4 | G760: 2013 | I760: of:=YEAR(TODAY())-[.G760] -> 12 | L760: 2011 | M760: Shanti kunj Haridwar | N760: Shanti Kunj Haridwar
A761: 6164 | B761: Shri Ram sharma | C761: sakahar ankurit aahar | D761: 1 | E761: 3 | F761: of:=[.E761]*[.D761] -> 3 | G761: 2013 | I761: of:=YEAR(TODAY())-[.G761] -> 12 | L761: 2011 | M761: Shanti kunj Haridwar | N761: Shanti Kunj Haridwar
A762: 6165 | B762: Shri Ram sharma | C762: Safal jeevan ki diaha me vidya vidhyan | D762: 1 | E762: 3 | F762: of:=[.E762]*[.D762] -> 3 | G762: 2013 | I762: of:=YEAR(TODAY())-[.G762] -> 12 | L762: 2011 | M762: Shanti kunj Haridwar | N762: Shanti Kunj Haridwar
A763: 6166 | B763: Shri Ram sharma | C763: Aahar chiktsa | D763: 1 | E763: 3 | F763: of:=[.E763]*[.D763] -> 3 | G763: 2013 | I763: of:=YEAR(TODAY())-[.G763] -> 12 | L763: 2011 | M763: Shanti kunj Haridwar | N763: Shanti Kunj Haridwar
A764: 6167 | B764: Shri Ram sharma | C764: Vidyathri jeevan me apna lakshya | D764: 1 | E764: 3 | F764: of:=[.E764]*[.D764] -> 3 | G764: 2013 | I764: of:=YEAR(TODAY())-[.G764] -> 12 | L764: 2011 | M764: Shanti kunj Haridwar | N764: Shanti Kunj Haridwar
A765: 6168 | B765: Shri Ram sharma | C765: Vivshno ke pishach se kese bache | D765: 1 | E765: 3 | F765: of:=[.E765]*[.D765] -> 3 | G765: 2013 | I765: of:=YEAR(TODAY())-[.G765] -> 12 | L765: 2011 | M765: Shanti kunj Haridwar | N765: Shanti Kunj Haridwar
A766: 6169 | B766: Shri Ram sharma | C766: Pratibha samvardhan | D766: 1 | E766: 3 | F766: of:=[.E766]*[.D766] -> 3 | G766: 2013 | I766: of:=YEAR(TODAY())-[.G766] -> 12 | L766: 2011 | M766: Shanti kunj Haridwar | N766: Shanti Kunj Haridwar
A767: 6170 | B767: Shri Ram sharma | C767: Nishtya faldhai jeevan sadna | D767: 1 | E767: 3 | F767: of:=[.E767]*[.D767] -> 3 | G767: 2013 | I767: of:=YEAR(TODAY())-[.G767] -> 12 | L767: 2011 | M767: Shanti kunj Haridwar | N767: Shanti Kunj Haridwar
A768: 6171 | B768: Shri Ram sharma | C768: Biptyo se darye nahi jujhiye | D768: 1 | E768: 3 | F768: of:=[.E768]*[.D768] -> 3 | G768: 2013 | I768: of:=YEAR(TODAY())-[.G768] -> 12 | L768: 2011 | M768: Shanti kunj Haridwar | N768: Shanti Kunj Haridwar
A769: 6172 | B769: Shri Ram sharma | C769: apni kamjoriyon se lade | D769: 1 | E769: 3 | F769: of:=[.E769]*[.D769] -> 3 | G769: 2013 | I769: of:=YEAR(TODAY())-[.G769] -> 12 | L769: 2011 | M769: Shanti kunj Haridwar | N769: Shanti Kunj Haridwar
A770: 6173 | B770: Shri Ram sharma | C770: Sadgun badhaye sishtachar vadye | D770: 1 | E770: 3 | F770: of:=[.E770]*[.D770] -> 3 | G770: 2013 | I770: of:=YEAR(TODAY())-[.G770] -> 12 | L770: 2011 | M770: Shanti kunj Haridwar | N770: Shanti Kunj Haridwar
A771: 6174 | B771: Shri Ram sharma | C771: Pade or use jeevan me utare | D771: 1 | E771: 3 | F771: of:=[.E771]*[.D771] -> 3 | G771: 2013 | I771: of:=YEAR(TODAY())-[.G771] -> 12 | L771: 2011 | M771: Shanti kunj Haridwar | N771: Shanti Kunj Haridwar
A772: 6175 | B772: Shri Ram sharma | C772: Unmado ke teen gun char chalan | D772: 1 | E772: 3 | F772: of:=[.E772]*[.D772] -> 3 | G772: 2013 | I772: of:=YEAR(TODAY())-[.G772] -> 12 | L772: 2011 | M772: Shanti kunj Haridwar | N772: Shanti Kunj Haridwar
A773: 6176 | B773: Shri Ram sharma | C773: sadgun apneye | D773: 1 | E773: 3 | F773: of:=[.E773]*[.D773] -> 3 | G773: 2013 | I773: of:=YEAR(TODAY())-[.G773] -> 12 | L773: 2011 | M773: Shanti kunj Haridwar | N773: Shanti Kunj Haridwar
A774: 6177 | B774: Shri Ram sharma | C774: apni kamjoriyon se lade | D774: 1 | E774: 3 | F774: of:=[.E774]*[.D774] -> 3 | G774: 2013 | I774: of:=YEAR(TODAY())-[.G774] -> 12 | L774: 2011 | M774: Shanti kunj Haridwar | N774: Shanti Kunj Haridwar
A775: 6178 | B775: Shri Ram sharma | C775: nishit faldai jeevan | D775: 1 | E775: 3 | F775: of:=[.E775]*[.D775] -> 3 | G775: 2013 | I775: of:=YEAR(TODAY())-[.G775] -> 12 | L775: 2011 | M775: Shanti kunj Haridwar | N775: Shanti Kunj Haridwar
A776: 6179 | B776: Shri Ram sharma | C776: Vipti se dare nahi jujhe | D776: 1 | E776: 3 | F776: of:=[.E776]*[.D776] -> 3 | G776: 2013 | I776: of:=YEAR(TODAY())-[.G776] -> 12 | L776: 2011 | M776: Shanti kunj Haridwar | N776: Shanti Kunj Haridwar
A777: 6180 | B777: Shri Ram sharma | C777: Vigyan sambardan ke upaye | D777: 1 | E777: 3 | F777: of:=[.E777]*[.D777] -> 3 | G777: 2013 | I777: of:=YEAR(TODAY())-[.G777] -> 12 | L777: 2011 | M777: Shanti kunj Haridwar | N777: Shanti Kunj Haridwar
A778: 6181 | B778: Shri Ram sharma | C778: uniti ke chal chalan | D778: 1 | E778: 3 | F778: of:=[.E778]*[.D778] -> 3 | G778: 2013 | I778: of:=YEAR(TODAY())-[.G778] -> 12 | L778: 2011 | M778: Shanti kunj Haridwar | N778: Shanti Kunj Haridwar
A779: 6182 | B779: Shri Ram sharma | C779: Padhe or use jeevan me utare | D779: 1 | E779: 3 | F779: of:=[.E779]*[.D779] -> 3 | G779: 2013 | I779: of:=YEAR(TODAY())-[.G779] -> 12 | L779: 2011 | M779: Shanti kunj Haridwar | N779: Shanti Kunj Haridwar
A780: 6183 | B780: Shri Ram sharma | C780: saflta se sakast shakti | D780: 1 | E780: 3 | F780: of:=[.E780]*[.D780] -> 3 | G780: 2013 | I780: of:=YEAR(TODAY())-[.G780] -> 12 | L780: 2011 | M780: Shanti kunj Haridwar | N780: Shanti Kunj Haridwar
A781: 6184 | B781: Shri Ram sharma | C781: vidhyarthi jeevan me apna lakshy kaise saadhe | D781: 1 | E781: 3 | F781: of:=[.E781]*[.D781] -> 3 | G781: 2013 | I781: of:=YEAR(TODAY())-[.G781] -> 12 | L781: 2011 | M781: Shanti kunj Haridwar | N781: Shanti Kunj Haridwar
A782: 6185 | B782: Shri Ram sharma | C782: Viysano ke pishash se bache | D782: 1 | E782: 3 | F782: of:=[.E782]*[.D782] -> 3 | G782: 2013 | I782: of:=YEAR(TODAY())-[.G782] -> 12 | L782: 2011 | M782: Shanti kunj Haridwar | N782: Shanti Kunj Haridwar
A783: 6186 | B783: Shri Ram sharma | C783: be strrong | D783: 1 | E783: 3 | F783: of:=[.E783]*[.D783] -> 3 | G783: 2013 | I783: of:=YEAR(TODAY())-[.G783] -> 12
A784: 6187 | B784: Shri Ram sharma | C784: Increase your memory | D784: 1 | E784: 3 | F784: of:=[.E784]*[.D784] -> 3 | G784: 2013 | I784: of:=YEAR(TODAY())-[.G784] -> 12 | L784: 2011 | M784: Shanti kunj Haridwar | N784: Shanti Kunj Haridwar
A785: 6188 | B785: Shri Ram sharma | C785: Steer the life | D785: 1 | E785: 3 | F785: of:=[.E785]*[.D785] -> 3 | G785: 2013 | I785: of:=YEAR(TODAY())-[.G785] -> 12 | L785: 2011 | M785: Shanti kunj Haridwar | N785: Shanti Kunj Haridwar
A786: 6190 | B786: Shri Ram sharma | C786: Scientific approach | D786: 1 | E786: 3 | F786: of:=[.E786]*[.D786] -> 3 | G786: 2013 | I786: of:=YEAR(TODAY())-[.G786] -> 12 | L786: 2011 | M786: Shanti kunj Haridwar | N786: Shanti Kunj Haridwar
A787: 6191 | B787: Shri Ram sharma | C787: Donmic and adventures | D787: 1 | E787: 3 | F787: of:=[.E787]*[.D787] -> 3 | G787: 2013 | I787: of:=YEAR(TODAY())-[.G787] -> 12 | L787: 2011 | M787: Shanti kunj Haridwar | N787: Shanti Kunj Haridwar
A788: 6192 | B788: Shri Ram sharma | C788: Processing goods in students life | D788: 1 | E788: 3 | F788: of:=[.E788]*[.D788] -> 3 | G788: 2013 | I788: of:=YEAR(TODAY())-[.G788] -> 12 | L788: 2011 | M788: Shanti kunj Haridwar | N788: Shanti Kunj Haridwar
A789: 6193 | B789: Shri Ram sharma | C789: Dominate way of success | D789: 1 | E789: 3 | F789: of:=[.E789]*[.D789] -> 3 | G789: 2013 | I789: of:=YEAR(TODAY())-[.G789] -> 12 | L789: 2011 | M789: Shanti kunj Haridwar | N789: Shanti Kunj Haridwar
A790: 6194 | B790: Shri Ram sharma | C790: Observe academic in life | D790: 1 | E790: 3 | F790: of:=[.E790]*[.D790] -> 3 | G790: 2013 | I790: of:=YEAR(TODAY())-[.G790] -> 12 | L790: 2011 | M790: Shanti kunj Haridwar | N790: Shanti Kunj Haridwar
A791: 6195 | B791: Shri Ram sharma | C791: three fairs & part selected pairs | D791: 1 | E791: 3 | F791: of:=[.E791]*[.D791] -> 3 | G791: 2013 | I791: of:=YEAR(TODAY())-[.G791] -> 12 | L791: 2011 | M791: Shanti kunj Haridwar | N791: Shanti Kunj Haridwar
A792: 6213 | B792: Robin sharma | C792: Great People of India | D792: 1 | E792: 0 | F792: of:=[.E792]*[.D792] -> 0 | G792: 2013 | I792: of:=YEAR(TODAY())-[.G792] -> 12 | L792: 2011 | M792: India Now foundation | N792: India Now foundation
A793: 6218 | B793: SS beri | C793: mathematics | D793: 1 | E793: 1999 | F793: of:=[.E793]*[.D793] -> 1999 | G793: 2013 | I793: of:=YEAR(TODAY())-[.G793] -> 12 | L793: 2011 | M793: Adorling Kindersley | N793: Pulse International Dehradun
A794: 6219 | B794: RD sharma | C794: Mathematics class IX | D794: 1 | E794: 295 | F794: of:=[.E794]*[.D794] -> 295 | G794: 2013 | I794: of:=YEAR(TODAY())-[.G794] -> 12 | L794: 2011 | M794: Dhanpat Rai Delhi | N794: Subash Book depot
A795: 6221 | B795: RD sharma | C795: Mathematics class XI | D795: 1 | E795: 345 | F795: of:=[.E795]*[.D795] -> 345 | G795: 2013 | I795: of:=YEAR(TODAY())-[.G795] -> 12 | L795: 2011 | M795: Dhanpat Rai Delhi | N795: Subash Book depot
A796: 6222 | B796: RD sharma | C796: Mathematics class XII part 1 | D796: 1 | E796: 345 | F796: of:=[.E796]*[.D796] -> 345 | G796: 2013 | I796: of:=YEAR(TODAY())-[.G796] -> 12 | L796: 2011 | M796: Dhanpat Rai Delhi | N796: Subash Book depot
A797: 6223 | B797: RD sharma | C797: Mathematics class XII part 2 | D797: 1 | E797: 590 | F797: of:=[.E797]*[.D797] -> 590 | G797: 2013 | I797: of:=YEAR(TODAY())-[.G797] -> 12 | L797: 2011 | M797: Dhanpat Rai Delhi | N797: Subash Book depot
A798: 6227 | B798: R Carbi | C798: The 7 habits of highly effective people | D798: 1 | E798: 499 | F798: of:=[.E798]*[.D798] -> 499 | G798: 2013 | I798: of:=YEAR(TODAY())-[.G798] -> 12 | L798: 2013 | M798: Manoj Publication | N798: AH Wheeler Prayagraj
A799: 6230 | B799: RD sharma | C799: Mathematics vol 2 RD Sharma | D799: 1 | E799: 225 | F799: of:=[.E799]*[.D799] -> 225 | G799: 2013 | I799: of:=YEAR(TODAY())-[.G799] -> 12 | L799: 2014 | M799: Dhanpat Rai Delhi | N799: Evergreen publishers
A800: 6231 | B800: RD sharma | C800: Mathematics class XI | D800: 1 | E800: 300 | F800: of:=[.E800]*[.D800] -> 300 | G800: 2013 | I800: of:=YEAR(TODAY())-[.G800] -> 12 | L800: 2014 | M800: Dhanpat Rai Delhi | N800: Evergreen publishers
A801: 6232 | B801: RD sharma | C801: Mathematics class XI | D801: 1 | E801: 300 | F801: of:=[.E801]*[.D801] -> 300 | G801: 2014 | I801: of:=YEAR(TODAY())-[.G801] -> 11 | L801: 2014 | M801: Dhanpat Rai Delhi | N801: Evergreen publishers
A802: 6236 | B802: Lakhvir singh | C802: Objective General Science | D802: 1 | E802: 150 | F802: of:=[.E802]*[.D802] -> 150 | G802: 2014 | I802: of:=YEAR(TODAY())-[.G802] -> 11 | L802: 2013 | M802: Arihant Publications | N802: Evergreen publishers
A803: 6239 | B803: KC Agarwal | C803: Vidhyarthi vikas va career chunaav | D803: 1 | E803: 120 | F803: of:=[.E803]*[.D803] -> 120 | G803: 2014 | I803: of:=YEAR(TODAY())-[.G803] -> 11 | L803: 2013 | M803: Arihant Publications | N803: Evergreen publishers
A804: 6244 | B804: Astha | C804: Akbar birbal | D804: 1 | E804: 15 | F804: of:=[.E804]*[.D804] -> 15 | G804: 2014 | I804: of:=YEAR(TODAY())-[.G804] -> 11 | L804: 2013 | M804: Lakshmi Publications | N804: Evergreen publishers
A805: 6248 | B805: Astha | C805: Tenali Rama | D805: 1 | E805: 20 | F805: of:=[.E805]*[.D805] -> 20 | G805: 2014 | I805: of:=YEAR(TODAY())-[.G805] -> 11 | L805: 2013 | M805: Lakshmi Publications | N805: Evergreen publishers
A806: 6249 | B806: Astha | C806: Ek aisi bidai | D806: 1 | E806: 15 | F806: of:=[.E806]*[.D806] -> 15 | G806: 2014 | I806: of:=YEAR(TODAY())-[.G806] -> 11 | L806: 2013 | M806: Dhanpat Rai Delhi | N806: Evergreen publishers
A807: 6251 | B807: RD sharma | C807: Mathematics clas VII | D807: 1 | E807: 75 | F807: of:=[.E807]*[.D807] -> 75 | G807: 2014 | I807: of:=YEAR(TODAY())-[.G807] -> 11 | L807: 2013 | M807: Dhanpat Rai Delhi | N807: Evergreen publishers
A808: 6259 | B808: RL Stefen | C808: Treasury Island | D808: 1 | E808: 100 | F808: of:=[.E808]*[.D808] -> 100 | G808: 2014 | I808: of:=YEAR(TODAY())-[.G808] -> 11 | L808: 2013 | M808: S.Chand and Company | N808: Evergreen publishers
A809: 6261 | B809: Denial duffi | C809: Robin Crusoe | D809: 1 | E809: 70 | F809: of:=[.E809]*[.D809] -> 70 | G809: 2014 | I809: of:=YEAR(TODAY())-[.G809] -> 11 | L809: 2013 | M809: S.Chand and Company | N809: Evergreen publishers
A810: 6274 | B810: A Hope | C810: The princess of Zenda | D810: 1 | E810: 90 | F810: of:=[.E810]*[.D810] -> 90 | G810: 2014 | I810: of:=YEAR(TODAY())-[.G810] -> 11 | L810: 2013 | M810: S.Chand and Company | N810: S.Chand and Company
A811: 6278 | B811: RM Modline | C811: The coral Island | D811: 1 | E811: 90 | F811: of:=[.E811]*[.D811] -> 90 | G811: 2014 | I811: of:=YEAR(TODAY())-[.G811] -> 11 | L811: 2013 | M811: S.Chand and Company | N811: S.Chand and Company
A812: 6284 | B812: Rm Omakar | C812: Personality development and career management | D812: 1 | E812: 340 | F812: of:=[.E812]*[.D812] -> 340 | G812: 2014 | I812: of:=YEAR(TODAY())-[.G812] -> 11 | L812: 2011 | M812: S.Chand and Company | N812: S.Chand and Company
A813: 6291 | B813: Alex | C813: Soft skills | D813: 1 | E813: 425 | F813: of:=[.E813]*[.D813] -> 425 | G813: 2014 | I813: of:=YEAR(TODAY())-[.G813] -> 11 | L813: 2013 | M813: S.Chand and Company | N813: S.Chand and Company
A814: 6305 | B814: Lakhvir singh | C814: Awareness of science class VIII | D814: 1 | E814: 280 | F814: of:=[.E814]*[.D814] -> 280 | G814: 2014 | I814: of:=YEAR(TODAY())-[.G814] -> 11 | L814: 2014 | M814: S.Chand and Company | N814: S.Chand and Company
A815: 6327 | B815: RS Agarwal | C815: A modern approach to verbal and non-verbal | D815: 1 | E815: 800 | F815: of:=[.E815]*[.D815] -> 800 | G815: 2014 | I815: of:=YEAR(TODAY())-[.G815] -> 11 | L815: 2014 | M815: S.Chand and Company | N815: S.Chand and Company
A816: 6349 | B816: BS sharma | C816: Mission NTSE class X | D816: 1 | E816: 75 | F816: of:=[.E816]*[.D816] -> 75 | G816: 2014 | I816: of:=YEAR(TODAY())-[.G816] -> 11 | L816: 2013 | M816: S.Chand and Company | N816: S.Chand and Company
A817: 6350 | B817: BS sharma | C817: Mission NTSE class X | D817: 1 | E817: 525 | F817: of:=[.E817]*[.D817] -> 525 | G817: 2014 | I817: of:=YEAR(TODAY())-[.G817] -> 11 | L817: 2013 | M817: S.Chand and Company | N817: S.Chand and Company
A818: 6354 | B818: EL James | C818: Fifty shades of grey | D818: 1 | E818: 450 | F818: of:=[.E818]*[.D818] -> 450 | G818: 2014 | I818: of:=YEAR(TODAY())-[.G818] -> 11 | L818: 2012 | M818: Nataraj Publishers dehradun | N818: Nataraj Publishers dehradun
A819: 6400 | B819: RK education add | C819: GRANDMA MORAL STORIES | D819: 1 | E819: 50 | F819: of:=[.E819]*[.D819] -> 50 | G819: 2014 | I819: of:=YEAR(TODAY())-[.G819] -> 11 | L819: 2008 | M819: KK Education aid | N819: Bookworld Dehradun
A820: 6434 | B820: Cambrize | C820: Robot and Robotic | D820: 1 | E820: 24 | F820: of:=[.E820]*[.D820] -> 24 | G820: 2014 | I820: of:=YEAR(TODAY())-[.G820] -> 11 | L820: 1994 | M820: NBT Publication | N820: NVS Lucknow
A821: 6435 | B821: Cambrize | C821: Robot and Robotic | D821: 1 | E821: 24 | F821: of:=[.E821]*[.D821] -> 24 | G821: 2014 | I821: of:=YEAR(TODAY())-[.G821] -> 11 | L821: 1994 | M821: NBT Publication | N821: NVS Lucknow
A822: 6436 | B822: Cambrize | C822: Robot and Robotic | D822: 1 | E822: 24 | F822: of:=[.E822]*[.D822] -> 24 | G822: 2014 | I822: of:=YEAR(TODAY())-[.G822] -> 11 | L822: 1994 | M822: NBT Publication | N822: NVS Lucknow
A823: 6440 | B823: Cambrize | C823: Robot and Robotic | D823: 1 | E823: 24 | F823: of:=[.E823]*[.D823] -> 24 | G823: 2014 | I823: of:=YEAR(TODAY())-[.G823] -> 11 | L823: 1994 | M823: NBT Publication | N823: NVS Lucknow
A824: 6445 | B824: Subash brothers | C824: Africa and India | D824: 1 | E824: 43 | F824: of:=[.E824]*[.D824] -> 43 | G824: 2014 | I824: of:=YEAR(TODAY())-[.G824] -> 11 | L824: 1996 | M824: NBT Publication | N824: NVS Lucknow
A825: 6452 | B825: Varrier Eluein | C825: When the world was young | D825: 1 | E825: 30 | F825: of:=[.E825]*[.D825] -> 30 | G825: 2014 | I825: of:=YEAR(TODAY())-[.G825] -> 11 | L825: 1996 | M825: NBT Publication | N825: NVS Lucknow
A826: 6456 | B826: BC sharma | C826: Material Marvels | D826: 1 | E826: 40 | F826: of:=[.E826]*[.D826] -> 40 | G826: 2014 | I826: of:=YEAR(TODAY())-[.G826] -> 11 | L826: 1999 | M826: Amity Publisher | N826: NVS Lucknow
A827: 6461 | B827: BC sharma | C827: Material Marvels | D827: 1 | E827: 40 | F827: of:=[.E827]*[.D827] -> 40 | G827: 2014 | I827: of:=YEAR(TODAY())-[.G827] -> 11 | L827: 1999 | M827: Amity Publisher | N827: NVS Lucknow
A828: 6464 | B828: Jean | C828: Democracy | D828: 1 | E828: 50 | F828: of:=[.E828]*[.D828] -> 50 | G828: 2014 | I828: of:=YEAR(TODAY())-[.G828] -> 11 | L828: 1998 | M828: Amity Publisher | N828: RO Lucknow
A829: 6475 | B829: Renuka gupta | C829: Household pests and their management | D829: 1 | E829: 40 | F829: of:=[.E829]*[.D829] -> 40 | G829: 2014 | I829: of:=YEAR(TODAY())-[.G829] -> 11 | L829: 2002 | M829: Amity Publisher | N829: NVS Lucknow
A830: 6821 | B830: Mohni Rao | C830: Yug Yug ki kranti | D830: 1 | E830: 10 | F830: of:=[.E830]*[.D830] -> 10 | G830: 2014 | I830: of:=YEAR(TODAY())-[.G830] -> 11 | L830: 1972 | M830: NBT Publication | N830: RO Lucknow
A831: 6824 | B831: BF chipper | C831: Wonders of the deep sea | D831: 1 | E831: 35 | F831: of:=[.E831]*[.D831] -> 35 | G831: 2014 | I831: of:=YEAR(TODAY())-[.G831] -> 11 | L831: 2006 | M831: NBT Publication | N831: RO Lucknow
A832: 6840 | B832: Geeta Press gorakhpur | C832: Geeta Prabodhi | D832: 1 | E832: 45 | F832: of:=[.E832]*[.D832] -> 45 | G832: 2014 | I832: of:=YEAR(TODAY())-[.G832] -> 11 | L832: 2014 | M832: Geeta Press gorakhpur | N832: Geeta Press gorakhpur
A833: 6862 | B833: RW Agarwal | C833: English course with Activity VIII | D833: 1 | E833: 250 | F833: of:=[.E833]*[.D833] -> 250 | G833: 2014 | I833: of:=YEAR(TODAY())-[.G833] -> 11 | L833: 2014 | M833: S.Chand and Company Delhi | N833: S.Chand and Company Dehradun
A834: 6864 | B834: Kiran Ashok kumar | C834: Inclusive Science Class VII | D834: 1 | E834: 205 | F834: of:=[.E834]*[.D834] -> 205 | G834: 2014 | I834: of:=YEAR(TODAY())-[.G834] -> 11 | L834: 2014 | M834: S.Chand and Company Delhi | N834: S.Chand and Company Dehradun
A835: 6865 | B835: Kiran Ashok kumar | C835: Inclusive Science Class VIII | D835: 1 | E835: 215 | F835: of:=[.E835]*[.D835] -> 215 | G835: 2014 | I835: of:=YEAR(TODAY())-[.G835] -> 11 | L835: 2014 | M835: S.Chand and Company Delhi | N835: S.Chand and Company Dehradun
A836: 6875 | B836: Linda | C836: The atlas of people and place | D836: 1 | E836: 149 | F836: of:=[.E836]*[.D836] -> 149 | G836: 2014 | I836: of:=YEAR(TODAY())-[.G836] -> 11 | L836: 2010 | M836: S.Chand and Company Delhi | N836: S.Chand and Company Dehradun
A837: 6883 | B837: Iang | C837: Our World COAL | D837: 1 | E837: 99 | F837: of:=[.E837]*[.D837] -> 99 | G837: 2014 | I837: of:=YEAR(TODAY())-[.G837] -> 11 | L837: 2010 | M837: S.Chand and Company Delhi | N837: S.Chand and Company Dehradun
A838: 6889 | B838: Sara Lavit | C838: NUCLEAR POWER | D838: 1 | E838: 99 | F838: of:=[.E838]*[.D838] -> 99 | G838: 2014 | I838: of:=YEAR(TODAY())-[.G838] -> 11 | L838: 2010 | M838: S.Chand and Company Delhi | N838: S.Chand and Company Dehradun
A839: 6915 | B839: K Watchman | C839: EVERYDAY CHEMICALS | D839: 1 | E839: 99 | F839: of:=[.E839]*[.D839] -> 99 | G839: 2014 | I839: of:=YEAR(TODAY())-[.G839] -> 11 | L839: 2010 | M839: S.Chand and Company Delhi | N839: S.Chand and Company Dehradun
A840: 6946 | B840: Jhon Richord | C840: SOUND AND MUSIC | D840: 1 | E840: 99 | F840: of:=[.E840]*[.D840] -> 99 | G840: 2014 | I840: of:=YEAR(TODAY())-[.G840] -> 11 | L840: 2010 | M840: S.Chand and Company Delhi | N840: S.Chand and Company Dehradun
A841: 6958 | B841: Antheny | C841: DRAWING | D841: 1 | E841: 99 | F841: of:=[.E841]*[.D841] -> 99 | G841: 2014 | I841: of:=YEAR(TODAY())-[.G841] -> 11 | L841: 2010 | M841: S.Chand and Company Delhi | N841: S.Chand and Company Dehradun
A842: 6962 | B842: RK Puri | C842: THE GREAT SPEECHES | D842: 1 | E842: 350 | F842: of:=[.E842]*[.D842] -> 350 | G842: 2014 | I842: of:=YEAR(TODAY())-[.G842] -> 11 | L842: 2014 | M842: Nataraj Publications | N842: S.Chand and Company Dehradun
A843: 6973 | B843: Sudhir Dikshit | C843: Safalta ke mantra (HINDI) | D843: 1 | E843: 150 | F843: of:=[.E843]*[.D843] -> 150 | G843: 2014 | I843: of:=YEAR(TODAY())-[.G843] -> 11 | L843: 2013 | M843: Manjul Publications | N843: S.Chand and Company Dehradun
A844: 6975 | B844: Sandeep Gupta | C844: hito-upsesh ki kahaniyan (HINDI) | D844: 1 | E844: 150 | F844: of:=[.E844]*[.D844] -> 150 | G844: 2014 | I844: of:=YEAR(TODAY())-[.G844] -> 11 | L844: 2014 | M844: Manoj Pocket books | N844: S.Chand and Company Dehradun
A845: 6983 | B845: Rs Agarwal | C845: A modern approach to verbal and non-verbal | D845: 1 | E845: 475 | F845: of:=[.E845]*[.D845] -> 475 | G845: 2014 | I845: of:=YEAR(TODAY())-[.G845] -> 11 | L845: 2014 | M845: S.Chand and Company Delhi | N845: College Book Depot Dehradun
A846: 6989 | B846: Vidya Prakashan | C846: Saiyukt higher secondary pariksha (HINDI) | D846: 1 | E846: 200 | F846: of:=[.E846]*[.D846] -> 200 | G846: 2014 | I846: of:=YEAR(TODAY())-[.G846] -> 11 | L846: 2013 | M846: Vidya Prakashan Mandir | N846: College Book Depot Dehradun
A847: 6991 | B847: Majid Husen | C847: Bharat ka Bhoogol | D847: 1 | E847: 425 | F847: of:=[.E847]*[.D847] -> 425 | G847: 2014 | I847: of:=YEAR(TODAY())-[.G847] -> 11 | L847: 2014 | M847: Tata MC Hill Delhi | N847: College Book Depot Dehradun
A848: 6992 | B848: Amit agarwal | C848: 36 Years chapterwise solved papers | D848: 1 | E848: 365 | F848: of:=[.E848]*[.D848] -> 365 | G848: 2014 | I848: of:=YEAR(TODAY())-[.G848] -> 11 | L848: 2014 | M848: Arihant Prakashan Delhi | N848: College Book Depot Dehradun
A849: 6993 | B849: DC Pandey | C849: IIT-JEE Physics | D849: 1 | E849: 345 | F849: of:=[.E849]*[.D849] -> 345 | G849: 2014 | I849: of:=YEAR(TODAY())-[.G849] -> 11 | L849: 2014 | M849: Arihant Prakashan Delhi | N849: College Book Depot Dehradun
A850: 6995 | B850: Asha | C850: MALALA - Bahadur ladki ki kahani (HINDI) | D850: 1 | E850: 150 | F850: of:=[.E850]*[.D850] -> 150 | G850: 2014 | I850: of:=YEAR(TODAY())-[.G850] -> 11 | L850: 2014 | M850: Hindpocket delhi | N850: diamond book depot
A851: 6996 | B851: Mahindra Bhardwaj | C851: Narendra Modi - sangharsh se shikhar tak | D851: 1 | E851: 60 | F851: of:=[.E851]*[.D851] -> 60 | G851: 2014 | I851: of:=YEAR(TODAY())-[.G851] -> 11 | L851: 2014 | M851: Rajat Prakshan Delhi | N851: diamond book depot
A852: 6998 | B852: Chetan Bhagat | C852: Half Girlfriend | D852: 1 | E852: 76 | F852: of:=[.E852]*[.D852] -> 76 | G852: 2014 | I852: of:=YEAR(TODAY())-[.G852] -> 11 | L852: 2014 | M852: Rupa and company Delhi | N852: diamond book depot
A853: 7000 | B853: Indian Book house | C853: navin Rashtriya School Atlas | D853: 1 | E853: 200 | F853: of:=[.E853]*[.D853] -> 200 | G853: 2015 | I853: of:=YEAR(TODAY())-[.G853] -> 10 | L853: 2014 | M853: Indian Book depot | N853: indian book depot
A854: 7001 | B854: Oxford University Press | C854: navin Rashtriya School Atlas | D854: 1 | E854: 200 | F854: of:=[.E854]*[.D854] -> 200 | G854: 2015 | I854: of:=YEAR(TODAY())-[.G854] -> 10 | L854: 2014 | M854: Indian Book depot | N854: indian book depot
A855: 7002 | B855: Oxford University Press | C855: oxford school atlas | D855: 1 | E855: 239 | F855: of:=[.E855]*[.D855] -> 239 | G855: 2015 | I855: of:=YEAR(TODAY())-[.G855] -> 10 | L855: 2014 | M855: Oxford university Press | N855: diamond book dwpot
A856: 7003 | B856: Oxford University Press | C856: oxford school atlas | D856: 1 | E856: 239 | F856: of:=[.E856]*[.D856] -> 239 | G856: 2015 | I856: of:=YEAR(TODAY())-[.G856] -> 10 | L856: 2014 | M856: Oxford university Press | N856: diamond book dwpot
A857: 7004 | B857: Wren and Martin | C857: High school English grammar and compostion | D857: 1 | E857: 215 | F857: of:=[.E857]*[.D857] -> 215 | G857: 2015 | I857: of:=YEAR(TODAY())-[.G857] -> 10 | L857: 2014 | M857: S.Chand and Company Delhi | N857: s.chand dehradun
A858: 7005 | B858: SK Gupta | C858: iit foundation mathmatics | D858: 1 | E858: 295 | F858: of:=[.E858]*[.D858] -> 295 | G858: 2015 | I858: of:=YEAR(TODAY())-[.G858] -> 10 | L858: 2014 | M858: S.Chand and Company Delhi | N858: s.chand dehradun
A859: 7008 | B859: MD house and NK Choudhary | C859: atlas for ics (english) | D859: 1 | E859: 125 | F859: of:=[.E859]*[.D859] -> 125 | G859: 2015 | I859: of:=YEAR(TODAY())-[.G859] -> 10 | L859: 2014 | M859: S.Chand and Company Delhi | N859: s.chand dehradun
A860: 7010 | B860: Trishul book company | C860: MALALA - Bahadur ladki ki kahani (HINDI) | D860: 1 | E860: 125 | F860: of:=[.E860]*[.D860] -> 125 | G860: 2015 | I860: of:=YEAR(TODAY())-[.G860] -> 10 | L860: 2015 | M860: Bodhgaya Publication Delhi | N860: gifted
A861: 7011 | B861: Shiv Khera | C861: You can win | D861: 1 | E861: 365 | F861: of:=[.E861]*[.D861] -> 365 | G861: 2015 | I861: of:=YEAR(TODAY())-[.G861] -> 10 | L861: 2012 | M861: Mac Millan and company | N861: gifted
A862: 7014 | B862: Shriram sharma | C862: prayavaran asantulan zimedar kon | D862: 1 | E862: 31 | F862: of:=[.E862]*[.D862] -> 31 | G862: 2015 | I862: of:=YEAR(TODAY())-[.G862] -> 10 | L862: 2010 | M862: Akhand Jyoti Sansthan Haridwar | N862: santi kunj haridwar
A863: 7017 | B863: Shriram sharma | C863: yog avam prakartic chikitsa | D863: 1 | E863: 34 | F863: of:=[.E863]*[.D863] -> 34 | G863: 2015 | I863: of:=YEAR(TODAY())-[.G863] -> 10 | L863: 2011 | M863: Akhand Jyoti Sansthan Haridwar | N863: santi kunj haridwar
A864: 7018 | B864: Shriram sharma | C864: asan pranayam se adhi Vyadhi Nivarana | D864: 1 | E864: 40 | F864: of:=[.E864]*[.D864] -> 40 | G864: 2015 | I864: of:=YEAR(TODAY())-[.G864] -> 10 | L864: 2011 | M864: Akhand Jyoti Sansthan Haridwar | N864: santi kunj haridwar
A865: 7021 | B865: Shriram sharma | C865: pranyam se aadi vyadi nivaran | D865: 1 | E865: 16 | F865: of:=[.E865]*[.D865] -> 16 | G865: 2015 | I865: of:=YEAR(TODAY())-[.G865] -> 10 | L865: 2010 | M865: Akhand Jyoti Sansthan Haridwar | N865: santi kunj haridwar
A866: 7022 | B866: Shriram sharma | C866: nari uthan ki samasiya ka samadhan | D866: 1 | E866: 16 | F866: of:=[.E866]*[.D866] -> 16 | G866: 2015 | I866: of:=YEAR(TODAY())-[.G866] -> 10 | L866: 2010 | M866: Akhand Jyoti Sansthan Haridwar | N866: santi kunj haridwar
A867: 7023 | B867: Shriram sharma | C867: asayam banam aatmghat | D867: 1 | E867: 9 | F867: of:=[.E867]*[.D867] -> 9 | G867: 2015 | I867: of:=YEAR(TODAY())-[.G867] -> 10 | L867: 2010 | M867: Akhand Jyoti Sansthan Haridwar | N867: santi kunj haridwar
A868: 7024 | B868: Shriram sharma | C868: vedo ka divye sandesh | D868: 1 | E868: 75 | F868: of:=[.E868]*[.D868] -> 75 | G868: 2015 | I868: of:=YEAR(TODAY())-[.G868] -> 10 | L868: 1997 | M868: Akhand Jyoti Sansthan Haridwar | N868: santi kunj haridwar
A869: 7025 | B869: Shriram sharma | C869: manusyya chalta firta ped nhi h | D869: 1 | E869: 24 | F869: of:=[.E869]*[.D869] -> 24 | G869: 2015 | I869: of:=YEAR(TODAY())-[.G869] -> 10 | L869: 2011 | M869: Akhand Jyoti Sansthan Haridwar | N869: santi kunj haridwar
A870: 7026 | B870: Shriram sharma | C870: mastisk pratiyaksh kalpvriksh | D870: 1 | E870: 21 | F870: of:=[.E870]*[.D870] -> 21 | G870: 2015 | I870: of:=YEAR(TODAY())-[.G870] -> 10 | L870: 2013 | M870: Akhand Jyoti Sansthan Haridwar | N870: santi kunj haridwar
A871: 7028 | B871: Shriram sharma | C871: shruti suda | D871: 1 | E871: 22 | F871: of:=[.E871]*[.D871] -> 22 | G871: 2015 | I871: of:=YEAR(TODAY())-[.G871] -> 10 | L871: 2013 | M871: Akhand Jyoti Sansthan Haridwar | N871: santi kunj haridwar
A872: 7029 | B872: Shriram sharma | C872: ham sab ek dusre par nirbhar hai | D872: 1 | E872: 19 | F872: of:=[.E872]*[.D872] -> 19 | G872: 2015 | I872: of:=YEAR(TODAY())-[.G872] -> 10 | L872: 2010 | M872: Akhand Jyoti Sansthan Haridwar | N872: santi kunj haridwar
A873: 7030 | B873: Shriram sharma | C873: sahirdyta Adhyatmik pragati ke liye avasyak | D873: 1 | E873: 15 | F873: of:=[.E873]*[.D873] -> 15 | G873: 2015 | I873: of:=YEAR(TODAY())-[.G873] -> 10 | L873: 2010 | M873: Akhand Jyoti Sansthan Haridwar | N873: santi kunj haridwar
A874: 7033 | B874: Shriram sharma | C874: parmatma sarvotam kriti nari | D874: 1 | E874: 9 | F874: of:=[.E874]*[.D874] -> 9 | G874: 2015 | I874: of:=YEAR(TODAY())-[.G874] -> 10 | L874: 2005 | M874: Akhand Jyoti Sansthan Haridwar | N874: santi kunj haridwar
A875: 7034 | B875: Shriram sharma | C875: pran ghatak yashng | D875: 1 | E875: 4 | F875: of:=[.E875]*[.D875] -> 4 | G875: 2015 | I875: of:=YEAR(TODAY())-[.G875] -> 10 | L875: 2014 | M875: Akhand Jyoti Sansthan Haridwar | N875: shanti kunj haridwar
A876: 7035 | B876: Shriram sharma | C876: sahyog v sahishunta | D876: 1 | E876: 4 | F876: of:=[.E876]*[.D876] -> 4 | G876: 2015 | I876: of:=YEAR(TODAY())-[.G876] -> 10 | L876: 2013 | M876: Akhand Jyoti Sansthan Haridwar | N876: shanti kunj haridwar
A877: 7036 | B877: Shriram sharma | C877: indriya sanyam | D877: 1 | E877: 4 | F877: of:=[.E877]*[.D877] -> 4 | G877: 2015 | I877: of:=YEAR(TODAY())-[.G877] -> 10 | L877: 2013 | M877: Akhand Jyoti Sansthan Haridwar | N877: shanti kunj haridwar
A878: 7037 | B878: Shriram sharma | C878: pawitra jeevan | D878: 1 | E878: 4 | F878: of:=[.E878]*[.D878] -> 4 | G878: 2015 | I878: of:=YEAR(TODAY())-[.G878] -> 10 | L878: 2010 | M878: Akhand Jyoti Sansthan Haridwar | N878: shanti kunj haridwar
A879: 7038 | B879: Shriram sharma | C879: aaptiyo m dherya | D879: 1 | E879: 4 | F879: of:=[.E879]*[.D879] -> 4 | G879: 2015 | I879: of:=YEAR(TODAY())-[.G879] -> 10 | L879: 2011 | M879: Akhand Jyoti Sansthan Haridwar | N879: shanti kunj haridwar
A880: 7039 | B880: Shriram sharma | C880: visva ki mhan nariya | D880: 1 | E880: 4 | F880: of:=[.E880]*[.D880] -> 4 | G880: 2015 | I880: of:=YEAR(TODAY())-[.G880] -> 10 | L880: 2015 | M880: Akhand Jyoti Sansthan Haridwar | N880: shanti kunj haridwar
A881: 7040 | B881: Shriram sharma | C881: bde aadmi nhi mha manav bano | D881: 1 | E881: 12 | F881: of:=[.E881]*[.D881] -> 12 | G881: 2015 | I881: of:=YEAR(TODAY())-[.G881] -> 10 | L881: 2010 | M881: Akhand Jyoti Sansthan Haridwar | N881: shanti kunj haridwar
A882: 7041 | B882: Shriram sharma | C882: shist bne sajan kahlye | D882: 1 | E882: 6 | F882: of:=[.E882]*[.D882] -> 6 | G882: 2015 | I882: of:=YEAR(TODAY())-[.G882] -> 10 | L882: 2013 | M882: Akhand Jyoti Sansthan Haridwar | N882: shanti kunj haridwar
A883: 7043 | B883: Shriram sharma | C883: safalta ke tin sadhak | D883: 1 | E883: 10 | F883: of:=[.E883]*[.D883] -> 10 | G883: 2015 | I883: of:=YEAR(TODAY())-[.G883] -> 10 | L883: 2013 | M883: Akhand Jyoti Sansthan Haridwar | N883: shanti kunj haridwar
A884: 7044 | B884: Shriram sharma | C884: chatro ka nirman adhyapak kare | D884: 1 | E884: 16 | F884: of:=[.E884]*[.D884] -> 16 | G884: 2015 | I884: of:=YEAR(TODAY())-[.G884] -> 10 | L884: 2014 | M884: Akhand Jyoti Sansthan Haridwar | N884: shanti kunj haridwar
A885: 7046 | B885: Shriram sharma | C885: jivan me mrityu | D885: 1 | E885: 4 | F885: of:=[.E885]*[.D885] -> 4 | G885: 2015 | I885: of:=YEAR(TODAY())-[.G885] -> 10 | L885: 2010 | M885: Akhand Jyoti Sansthan Haridwar | N885: shanti kunj haridwar
A886: 7047 | B886: Shriram sharma | C886: savdhani v suraksa | D886: 1 | E886: 4 | F886: of:=[.E886]*[.D886] -> 4 | G886: 2015 | I886: of:=YEAR(TODAY())-[.G886] -> 10 | L886: 2014 | M886: Akhand Jyoti Sansthan Haridwar | N886: shanti kunj haridwar
A887: 7048 | B887: Shriram sharma | C887: sachhta manusyta ka gorav | D887: 1 | E887: 4 | F887: of:=[.E887]*[.D887] -> 4 | G887: 2015 | I887: of:=YEAR(TODAY())-[.G887] -> 10 | L887: 2013 | M887: Akhand Jyoti Sansthan Haridwar | N887: shanti kunj haridwar
A888: 7049 | B888: Shriram sharma | C888: parkarti ka anusaran | D888: 1 | E888: 5 | F888: of:=[.E888]*[.D888] -> 5 | G888: 2015 | I888: of:=YEAR(TODAY())-[.G888] -> 10 | L888: 2010 | M888: Akhand Jyoti Sansthan Haridwar | N888: shanti kunj haridwar
A889: 7050 | B889: Shriram sharma | C889: nari ki mahanta | D889: 1 | E889: 4 | F889: of:=[.E889]*[.D889] -> 4 | G889: 2015 | I889: of:=YEAR(TODAY())-[.G889] -> 10 | L889: 2013 | M889: Akhand Jyoti Sansthan Haridwar | N889: shanti kunj haridwar
A890: 7051 | B890: Shriram sharma | C890: dhan ka sadyopog | D890: 1 | E890: 4 | F890: of:=[.E890]*[.D890] -> 4 | G890: 2015 | I890: of:=YEAR(TODAY())-[.G890] -> 10 | L890: 2010 | M890: Akhand Jyoti Sansthan Haridwar | N890: shanti kunj haridwar
A891: 7052 | B891: Shriram sharma | C891: sakti ka sadopyog | D891: 1 | E891: 4 | F891: of:=[.E891]*[.D891] -> 4 | G891: 2015 | I891: of:=YEAR(TODAY())-[.G891] -> 10 | L891: 2013 | M891: Akhand Jyoti Sansthan Haridwar | N891: shanti kunj haridwar
A892: 7053 | B892: Shriram sharma | C892: apurnta se purnta ke aur | D892: 1 | E892: 4 | F892: of:=[.E892]*[.D892] -> 4 | G892: 2015 | I892: of:=YEAR(TODAY())-[.G892] -> 10 | L892: 2011 | M892: Akhand Jyoti Sansthan Haridwar | N892: shanti kunj haridwar
A893: 7057 | B893: Shriram sharma | C893: gopniya gaytri se sankat nivaran | D893: 1 | E893: 7 | F893: of:=[.E893]*[.D893] -> 7 | G893: 2015 | I893: of:=YEAR(TODAY())-[.G893] -> 10 | L893: 2013 | M893: Akhand Jyoti Sansthan Haridwar | N893: shanti kunj haridwar
A894: 7058 | B894: Shriram sharma | C894: gaytri maha mantra se sankat nivaran | D894: 1 | E894: 6 | F894: of:=[.E894]*[.D894] -> 6 | G894: 2015 | I894: of:=YEAR(TODAY())-[.G894] -> 10 | L894: 2014 | M894: Akhand Jyoti Sansthan Haridwar | N894: shanti kunj haridwar
A895: 7059 | C895: gayatri maha mantra | D895: 1 | E895: 7 | F895: of:=[.E895]*[.D895] -> 7 | G895: 2015 | I895: of:=YEAR(TODAY())-[.G895] -> 10
A896: 7060 | B896: Shriram sharma | C896: paramartha aur swarth ka samanya | D896: 1 | E896: 4 | F896: of:=[.E896]*[.D896] -> 4 | G896: 2015 | I896: of:=YEAR(TODAY())-[.G896] -> 10 | L896: 2013 | M896: Akhand Jyoti Sansthan Haridwar | N896: shanti kunj haridwar
A897: 7061 | B897: Shriram sharma | C897: atma gyan v atma katha | D897: 1 | E897: 4 | F897: of:=[.E897]*[.D897] -> 4 | G897: 2015 | I897: of:=YEAR(TODAY())-[.G897] -> 10 | L897: 2013 | M897: Akhand Jyoti Sansthan Haridwar | N897: shanti kunj haridwar
A898: 7062 | B898: Shriram sharma | C898: swadyay aur satsang | D898: 1 | E898: 4 | F898: of:=[.E898]*[.D898] -> 4 | G898: 2015 | I898: of:=YEAR(TODAY())-[.G898] -> 10 | L898: 2015 | M898: Akhand Jyoti Sansthan Haridwar | N898: shanti kunj haridwar
A899: 7063 | B899: Shriram sharma | C899: udarta v dur darshita | D899: 1 | E899: 4 | F899: of:=[.E899]*[.D899] -> 4 | G899: 2015 | I899: of:=YEAR(TODAY())-[.G899] -> 10 | L899: 2013 | M899: Akhand Jyoti Sansthan Haridwar | N899: shanti kunj haridwar
A900: 7064 | B900: Shriram sharma | C900: darma ki sudradh dharna | D900: 1 | E900: 4 | F900: of:=[.E900]*[.D900] -> 4 | G900: 2015 | I900: of:=YEAR(TODAY())-[.G900] -> 10 | L900: 2010 | M900: Akhand Jyoti Sansthan Haridwar | N900: shanti kunj haridwar
A901: 7065 | B901: Shriram sharma | C901: suraksa swasth ki raksa parkarti ke anusaran se kare | D901: 1 | E901: 4 | F901: of:=[.E901]*[.D901] -> 4 | G901: 2015 | I901: of:=YEAR(TODAY())-[.G901] -> 10 | L901: 2011 | M901: Akhand Jyoti Sansthan Haridwar | N901: shanti kunj haridwar
A902: 7066 | B902: Shriram sharma | C902: pragyabhiyan me yog vyayam | D902: 1 | E902: 4 | F902: of:=[.E902]*[.D902] -> 4 | G902: 2015 | I902: of:=YEAR(TODAY())-[.G902] -> 10 | L902: 2011 | M902: Akhand Jyoti Sansthan Haridwar | N902: shanti kunj haridwar
A903: 7067 | B903: Shriram sharma | C903: gamlo me swasth | D903: 1 | E903: 9 | F903: of:=[.E903]*[.D903] -> 9 | G903: 2015 | I903: of:=YEAR(TODAY())-[.G903] -> 10 | L903: 2014 | M903: Akhand Jyoti Sansthan Haridwar | N903: shanti kunj haridwar
A904: 7069 | B904: Shriram sharma | C904: vicharo ki sarjanatamak sakti | D904: 1 | E904: 7 | F904: of:=[.E904]*[.D904] -> 7 | G904: 2015 | I904: of:=YEAR(TODAY())-[.G904] -> 10 | L904: 2015 | M904: Akhand Jyoti Sansthan Haridwar | N904: shanti kunj haridwar
A905: 7070 | B905: Shriram sharma | C905: ham durbal nhi sakti Sali bane | D905: 1 | E905: 6 | F905: of:=[.E905]*[.D905] -> 6 | G905: 2015 | I905: of:=YEAR(TODAY())-[.G905] -> 10 | L905: 2013 | M905: Akhand Jyoti Sansthan Haridwar | N905: shanti kunj haridwar
A906: 7071 | B906: Shriram sharma | C906: vak sakti aur niyojana | D906: 1 | E906: 4 | F906: of:=[.E906]*[.D906] -> 4 | G906: 2015 | I906: of:=YEAR(TODAY())-[.G906] -> 10 | L906: 2012 | M906: Akhand Jyoti Sansthan Haridwar | N906: shanti kunj haridwar
A907: 7072 | B907: Shriram sharma | C907: mitarta kre soch samaj kar | D907: 1 | E907: 12 | F907: of:=[.E907]*[.D907] -> 12 | G907: 2015 | I907: of:=YEAR(TODAY())-[.G907] -> 10 | L907: 2014 | M907: Akhand Jyoti Sansthan Haridwar | N907: shanti kunj haridwar
A908: 7073 | B908: Shriram sharma | C908: kathinayo ki kasoti pe khare utre | D908: 1 | E908: 4 | F908: of:=[.E908]*[.D908] -> 4 | G908: 2015 | I908: of:=YEAR(TODAY())-[.G908] -> 10 | L908: 2013 | M908: Akhand Jyoti Sansthan Haridwar | N908: shanti kunj haridwar
A909: 7075 | B909: Shriram sharma | C909: buraeyo ke andhkar me unati ke kirne | D909: 1 | E909: 6 | F909: of:=[.E909]*[.D909] -> 6 | G909: 2015 | I909: of:=YEAR(TODAY())-[.G909] -> 10 | L909: 2010 | M909: Akhand Jyoti Sansthan Haridwar | N909: shanti kunj haridwar
A910: 7077 | B910: Shriram sharma | C910: parkarti ki parsanata se jude | D910: 1 | E910: 12 | F910: of:=[.E910]*[.D910] -> 12 | G910: 2015 | I910: of:=YEAR(TODAY())-[.G910] -> 10 | L910: 2013 | M910: Akhand Jyoti Sansthan Haridwar | N910: shanti kunj haridwar
A911: 7078 | B911: Shriram sharma | C911: nirasa ko pas bhatakne na de | D911: 1 | E911: 4 | F911: of:=[.E911]*[.D911] -> 4 | G911: 2015 | I911: of:=YEAR(TODAY())-[.G911] -> 10 | L911: 2014 | M911: Akhand Jyoti Sansthan Haridwar | N911: shanti kunj haridwar
A912: 7079 | B912: Shriram sharma | C912: do mahan avlamb atmsakti | D912: 1 | E912: 10 | F912: of:=[.E912]*[.D912] -> 10 | G912: 2015 | I912: of:=YEAR(TODAY())-[.G912] -> 10 | L912: 2011 | M912: Akhand Jyoti Sansthan Haridwar | N912: shanti kunj haridwar
A913: 7080 | B913: Shriram sharma | C913: ham bhagyavdi nhi karmavadi bne | D913: 1 | E913: 4 | F913: of:=[.E913]*[.D913] -> 4 | G913: 2015 | I913: of:=YEAR(TODAY())-[.G913] -> 10 | L913: 2014 | M913: Akhand Jyoti Sansthan Haridwar | N913: shanti kunj haridwar
A914: 7081 | B914: Shriram sharma | C914: pariskrit vyaktitva ek uplabdhi | D914: 1 | E914: 7 | F914: of:=[.E914]*[.D914] -> 7 | G914: 2015 | I914: of:=YEAR(TODAY())-[.G914] -> 10 | L914: 2013 | M914: Akhand Jyoti Sansthan Haridwar | N914: shanti kunj haridwar
A915: 7082 | B915: Shriram sharma | C915: vartaman chunoti v yuva warg | D915: 1 | E915: 6 | F915: of:=[.E915]*[.D915] -> 6 | G915: 2015 | I915: of:=YEAR(TODAY())-[.G915] -> 10 | L915: 2014 | M915: Akhand Jyoti Sansthan Haridwar | N915: shanti kunj haridwar
A916: 7083 | B916: Shriram sharma | C916: hare na himmat | D916: 1 | E916: 3 | F916: of:=[.E916]*[.D916] -> 3 | G916: 2015 | I916: of:=YEAR(TODAY())-[.G916] -> 10 | L916: 2014 | M916: Akhand Jyoti Sansthan Haridwar | N916: shanti kunj haridwar
A917: 7084 | B917: Shriram sharma | C917: hare na himmat | D917: 1 | E917: 10 | F917: of:=[.E917]*[.D917] -> 10 | G917: 2015 | I917: of:=YEAR(TODAY())-[.G917] -> 10 | L917: 2011 | M917: Akhand Jyoti Sansthan Haridwar | N917: shanti kunj haridwar
A918: 7085 | B918: Shriram sharma | C918: jivan sadhan ke sopan | D918: 1 | E918: 7 | F918: of:=[.E918]*[.D918] -> 7 | G918: 2015 | I918: of:=YEAR(TODAY())-[.G918] -> 10 | L918: 2013 | M918: Akhand Jyoti Sansthan Haridwar | N918: shanti kunj haridwar
A919: 7087 | B919: Shriram sharma | C919: avsar prasikshan academy | D919: 1 | E919: 7 | F919: of:=[.E919]*[.D919] -> 7 | G919: 2015 | I919: of:=YEAR(TODAY())-[.G919] -> 10 | L919: 2010 | M919: Akhand Jyoti Sansthan Haridwar | N919: shanti kunj haridwar
A920: 7089 | B920: Shriram sharma | C920: jila prishiksan academy | D920: 1 | E920: 90 | F920: of:=[.E920]*[.D920] -> 90 | G920: 2015 | I920: of:=YEAR(TODAY())-[.G920] -> 10 | L920: 2013 | M920: Akhand Jyoti Sansthan Haridwar | N920: shanti kunj haridwar
A921: 7090 | B921: Shriram sharma | C921: physical handbook | D921: 1 | E921: 17 | F921: of:=[.E921]*[.D921] -> 17 | G921: 2015 | I921: of:=YEAR(TODAY())-[.G921] -> 10 | L921: 2011 | M921: Akhand Jyoti Sansthan Haridwar | N921: shanti kunj haridwar
A922: 7095 | B922: Shriram sharma | C922: vhavarik vedant ke parcharak | D922: 1 | E922: 6 | F922: of:=[.E922]*[.D922] -> 6 | G922: 2015 | I922: of:=YEAR(TODAY())-[.G922] -> 10 | L922: 2011 | M922: Akhand Jyoti Sansthan Haridwar | N922: shanti kunj haridwar
A923: 7096 | B923: Shriram sharma | C923: maharni ahilya bai | D923: 1 | E923: 6 | F923: of:=[.E923]*[.D923] -> 6 | G923: 2015 | I923: of:=YEAR(TODAY())-[.G923] -> 10 | L923: 2013 | M923: Akhand Jyoti Sansthan Haridwar | N923: shanti kunj haridwar
A924: 7156 | B924: N Krishna Swami | C924: enistein papers | D924: 1 | E924: 50 | F924: of:=[.E924]*[.D924] -> 50 | G924: 2015 | I924: of:=YEAR(TODAY())-[.G924] -> 10 | L924: 2015 | M924: c.v. Natarajan offical trust | N924: india now foundation
A925: 7178 | B925: Anant Rai | C925: stories of rama | D925: 1 | E925: 225 | F925: of:=[.E925]*[.D925] -> 225 | G925: 2015 | I925: of:=YEAR(TODAY())-[.G925] -> 10 | L925: 2015 | M925: c.v. Natarajan offical trust | N925: india now foundation
A926: 7181 | B926: Anant Rai | C926: stories of shiva | D926: 1 | E926: 225 | F926: of:=[.E926]*[.D926] -> 225 | G926: 2015 | I926: of:=YEAR(TODAY())-[.G926] -> 10 | L926: 2015 | M926: A.c.k delhi | N926: india now foundation
A927: 7200 | B927: Anant Rai | C927: Tales of revolutionary Aryans | D927: 1 | E927: 225 | F927: of:=[.E927]*[.D927] -> 225 | G927: 2015 | I927: of:=YEAR(TODAY())-[.G927] -> 10 | L927: 2015 | M927: A.c.k delhi | N927: india now foundation
A928: 7398 | B928: Sekshpeare | C928: SHAKESPEARE KI ROCHAK KAHANIYA | D928: 1 | E928: 250 | F928: of:=[.E928]*[.D928] -> 250 | G928: 2015 | I928: of:=YEAR(TODAY())-[.G928] -> 10 | L928: 2015 | M928: PRATISTHAN | N928: ASHIRVAD BOOK DEPOT
A929: 7664 | B929: Sanskrit Bharti | C929: Kallika | D929: 1 | E929: 50 | F929: of:=[.E929]*[.D929] -> 50 | G929: 2015 | I929: of:=YEAR(TODAY())-[.G929] -> 10 | L929: 2015 | M929: nvs lucknow | N929: sanskrit bharti delhi
A930: 8245 | B930: v nayadu | C930: more ki puch par aak | D930: 1 | E930: 35 | F930: of:=[.E930]*[.D930] -> 35 | G930: 2016 | I930: of:=YEAR(TODAY())-[.G930] -> 9 | L930: 2014 | M930: NATIONAL BOOKS TRUST | N930: NATIONAL BOOKS TRUST
A931: 9185 | B931: CNR Rao | C931: Rashayan Vigyan ki duniya | D931: 1 | E931: 335 | F931: of:=[.E931]*[.D931] -> 335 | G931: 2017 | I931: of:=YEAR(TODAY())-[.G931] -> 8 | L931: 2017 | M931: National Books Trust | N931: National Books Trust
A932: 9209 | B932: Pushpa mist Bhargava | C932: devdoot saitan or vigyan | D932: 1 | E932: 215 | F932: of:=[.E932]*[.D932] -> 215 | G932: 2017 | I932: of:=YEAR(TODAY())-[.G932] -> 8 | L932: 2017 | M932: National Books Trust | N932: National Books Trust
A933: 9215 | B933: Mahesh dubey | C933: Adbhut jivan v vilakshan gadit | D933: 1 | E933: 205 | F933: of:=[.E933]*[.D933] -> 205 | G933: 2017 | I933: of:=YEAR(TODAY())-[.G933] -> 8 | L933: 2017 | M933: National Books Trust | N933: National Books Trust
A934: 9217 | B934: Namber singh | C934: Premchandra pratiniti sankalan | D934: 1 | E934: 70 | F934: of:=[.E934]*[.D934] -> 70 | G934: 2017 | I934: of:=YEAR(TODAY())-[.G934] -> 8 | L934: 2017 | M934: National Books Trust | N934: National Books Trust
A935: 9231 | B935: Aman vashu | C935: Humara paryavaran | D935: 1 | E935: 105 | F935: of:=[.E935]*[.D935] -> 105 | G935: 2017 | I935: of:=YEAR(TODAY())-[.G935] -> 8 | L935: 2017 | M935: National Books Trust | N935: National Books Trust
A936: 9233 | B936: Variden hem | C936: Mithak manushya | D936: 1 | E936: 135 | F936: of:=[.E936]*[.D936] -> 135 | G936: 2017 | I936: of:=YEAR(TODAY())-[.G936] -> 8 | L936: 2017 | M936: National Books Trust | N936: National Books Trust
A937: 9238 | B937: Ila Tripathi | C937: Deen dayal upadhyay yogdan | D937: 1 | E937: 215 | F937: of:=[.E937]*[.D937] -> 215 | G937: 2017 | I937: of:=YEAR(TODAY())-[.G937] -> 8 | L937: 2017 | M937: National Books Trust | N937: National Books Trust
A938: 9242 | B938: Jainth narilikar | C938: krishn viver | D938: 1 | E938: 65 | F938: of:=[.E938]*[.D938] -> 65 | G938: 2017 | I938: of:=YEAR(TODAY())-[.G938] -> 8 | L938: 2017 | M938: National Books Trust | N938: National Books Trust
A939: 9247 | B939: R Boss | C939: Subhash chandr boss | D939: 1 | E939: 80 | F939: of:=[.E939]*[.D939] -> 80 | G939: 2017 | I939: of:=YEAR(TODAY())-[.G939] -> 8 | L939: 2017 | M939: National Books Trust | N939: National Books Trust